Name;Country;Description;Thumbnail;Publisher_Names;Developer_Names;Platform;Release_Date;Genre;Steam_Link;Epic_Link;PlayStation_Link;Xbox_Link;Switch_Link;GOG_Link
DRAMA;Argentina;An exciting game, full of traps and mysteries to be solved in each of its 96 levels. In this hostile story you must put all your skills to the test to solve the hidden enigmas and lea...;https://shared.cloudflare.steamstatic.com/store_item_assets/steam/apps/1703480/header.jpg?t=1629820798;SHARED DREAMS STUDIOS;SHARED DREAMS STUDIOS;Windows;6 Aug, 2021;Action, Adventure, Casual, Indie;https://store.steampowered.com/app/1703480/DRAMA/;Unknown;;;;
Darkestville Castle;Argentina;Like any decent demon Cid spends his nights performing all kind of evil deeds to the peaceful people of Darkestville. Little does he know that his old arch enemy is about to change hi...;https://shared.cloudflare.steamstatic.com/store_item_assets/steam/apps/689900/header.jpg?t=1728902158;ESDigital Games;Epic Llama Games;Windows, macOS, SteamOS + Linux;21 Sep, 2017;Adventure, Indie;https://store.steampowered.com/app/689900/Darkestville_Castle/;Unknown;;;https://www.nintendo.com/us/store/products/darkestville-castle-switch/;
Dead Sale;Argentina;You are Marcus, an appraiser exploring a house for sale. Power outages reveal a dark entity hunting you. With the help of a mirror, uncover what’s hidden and escape before both time...;https://shared.cloudflare.steamstatic.com/store_item_assets/steam/apps/3267050/header.jpg?t=1743704813;keter studio;Keter studio;Windows;20 Dec, 2024;Action, Adventure, Indie, Free To Play;https://store.steampowered.com/app/3267050/Dead_Sale/;Unknown;;;;
Deck of Souls;Argentina;Roguelite deck-building meets souls-like. Break out of an infinite loop to close the hell gates, turn enemies into cards, and build your own omnipotent Deck of Souls! Rolls included.;https://shared.cloudflare.steamstatic.com/store_item_assets/steam/apps/2088770/header_alt_assets_4.jpg?t=1736860191;HeroCraft PC;Bigboot Studios;Windows;10 Dec, 2024;RPG, Strategy;https://store.steampowered.com/app/2088770/Deck_of_Souls/;Unknown;;;;
Deep Beyond;Argentina;Deep Beyond Is a first-person interactive thriller about a sea explorer and the mystery behind her father’s disappearance.;https://shared.cloudflare.steamstatic.com/store_item_assets/steam/apps/2841720/header.jpg?t=1717422385;Avix Games;Avix Games;Windows;15 May, 2024;Adventure, Indie;https://store.steampowered.com/app/2841720/Deep_Beyond/;Unknown;;;;
Deeply Dark: Found Footage;Argentina;WARNING: This is not a game, this software was found on the Deep Web and contains interactive material about the phenomenon of backrooms, we have received numerous reports of fatal ac...;https://shared.cloudflare.steamstatic.com/store_item_assets/steam/apps/1291660/header.jpg?t=1705258256;DALESI;DALESI;Windows;31 Oct, 2023;Indie, Simulation;https://store.steampowered.com/app/1291660/Deeply_Dark_Found_Footage/;Unknown;;;;
Deranged;Argentina;Deranged is a single player puzzle and psychological horror video game. Find a way to escape the O'Connor mansion before things get tough. Remember that in order to escape you must co...;https://shared.cloudflare.steamstatic.com/store_item_assets/steam/apps/1813560/header.jpg?t=1645555943;Franco Hernandez;Franco Hernandez;Windows;23 Nov, 2021;Adventure;https://store.steampowered.com/app/1813560/Deranged/;Unknown;;;;
Desert Pirates;Argentina;Prepare for epic vehicle combat! In this Roguelike convoy game, expand, conquer warlords, seize resources, and RIDE ON to eternal glory!;https://shared.cloudflare.steamstatic.com/store_item_assets/steam/apps/1454270/header.jpg?t=1724181812;Hernán Smicht;Hernán Smicht, Esteban Pisera, AXIOS;Windows;To be announced;Racing;https://store.steampowered.com/app/1454270/Desert_Pirates/;Unknown;;;;
Desvelado;Argentina;Turn off the lights, dodge the ghosts and go to sleep as soon as you can in this hand-crafted 2d platform experience! In this vampiric precision platformer you will overcome challengi...;https://shared.cloudflare.steamstatic.com/store_item_assets/steam/apps/2878710/header.jpg?t=1744347821;Vampi Team;Valentín Zacarías, Pablo Cuello, Joacoyco;Windows;14 Aug, 2024;Adventure, Casual, Indie;https://store.steampowered.com/app/2878710/Desvelado/;Unknown;;;;
Diesel Burners;Argentina;Diesel Burners is a fast-paced aerial shooter. Destroy hordes of enemies while collecting resources and power-ups. Buy, upgrade, and customize your character and planes, and put your ...;https://shared.cloudflare.steamstatic.com/store_item_assets/steam/apps/2616320/header.jpg?t=1707418937;Syncromind;Syncromind Games;Windows, macOS;To be announced;Action, Casual, Indie;https://store.steampowered.com/app/2616320/Diesel_Burners/;Unknown;;;;
Discoverer;Argentina;Discoverer is a game of exploration and discovery. You must locate new lands while searching for the Land of Energy and attempts to save the destiny of the world.;https://shared.cloudflare.steamstatic.com/store_item_assets/steam/apps/1161000/header.jpg?t=1687823341;GEOMETRIC BYTES;GEOMETRIC BYTES;Windows;To be announced;Action, Adventure;https://store.steampowered.com/app/1161000/Discoverer/;Unknown;;;;
Dome Discover;Argentina;Adventure RPG game with anime aesthetics set in a word where humans live enslaved in a Dome without being able to escape. Do you dare to leave this place and know the truth?;https://shared.cloudflare.steamstatic.com/store_item_assets/steam/apps/1446470/header.jpg?t=1737855234;Rosario Puche;Rosario Puche;Windows;28 Nov, 2020;RPG;https://store.steampowered.com/app/1446470/Dome_Discover/;Unknown;;;;
Don't Kill Rumble;Argentina;Don't Kill Rumble, a relentless multiplayer king of the hill rumble with frentic levels, waky customizable characters and grim enemies. Do you have what it takes to be the next champi...;https://shared.cloudflare.steamstatic.com/store_item_assets/steam/apps/2146310/header.jpg?t=1744381126;Scubalight Studios;Scubalight Studios;Windows;To be announced;Indie, Massively Multiplayer, Early Access;https://store.steampowered.com/app/2146310/Dont_Kill_Rumble/;Unknown;;;;
Doomsday Derby;Argentina;Play this indie arcade pixelated mini derby game! Destroy the cars that want to destroy you with a powerful gun and missiles in a battle arena. Avoid the chickens and destroy the gian...;https://shared.cloudflare.steamstatic.com/store_item_assets/steam/apps/2316860/header.jpg?t=1744056849;LFR games;LFR games;Windows;27 Jun, 2023;Indie, Racing, Sports;https://store.steampowered.com/app/2316860/Doomsday_Derby/;Unknown;;;;
Doorways: Holy Mountains of Flesh;Argentina;Doorways: Holy Mountains of Flesh is an Immersive Horror Adventure, featuring a Complex Story and Deep Atmosphere.;https://shared.cloudflare.steamstatic.com/store_item_assets/steam/apps/383930/header.jpg?t=1724087877;Saibot Studios;Saibot Studios;Windows, macOS, SteamOS + Linux;10 Aug, 2016;Action, Adventure, Indie;https://store.steampowered.com/app/383930/Doorways_Holy_Mountains_of_Flesh/;Unknown;;;;
Doorways: Old Prototype;Argentina;An immersive and twisted adventure created before the official development of the Doorways saga;https://shared.cloudflare.steamstatic.com/store_item_assets/steam/apps/525780/header.jpg?t=1724087880;Saibot Studios;Saibot Studios;Windows, macOS, SteamOS + Linux;5 Oct, 2016;Action, Adventure, Indie, Free To Play;https://store.steampowered.com/app/525780/Doorways_Old_Prototype/;Unknown;;;;
Doorways: Prelude;Argentina;Doorways is an immersive horror adventure, featuring a complex story and deep atmosphere.;https://shared.cloudflare.steamstatic.com/store_item_assets/steam/apps/248470/header.jpg?t=1724087882;Saibot Studios;Saibot Studios;Windows, macOS, SteamOS + Linux;20 Sep, 2013;Action, Adventure, Indie;https://store.steampowered.com/app/248470/Doorways_Prelude/;Unknown;;;;
Doorways: The Underworld;Argentina;Doorways: The Underworld is an immersive horror adventure, featuring a complex story and deep atmosphere.;https://shared.cloudflare.steamstatic.com/store_item_assets/steam/apps/311250/header.jpg?t=1724087884;Saibot Studios;Saibot Studios;Windows, macOS, SteamOS + Linux;17 Sep, 2014;Action, Adventure, Indie;https://store.steampowered.com/app/311250/Doorways_The_Underworld/;Unknown;;;;
Dorfs: Hammers for Hire;Argentina;A co-op crafting platformer where your friends prove worse than any enemy. Craft weapons and armor from your dwarven workshop, help your patron's army win the battle, and make your wa...;https://shared.cloudflare.steamstatic.com/store_item_assets/steam/apps/1707790/header.jpg?t=1689170827;Ravegan;Ravegan;Windows;21 Jun, 2022;Action, Casual, Indie;https://store.steampowered.com/app/1707790/Dorfs_Hammers_for_Hire/;Unknown;;;;
Dreamcore;Argentina;"Step into the surreal with Dreamcore, a body-cam styled psychological horror game that plunges you into the eerie beauty of ""liminal spaces."" Unravel the mysteries of Dreamcore’s no...";https://shared.cloudflare.steamstatic.com/store_item_assets/steam/apps/2453060/header.jpg?t=1741978327;Tlön Industries;Montraluz;Windows;23 Jan, 2025;Adventure, Indie;https://store.steampowered.com/app/2453060/Dreamcore/;Unknown;;https://www.xbox.com/en-us/games/store/dreamcore/9pcw3dr9glfb;;
Dreieck;Argentina;Play as a lowly triangle in this fast-paced top-down shooter on a dystopian polygon-based universe. Defeat your oppressors, claim glory!;https://shared.cloudflare.steamstatic.com/store_item_assets/steam/apps/2354050/header.jpg?t=1730410957;Resaca Games;Resaca Games;Windows;To be announced;Action, Indie;https://store.steampowered.com/app/2354050/Dreieck/;Unknown;;;;
Drop Alive;Argentina;“Happiness is only real when shared, especially with a water drop”. (Isn’t that how it goes?). Take a deep breath and immerse yourself in the greatest journey you’ll ever set ...;https://shared.cloudflare.steamstatic.com/store_item_assets/steam/apps/513450/header.jpg?t=1486742812;Ipsilon Developments;Invi Games;Windows;6 Dec, 2016;Casual, Free To Play, Indie;https://store.steampowered.com/app/513450/Drop_Alive/;Unknown;;;;
Dunjungle;Argentina;A 2d action-packed roguelite about a monkey hero protecting the jungle from the rise of a corruptive power. Explore ever-changing dungeons, fight weird enemies and gear up with lots o...;https://shared.cloudflare.steamstatic.com/store_item_assets/steam/apps/1589570/header.jpg?t=1745228931;Astrolabe Games;Bruno Bombardi;Windows, macOS;22 Oct, 2024;Action, Adventure, Indie, Early Access;https://store.steampowered.com/app/1589570/Dunjungle/;Unknown;;;;
EON Fighter;Argentina;"Embark on an action-packed adventure with ""EON Fighter,"" a thrilling spaceship shooter game with roguelite elements. Pilot your fighter through space, collect resources, and battle yo...";https://shared.cloudflare.steamstatic.com/store_item_assets/steam/apps/2146720/header.jpg?t=1740746699;Square Wheel;Square Wheel;Windows;13 Aug, 2023;Action, Adventure, Casual, Indie;https://store.steampowered.com/app/2146720/EON_Fighter/;Unknown;;;;
EON Trooper;Argentina;Lead an elite squad on a hostile alien planet! Recruit and command up to 4 NPC soldiers with unique powers to complete missions and overcome waves of enemies. Level up and dominate th...;https://shared.cloudflare.steamstatic.com/store_item_assets/steam/apps/2452800/header.jpg?t=1740746696;Square Wheel;Square Wheel;Windows;10 Sep, 2024;Action, Adventure, Casual, Indie;https://store.steampowered.com/app/2452800/EON_Trooper/;Unknown;;;;
EONIA;Argentina;A first-person adventure game that takes place in a magical, colorful open world. Live Albius’ story, Master Enodio’s apprentice, and meet his loyal magical pet Flino, as you disc...;https://shared.cloudflare.steamstatic.com/store_item_assets/steam/apps/826180/header.jpg?t=1619216932;GEOMETRIC BYTES;GEOMETRIC BYTES;Windows;24 Nov, 2019;Action, Adventure, Indie, RPG;https://store.steampowered.com/app/826180/EONIA/;Unknown;;;;
EONIA Revelations;Argentina;EONIA Revelations is a first-person graphic adventure set in a vast world that blends the beauty of fantasy with the fascination of science fiction, teeming with creatures to catalogu...;https://shared.cloudflare.steamstatic.com/store_item_assets/steam/apps/2487710/header.jpg?t=1746491984;GEOMETRIC BYTES;GEOMETRIC BYTES;Windows;To be announced;Adventure, Indie;https://store.steampowered.com/app/2487710/EONIA_Revelations/;Unknown;;;;
ETHEREAL;Argentina;A profound experience that carries players into an unknown and mysterious world surrounded by carefully designed puzzles...;https://shared.cloudflare.steamstatic.com/store_item_assets/steam/apps/751220/header.jpg?t=1556113441;Nonsense Arts;Nicolás Recabarren, Tomás Batista;Windows, macOS;7 Mar, 2019;Indie;https://store.steampowered.com/app/751220/ETHEREAL/;Unknown;;;;
El Tango de la Muerte;Argentina;Do the tango to win the heart of your loved one! Each song in this casual RHYTHM game will unveil the story of Luciano and Martita. Influenced by games like OSU and Crypt of the Necro...;https://shared.cloudflare.steamstatic.com/store_item_assets/steam/apps/701380/header.jpg?t=1656005190;Hernán Smicht;Hernán Smicht, YIRA::;Windows;24 Apr, 2018;Unknown;https://store.steampowered.com/app/701380/El_Tango_de_la_Muerte/;Unknown;;;;
Element Space;Argentina;Year 2199. Assemble an elite crew and make allies to combat a shadowy organization threatening the future of humanity. Face overwhelming odds with strategy. Make your choices and save...;https://shared.cloudflare.steamstatic.com/store_item_assets/steam/apps/887370/header.jpg?t=1595388734;Inca Games;Sixth Vowel;Windows;14 Feb, 2019;Action, Indie, RPG, Strategy;https://store.steampowered.com/app/887370/Element_Space/;Unknown;;;;
Enough with the Witch;Argentina;Destroy the evil witch that contaminated the region and cursed their happy habitants to convert them into horrible (but cute) monsters. This auto attacker with deck building mechanics...;https://shared.cloudflare.steamstatic.com/store_item_assets/steam/apps/2910340/header.jpg?t=1729572624;Birdy Games;Birdy Games;Windows;To be announced;Action, Adventure, Indie;https://store.steampowered.com/app/2910340/Enough_with_the_Witch/;Unknown;;;;
Escape Of The Hammer Princess;Argentina;A retro-styled rampage in both 3D and 2D! Bash some Skulls, Break Stuff, and Rise as a Legend!;https://shared.cloudflare.steamstatic.com/store_item_assets/steam/apps/3136530/header.jpg?t=1742499016;Hammer Princess Team;Hammer Princess Team;Windows;To be announced;Action, Adventure, Casual, Indie;https://store.steampowered.com/app/3136530/Escape_Of_The_Hammer_Princess/;Unknown;;;;
Esse Proxy;Argentina;Slick, stylish and brutal, 3D Cyberpunk Shooter. Located in a dystopian future, you'll experience the intertwined stories of three different characters, each with their own abilities,...;https://shared.cloudflare.steamstatic.com/store_item_assets/steam/apps/1485070/header.jpg?t=1728901745;FromSouthGames;FromSouthGames;Windows;11 Jul, 2022;Action, Indie;https://store.steampowered.com/app/1485070/Esse_Proxy/;Unknown;;;;
Evan's Remains;Argentina;Years after a boy genius named Evan disappears, a bizarre letter arrives. Evan wants a girl named Dysis to come find him. As Dysis, you’ll need to solve an intricate series of puzzl...;https://shared.cloudflare.steamstatic.com/store_item_assets/steam/apps/1110050/header.jpg?t=1729016253;Whitethorn Games;maitan69;Windows, macOS;11 Jun, 2020;Adventure, Casual, Indie;https://store.steampowered.com/app/1110050/Evans_Remains/;Unknown;;;;
Extreme Rally Raid;Argentina;Extreme Rally Raid is a 3D PC game, close to rally raid races experiences. Extreme races, long and strong stages, in natural environments with a lower human intervention.;https://shared.cloudflare.steamstatic.com/store_item_assets/steam/apps/2615040/header.jpg?t=1716521077;Punto Simu Studios;Punto Simu Studios;Windows, SteamOS + Linux;23 May, 2024;Indie, Racing, Sports;https://store.steampowered.com/app/2615040/Extreme_Rally_Raid/;Unknown;;;;
F11 Football Manager;Argentina;Manage your own club in F11 Football Manager. Sign players, upgrade the stadium, negotiate sponsorships and devise tactics to lead your team to glory. Do you have what it takes to be ...;https://shared.cloudflare.steamstatic.com/store_item_assets/steam/apps/3465170/header.jpg?t=1741611603;Factotum;Factotum;Windows;19 Feb, 2025;Simulation, Sports;https://store.steampowered.com/app/3465170/F11_Football_Manager/;Unknown;;;;
FACTOR D;Argentina;ANIME-style 2d turn-based fighting game, choose 1 character among the 12, with different endings for each one, discover the story by winning with each character;https://shared.cloudflare.steamstatic.com/store_item_assets/steam/apps/1887360/cb67f017c82e5db5e5d0cafb9dd0509b4142e4dc/header.jpg?t=1742006236;Jose Omar Carrizo;Jose Omar Carrizo;Windows, SteamOS + Linux;23 May, 2022;Action, Indie, RPG, Early Access;https://store.steampowered.com/app/1887360/FACTOR_D/;Unknown;;;;
FUTURE NOIR;Argentina;FUTURE NOIR is an adventure and action game that combines elements of first-person shooters and walking simulators. You must solve a crime that will take you to remote places in a dys...;https://shared.cloudflare.steamstatic.com/store_item_assets/steam/apps/1384150/header.jpg?t=1696232797;The Tierno Company;The Tierno Company;Windows;To be announced;Action, Adventure, Indie;https://store.steampowered.com/app/1384150/FUTURE_NOIR/;Unknown;;;;
Fallen: A2P Protocol;Argentina;A post-apocalyptic, turn based, tactical combat and strategy game where you lead your caravan on a quest for revenge.;https://shared.cloudflare.steamstatic.com/store_item_assets/steam/apps/325790/header.jpg?t=1447363904;Red Katana;Red Katana;Windows, macOS, SteamOS + Linux;14 Aug, 2015;Indie, RPG, Strategy;https://store.steampowered.com/app/325790/Fallen_A2P_Protocol/;Unknown;https://store.playstation.com/en-us/product/UP0421-CUSA04839_00-FALLENA2P0000107/;;;
Farol del Diablo (Devil's Lantern);Argentina;Armed with only a flashlight and limited resources, Catalina, our protagonist, embarks on a quest for valuable objects despite the rumors of the Luz Mala guarding the town. You must u...;https://shared.cloudflare.steamstatic.com/store_item_assets/steam/apps/3544060/07dd5dbbbd4560628f097818722829447bb1c922/header.jpg?t=1745522247;Arcanum: Game Forge;Arcanum: Game Forge;Windows;To be announced;Action, Adventure, Indie;https://store.steampowered.com/app/3544060/Farol_del_Diablo_Devils_Lantern/;Unknown;;;;
Fate of Kai;Argentina;Fate of Kai is a new kind of adventure. Explore different storylines, solve complex puzzles, travel through time and manipulate characters ideas to help Kai reach the castle. The game...;https://shared.cloudflare.steamstatic.com/store_item_assets/steam/apps/1426480/header.jpg?t=1638237930;TheGamePublisher.com;TRYLIGHT GAME STUDIO;Windows;19 Mar, 2021;Adventure, Casual, Indie;https://store.steampowered.com/app/1426480/Fate_of_Kai/;Unknown;;;;
Fidel Dungeon Rescue;Argentina;A critically acclaimed roguelite where you can REWIND to find the optimal path through monsters, treasure and secrets. Quick to play. No grinding. No filler. Deep gameplay.;https://shared.cloudflare.steamstatic.com/store_item_assets/steam/apps/573170/header.jpg?t=1607725858;Daniel Benmergui;Daniel Benmergui, Jeremías Babini, Hernán Rozenwasser;Windows, macOS;1 Aug, 2017;Indie, RPG;https://store.steampowered.com/app/573170/Fidel_Dungeon_Rescue/;Unknown;;;;
Floppy Disks from Hell;Argentina;Help Floppy Disks to repair from the flames a broken cell phone due to a strange malfunction on a World scale!;https://shared.cloudflare.steamstatic.com/store_item_assets/steam/apps/2131080/header.jpg?t=1690900784;BLJ Games;BLJ Games;Windows;4 Dec, 2022;Adventure, Casual;https://store.steampowered.com/app/2131080/Floppy_Disks_from_Hell/;Unknown;;;;
Foosball - Street Edition;Argentina;Foosball - Street Edition is a 5 VS 5 arcade football game, that puts you in the control of 9 teams of foosball players, each one with unique skills and abilities. Enjoy playing footb...;https://shared.cloudflare.steamstatic.com/store_item_assets/steam/apps/280830/header.jpg?t=1447360472;Yuisy;Yuisy, Exkee;Windows, macOS, SteamOS + Linux;16 Apr, 2014;Casual, Indie, Sports;https://store.steampowered.com/app/280830/Foosball__Street_Edition/;Unknown;;;;
Forager;Argentina;"The highly popular and quirky ""idle game that you want to actively keep playing"". Explore, craft, gather & manage resources, find secrets and build your base out of nothing! Buy land ...";https://shared.cloudflare.steamstatic.com/store_item_assets/steam/apps/751780/header.jpg?t=1699372258;Humble Games;HopFrog;Windows;18 Apr, 2019;Action, Adventure, Indie, Simulation;https://store.steampowered.com/app/751780/Forager/;Unknown;;https://www.xbox.com/en-us/games/store/Forager/9P5SFDNW6V13;https://www.nintendo.com/us/store/products/forager-switch/;
Fracas;Argentina;Fracas is a dungeon crawler that evokes a retro RPG experience and a complex story. In its short duration, it seeks to keep you intrigued as you solve the mystery behind this enigmati...;https://shared.cloudflare.steamstatic.com/store_item_assets/steam/apps/2824960/header.jpg?t=1741025503;Blacc Ski Weekend Industries;Rookbird Games;Windows, SteamOS + Linux;3 Mar, 2025;RPG;https://store.steampowered.com/app/2824960/Fracas/;Unknown;;;;
Funerary Services Marquez Paz;Argentina;"Enter the rough streets of Marquez Paz, Argentina. Explore the neighborhood and meet its peculiar inhabitants, work for ""the fune"" and get some cash, cave the head in of a couple of i...";https://shared.cloudflare.steamstatic.com/store_item_assets/steam/apps/1885040/header.jpg?t=1666983467;devpetrichor;devpetrichor;Windows;To be announced;Adventure, Casual, Indie;https://store.steampowered.com/app/1885040/Funerary_Services_Marquez_Paz/;Unknown;;;;
GENIUS AT WORK!;Argentina;Test your intelligence and creativity! With Genius At Work you will have your construction area where you can let your imagination fly and carry out your technical projects.;https://shared.cloudflare.steamstatic.com/store_item_assets/steam/apps/1467580/header.jpg?t=1738532008;Lucas Fernandez;Lucas Fernandez;Windows;3 Dec, 2020;Indie, Simulation;https://store.steampowered.com/app/1467580/GENIUS_AT_WORK/;Unknown;;;;
Giant Life;Argentina;"A ""Giant Life"" is a VR physic-based puzzle game. Play as an angry giant through a virtual reality journey, exploring the realm, destroying settlements and frightening its inhabitants.";https://shared.cloudflare.steamstatic.com/store_item_assets/steam/apps/1081250/header.jpg?t=1561420057;Patagoniart;Patagoniart;Windows;7 Jun, 2019;Action, Adventure, Casual, Indie;https://store.steampowered.com/app/1081250/Giant_Life/;Unknown;;;;
Gladiator of sparta;Argentina;A classic addictive/fun indie mini game for windows that you will play every time!. Do you ever wonder what is like to be in a realistic combat arena and how it feel? Play as Octavius...;https://shared.cloudflare.steamstatic.com/store_item_assets/steam/apps/1717800/header.jpg?t=1744056876;LFR games;LFR games;Windows;11 Oct, 2021;Action, Adventure, Indie, Strategy;https://store.steampowered.com/app/1717800/Gladiator_of_sparta/;Unknown;;;;
Go Slimey Go!;Argentina;Go Slimey Go! is an easy-to-pick-up game for all players! Help Slimey, our tiny slippery protagonist, visit his friends for some well deserved teatime after some thrilling platforming...;https://shared.cloudflare.steamstatic.com/store_item_assets/steam/apps/3215230/43b3fc6ffaa889a4354f44a0f41d82e6cc7e8c3a/header.jpg?t=1741618115;Tembac and Chabbie;Tembac, Chabbie;Windows;To be announced;Action, Adventure, Casual, Indie;https://store.steampowered.com/app/3215230/Go_Slimey_Go/;Unknown;;;;
Goblin Cleanup;Argentina;A co-op cleaning game where you have to clean and rearrange a dungeon before the next adventurers come to complete it again.;https://shared.cloudflare.steamstatic.com/store_item_assets/steam/apps/2748340/header.jpg?t=1736372618;Crisalu Games;Crisalu Games;Windows;To be announced;Adventure, Casual, Indie, Simulation, Early Access;https://store.steampowered.com/app/2748340/Goblin_Cleanup/;Unknown;;;;
Golazo! 2;Argentina;Dynamic arcade football game with medium-sized fields, no fouls, and offsides whistled. Add street gameplay to this mix to have just pure fun & action!;https://shared.cloudflare.steamstatic.com/store_item_assets/steam/apps/1499700/header.jpg?t=1745977687;Purple Tree S R L;Purple Tree S R L;Windows;31 Aug, 2022;Sports;https://store.steampowered.com/app/1499700/Golazo_2/;Unknown;;;;
Golazo! Soccer League;Argentina;Golazo is a dynamic arcade football game with a medium-sized fields, no fouls and offsides whistled. Just pure fun!;https://shared.cloudflare.steamstatic.com/store_item_assets/steam/apps/1431040/header.jpg?t=1745977635;Purple Play LLC;Purple Tree S R L;Windows;3 Nov, 2020;Casual, Sports;https://store.steampowered.com/app/1431040/Golazo_Soccer_League/;Unknown;;;;
Goldenjar Fall - Definitive Edition;Argentina;Embark on an exciting adventure in Goldenjar Fall! An epic ARPG that will immerse you in the legendary land of Clan Goldenjar, where Korik, a brave dwarf, seeks the path back to his a...;https://shared.cloudflare.steamstatic.com/store_item_assets/steam/apps/1631010/header.jpg?t=1728809372;Gamera Interactive;Ardeal Studio;Windows;19 Sep, 2023;Action, Adventure, Indie, RPG;https://store.steampowered.com/app/1631010/Goldenjar_Fall__Definitive_Edition/;Unknown;;;;
Goodbye Dr. Sanchez;Argentina;Goodbye Dr. Sanchez is a first person two player coop horror game where you must escape from the evil Dr. Sanchez’s imprisonment. Explore Sanchez’s domains. Avoid traps and other ...;https://shared.cloudflare.steamstatic.com/store_item_assets/steam/apps/1456000/header.jpg?t=1687450418;Cinnamon Matcha;Cinnamon Matcha;Windows;20 Jun, 2023;Action, Adventure, Casual;https://store.steampowered.com/app/1456000/Goodbye_Dr_Sanchez/;Unknown;;;;
