Name;Country;Description;Thumbnail;Publisher_Names;Developer_Names;Platform;Release_Date;Genre;Steam_Link;Epic_Link;PlayStation_Link;Xbox_Link;Switch_Link;GOG_Link
2030;Argentina;ONLINE sci-fi Multiplayer ZOMBIE game.It's 2030 AC, Beings from planet Venus are back and they declare WAR to humans with a deadly virus. Use ultimate military weapons, make body part...;https://shared.cloudflare.steamstatic.com/store_item_assets/steam/apps/1752890/header.jpg?t=1744056785;LFR games;LFR games;Windows;21 Feb, 2022;Action, Indie, Massively Multiplayer, Simulation;https://store.steampowered.com/app/1752890/2030/;Unknown;;;;
A Fungus In My Garden;Argentina;A Fungus in my Garden is a VR first person shooter where you have to save the Kingdom and Humanity fighting against Giants and mutant insects.;https://shared.cloudflare.steamstatic.com/store_item_assets/steam/apps/1850860/header.jpg?t=1653103571;Broken Compass Studio, Inc.;Broken Compass Studio, Inc.;Windows;20 May, 2022;Action, Indie;https://store.steampowered.com/app/1850860/A_Fungus_In_My_Garden/;Unknown;;;;
A Simple Door;Argentina;Try to escape from “A Simple Door” by facing your past, your darkest secrets and your fears through the doors.;https://shared.cloudflare.steamstatic.com/store_item_assets/steam/apps/3118700/header.jpg?t=1739301853;Keter Studio;Keter studio;Windows;To be announced;Action, Adventure, Indie;https://store.steampowered.com/app/3118700/A_Simple_Door/;Unknown;;;;
AESIR Online;Argentina;A massively multiplayer online role-playing game (MMORPG) developed in GODOT Engine by a group of friends from Argentina. It was inspired by a game created in 1999 called Argentum Onl...;https://shared.cloudflare.steamstatic.com/store_item_assets/steam/apps/2324940/header.jpg?t=1744809560;AESIR Online Staff;Leandro Mendoza, Agustin Di Lauro, Sebastian Di Lauro, Mateo Miccino, Alan Pallas, Mauro Bambozzi, Emiliano Martino;Windows, macOS, SteamOS + Linux;8 Nov, 2023;Adventure, Indie, Massively Multiplayer, RPG, Free To Play;https://store.steampowered.com/app/2324940/AESIR_Online/;Unknown;;;;
ASKE;Argentina;A first person shooter that sets you far away, near death.;https://shared.cloudflare.steamstatic.com/store_item_assets/steam/apps/1672790/header.jpg?t=1628958166;Tomás Esconjaureguy;Tomás Esconjaureguy;Windows, macOS, SteamOS + Linux;To be announced;Action, Indie;https://store.steampowered.com/app/1672790/ASKE/;Unknown;;;;
ASYLUM;Argentina;An epic supernatural horror adventure and the spiritual successor to cult classic Scratches set in a massive, decaying mental institute. Inspired by H. P. Lovecraft, Hammer Films and ...;https://shared.cloudflare.steamstatic.com/store_item_assets/steam/apps/230210/header.jpg?t=1745611590;Senscape;Senscape;Windows, macOS;13 Mar, 2025;Adventure, Indie;https://store.steampowered.com/app/230210/ASYLUM/;Unknown;;;;
AWAKENING;Argentina;Awakening is a first person experimental puzzle game with a unique gameplay based on pattern recognition. Guide a soul that decided to find meaning by solving puzzle machines with vid...;https://shared.cloudflare.steamstatic.com/store_item_assets/steam/apps/1118830/header.jpg?t=1692705723;PapaCorps;PapaCorps;Windows;To be announced;Indie;https://store.steampowered.com/app/1118830/AWAKENING/;Unknown;;;;
Aboard the Adventure;Argentina;Aboard the adventure is a humorous adventure game in which you will be part of the team of the daring Captain Quinn, with the objective of defeating the sinister Professor Weaver in a...;https://shared.cloudflare.steamstatic.com/store_item_assets/steam/apps/1765670/header.jpg?t=1727801954;Chenke Games;Chenke Games;Windows;To be announced;Action, Adventure, Indie;https://store.steampowered.com/app/1765670/Aboard_the_Adventure/;Unknown;;;;
Above - VR;Argentina;Above is a virtual experience that place the player in the position of a stranded astronaut in space. Join the main character in a visually stunning experience during the last minutes...;https://shared.cloudflare.steamstatic.com/store_item_assets/steam/apps/547040/header.jpg?t=1560493924;Patagoniart;Patagoniart;Windows;1 Nov, 2016;Adventure, Simulation;https://store.steampowered.com/app/547040/Above__VR/;Unknown;;;;
Ad Wars;Argentina;Tired of ads? Ad Wars is a multi-genre game where you travel all over the Internet to destroy ads once and for all! Jump your way into Super Freemium Lands, battle monsters RPG-style ...;https://shared.cloudflare.steamstatic.com/store_item_assets/steam/apps/1554050/header.jpg?t=1730290333;Moon Snack Games;Moon Snack Games;Windows, macOS, SteamOS + Linux;20 May, 2022;Action, Adventure, Indie, RPG, Early Access;https://store.steampowered.com/app/1554050/Ad_Wars/;Unknown;;;;
Adventure Time: Finn and Jake's Epic Quest;Argentina;Team up as Finn and Jake in a 3D adventure of epic proportions! The Land of Ooo has been transformed into a giant video game, and BMO has been kidnapped. Brawl your way through the Wi...;https://shared.cloudflare.steamstatic.com/store_item_assets/steam/apps/258590/header.jpg?t=1734980251;Cartoon Network Games;NGD Studios;Windows;11 Apr, 2014;Action, Adventure;https://store.steampowered.com/app/258590/Adventure_Time_Finn_and_Jakes_Epic_Quest/;Unknown;;;;
AfroPenguin & The Forbidden Ramen;Argentina;"""AfroPenguin & The Forbidden Ramen"" is a challenging argentinian 2D adventure game which pays homage to those Nintendo titles that made us smile as a kid (and why not, as adults).";https://shared.cloudflare.steamstatic.com/store_item_assets/steam/apps/2372750/header.jpg?t=1681485385;Osaka Studios;Leonardo Jorge Monge, Osaka Studios;Windows, macOS, SteamOS + Linux;14 Apr, 2023;Action, Adventure, Casual, Indie;https://store.steampowered.com/app/2372750/AfroPenguin__The_Forbidden_Ramen/;Unknown;;;;
All Knowledge Authority;Argentina;Be part of the All Knowledge Authority, and go in search of those forgotten mysteries in the corners of the world. Discover the secrets that forces that will surprise you want to hide...;https://shared.cloudflare.steamstatic.com/store_item_assets/steam/apps/2644090/header.jpg?t=1716669065;GEOMETRIC BYTES;GEOMETRIC BYTES;Windows;To be announced;Action, Adventure;https://store.steampowered.com/app/2644090/All_Knowledge_Authority/;Unknown;;;;
Almohadin: escape from the basement;Argentina;Almohadin: escape from the basement is an indie fast-paced 2D precision platformer packed with colorful visuals and bullet hell action. Face a story-rich cartoony adventure inspired b...;https://shared.cloudflare.steamstatic.com/store_item_assets/steam/apps/3157360/afb9307943be0d3810658799ee28b012c7539976/header.jpg?t=1746132372;Talio Games;Talio Games;Windows;1 Nov, 2024;Action, Adventure, Indie, Early Access;https://store.steampowered.com/app/3157360/Almohadin_escape_from_the_basement/;Unknown;;;;
Alone;Argentina;An isometric survival RPG without the survival. Collect resources and craft items and weapons. Build a settlement on your island. Hunt in the darkest forests, or slay the undead in th...;https://shared.cloudflare.steamstatic.com/store_item_assets/steam/apps/1975890/header.jpg?t=1733569763;Super Llama Games;Super Llama Games;Windows;22 Jul, 2022;Adventure, Casual, Indie, RPG, Early Access;https://store.steampowered.com/app/1975890/Alone/;Unknown;;;;
Alone With a Bunch of Robots;Argentina;Help the experienced space engineer Lenox and 44, his loyal AI Robot, to survive in a hostile environment full of discoveries and unexpected encounters. Join them in that quest for re...;https://shared.cloudflare.steamstatic.com/store_item_assets/steam/apps/1029190/header.jpg?t=1687823236;GEOMETRIC BYTES;GEOMETRIC BYTES;Windows;To be announced;Adventure;https://store.steampowered.com/app/1029190/Alone_With_a_Bunch_of_Robots/;Unknown;;;;
Animal Liberation Squad;Argentina;A stealthy short tale about underground animal activism. Lead a team of activists, rescue animals, break expensive machinery, graffiti walls and celebrate with vegan food at the Twist...;https://shared.cloudflare.steamstatic.com/store_item_assets/steam/apps/1297520/header.jpg?t=1740595175;Hidden People Club;Hidden People Club;Windows, macOS, SteamOS + Linux;To be announced;Action, Adventure, Indie, Strategy;https://store.steampowered.com/app/1297520/Animal_Liberation_Squad/;Unknown;;;;
Antarctic Adventure;Argentina;Experience Antarctic science at first-hand! A unique way of understanding why scientific research is so important to understand the planet we live in.;https://shared.cloudflare.steamstatic.com/store_item_assets/steam/apps/2053280/header.jpg?t=1657820678;Universidad Nacional de Tierra del Fuego;Universidad Nacional de Tierra del Fuego;Windows;14 Jul, 2022;Adventure, Free To Play, RPG, Simulation;https://store.steampowered.com/app/2053280/Antarctic_Adventure/;Unknown;;;;
Arcade Mayhem Juanito;Argentina;Arcade Mayhem Juanito is a retro experience about arcade-hopping. Teleport into different video games, play with unique mechanics inspired by well-known arcade games, face stunningly ...;https://shared.cloudflare.steamstatic.com/store_item_assets/steam/apps/617440/header.jpg?t=1580161708;Game Ever Studio;Game Ever Studio;Windows;3 Aug, 2017;Action, Adventure, Casual, Indie;https://store.steampowered.com/app/617440/Arcade_Mayhem_Juanito/;Unknown;;;;
Argentum Online;Argentina;Argentum Online, a 2D MMORPG, offers epic quests, dungeon delves, and battles in a fantasy world. Emphasizing community, it features alliances, PvP, and a player-driven economy, all w...;https://shared.cloudflare.steamstatic.com/store_item_assets/steam/apps/1956740/header.jpg?t=1743411203;Noland Studios;Noland Studios;Windows;29 Apr, 2022;Action, Adventure, Massively Multiplayer, RPG, Strategy, Free To Play;https://store.steampowered.com/app/1956740/Argentum_Online/;Unknown;;;;
Arran: The Book of Heroes;Argentina;Arran is a hack and slash co-op dark fantasy adventure with some RPG elements. Gore through enemies solo or along with up to 5 online players in the dark dungeons and barbaric lands o...;https://shared.cloudflare.steamstatic.com/store_item_assets/steam/apps/1545080/header.jpg?t=1701392427;Pal'Sur Studios;Pal'Sur Studios;Windows;To be announced;Action, Adventure, RPG;https://store.steampowered.com/app/1545080/Arran_The_Book_of_Heroes/;Unknown;;;;
Arranger: A Role-Puzzling Adventure;Argentina;Find your way in a world of breezy, thoughtful puzzles, along a charming journey of self-discovery.;https://shared.cloudflare.steamstatic.com/store_item_assets/steam/apps/2596420/header.jpg?t=1745972134;Furniture & Mattress LLC;Furniture & Mattress LLC;Windows, macOS;25 Jul, 2024;Adventure, Indie, RPG;https://store.steampowered.com/app/2596420/Arranger_A_RolePuzzling_Adventure/;Unknown;https://store.playstation.com/en-us/concept/10009671;;;
AstroBrawl;Argentina;AstroBrawl is a fast-paced interplanetary shooter in which gravity is your best ally and your worst enemy. Be an alien warrior through couch/online deathmatch and survival modes.;https://shared.cloudflare.steamstatic.com/store_item_assets/steam/apps/3175020/header.jpg?t=1740146481;PapaCorps;PapaCorps;Windows, macOS, SteamOS + Linux;To be announced;Action, Indie;https://store.steampowered.com/app/3175020/AstroBrawl/;Unknown;;;;
Automachef;Argentina;Welcome to Automachef, a resource management puzzler where you design kitchens, program machinery and watch your genius come to life! It’s time to engineer tomorrow’s kitchen, today!;https://shared.cloudflare.steamstatic.com/store_item_assets/steam/apps/984800/header.jpg?t=1726588825;Team17 Digital Ltd;Rhombico Games;Windows;23 Jul, 2019;Indie, Simulation;https://store.steampowered.com/app/984800/Automachef/;Unknown;;;https://www.nintendo.com/us/store/products/automachef-switch/;
Awakening;Argentina;Put an end to the chaos in this 2D action platformer! Engage in hand-to-hand combat against the gangs of Everseam, earn upgrades, and take down bosses vying for control of the city;https://shared.cloudflare.steamstatic.com/store_item_assets/steam/apps/3351410/header.jpg?t=1738606087;NiceTry;Behnder;Windows;3 Feb, 2025;Action, Adventure, Casual, Indie;https://store.steampowered.com/app/3351410/Awakening/;Unknown;;;;
Bahnsen Knights;Argentina;1986, Tornado Alley, USA… Go undercover as Boulder, an agent infiltrating the notorious religious cult known as the Bahnsen Knights. Face off against occultists, biblical storms, an...;https://shared.cloudflare.steamstatic.com/store_item_assets/steam/apps/1933190/header.jpg?t=1702905485;Chorus Worldwide Games;LCB Game Studio;Windows, macOS;14 Dec, 2023;Adventure, Indie;https://store.steampowered.com/app/1933190/Bahnsen_Knights/;Unknown;https://store.playstation.com/en-us/concept/10007958;;;
BalanCity;Argentina;BalanCity is a city building / balance physics game. It's a mixture between old school SimCity and Jenga. You must build the tallest towering city over a balancing platform while keep...;https://shared.cloudflare.steamstatic.com/store_item_assets/steam/apps/462680/header.jpg?t=1585592395;MeNic Games;MeNic Games;Windows, macOS, SteamOS + Linux;21 Sep, 2016;Casual, Indie, Simulation, Strategy;https://store.steampowered.com/app/462680/BalanCity/;Unknown;;;;
Beacon of Neyda;Argentina;In a world where a robot revolution failed, the last humans search for a way to survive and escape. Beacon of Neyda is a side-scroller strategy game where you have to survive waves of...;https://shared.cloudflare.steamstatic.com/store_item_assets/steam/apps/2000970/header.jpg?t=1738515837;Ghost Creative Studio;Ghost Creative Studio;Windows, SteamOS + Linux;To be announced;Action, Adventure, Indie, Strategy;https://store.steampowered.com/app/2000970/Beacon_of_Neyda/;Unknown;;;;
Below, Rusted Gods;Argentina;Below, Rusted Gods is a narrative-driven horror game where you are the lifeline supporting an expedition into the unknown. Keep both yourself and your squad alive by interpreting inst...;https://shared.cloudflare.steamstatic.com/store_item_assets/steam/apps/2895680/332bcf89d0a06c3791f3f8d4f2764b2ff4b6b2e5/header.jpg?t=1745287620;FromSouthGames;FromSouthGames;Windows;To be announced;Action, Adventure, Indie, Simulation;https://store.steampowered.com/app/2895680/Below_Rusted_Gods/;Unknown;;;;
Bichito Clicker;Argentina;Clicker / Idle style game where you must use your skill and abilities by clicking on the Bichos on your screen to defeat them and thus obtain points to improve yourself and face other...;https://shared.cloudflare.steamstatic.com/store_item_assets/steam/apps/2454140/header.jpg?t=1728964606;Shieldering GameStudio;Shieldering GameStudio;Windows;24 May, 2024;Action, Adventure, Casual, Indie;https://store.steampowered.com/app/2454140/Bichito_Clicker/;Unknown;;;;
Bildo;Argentina;Bildo is a 2D platform game in which the player plays the role of Bildo, a boy who saw his homeland consumed and ravaged by The Darkness, and decided to start a quest around the world...;https://shared.cloudflare.steamstatic.com/store_item_assets/steam/apps/674390/header.jpg?t=1591085572;DALESI;DALESI;Windows;20 Jul, 2017;Adventure, Indie;https://store.steampowered.com/app/674390/Bildo/;Unknown;;;;
Black Lotus Motel;Argentina;2 PLAYER ONLINE CO-OP simulator that puts your cooperative skills to the test. Choose your partner and ESCAPE TOGETHER before it's too late.;https://shared.cloudflare.steamstatic.com/store_item_assets/steam/apps/1677400/header.jpg?t=1705961817;A3;Ale Barredo;Windows, macOS;20 Apr, 2022;Simulation;https://store.steampowered.com/app/1677400/Black_Lotus_Motel/;Unknown;;;;
Bleeding Roots;Argentina;Bleeding Roots is a free fifteen minute horror game about a man taking care of his plants throughout the seasons.;https://shared.cloudflare.steamstatic.com/store_item_assets/steam/apps/3091770/header.jpg?t=1738805347;Mechanikoi;Mechanikoi, Luka Hizo Algo;Windows;7 Sep, 2024;Indie, Free To Play;https://store.steampowered.com/app/3091770/Bleeding_Roots/;Unknown;;;;
Bloody Service;Argentina;The conjoined twins were bullied and humiliated... Now justice will be served! BLOODY SERVICE is a dark, gory and violent coming-of-age slasher FMV Visual Novel with gruesome deaths a...;https://shared.cloudflare.steamstatic.com/store_item_assets/steam/apps/1415020/header.jpg?t=1613098314;CASE;CASE;Windows, macOS, SteamOS + Linux;22 Dec, 2020;Adventure, Indie;https://store.steampowered.com/app/1415020/Bloody_Service/;Unknown;;;;
Blossom, La Jirafa SAGA;Argentina;Enjoy the journey in this fun platform and Runner game thus begins her escape to Freedom. Help Blossom to escape the Zoo in part 1 and get the Ship to help her complete her journey in...;https://shared.cloudflare.steamstatic.com/store_item_assets/steam/apps/1834720/header.jpg?t=1737839660;BLJ Games;BLJ Games;Windows;5 Jan, 2022;Adventure, Casual, Indie;https://store.steampowered.com/app/1834720/Blossom_La_Jirafa_SAGA/;Unknown;;;;
Blue Fire;Argentina;Embark on an extraordinary adventure through the perished world of Penumbra to explore unique temples filled with increasingly difficult 3D platforming challenges, diverse enemies, qu...;https://shared.cloudflare.steamstatic.com/store_item_assets/steam/apps/1220150/header.jpg?t=1655302580;Graffiti Games;Robi Studios;Windows;4 Feb, 2021;Action, Adventure, Indie;https://store.steampowered.com/app/1220150/Blue_Fire/;Unknown;;;https://www.nintendo.com/us/store/products/blue-fire-switch/;
Blue Fire: Void Maker;Argentina;Blue Fire: Void Maker is a 3D platforming and level creation game. Let your imagination run wild designing hardcore, epic or silly levels and sharing them with others! The possibiliti...;https://shared.cloudflare.steamstatic.com/store_item_assets/steam/apps/1793350/header.jpg?t=1726840686;Graffiti Games;Robi Studios;Windows;4 Feb, 2022;Indie, Free To Play;https://store.steampowered.com/app/1793350/Blue_Fire_Void_Maker/;Unknown;;;;
Blue Rider;Argentina;In a valley flooded with bullets, your next challenge rises from a heap of scraps. This time there aren't blue hedgehogs or mega men to save you. Hop in and become the Blue Rider!;https://shared.cloudflare.steamstatic.com/store_item_assets/steam/apps/402340/header.jpg?t=1568830813;Ravegan;Ravegan;Windows;3 Mar, 2016;Action, Indie;https://store.steampowered.com/app/402340/Blue_Rider/;Unknown;https://store.playstation.com/en-us/product/UP1638-CUSA06498_00-BLUERIDERRAVEGAN/;https://www.xbox.com/en-us/games/store/Blue-Rider/C10VSTXQH606;;
Bots Chaos;Argentina;Can you finish this game in 10 minutes? Bots Chaos is an action FPS game where you must destroy many robots to beat a score in 10 minutes. You will never get bored in this casual, har...;https://shared.cloudflare.steamstatic.com/store_item_assets/steam/apps/2336970/header.jpg?t=1738536059;Lucas Fernandez;Lucas Fernandez;Windows;31 Mar, 2023;Action, Casual, Indie;https://store.steampowered.com/app/2336970/Bots_Chaos/;Unknown;;;;
Bunch of Heroes;Argentina;Pick up the Horror Pack for free during the Steam Halloween Sale! Offer ends November 1st at 10AM Pacific.;https://shared.cloudflare.steamstatic.com/store_item_assets/steam/apps/111400/header.jpg?t=1569422377;Nimble Giant Entertainment;Nimble Giant Entertainment;Windows;21 Sep, 2011;Action, Indie;https://store.steampowered.com/app/111400/Bunch_of_Heroes/;Unknown;;;;
CANINE;Argentina;PSX style horror game about a boy looking for his dog, kidnapped by an evil corporation that runs experiments with pets.;https://shared.cloudflare.steamstatic.com/store_item_assets/steam/apps/2334780/header.jpg?t=1721933565;Puko;Puko;Windows;10 May, 2023;Indie;https://store.steampowered.com/app/2334780/CANINE/;Unknown;;;;
CHACAL;Argentina;Run, hit, and dodge bullets with CHACAL! From the southern reaches to the capital of Argentina, achieve the best Score, and defeat the evil President Francisco to free the nation from...;https://shared.cloudflare.steamstatic.com/store_item_assets/steam/apps/1528370/header.jpg?t=1613743231;Pernich Media;Pernich Media;Windows;19 Feb, 2021;Action, Adventure, Casual, Indie;https://store.steampowered.com/app/1528370/CHACAL/;Unknown;;;;
COLD VR;Argentina;Time is your greatest weapon! Move to slow it down, stop, and risk everything. ;https://shared.cloudflare.steamstatic.com/store_item_assets/steam/apps/2636890/header.jpg?t=1739441282;Perp Games;ALLWARE LLC;Windows;11 Feb, 2025;Action, Casual, Indie, Strategy;https://store.steampowered.com/app/2636890/COLD_VR/;Unknown;;;;
Cannibal Abduction;Argentina;The family is hungry and he must provide, VHS slasher survival horror.;https://shared.cloudflare.steamstatic.com/store_item_assets/steam/apps/2189640/header.jpg?t=1730323109;selewi;Tomás Esconjaureguy;Windows, macOS, SteamOS + Linux;13 Jan, 2023;Adventure, Indie;https://store.steampowered.com/app/2189640/Cannibal_Abduction/;Unknown;;;;
Capibara Lost Dreams;Argentina;Enjoy the story of Frank and his adventure to escape from an island dominated by a sect of humanoid Capybaras, fight, explore, and meet countless fun characters!;https://shared.cloudflare.steamstatic.com/store_item_assets/steam/apps/2919870/header.jpg?t=1746027212;Cat Dreams Ar;Cat Dreams Ar;Windows;7 Mar, 2025;Action, Adventure, Casual, Indie;https://store.steampowered.com/app/2919870/Capibara_Lost_Dreams/;Unknown;;;;
Champions Of Chaos 2;Argentina;Champions of chaos 2 is an Arena turn based RPG where the player can combine up to 10 different classes in a two man party to fight waves of enemies and gain reputation and allies. Th...;https://shared.cloudflare.steamstatic.com/store_item_assets/steam/apps/366100/header.jpg?t=1447373280;Epic LLama;Epic LLama;Windows;24 Aug, 2015;Casual, Indie, RPG, Strategy;https://store.steampowered.com/app/366100/Champions_Of_Chaos_2/;Unknown;;;;
Champions of Regnum;Argentina;Choose your Realm and engage in the most dynamic player driven battlefield available on any MMO. Fight for the Alsius Empire, protect the woods of Syrtis or avenge the Brotherhood of ...;https://shared.cloudflare.steamstatic.com/store_item_assets/steam/apps/222520/header.jpg?t=1612867232;Nimble Giant Entertainment;Nimble Giant Entertainment;Windows, macOS, SteamOS + Linux;24 May, 2007;Free To Play, Indie, Massively Multiplayer, RPG;https://store.steampowered.com/app/222520/Champions_of_Regnum/;Unknown;;;;
Conur Life;Argentina;Survive the streets of San Hugo facing all kinds of problems in this open world located in Argentina.;https://shared.cloudflare.steamstatic.com/store_item_assets/steam/apps/1888330/f4dd0d4ce91918f904c74a0c8403e1e545a8b283/header.jpg?t=1743089612;MicroProse Software;San Hugo Studios;Windows;6 Mar, 2023;Action, Adventure, Casual, Indie, Racing, RPG, Early Access;https://store.steampowered.com/app/1888330/Conur_Life/;Unknown;;;;
County Hospital;Argentina;County Hospital is a singleplayer offline psychological horror inmersive game with jumpscares and high quality assets. Paranormal activity is happening, gather as much evidence as you...;https://shared.cloudflare.steamstatic.com/store_item_assets/steam/apps/1697560/header.jpg?t=1744056750;LFR games;LFR games;Windows;4 Aug, 2021;Action, Indie, Simulation, Strategy;https://store.steampowered.com/app/1697560/County_Hospital/;Unknown;;;;
County Hospital 2;Argentina;Paranormal Horror! Using just a handycam go inside a very dark abandoned hospital, the nightvision will help you to see, explore the place and face all kinds of brutal entities in a c...;https://shared.cloudflare.steamstatic.com/store_item_assets/steam/apps/1775990/header.jpg?t=1744056819;LFR games;LFR games;Windows;3 Oct, 2022;Action, Adventure, Indie, Strategy;https://store.steampowered.com/app/1775990/County_Hospital_2/;Unknown;;;;
Cursed West;Argentina;Cursed West contains the spirit of Glories of the past, Holding aspects such as Difficulty and Mechanics. Adding more modern visuals in both, levels with traditional 2d gameplay, as i...;https://shared.cloudflare.steamstatic.com/store_item_assets/steam/apps/512550/header.jpg?t=1473440428;GoeX GameS;GoeX GameS;Windows;9 Sep, 2016;Action, Adventure, Indie;https://store.steampowered.com/app/512550/Cursed_West/;Unknown;;;;
DEBT DEADLINE;Argentina;A psycho-thriller narrative RPG, fusing a retro-cinematic art style with mechanics from visual novels and adventure games. Escape a procedurally generated looping nightmare. Manage yo...;https://shared.cloudflare.steamstatic.com/store_item_assets/steam/apps/2558250/header.jpg?t=1702078123;Whispering Naked Man;Whispering Naked Man;Windows, macOS;To be announced;Adventure, RPG;https://store.steampowered.com/app/2558250/DEBT_DEADLINE/;Unknown;;;;
DIGITAL EXORCIST CF1_DEFRAG;Argentina;After the mysterious death of a Superstar Idol, disgraced DATA Agent Sawyer must face his ultimate challenge yet, being an undercover high school teacher while also keeping the Missis...;https://shared.cloudflare.steamstatic.com/store_item_assets/steam/apps/2944390/header.jpg?t=1722034004;COOL BEANS PRODUCTIONS ;COOL BEANS PRODUCTIONS;Windows;To be announced;Adventure;https://store.steampowered.com/app/2944390/DIGITAL_EXORCIST_CF1_DEFRAG/;Unknown;;;;
DIGITAL EXORCIST case_(0);Argentina;Step into a dark world where cyberdemons haunt humankind. When mutilated bodies start appearing all over this sleepy town in the Mississippi inaka, Sawyer, ex-AGENCY operative, now un...;https://shared.cloudflare.steamstatic.com/store_item_assets/steam/apps/2299040/header.jpg?t=1722034128;COOL BEANS PRODUCTIONS;COOL BEANS PRODUCTIONS;Windows;27 Apr, 2023;Adventure, Indie, RPG;https://store.steampowered.com/app/2299040/DIGITAL_EXORCIST_case_0/;Unknown;;;;
DOGOS;Argentina;DOGOS innovates the classic shmup gameplay incorporating 3D graphics, dynamic camera, and the ability to move through scenarios as if it were an open world. If you like fast-paced, th...;https://shared.cloudflare.steamstatic.com/store_item_assets/steam/apps/507050/header.jpg?t=1475525449;INTERNET URL S.A.;OPQAM;Windows;6 Sep, 2016;Action, Indie, Simulation;https://store.steampowered.com/app/507050/DOGOS/;Unknown;;;;
