Name;Country;Description;Thumbnail;Publisher_Names;Developer_Names;Platform;Release_Date;Genre;Steam_Link;Epic_Link;PlayStation_Link;Xbox_Link;Switch_Link;GOG_Link
Star Trek: Infinite;Argentina;Star Trek: Infinite is a grand strategy experience that lets you play your own Star Trek story as the leader of one of four major factions in the galaxy. Follow the specially crafted ...;https://shared.cloudflare.steamstatic.com/store_item_assets/steam/apps/1622900/header.jpg?t=1697483511;Paradox Interactive;Nimble Giant Entertainment;Windows, macOS;12 Oct, 2023;Adventure, Simulation, Strategy;https://store.steampowered.com/app/1622900/Star_Trek_Infinite/;Unknown;;;;
Stellar Mess: Operation Kush (Chapter 2);Argentina;Stellar Mess is a point&click 2D graphic adventure game with retro style, where the least likely hero must rescue the princess and save the galaxy from a tyrannical Stellar Armada. Al...;https://shared.cloudflare.steamstatic.com/store_item_assets/steam/apps/2847880/header.jpg?t=1741055986;Tibba Games;Tibba Games;Windows;3 Mar, 2025;Adventure;https://store.steampowered.com/app/2847880/Stellar_Mess_Operation_Kush_Chapter_2/;Unknown;;;;
Stellar Mess: The Princess Conundrum (Chapter 1);Argentina;Stellar Mess is a 2D point&click adventure game, set somewhere in Argentinean Patagonia. The game is inspired by early classic EGA games of the genre.;https://shared.cloudflare.steamstatic.com/store_item_assets/steam/apps/1507530/header.jpg?t=1740078085;Tibba Games;Tibba Games;Windows;26 Feb, 2023;Adventure, Indie;https://store.steampowered.com/app/1507530/Stellar_Mess_The_Princess_Conundrum_Chapter_1/;Unknown;;;;
Stellar Serenity;Argentina;Stellar Serenity is a relaxation game where you process materials and craft items in a spaceship. No pressure, no chance to fail.;https://shared.cloudflare.steamstatic.com/store_item_assets/steam/apps/2410850/header.jpg?t=1697552868;Gran Idea Games;Gran Idea Games;Windows;17 Oct, 2023;Adventure, Casual, Indie;https://store.steampowered.com/app/2410850/Stellar_Serenity/;Unknown;;;;
Storyteller;Argentina;Storyteller is an award-winning puzzle game about building stories. Start with a title, settings and characters and create a story that fits the story’s description. Play with stori...;https://shared.cloudflare.steamstatic.com/store_item_assets/steam/apps/1624540/header.jpg?t=1729098997;Annapurna Interactive;Daniel Benmergui;Windows, macOS;23 Mar, 2023;Adventure;https://store.steampowered.com/app/1624540/Storyteller/;Unknown;;;;
Street Paint Playground;Argentina;You are an artist with motor paint machine in a cool beach enviroment with some old walls to put your art into, the police and their dogs just want to stop the fun! make them happy wi...;https://shared.cloudflare.steamstatic.com/store_item_assets/steam/apps/2150560/header.jpg?t=1744057797;LFR games;LFR games;Windows;27 Sep, 2022;Casual, Indie;https://store.steampowered.com/app/2150560/Street_Paint_Playground/;Unknown;;;;
Sujeto 124: El hombre de traje;Argentina;Daniel Arias heads towards a mysterious house that his company bought, investigate the place and solve the puzzles that you will find to discover the terrible truth.;https://shared.cloudflare.steamstatic.com/store_item_assets/steam/apps/2416260/header.jpg?t=1702789236;Chun Chun Games;Chun Chun Games;Windows;19 May, 2023;Indie;https://store.steampowered.com/app/2416260/Sujeto_124_El_hombre_de_traje/;Unknown;;;;
Super Crazy Chickens;Argentina;Help this crazy team of chickens to get the mysterious green eggs while adding more and more members to the adventure. Discover all the secrets, challenge the fearsome bosses or simpl...;https://shared.cloudflare.steamstatic.com/store_item_assets/steam/apps/2180830/header.jpg?t=1722805008;The Freak World;The Freak World;Windows;1 Nov, 2022;Adventure, Indie;https://store.steampowered.com/app/2180830/Super_Crazy_Chickens/;Unknown;;;;
Super Farming Boy;Argentina;Your farm is under attack! Fly, harvest, grow crops & whack enemies with your shape-shifting one-button superpowers as you seek revenge from your evil nemesis, Korpo, who has captured...;https://shared.cloudflare.steamstatic.com/store_item_assets/steam/apps/659300/53e1795660bc0b11543f6a3c983207a4f4e8cc7b/header.jpg?t=1745587650;Renxo Europe Limited;LemonChili Soft;Windows;To be announced;Adventure, Casual, Indie, Free To Play, Early Access;https://store.steampowered.com/app/659300/Super_Farming_Boy/;Unknown;;;;
Super Intergalactic Gang;Argentina;Super Intergalactic Gang is a classic arcade shoot-em-up with a new twist. Slow time to dodge waves of bullets, charge up shots into super attacks, and even punch your enemies to deat...;https://shared.cloudflare.steamstatic.com/store_item_assets/steam/apps/429260/header.jpg?t=1666624152;Martin Cerdeira;Martin Cerdeira;Windows;4 Jan, 2016;Action, Casual;https://store.steampowered.com/app/429260/Super_Intergalactic_Gang/;Unknown;;;;
Super Symbol Boys;Argentina;Someone stole people's faces! Will any hero be able to collect the 100 Chistorbes to recover the face of the whole world? Game mechanics of gravity, run jump and dodge with a distinct...;https://shared.cloudflare.steamstatic.com/store_item_assets/steam/apps/1394370/header.jpg?t=1707177666;Andru Caba;Andru Caba;Windows;1 Feb, 2023;Adventure, Casual, Indie, Early Access;https://store.steampowered.com/app/1394370/Super_Symbol_Boys/;Unknown;;;;
Surviving The Humans;Argentina;Surviving the Humans is a 2D point-and-click adventure-style video game. Face the humans, who will seek to eliminate you in any way, while you learn what it is to be a zombie;https://shared.cloudflare.steamstatic.com/store_item_assets/steam/apps/1652460/header.jpg?t=1679961393;Surprised Monkey Studio;Surprised Monkey Studio;Windows;To be announced;Adventure;https://store.steampowered.com/app/1652460/Surviving_The_Humans/;Unknown;;;;
Switch It;Argentina;A bit frustrating game where you have to reach the end using the different types of blocks that you have.;https://shared.cloudflare.steamstatic.com/store_item_assets/steam/apps/1655060/header.jpg?t=1672955382;Lucas Fernandez;Lucas Fernandez;Windows;17 Jun, 2021;Casual, Indie;https://store.steampowered.com/app/1655060/Switch_It/;Unknown;;;;
Tales Of Miravia;Argentina;Immerse yourself in the world of Tales of Miravia, an action-packed RPG where every decision shapes your journey. Explore, battle, and uncover secrets in a fantasy realm filled with d...;https://shared.cloudflare.steamstatic.com/store_item_assets/steam/apps/3475020/df59d5cab00c2aa5b7d9bc063d48819c353f3428/header.jpg?t=1745941645;LeashaDevGames;LeashaDevGames;Windows;27 Feb, 2025;Action, Adventure, Casual, Indie, RPG, Strategy;https://store.steampowered.com/app/3475020/Tales_Of_Miravia/;Unknown;;;;
Tales of Old: Dominus;Argentina;The Battle of Brides is over, the kingdom lies in ruins. The corrupt rule, the just die or flee. As one of the defeated, forge your path of vengeance: Master warfare, claim and manage...;https://shared.cloudflare.steamstatic.com/store_item_assets/steam/apps/2761000/b11379b82a80ec000101b6e264aea858c0e8c667/header.jpg?t=1743612646;indie.io;Hvmana Industries MMD;Windows;To be announced;Action, Adventure, RPG, Simulation;https://store.steampowered.com/app/2761000/Tales_of_Old_Dominus/;Unknown;;;;
Tango: The Adventure Game;Argentina;A point & click adventure based on the legendary life of the greatest Tango singer, Carlos Gardel. With a strong grasp on Argentinean culture, it guides the player through a very char...;https://shared.cloudflare.steamstatic.com/store_item_assets/steam/apps/888010/header.jpg?t=1580828864;Inca Games;Gualicho Games;Windows, macOS;16 Nov, 2018;Adventure, Indie;https://store.steampowered.com/app/888010/Tango_The_Adventure_Game/;Unknown;;;;
Tempomancy;Argentina;Overcome any obstacle in the surreal adventure of the Tempomancer and discover the secrets that the forbidden lands of Fissra hide, always with Time on your side.;https://shared.cloudflare.steamstatic.com/store_item_assets/steam/apps/2596840/header.jpg?t=1719549748;Wanderer Labs, Image Campus;Wanderer Labs;Windows;To be announced;Action, Adventure, Indie;https://store.steampowered.com/app/2596840/Tempomancy/;Unknown;;;;
Tenebris Somnia;Argentina;Tenebris Somnia is a 2D survival horror adventure game with live action cutscenes. Unveil the depths of a disturbing story by solving puzzles and fighting horrible creatures.;https://shared.cloudflare.steamstatic.com/store_item_assets/steam/apps/2121510/header.jpg?t=1729129039;New Blood Interactive;Andrés Borghi, Saibot Studios;Windows;To be announced;Adventure, Indie;https://store.steampowered.com/app/2121510/Tenebris_Somnia/;Unknown;;;;
Teratopia;Argentina;Rid the land of evil invaders and rescue your friends in this colorful 3D action brawler!;https://shared.cloudflare.steamstatic.com/store_item_assets/steam/apps/1338100/header.jpg?t=1720816639;Eastasiasoft Limited;Ravegan;Windows;20 Jan, 2021;Action, Adventure, Indie;https://store.steampowered.com/app/1338100/Teratopia/;Unknown;https://store.playstation.com/en-us/product/UP2005-CUSA20357_00-TERATOPIA0000000/;;;
The 5th Door;Argentina;You find yourself in a quiet room with four doors. There's always an anomaly. Choose wisely.;https://shared.cloudflare.steamstatic.com/store_item_assets/steam/apps/3623590/20cbc7da2e8aaf2e56edeb1821f604ef1f747482/header.jpg?t=1745885744;Deliver Games;German Rieck, Tomas Gonzalez;Windows, macOS;15 May, 2025;Indie;https://store.steampowered.com/app/3623590/The_5th_Door/;Unknown;;;;
The Ballad of Bonky;Argentina;A bouncy claymation adventure. Bonky and Puncho take down evil robots, cryptids and weird lizards with the power of friendship ✨;https://shared.cloudflare.steamstatic.com/store_item_assets/steam/apps/1619870/header.jpg?t=1733711868;knutsel;Guy, cobcris;Windows, macOS, SteamOS + Linux;To be announced;Action, Adventure, Casual, Indie, RPG;https://store.steampowered.com/app/1619870/The_Ballad_of_Bonky/;Unknown;;;;
The Black Heart;Argentina;The Black Heart is a VS 2d fighting game in the tradition of Street Fighter or Mortal Kombat, where 6 creatures face each other in cruel battles with gothic aesthetic.;https://shared.cloudflare.steamstatic.com/store_item_assets/steam/apps/1431780/header.jpg?t=1727046768;Saibot Studios;Andrés Borghi;Windows;21 Oct, 2021;Action, Adventure, Indie;https://store.steampowered.com/app/1431780/The_Black_Heart/;Unknown;;;;
The Chosen Warriors;Argentina;The Chosen Warriors is a new old school side scroller beat 'em up inspired by games like Golden Axe and Knights of the Round.;https://shared.cloudflare.steamstatic.com/store_item_assets/steam/apps/610730/header.jpg?t=1597648284;GoeX GameS;GoeX GameS;Windows;22 Dec, 2017;Action, Adventure, Indie;https://store.steampowered.com/app/610730/The_Chosen_Warriors/;Unknown;;;;
The Cult of Chanseville;Argentina;"""The Cult of Chanseville"" is an indie suspense/horror game that's inspired by classics of the genre! The game will be released as soon as it's ready!";https://shared.cloudflare.steamstatic.com/store_item_assets/steam/apps/1802610/header.jpg?t=1673199091;Developing Dreams AR Game Studios;Developing Dreams AR, Matias Ezequiel Weschenfeller;Windows;To be announced;Adventure, Casual, Indie, Simulation;https://store.steampowered.com/app/1802610/The_Cult_of_Chanseville/;Unknown;;;;
The Escapist;Argentina;A fast paced die-a-lot platformer;https://shared.cloudflare.steamstatic.com/store_item_assets/steam/apps/315480/header.jpg?t=1447362808;Backstab Games;Backstab Games;Windows, macOS, SteamOS + Linux;15 Sep, 2014;Action, Indie;https://store.steampowered.com/app/315480/The_Escapist/;Unknown;;;;
The Fable of a Rabbit;Argentina;You are Leen -a humble rabbit- and you will face a world full of prejudices and mysteries. Explore a vast land, gather resources and build your settlement. Discover the truth behind t...;https://shared.cloudflare.steamstatic.com/store_item_assets/steam/apps/1362840/header.jpg?t=1688013589;GEOMETRIC BYTES;GEOMETRIC BYTES;Windows;To be announced;Action, Adventure, Indie, RPG;https://store.steampowered.com/app/1362840/The_Fable_of_a_Rabbit/;Unknown;;;;
The Fragment;Argentina;His wife Jane and you are scientists hired by the US government to investigate a strange element found in an asteroid that fell to planet earth, but in the middle of the investigation...;https://shared.cloudflare.steamstatic.com/store_item_assets/steam/apps/1107190/header.jpg?t=1572151185;PG Entertainment;David Pierucci;Windows;26 Oct, 2019;Indie;https://store.steampowered.com/app/1107190/The_Fragment/;Unknown;;;;
The Interactive Adventures of Dog Mendonça & Pizzaboy®;Argentina;Based on the award-winning graphic novel series published by Dark Horse, uncover the supernatural mysteries of Lisbon's underworld in 'The Interactive Adventures of Dog Mendonça & Pi...;https://shared.cloudflare.steamstatic.com/store_item_assets/steam/apps/330420/header.jpg?t=1645612260;Ravenscourt;OKAM Studio;Windows, macOS, SteamOS + Linux;3 Mar, 2016;Adventure;https://store.steampowered.com/app/330420/The_Interactive_Adventures_of_Dog_Mendonca__Pizzaboy/;Unknown;;;;
The Journey: Bob's Story;Argentina;The Journey: Bob's Story is an Exploration, Atmospheric and puzzle 2D platformer. Play as Bob, who goes on an adventure to find his best friend Neibag who left the village with a grou...;https://shared.cloudflare.steamstatic.com/store_item_assets/steam/apps/385410/header.jpg?t=1515794443;Tomas Gonzalez;Tomas Gonzalez, Martin Pilaszek;Windows;8 Sep, 2017;Adventure, Casual, Indie;https://store.steampowered.com/app/385410/The_Journey_Bobs_Story/;Unknown;;;;
The Last Promise;Argentina;In this short and thrilling experience, join Thomas, a young explorer, and Lucy, a brave princess, on an adventure to restore order and peace between the demon, human, and fairy kingd...;https://shared.cloudflare.steamstatic.com/store_item_assets/steam/apps/1149180/header.jpg?t=1731469077;Undermax Games;Undermax Games;Windows;31 Oct, 2019;Indie, RPG, Free To Play, Early Access;https://store.steampowered.com/app/1149180/The_Last_Promise/;Unknown;;;;
The Neon Mate;Argentina;The Neon Mate is an unique retro 3D platformer experience with synthwave music and endless gameplay;https://shared.cloudflare.steamstatic.com/store_item_assets/steam/apps/1334970/header.jpg?t=1596651352;Rhomita;Rhomita;Windows;5 Aug, 2020;Action, Casual, Indie;https://store.steampowered.com/app/1334970/The_Neon_Mate/;Unknown;;;;
The Night of the Scissors;Argentina;Scrap hunting season has gone wrong, VHS slasher survival horror.;https://shared.cloudflare.steamstatic.com/store_item_assets/steam/apps/1975180/header.jpg?t=1730323232;selewi;Tomás Esconjaureguy;Windows, macOS, SteamOS + Linux;13 May, 2022;Action, Adventure, Indie;https://store.steampowered.com/app/1975180/The_Night_of_the_Scissors/;Unknown;;;;
The Parrot That Summons Demons;Argentina;Once the pet of an evil worshiper... Now adopted by an unlucky family! THE PARROT THAT SUMMONS DEMONS is a horror FMV visual novel featuring a dark and unsettling story with several p...;https://shared.cloudflare.steamstatic.com/store_item_assets/steam/apps/1487200/header.jpg?t=1740592939;CASE;CASE;Windows, macOS, SteamOS + Linux;To be announced;Adventure, Indie;https://store.steampowered.com/app/1487200/The_Parrot_That_Summons_Demons/;Unknown;;;;
The Path Into The Abyss;Argentina;"""The Path into the Abyss"" is a hardcore first-person open-world survival shooter set in Buenos Aires with a backdrop of cosmic horror, combat mechanics, dynamic AI, and looting.";https://shared.cloudflare.steamstatic.com/store_item_assets/steam/apps/3000460/header.jpg?t=1717876063;MXR Productions;MXR Productions;Windows;To be announced;Action, Adventure, Indie, RPG;https://store.steampowered.com/app/3000460/The_Path_Into_The_Abyss/;Unknown;;;;
Thumb Fighter;Argentina;These Thumbs are hungry for battle. You in?;https://shared.cloudflare.steamstatic.com/store_item_assets/steam/apps/1522620/header.jpg?t=1617921186;Avix Games;Avix Games;Windows;To be announced;Action, Casual, Indie;https://store.steampowered.com/app/1522620/Thumb_Fighter/;Unknown;Unknown;;;
Thunder Ray;Argentina;Thunder Ray is Arcade-Boxing, Retro-like gameplay with blood and violence. Defeat all the best fighters in the galaxy to become the GOAT of the universe.;https://shared.cloudflare.steamstatic.com/store_item_assets/steam/apps/1944910/header.jpg?t=1745977467;Purple Tree S R L;Purple Tree S R L;Windows;14 Sep, 2023;Action, Casual, Indie, Sports;https://store.steampowered.com/app/1944910/Thunder_Ray/;Unknown;;https://www.xbox.com/en-us/games/store/thunder-ray/9nlzn34wnpbt;;
ThunderWheels;Argentina;ThunderWheels is a retro racing game with a classic top-down racing perspective plus third and first person view, realistic physics and really fun circuits full of 80's nostalgia.;https://shared.cloudflare.steamstatic.com/store_item_assets/steam/apps/296790/header.jpg?t=1669710891;Arcade Injection;Arcade Injection;Windows;2 Nov, 2017;Casual, Indie, Racing, Simulation, Sports, Early Access;https://store.steampowered.com/app/296790/ThunderWheels/;Unknown;;;;
Tilebreaker;Argentina;Destroy blocks through 20 levels and 5 unique bosses with different mechanics. Do it in the best possible time!;https://shared.cloudflare.steamstatic.com/store_item_assets/steam/apps/1940490/header.jpg?t=1727386791;Square Wheel;Square Wheel;Windows;26 Apr, 2022;Action, Casual, Indie;https://store.steampowered.com/app/1940490/Tilebreaker/;Unknown;;;;
Tinytopia;Argentina;Construct charming toy towns and cities atop tiny terrain. Combine building blocks to create new megastructures. Test your skills in the physics-based Challenge stages or simply unwin...;https://shared.cloudflare.steamstatic.com/store_item_assets/steam/apps/968550/header.jpg?t=1729181311;Mastiff;MeNic Games;Windows, macOS, SteamOS + Linux;30 Aug, 2021;Casual, Simulation, Strategy;https://store.steampowered.com/app/968550/Tinytopia/;Unknown;;;;
Torii;Argentina;Let's fall together.;https://shared.cloudflare.steamstatic.com/store_item_assets/steam/apps/1589680/header.jpg?t=1734970657;Moswig;Moswig;Windows;17 Nov, 2022;Indie;https://store.steampowered.com/app/1589680/Torii/;Unknown;;;;
Tournament Ark;Argentina;A heavily anime-inspired deck builder. You play as one of the participants in the Tournament Ark, a combat tournament held on an interdimensional boat. Pick the right moves, choose th...;https://shared.cloudflare.steamstatic.com/store_item_assets/steam/apps/1666520/header.jpg?t=1732843658;Faws;Faws;Windows, SteamOS + Linux;18 Dec, 2022;Indie, Strategy, Free To Play;https://store.steampowered.com/app/1666520/Tournament_Ark/;Unknown;;;;
Tracks n' Turrets;Argentina;Get ready to embark on an exciting strategy adventure in a fantasy world where mobility and strategic planning are essential for survival. Prepare to defend your kingdoms on the move ...;https://shared.cloudflare.steamstatic.com/store_item_assets/steam/apps/2643560/header.jpg?t=1739447409;Ghost Creative Studio;Ghost Creative Studio;Windows;To be announced;Indie;https://store.steampowered.com/app/2643560/Tracks_n_Turrets/;Unknown;;;;
Trade Conquest;Argentina;Rise from a cunning strategist to a powerful ruler. Master economic warfare, manipulate global events, and build industries or armies to conquer the world. Every decision in this mode...;https://shared.cloudflare.steamstatic.com/store_item_assets/steam/apps/3160580/dfa2642810d09efd1129ec2a0da419ff5202a617/header.jpg?t=1746453798;GrandPaw Games;GrandPaw Games;Windows;17 Dec, 2024;Indie, Simulation, Strategy;https://store.steampowered.com/app/3160580/Trade_Conquest/;Unknown;;;;
Trash Troopers: Earth Reclaim;Argentina;Instead of constructing cities, you're on a mission to clean up the mess left behind by the older generation. You'll guide your Troopers to pick up trash, dismantle old oil facilities...;https://shared.cloudflare.steamstatic.com/store_item_assets/steam/apps/2592010/header.jpg?t=1744057819;LFR games;LFR games;Windows;2 May, 2024;Casual, Simulation, Strategy;https://store.steampowered.com/app/2592010/Trash_Troopers_Earth_Reclaim/;Unknown;;;;
Trials of Azra;Argentina;Play as Sam, a kid that controls the dead! Defeat your enemies with magic and control their bodies to solve challenging puzzles!;https://shared.cloudflare.steamstatic.com/store_item_assets/steam/apps/487160/header.jpg?t=1726493825;Onion Core;Onion Core, Bruno Bombardi, Alejandro Elizalde;Windows, macOS, SteamOS + Linux;1 Aug, 2016;Adventure, Indie;https://store.steampowered.com/app/487160/Trials_of_Azra/;Unknown;;;;
Trident's Wake;Argentina;Trident's Wake is an intense co-operative twin-stick shooter in an unforgiving sci-fi setting. Join up to three other players to take back humanity's last hope - the colony ship code-...;https://shared.cloudflare.steamstatic.com/store_item_assets/steam/apps/704880/header.jpg?t=1623430199;Graffiti Games;Bacus Studios;Windows;4 Jun, 2019;Action, Indie;https://store.steampowered.com/app/704880/Tridents_Wake/;Unknown;;;;
True Racing;Argentina;The best way to start a carrer as politician? YES!!! ONE WORD!!! Wheels!!!... and, this is about it, how to solve political stuffs that can't be fixed within the democracy, with the d...;https://shared.cloudflare.steamstatic.com/store_item_assets/steam/apps/1821810/header.jpg?t=1722426928;BSO;BSO, BSA;Windows;24 Mar, 2022;Casual, Indie, Racing, Sports;https://store.steampowered.com/app/1821810/True_Racing/;Unknown;;;;
ULTRATORO;Argentina;Drive at full speed in donut-shaped worlds. Your car is a hacking device and your mission is to destroy the biggest megacorporation on the planet. Experience an adrenaline filed arcad...;https://shared.cloudflare.steamstatic.com/store_item_assets/steam/apps/2274250/header.jpg?t=1707469887;RETSA GAMES;RETSA GAMES;Windows, SteamOS + Linux;9 Feb, 2024;Action, Indie, Racing;https://store.steampowered.com/app/2274250/ULTRATORO/;Unknown;;;;
Understanding, The Game;Argentina;'Understanding, the game' it's a suspense/investigation horror indie game inspired in classic horror games! Full Game coming as soon we can! Help us grow the game!;https://shared.cloudflare.steamstatic.com/store_item_assets/steam/apps/1491640/header.jpg?t=1645847369;MatyGexGames;Matias Ezequiel Weschenfeller;Windows;23 Dec, 2020;Adventure, Casual, Free To Play, Indie;https://store.steampowered.com/app/1491640/Understanding_The_Game/;Unknown;;;;
Unrest Indigo;Argentina;The idea that all feelings have a single definition is about to change. Unrest Indigo is a first person game of the horror genre that explores the dark depths of a great change.;https://shared.cloudflare.steamstatic.com/store_item_assets/steam/apps/951470/header.jpg?t=1558043264;Marcos Dumont ;Marcos Dumont;Windows;12 Apr, 2019;Indie;https://store.steampowered.com/app/951470/Unrest_Indigo/;Unknown;;;;
Unswappers;Argentina;"Unswappers is an exciting game where the player becomes an agent of a timeless organization tasked with fixing changes in reality, also refered as ""Anomalies"" or ""Swaps"", caused by Re...";https://shared.cloudflare.steamstatic.com/store_item_assets/steam/apps/2405070/header.jpg?t=1694206437;SAF;SAF;Windows;25 Jul, 2023;Casual, Indie;https://store.steampowered.com/app/2405070/Unswappers/;Unknown;;;;
Unusual Findings;Argentina;Three friends uncover mysteries in the 1980s. Follow their amazing adventures in a game where your decisions really matter. Be prepared to spin like a record on your incredible journe...;https://shared.cloudflare.steamstatic.com/store_item_assets/steam/apps/1605320/header.jpg?t=1729766657;ESDigital Games;Epic Llama Games;Windows, macOS, SteamOS + Linux;12 Oct, 2022;Adventure, Indie;https://store.steampowered.com/app/1605320/Unusual_Findings/;Unknown;https://store.playstation.com/en-us/concept/10005550;;https://www.nintendo.com/us/store/products/unusual-findings-switch/;
Unveil;Argentina;Experience Survival in it's purest form. Unveil delivers a rich recreation of Nature with a deep simulation of Weather, Body, Flora & Fauna, Fire and more.;https://shared.cloudflare.steamstatic.com/store_item_assets/steam/apps/375210/header.jpg?t=1681227386;Particle Studios;Particle Studios;Windows;19 Apr, 2016;Indie, Simulation;https://store.steampowered.com/app/375210/Unveil/;Unknown;;;;
Valeria the Pagan Priestess;Argentina;Valeria the Pagan Priestess is a savage and sexy celebration of old-school dark fantasy themes, modernized with visceral hack-and-slash combat!;https://shared.cloudflare.steamstatic.com/store_item_assets/steam/apps/2400650/header.jpg?t=1729267600;Skynet Games;Gauchobot;Windows;To be announced;Action, Adventure, Indie;https://store.steampowered.com/app/2400650/Valeria_the_Pagan_Priestess/;Unknown;;;;
Valerosa;Argentina;Put yourself in the role of the courageous women and discover the challenges they had to face throughout the different eras. Fight for the fundamental rights of women in Argentina, ch...;https://shared.cloudflare.steamstatic.com/store_item_assets/steam/apps/2560960/header.jpg?t=1715707357;Team Ojeras;Team Ojeras;Windows;To be announced;Action, Casual, Indie, Strategy;https://store.steampowered.com/app/2560960/Valerosa/;Unknown;Unknown;;;
Varney Lake;Argentina;Summer, 1954. A perfect vacation awaits three best friends, playing games, making crazy plans, and running from bullies... Until they meet the vampire. What really happened that summe...;https://shared.cloudflare.steamstatic.com/store_item_assets/steam/apps/1933180/header.jpg?t=1721409594;Chorus Worldwide Games;LCB Game Studio;Windows, macOS;28 Apr, 2023;Adventure, Indie;https://store.steampowered.com/app/1933180/Varney_Lake/;Unknown;;https://www.xbox.com/en-US/games/store/varney-lake/9NXDR9SSKTJ4;;
