Name;Country;Description;Thumbnail;Publisher_Names;Developer_Names;Platform;Release_Date;Genre;Steam_Link;Epic_Link;PlayStation_Link;Xbox_Link;Switch_Link;GOG_Link
Gravity Girl;Argentina;Follow the story of Layla, a young witch with the power to control gravity. Together with the coven, she will fight against the threat that has returned once again to destroy the game...;https://shared.cloudflare.steamstatic.com/store_item_assets/steam/apps/3154470/header.jpg?t=1728010939;Joacoyco;Joacoyco;Windows;To be announced;Adventure, Indie;https://store.steampowered.com/app/3154470/Gravity_Girl/;Unknown;;;;
Halftime Builders;Argentina;Halftime Builders is a game that mixes Tower Defense, Horde Survivor, RTS and Roguelike elements. Pick your defenses, build them up, collect scrap, level up and kill an endless amount...;https://shared.cloudflare.steamstatic.com/store_item_assets/steam/apps/2342720/header.jpg?t=1737481012;Bigboot Studios;Bigboot Studios;Windows, SteamOS + Linux;To be announced;Action, Casual, RPG, Strategy, Early Access;https://store.steampowered.com/app/2342720/Halftime_Builders/;Unknown;;;;
Halftime Heroes;Argentina;SURVIVE COUNTLESS HORDES, BE A ONE MAN ARMY, DIE AND RETURN STRONGER. Halftime Heroes is a Survival Rogue Action RPG game with short and intense matches where you learn spells, level ...;https://shared.cloudflare.steamstatic.com/store_item_assets/steam/apps/1907900/header.jpg?t=1728846968;Bigboot Studios;Bigboot Studios;Windows, SteamOS + Linux;11 May, 2023;Action, Adventure, RPG;https://store.steampowered.com/app/1907900/Halftime_Heroes/;Unknown;;;https://www.nintendo.com/us/store/products/halftime-heroes-switch/;
Hayaku! Island of Darkness;Argentina;Explore a mysterious island full of dangers and uncover the secrets behind the anomalous creatures that inhabit it in this retro-style metroidvania.;https://shared.cloudflare.steamstatic.com/store_item_assets/steam/apps/2402500/header.jpg?t=1713816338;Pizia Studios;Pizia Studios;Windows;To be announced;Action, Adventure, Indie;https://store.steampowered.com/app/2402500/Hayaku_Island_of_Darkness/;Unknown;;;;
Hellbound;Argentina;Classic First Person Shooter style game. Like the good old days. An action game focused on speed, gore, guns, and metal music. Inspired by the 90s’ classics with modern visuals and ...;https://shared.cloudflare.steamstatic.com/store_item_assets/steam/apps/753590/header.jpg?t=1727046815;Saibot Studios;Saibot Studios;Windows;4 Aug, 2020;Action, Indie;https://store.steampowered.com/app/753590/Hellbound/;Unknown;;;;
Hellbound: Survival Mode;Argentina;FULL GAME NOW AVAILABLE. GO GET IT! This is the Free Survival Mode for Hellbound: a '90s style First Person Shooter, made 30 years later… but just a glimpse of the full game, go che...;https://shared.cloudflare.steamstatic.com/store_item_assets/steam/apps/802200/header.jpg?t=1724088076;Saibot Studios;Saibot Studios;Windows;9 May, 2018;Action, Indie, Free To Play;https://store.steampowered.com/app/802200/Hellbound_Survival_Mode/;Unknown;;;;
Hex Defense;Argentina;Hex Defense is a virtual reality tower defense game. Engage in combat defending your base in this inmersive tabletop world. Setup your defenses, manage and modify them according to th...;https://shared.cloudflare.steamstatic.com/store_item_assets/steam/apps/1014900/header.jpg?t=1561135786;Patagoniart;Patagoniart;Windows;15 Feb, 2019;Action, Casual, Simulation, Strategy;https://store.steampowered.com/app/1014900/Hex_Defense/;Unknown;;;;
Hidden Lands - Spot the differences;Argentina;These lands are paused in time, split apart. Find their differences to to bring them back to life. Discover ancient civilizations through their lost treasures.;https://shared.cloudflare.steamstatic.com/store_item_assets/steam/apps/1378060/header.jpg?t=1620411474;Avix Games;Avix Games;Windows;28 Jan, 2021;Casual, Free To Play, Indie;https://store.steampowered.com/app/1378060/Hidden_Lands__Spot_the_differences/;Unknown;;;;
Hidden: On the trail of the Ancients;Argentina;"Immersed into dark and unexplored ancient woods in a search of the almost forgotten ""Legend of the Ancients"". But not everything goes as planned as the place keeps a never revealed ho...";https://shared.cloudflare.steamstatic.com/store_item_assets/steam/apps/352580/header.jpg?t=1464207711;Lost Spell;Lost Spell;Windows;5 Aug, 2015;Adventure, Indie;https://store.steampowered.com/app/352580/Hidden_On_the_trail_of_the_Ancients/;Unknown;;;;
I See Red;Argentina;Matthew Taurus, after losing everything in a horrifying event, turned from honorable policeman into vengeful outlaw. Get ready to rage through dangerous spaceships in this frantic twi...;https://shared.cloudflare.steamstatic.com/store_item_assets/steam/apps/1594460/d018062c2a8efe09443e97385b2c6547df4a4261/header.jpg?t=1745422689;Whiteboard Games;Whiteboard Games;Windows;24 Oct, 2022;Action, Indie;https://store.steampowered.com/app/1594460/I_See_Red/;Unknown;;;;
IF: Walls could answer;Argentina;What if walls could answer? Whatever that means, you’ll explore the memories of a neurotic scientist resolving puzzles that could help his mental state, discovering different ending...;https://shared.cloudflare.steamstatic.com/store_item_assets/steam/apps/2436090/header.jpg?t=1720815030;Todist;Todist;Windows;6 Jun, 2023;Adventure, Indie;https://store.steampowered.com/app/2436090/IF_Walls_could_answer/;Unknown;;;;
Idle Slayer;Argentina;Idle Slayer is an incremental game with idle and active playstyle mechanics, medieval pixel art visuals and retro 8-bit sounds and music.;https://shared.cloudflare.steamstatic.com/store_item_assets/steam/apps/1353300/header.jpg?t=1728934681;Pablo Leban;Pablo Leban;Windows;21 Dec, 2020;Casual, Indie, Strategy, Free To Play;https://store.steampowered.com/app/1353300/Idle_Slayer/;Unknown;;;;
Insert Paper;Argentina;You don't know who or where you are. The papers are there and the computers are asking you to insert paper. Your job here is simple: find the documents considering the information req...;https://shared.cloudflare.steamstatic.com/store_item_assets/steam/apps/661490/header.jpg?t=1715050380;Conglomerate 5;Startreming;Windows;10 Oct, 2017;Indie;https://store.steampowered.com/app/661490/Insert_Paper/;Unknown;;;;
John's Tombstone;Argentina;Drive inside a dream, explore one of Saturn's moons, and discover the afterlife. John's Tombstone is a walking simulator, a story split in three chapters, each chapter very different ...;https://shared.cloudflare.steamstatic.com/store_item_assets/steam/apps/1826820/header.jpg?t=1650394959;Bigboot Studios;Bigboot Studios;Windows, macOS, SteamOS + Linux;To be announced;Adventure, Indie;https://store.steampowered.com/app/1826820/Johns_Tombstone/;Unknown;;;;
Junior Solutions;Argentina;Junior Solutions us a Sci Fi 3D graphic adventure. Where the player will travel in the multiverse solving conflicts of the different civilizations that inhabit each world and making h...;https://shared.cloudflare.steamstatic.com/store_item_assets/steam/apps/1460520/header.jpg?t=1676659733;Scubalight Studios;Scubalight Studios;Windows;To be announced;Adventure, Indie;https://store.steampowered.com/app/1460520/Junior_Solutions/;Unknown;;;;
KVLT;Argentina;Fight your way through armies of Nazi occultists, religious zealots, and unspeakable cosmic horrors to unveil the Eldritch secrets behind the war theatre in this 2000s-era-inspired gr...;https://shared.cloudflare.steamstatic.com/store_item_assets/steam/apps/2113960/header.jpg?t=1732803338;Evil Guinea Pig;Evil Guinea Pig;Windows;To be announced;Action, Indie;https://store.steampowered.com/app/2113960/KVLT/;Unknown;;;;
Kelvin and the Infamous Machine;Argentina;Kelvin and the Infamous Machine is a hilarious point-and-click adventure in which you stumble irresponsibly through history to help legendary geniuses complete their masterworks!;https://shared.cloudflare.steamstatic.com/store_item_assets/steam/apps/376520/header.jpg?t=1739395877;Blyts;Blyts;Windows, macOS, SteamOS + Linux;21 Jul, 2016;Adventure, Indie;https://store.steampowered.com/app/376520/Kelvin_and_the_Infamous_Machine/;Unknown;;;;
Kentum;Argentina;Stranded in the year 10,000, Kent—an average Joe turned clone—must survive, explore, and rebuild civilization with the help of a snarky AI. Craft, farm, and automate in this 2D cr...;https://shared.cloudflare.steamstatic.com/store_item_assets/steam/apps/2165140/bd6e3e07ab620beded4bf2820fab8d6d4df97a06/header.jpg?t=1745907303;Tlön Industries, indienova;Tlön Industries;Windows;To be announced;Action, Adventure, Simulation;https://store.steampowered.com/app/2165140/Kentum/;Unknown;;;;
Kernel Hearts;Argentina;Gather your allies. Eliminate Angels. Transform into a Magical Girl. Slay god. Kernel Hearts is a Multiplayer Co-Op Roguelike Action RPG about four magical girls and their attempt to ...;https://shared.cloudflare.steamstatic.com/store_item_assets/steam/apps/2902170/bff6b70d09cc0ce5911de7a1ec63b87b6d49f523/header.jpg?t=1744217348;Whitethorn Games;Ephemera Games;Windows;To be announced;Action, Indie;https://store.steampowered.com/app/2902170/Kernel_Hearts/;Unknown;;;;
Khoros;Argentina;Khoros is a theatrical puzzle set on Ancient Greek theater's charming scenarios. Guide Ere in a path to glory performing the most acclaimed plays. Bring together a powerful cast and r...;https://shared.cloudflare.steamstatic.com/store_item_assets/steam/apps/1843780/header.jpg?t=1671021883;Team Spicy Bubble;Sureksu;Windows;18 May, 2022;Casual, Indie, Strategy;https://store.steampowered.com/app/1843780/Khoros/;Unknown;;;;
Kosmolaris;Argentina;Kosmolaris is a relaxing puzzle game where you'll have combine a wide variety of elements to create new ones, starting with four basic elements: Air 💨, Fire 🔥, Earth 🍃, and Water 💧.;https://shared.cloudflare.steamstatic.com/store_item_assets/steam/apps/3284610/header.jpg?t=1732277676;John Arrow Games;Juan Manuel Flecha;Windows;22 Nov, 2024;Casual, Indie, Free To Play;https://store.steampowered.com/app/3284610/Kosmolaris/;Unknown;;;;
LOCOSOCCER 2;Argentina;LOCOSOCCER 2 is a crazy fast-paced physics-based casual football game that you can play everywhere with anybody or against anybody.;https://shared.cloudflare.steamstatic.com/store_item_assets/steam/apps/2173530/header.jpg?t=1735781760;TheGamePublisher.com;Startreming Games;Windows, macOS, SteamOS + Linux;7 Dec, 2022;Casual, Sports;https://store.steampowered.com/app/2173530/LOCOSOCCER_2/;Unknown;;;;
La Salamanca;Argentina;"""La Salamanca"" is an inmersive first-person psychological horror experience inspired by a local legend from Argentina, a story-driven game where you traverse different sections, solve...";https://shared.cloudflare.steamstatic.com/store_item_assets/steam/apps/3025180/header.jpg?t=1745870850;Carpincho Studio;Carpincho Studio;Windows;23 May, 2025;Action, Adventure, Indie;https://store.steampowered.com/app/3025180/La_Salamanca/;Unknown;;;;
Last Vanguard;Argentina;Explore a stunning hand-crafted world ravaged by war and ruled by a evil tyrant. Face a wide variety of enemies as you customize your strategy, switch weapons, and unlock powerful abi...;https://shared.cloudflare.steamstatic.com/store_item_assets/steam/apps/1729180/header.jpg?t=1744664526;Cool Tapir Studios;Cool Tapir Studios;Windows;5 Nov, 2024;Action, Adventure, Indie, Early Access;https://store.steampowered.com/app/1729180/Last_Vanguard/;Unknown;;;;
Liberators' Chronicles;Argentina;Liberators' Chronicles is an exciting turn-based strategy game that will take you to the South American independence campaigns. Liberate half a continent from the yoke of the Spanish ...;https://shared.cloudflare.steamstatic.com/store_item_assets/steam/apps/2603120/fbac8dd3890d91cdb644117ecac5187ad54ed66c/header.jpg?t=1745608080;Digi Learnnials;Digi Learnnials;Windows;To be announced;Simulation, Strategy;https://store.steampowered.com/app/2603120/Liberators_Chronicles/;Unknown;;;;
Lifo Harvester (EP);Argentina;A puzzle where order matters.;https://shared.cloudflare.steamstatic.com/store_item_assets/steam/apps/562750/header.jpg?t=1503855687;Martin Cerdeira;Martin Cerdeira;Windows, SteamOS + Linux;To be announced;Indie;https://store.steampowered.com/app/562750/Lifo_Harvester_EP/;Unknown;;;;
Lihue;Argentina;Lihue is a narrative adventure that takes place in the dream of a 26-year-old trans girl. Through her memories you will know her deepest desires and fears. Explore the landscapes of h...;https://shared.cloudflare.steamstatic.com/store_item_assets/steam/apps/1298850/header.jpg?t=1628529843;Nehual Pascale;Nehual Pascale;Windows;9 Aug, 2021;Adventure, Indie;https://store.steampowered.com/app/1298850/Lihue/;Unknown;;;;
Linked Worlds;Argentina;Linked Worlds is a JRPG with unique twists to the genre. Immerse yourself in strategic battles that take place in a grid-based movement system, 100 abilities to equip and unequip offe...;https://shared.cloudflare.steamstatic.com/store_item_assets/steam/apps/2015360/header.jpg?t=1680376168;NicoDiti;NicoDiti;Windows;29 Mar, 2023;Indie, RPG, Strategy;https://store.steampowered.com/app/2015360/Linked_Worlds/;Unknown;;;;
Little Locked Rooms;Argentina;Grab your magnifying glass and peek inside a series of tiny dioramas filled with crimes and carefully crafted mysteries! Think outside the box and solve them all in this new brand of ...;https://shared.cloudflare.steamstatic.com/store_item_assets/steam/apps/2468670/header.jpg?t=1739114573;riolucci;riolucci;Windows, SteamOS + Linux;5 Jun, 2024;Indie;https://store.steampowered.com/app/2468670/Little_Locked_Rooms/;Unknown;;;;
LocoSoccer Classic;Argentina;LocoSoccer is a fun, crazy physics-based soccer game where you must do a lot of goals to win cups and accesories for your team. Your objective is easy: win all cups with your goals. H...;https://shared.cloudflare.steamstatic.com/store_item_assets/steam/apps/396360/header.jpg?t=1710345647;TheGamePublisher.com;Startreming Games;Windows, SteamOS + Linux;9 Dec, 2015;Indie, Sports, Strategy;https://store.steampowered.com/app/396360/LocoSoccer_Classic/;Unknown;;;;
Los Infernales;Argentina;The infernals, a war game about brave warriors at the beginning of the 19th century. A game that combines runner, Hack and Slash and many shots in a story based on Gaucho wars.;https://shared.cloudflare.steamstatic.com/store_item_assets/steam/apps/2650400/header.jpg?t=1718216181;TMO Games;TMO Games;Windows;To be announced;Action, Indie;https://store.steampowered.com/app/2650400/Los_Infernales/;Unknown;;;;
Lup;Argentina;Lup is a 2D platformer with heart, throughout the game you'll have to overcome enemies and challenges using weapons and items.;https://shared.cloudflare.steamstatic.com/store_item_assets/steam/apps/412600/header.jpg?t=1489581703;Back To Basics Gaming;Leo B;Windows;1 Apr, 2016;Action, Indie;https://store.steampowered.com/app/412600/Lup/;Unknown;;;;
MEDAL WINNERS 24;Argentina;Win more medals than your opponents to rank at the top of the medal table in javelin throw, 100 metres, cycling, basketball shooting, pole vault, shot put, and other events across fou...;https://shared.cloudflare.steamstatic.com/store_item_assets/steam/apps/2645800/header.jpg?t=1722912704;Dual Gen Studios;Dual Gen Studios;Windows;To be announced;Casual, Indie, Racing, Simulation, Sports;https://store.steampowered.com/app/2645800/MEDAL_WINNERS_24/;Unknown;;;;
Magia y Demonios;Argentina;Old-school isometric RPG game. 6 character classes, skills and various types of weapons. Monsters, champions and bosses in semi-procedural levels.;https://shared.cloudflare.steamstatic.com/store_item_assets/steam/apps/2661490/header.jpg?t=1742193809;anyeos;anyeos;Windows, SteamOS + Linux;3 Mar, 2025;Action, Adventure, Indie, RPG, Early Access;https://store.steampowered.com/app/2661490/Magia_y_Demonios/;Unknown;;;;
Maki: Paw of Fury;Argentina;Unknown;https://shared.cloudflare.steamstatic.com/store_item_assets/steam/apps/2119850/header.jpg?t=1736252610;RedDeer.Games;Bacord;Windows;12 Dec, 2024;Action, Adventure, Casual, Indie;https://store.steampowered.com/app/2119850/Maki_Paw_of_Fury/;Unknown;;;;
Malvinas: La Ultima Carta;Argentina;The last survivor of a battalion (a teenage soldier) must protect the last letter of his fallen comrades. Undergo the hunger, cold and violence the Argentinean soldiers had to endure ...;https://shared.cloudflare.steamstatic.com/store_item_assets/steam/apps/2584740/f0071e94c91374d114cde7bdfe789f3015c2be12/header.jpg?t=1745431047;El Burro Studio;El Burro Studio;Windows;To be announced;Action, Adventure, Free To Play;https://store.steampowered.com/app/2584740/Malvinas_La_Ultima_Carta/;Unknown;;;;
Master Of Earth;Argentina;A voice from beyond awakens the vast potential within you. As you master these unearthed powers, you will raise the secrets hidden in a temple once thought destroyed.;https://shared.cloudflare.steamstatic.com/store_item_assets/steam/apps/954310/header.jpg?t=1721830127;TheGamePublisher.com;Startreming Games;Windows;To be announced;Action, Adventure, Indie;https://store.steampowered.com/app/954310/Master_Of_Earth/;Unknown;;;;
Master of Orion;Argentina;The ascendant spacefaring 4X strategy game returns! A new chapter in the epic Master of Orion saga is poised to once again capture the imaginations of millions of gamers.;https://shared.cloudflare.steamstatic.com/store_item_assets/steam/apps/298050/header.jpg?t=1708071557;Wargaming Labs;NGD Studios;Windows, macOS, SteamOS + Linux;26 Feb, 2016;Strategy;https://store.steampowered.com/app/298050/Master_of_Orion/;Unknown;;;;
Mecha Snake;Argentina;Cross the enemy base with the snake, and get the best score.;https://shared.cloudflare.steamstatic.com/store_item_assets/steam/apps/1624610/header.jpg?t=1672955270;Lucas Fernandez;Lucas Fernandez;Windows;18 May, 2021;Action, Casual, Indie;https://store.steampowered.com/app/1624610/Mecha_Snake/;Unknown;;;;
Mothmen 1966;Argentina;Mothmen 1966 is a 'Pixel Pulp' - a visual novel fusing exceptional writing and stunning illustration, inspired by mid-20th century pulp fiction and 80s home computer graphics - set am...;https://shared.cloudflare.steamstatic.com/store_item_assets/steam/apps/1755030/header.jpg?t=1703184140;Chorus Worldwide Games;LCB Game Studio;Windows, macOS;14 Jul, 2022;Adventure, Indie;https://store.steampowered.com/app/1755030/Mothmen_1966/;Unknown;;;;
My Tower, My Home;Argentina;My Tower My Home is a blend between a tower defense game and shooter-platformer 2D game. You must defend the Tower Core, kill enemies, gain gold, buy upgrades for your hero, buy tower...;https://shared.cloudflare.steamstatic.com/store_item_assets/steam/apps/435600/header.jpg?t=1668519467;Shoor Games;Shoor Games;Windows;16 Mar, 2016;Action, Indie, RPG, Strategy;https://store.steampowered.com/app/435600/My_Tower_My_Home/;Unknown;;;;
NeonCyber.exe;Argentina;NeonCyber.exe is a 3D platformer parkour game. Complete levels in the shortest time possible and earn points to reach your best record.;https://shared.cloudflare.steamstatic.com/store_item_assets/steam/apps/2070750/header.jpg?t=1722176792;Julian Chiaravalli;Julian Chiaravalli;Windows;26 Jul, 2024;Action, Casual, Indie, Early Access;https://store.steampowered.com/app/2070750/NeonCyberexe/;Unknown;;;;
Nine Witches: Family Disruption;Argentina;When an occult German WW2 division releases an ancient curse upon the world, a supernatural problem is going to require a supernatural solution. Take control of two playable heroes as...;https://shared.cloudflare.steamstatic.com/store_item_assets/steam/apps/1272580/header.jpg?t=1678321958;Blowfish Studios;Indiesruption;Windows;4 Dec, 2020;Action, Adventure, Indie;https://store.steampowered.com/app/1272580/Nine_Witches_Family_Disruption/;Unknown;https://store.playstation.com/en-us/product/UP5552-CUSA18408_00-NINEWITCHESPS400/;https://www.xbox.com/en-us/games/store/Nine-Witches-Family-Disruption/9PGSLC7DW3WC;https://www.nintendo.com/us/store/products/nine-witches-family-disruption-switch/;
Niut;Argentina;Niut is kidnapped and sent to an unknown planet (Anthara), where she will have to survive alongside other people who share the same destiny, fight against powerful enemies of other mo...;https://shared.cloudflare.steamstatic.com/store_item_assets/steam/apps/3566140/eadd0f7df405fe7c1649323fce2eaa8be4729a37/header.jpg?t=1745392628;AF Works ®;AF Works ®;Windows;23 Apr, 2025;Action, Adventure, Casual, Indie, Racing, RPG, Simulation, Strategy;https://store.steampowered.com/app/3566140/Niut/;Unknown;;;;
Nobodies: After Death;Argentina;Nobodies: After Death is a puzzling point-and-click adventure in cleaning up dirty work. After your agency takes out a target, you make the evidence disappear without a trace. Find a ...;https://shared.cloudflare.steamstatic.com/store_item_assets/steam/apps/1816950/header.jpg?t=1739397897;Blyts;Blyts;Windows, macOS, SteamOS + Linux;20 Apr, 2023;Adventure, Casual, Indie;https://store.steampowered.com/app/1816950/Nobodies_After_Death/;Unknown;;;;
Nobodies: Murder Cleaner;Argentina;Nobodies is a puzzle-filled point-and-click adventure in which you must cover up government-sanctioned assassinations. Hide the bodies, destroy the evidence, and leave no trace you we...;https://shared.cloudflare.steamstatic.com/store_item_assets/steam/apps/1038280/header.jpg?t=1739397615;Blyts;Blyts;Windows, macOS, SteamOS + Linux;30 Sep, 2019;Adventure, Casual, Indie;https://store.steampowered.com/app/1038280/Nobodies_Murder_Cleaner/;Unknown;;;;
Noir Storm;Argentina;Take on the role of a private detective who, intercepted by a MOSSAD spy on the city of Buenos Aires in 1952, is drawn into a dangerous odyssey against exiles from the Third Reich and...;https://shared.cloudflare.steamstatic.com/store_item_assets/steam/apps/1845980/header.jpg?t=1699899924;Diskeletton Studios;Diskeletton Studios;Windows;To be announced;Adventure, Indie;https://store.steampowered.com/app/1845980/Noir_Storm/;Unknown;;;;
Noroi E: Susan's Memories;Argentina;Noroi E: Susan's Memories is a psychological horror game where Susan, desperate to help her boyfriend David, discovers an ancient curse that forces him to control demonic entities. In...;https://shared.cloudflare.steamstatic.com/store_item_assets/steam/apps/2411320/header.jpg?t=1734304725;Kristhian D. Muñoz, Cristian David García, CiberFly Studios;CiberFly Interactive Studios, CiberFly Studios;Windows;To be announced;Adventure, Indie, RPG, Strategy, Early Access;https://store.steampowered.com/app/2411320/Noroi_E_Susans_Memories/;Unknown;;;;
NoseBound;Argentina;An adventure game like no other. A detective story in the vein of Film Noir. An unusual path into a paranormal realm.;https://shared.cloudflare.steamstatic.com/store_item_assets/steam/apps/340020/header.jpg?t=1741867764;Plug In Digital;Quarantine Interactive;Windows, macOS;9 Dec, 2024;Adventure, Indie;https://store.steampowered.com/app/340020/NoseBound/;Unknown;;;;
Nubarron: The adventure of an unlucky gnome;Argentina;Guide Gnome across the dangers of this twisted fairytale world. Can you make the annoying cloud go away? And recover his stolen Lucky Hat? Trust your friends? Find out in this, a casu...;https://shared.cloudflare.steamstatic.com/store_item_assets/steam/apps/414160/header.jpg?t=1667224891;Hidden People Club;Nastycloud;Windows, macOS, SteamOS + Linux;30 Jan, 2020;Adventure, Indie;https://store.steampowered.com/app/414160/Nubarron_The_adventure_of_an_unlucky_gnome/;Unknown;;;;
Nucleares;Argentina;Nuclear Reactor Simulator: Take Control. Prevent Disaster. Power the World.;https://shared.cloudflare.steamstatic.com/store_item_assets/steam/apps/1428420/header.jpg?t=1739035891;Iván Marcelo Pretti;Iván Marcelo Pretti;Windows;13 Mar, 2023;Indie, Simulation;https://store.steampowered.com/app/1428420/Nucleares/;Unknown;;;;
Obey Me;Argentina;Heaven and Hell are locked in a millennial conflict for the souls of Mankind. Vanessa, a lowly Soul Huntress and Monty, her hellhound companion will tip the balance of war in this 3D ...;https://shared.cloudflare.steamstatic.com/store_item_assets/steam/apps/1034890/header.jpg?t=1726544990;Blowfish Studios;Error 404 Game Studios S.A.;Windows;21 Apr, 2020;Action, Adventure, Indie;https://store.steampowered.com/app/1034890/Obey_Me/;Unknown;https://store.playstation.com/en-us/concept/235101/;;;
Okhlos: Omega;Argentina;Squeeze into your toga and slide on your sandals to rally the angry mobs of Okhlos and bring down the oppressive god of mythological Greece!;https://shared.cloudflare.steamstatic.com/store_item_assets/steam/apps/400180/header.jpg?t=1637018746;Devolver Digital;Coffee Powered Machine;Windows, macOS, SteamOS + Linux;18 Aug, 2016;Action, Indie, Strategy;https://store.steampowered.com/app/400180/Okhlos_Omega/;Unknown;;;;
Ophelia's Chapter;Argentina;A story-rich, psychological-horror adventure game. Play as an urban witch with psychic abilities and delve into the mysteries of a world inspired by the work of Neil Gaiman and Stephe...;https://shared.cloudflare.steamstatic.com/store_item_assets/steam/apps/2457500/header.jpg?t=1718145472;Red Tear Games;Red Tear Games;Windows, macOS;To be announced;Adventure;https://store.steampowered.com/app/2457500/Ophelias_Chapter/;Unknown;;;;
Orange Adventure;Argentina;Have fun with this amazing tribute to the best SNES and MEGADRIVE games!;https://shared.cloudflare.steamstatic.com/store_item_assets/steam/apps/510280/header.jpg?t=1474636304;Indio Games;Indio Games;Windows;1 Aug, 2016;Adventure, Indie;https://store.steampowered.com/app/510280/Orange_Adventure/;Unknown;;;;
Out of Bounds;Argentina;"Out of Bounds is a puzzle shooter where you need to ""create"" a game while ""fixing"" bugs!";https://shared.cloudflare.steamstatic.com/store_item_assets/steam/apps/1787100/header.jpg?t=1724088265;Saibot Studios;Tobías Rusjan;Windows;16 Dec, 2022;Action, Adventure, Casual, Indie, Simulation;https://store.steampowered.com/app/1787100/Out_of_Bounds/;Unknown;;;;
