Name;Country;Description;Thumbnail;Publisher_Names;Developer_Names;Platform;Release_Date;Genre;Steam_Link;Epic_Link;PlayStation_Link;Xbox_Link;Switch_Link;GOG_Link
A Collection of Bad Moments;Finland;A Collection of Bad Moments is an adventure game where the player discovers themselves in various tough situations and must use their wits to figure a way out! The moments vary from a...;https://shared.cloudflare.steamstatic.com/store_item_assets/steam/apps/717120/header.jpg?t=1611926374;Sky Trail Ltd;Sky Trail Ltd;Windows;12 Jan, 2018;Action, Adventure;https://store.steampowered.com/app/717120/A_Collection_of_Bad_Moments/;Unknown;;;;
A Living Room;Finland;You are a man in a room. Something feels off. Or maybe it's on. A short existential comedy point-and-click non-adventure about the limitations and imitations of human existence – or...;https://shared.cloudflare.steamstatic.com/store_item_assets/steam/apps/2847640/header.jpg?t=1714036823;Instant Million;Valtteri Tavast;Windows;25 Apr, 2024;Adventure, Casual, Indie, Free To Play;https://store.steampowered.com/app/2847640/A_Living_Room/;Unknown;;;;
A Lone Piece;Finland;Easy to learn. Hard to master. A Lone Piece is a chess themed puzzle game where you control a single pawn caught in the middle of opposing hostile pieces. Your main job is to escape t...;https://shared.cloudflare.steamstatic.com/store_item_assets/steam/apps/2180920/header.jpg?t=1731052261;Kuura Playhouse;Marko Haaja;Windows;2 Mar, 2023;Indie, Strategy;https://store.steampowered.com/app/2180920/A_Lone_Piece/;Unknown;;;;
ABC: AUDIO REACTIVE BEAT CIRCLE;Finland;Experience a new way to listen to your favourite music. Audio-reactive arcade game where you dodge pulsating shapes. The player spin around the center and dodges the neon shapes that ...;https://shared.cloudflare.steamstatic.com/store_item_assets/steam/apps/1350080/header.jpg?t=1743066144;Mlyst;Mlyst;Windows;21 Aug, 2020;Action, Casual, Indie, Free To Play;https://store.steampowered.com/app/1350080/ABC_AUDIO_REACTIVE_BEAT_CIRCLE/;Unknown;;;;
AI Kills All Humans;Finland;AI Kills All Humans is a Tactical RTS game in which you play as an AI sending robots to kill all humans. You however don't have direct control of your robots, but robots independently...;https://shared.cloudflare.steamstatic.com/store_item_assets/steam/apps/2234780/header.jpg?t=1736426676;Ugalabugala Oy;One Joyful Day;Windows;To be announced;Strategy;https://store.steampowered.com/app/2234780/AI_Kills_All_Humans/;Unknown;;;;
ARRIVAL: ZERO EARTH;Finland;Fight giant War of the Worlds -style aliens invading Finland during a Winter in the 90's. Build an army of local townspeople in this chaotic semi-autobattler roguelike. Navigate throu...;https://shared.cloudflare.steamstatic.com/store_item_assets/steam/apps/1613580/header.jpg?t=1738184455;jounitus;jounitus;Windows;12 Jan, 2024;Action, Indie, RPG;https://store.steampowered.com/app/1613580/ARRIVAL_ZERO_EARTH/;Unknown;;;;
Action Legion;Finland;Action Legion is a mouse-controlled, single-player war game on the PC and Mac.;https://shared.cloudflare.steamstatic.com/store_item_assets/steam/apps/431630/header.jpg?t=1466662838;Aeonic Entertainment;Aeonic Entertainment;Windows, macOS, SteamOS + Linux;19 Apr, 2016;Action, Indie;https://store.steampowered.com/app/431630/Action_Legion/;Unknown;;;;
Adventures of Dragon;Finland;Unlikely hero is thrust into a crazy world and gets involved in a grand adventure!;https://shared.cloudflare.steamstatic.com/store_item_assets/steam/apps/770370/header.jpg?t=1745755754;Tuomo's games;Tuomo Laine;Windows, macOS;20 Dec, 2018;Adventure, Casual, Indie, RPG;https://store.steampowered.com/app/770370/Adventures_of_Dragon/;Unknown;;;;
Afterdream;Finland;Get lost in a lucid dream, bending the lines between reality and fiction. Utilize the strange camera to navigate through the ghosts' mysterious residence. Find the purpose of your noc...;https://shared.cloudflare.steamstatic.com/store_item_assets/steam/apps/1995880/header.jpg?t=1745568899;Gamirror Games;Jesse Makkonen;Windows;28 Sep, 2023;Adventure, Indie;https://store.steampowered.com/app/1995880/Afterdream/;Unknown;;;;
Ages of Conflict: World War Simulator;Finland;Ages of Conflict is a versatile Map Simulation game where you create and observe custom AI nations battle it out across an infinite number of worlds. Paint imaginative maps and scenar...;https://shared.cloudflare.steamstatic.com/store_item_assets/steam/apps/2186320/header.jpg?t=1745443602;JoySpark Games;JoySpark Games;Windows, macOS, SteamOS + Linux;17 Feb, 2023;Casual, Indie, Simulation, Early Access;https://store.steampowered.com/app/2186320/Ages_of_Conflict_World_War_Simulator/;Unknown;;;;
AirBuccaneers;Finland;Welcome to the ancient North, once the cradle of culture and peace, but is now corrupted by magic and inhabited by nasty bandits sowing destruction in airships.Choose to be a vicious ...;https://shared.cloudflare.steamstatic.com/store_item_assets/steam/apps/223630/header.jpg?t=1447356882;LudoCraft Ltd.;LudoCraft Ltd.;Windows;Unknown;Action, Free To Play, Indie, RPG, Strategy;https://store.steampowered.com/app/223630/AirBuccaneers/;Unknown;;;;
Alan Wake;Finland;A Dark Presence stalks the small town of Bright Falls, pushing Alan Wake to the brink of sanity in his fight to unravel the mystery and save his love.;https://shared.cloudflare.steamstatic.com/store_item_assets/steam/apps/108710/header.jpg?t=1726554283;Remedy Entertainment;Remedy Entertainment;Windows;16 Feb, 2012;Action, Adventure;https://store.steampowered.com/app/108710/Alan_Wake/;Unknown;;;;
Alan Wake's American Nightmare;Finland;A thrilling new storyline, hordes of creepy enemies, serious firepower and beautiful Arizona locations, combined with a fun and challenging new game mode!;https://shared.cloudflare.steamstatic.com/store_item_assets/steam/apps/202750/header.jpg?t=1726554251;Remedy Entertainment;Remedy Entertainment;Windows;22 May, 2012;Action, Adventure;https://store.steampowered.com/app/202750/Alan_Wakes_American_Nightmare/;Unknown;;;;
Albert Mort - Desert Heat;Finland;Albert Mort is a third-person/side-scroller action shooter game in which the main goal is to complete short but hard missions with different goals. Missions also contain sub missions ...;https://shared.cloudflare.steamstatic.com/store_item_assets/steam/apps/670780/header.jpg?t=1511625789;TeeKoo Games Ltd;TeeKoo Games Ltd;Windows, macOS;23 Aug, 2017;Action, Indie;https://store.steampowered.com/app/670780/Albert_Mort__Desert_Heat/;Unknown;;;;
Alien Robot Monsters;Finland;Epic sci-fi tower defense action with 16-bit era look and feel, pitching your colonists against an almost endless horde of hostile alien robots who strongly oppose your attempts of co...;https://shared.cloudflare.steamstatic.com/store_item_assets/steam/apps/391250/header.jpg?t=1498261775;Kraftix Games;Kraftix Games;Windows, macOS, SteamOS + Linux;9 Sep, 2015;Action, Indie, Strategy;https://store.steampowered.com/app/391250/Alien_Robot_Monsters/;Unknown;;;;
Among the Trolls;Finland;Among the Trolls is a first-person survival-adventure game where the secret mysteries of Finnish forests are unraveled. Venture deep into the Finnish wilderness to uncover family trut...;https://shared.cloudflare.steamstatic.com/store_item_assets/steam/apps/1675260/header.jpg?t=1744202195;505 Pulse;Avantgarden;Windows;To be announced;Action, Adventure, Simulation, Early Access;https://store.steampowered.com/app/1675260/Among_the_Trolls/;Unknown;;;;
Ancestory;Finland;Turn-based strategy meets card game! Outwit your opponent on multiple different battlefields with cunning strategies. Build your own decks made of underworldly minions and powerful sp...;https://shared.cloudflare.steamstatic.com/store_item_assets/steam/apps/349840/header.jpg?t=1745491456;Kajak Games, Kajaksi Game Collective;Kajak Games;Windows;13 Oct, 2015;Indie, Strategy;https://store.steampowered.com/app/349840/Ancestory/;Unknown;;;;
Ancient Savo;Finland;Raise a family in the pristine woodlands of ancient Finland. Manage your homestead, craft tools and items, barter for goods, live off the land. Continue as your offspring, start new h...;https://shared.cloudflare.steamstatic.com/store_item_assets/steam/apps/2872000/header.jpg?t=1742469958;Enormous Elk;Erkka Lehmus;Windows, macOS, SteamOS + Linux;20 Sep, 2024;Indie, RPG, Simulation, Strategy;https://store.steampowered.com/app/2872000/Ancient_Savo/;Unknown;;;;
Angelus Brand VR Experience;Finland;Enjoy the Angelus Brand VR Experience with a few games and a show room. Look at Angelus products while playing basketball or running through a challenging dodging game. Try to get the...;https://shared.cloudflare.steamstatic.com/store_item_assets/steam/apps/954160/header.jpg?t=1541154993;Miikka Åsnabrygg, Tyler Brucato;Miikka Åsnabrygg;Windows;2 Nov, 2018;Free To Play, Indie;https://store.steampowered.com/app/954160/Angelus_Brand_VR_Experience/;Unknown;;;;
Angry Bunny;Finland;Be a hero bunny and try to find way to back home. Avoid enemies and traps and explode big carrot which is obstacle between rabbit hole and bunny.;https://shared.cloudflare.steamstatic.com/store_item_assets/steam/apps/1168650/header.jpg?t=1715810719;HaDe Games;Tero Lunkka;Windows;31 Oct, 2019;Adventure, Casual, Indie, Strategy;https://store.steampowered.com/app/1168650/Angry_Bunny/;Unknown;;;;
Ants Took My Eyeball;Finland;Ants Took My Eyeball is a 2D action platformer roguelite. Descend into an ever-changing ant hill, fight your way through hordes of insects with a variety of weapons, face formidable b...;https://shared.cloudflare.steamstatic.com/store_item_assets/steam/apps/1627890/header.jpg?t=1732857244;Bosmic Forge;Bosmic Forge;Windows;19 Apr, 2024;Action, Adventure, Indie;https://store.steampowered.com/app/1627890/Ants_Took_My_Eyeball/;Unknown;;;;
Assault Wing;Finland;Assault Wing is a free 2D side scrolling retro PvP shooter. You will choose your ship, special weapon and ship modification. The arenas are physics based with destructible terrain. Se...;https://shared.cloudflare.steamstatic.com/store_item_assets/steam/apps/1971370/header.jpg?t=1706273704;Planteam Lamberg;Studfarm Studios;Windows, macOS, SteamOS + Linux;26 Jan, 2024;Action, Indie;https://store.steampowered.com/app/1971370/Assault_Wing/;Unknown;;;;
Atomic Hazard;Finland;Atomic Hazard is a action puzle platformer. Take advantage of your environment in physics-based movement and combat.;https://shared.cloudflare.steamstatic.com/store_item_assets/steam/apps/2611110/header.jpg?t=1697699441;Team-K;Team-K;Windows, macOS, SteamOS + Linux;19 Oct, 2023;Action, Adventure, Indie;https://store.steampowered.com/app/2611110/Atomic_Hazard/;Unknown;;;;
Autogun Heroes: Supercharged;Finland;Blast your way through alien-infested planets and help Gus rescue powerful heroes, one by one, to save the galaxy. This challenging 2D action platformer combines intense shoot-'em-up ...;https://shared.cloudflare.steamstatic.com/store_item_assets/steam/apps/3328730/header.jpg?t=1744614197;Nitro Games;Nitro Games;Windows;To be announced;Action, Adventure, Casual;https://store.steampowered.com/app/3328730/Autogun_Heroes_Supercharged/;Unknown;;;;
Azkend 2: The World Beneath;Finland;Azkend 2: The World Beneath is a beautifully polished match-three adventure game set in an awe-inspiring underground world. Enjoy superbly smooth casual matching puzzle gameplay, an e...;https://shared.cloudflare.steamstatic.com/store_item_assets/steam/apps/550440/header.jpg?t=1572299290;10tons Ltd;10tons Ltd;Windows;14 Mar, 2012;Adventure, Casual, Indie;https://store.steampowered.com/app/550440/Azkend_2_The_World_Beneath/;Unknown;;https://www.xbox.com/en-us/games/store/Azkend-2-The-World-Beneath/BS6ZW396SFQ0;https://www.nintendo.com/us/store/products/azkend-2-the-world-beneath-switch/;
BADLAND: Game of the Year Edition;Finland;With BADLAND: Game of the Year Edition, experience the multi-award-winning action adventure like never before - redesigned for Steam.;https://shared.cloudflare.steamstatic.com/store_item_assets/steam/apps/269670/header.jpg?t=1569395419;Frogmind;Frogmind;Windows, macOS, SteamOS + Linux;26 May, 2015;Action, Adventure, Indie;https://store.steampowered.com/app/269670/BADLAND_Game_of_the_Year_Edition/;Unknown;https://store.playstation.com/en-us/product/UP4530-CUSA01414_00-GAMEOFTHEYEAREDI?pubDate=20250301;;;
Baba Is You;Finland;Baba Is You is a puzzle game where the rules you have to follow are present as blocks you can interact with. By manipulating them, you can change how the game works, repurpose things ...;https://shared.cloudflare.steamstatic.com/store_item_assets/steam/apps/736260/header.jpg?t=1698353847;Hempuli Oy;Hempuli Oy;Windows, macOS, SteamOS + Linux;13 Mar, 2019;Indie;https://store.steampowered.com/app/736260/Baba_Is_You/;Unknown;;;https://www.nintendo.com/us/store/products/baba-is-you-switch/;
Balancelot;Finland;Use your controller or keyboard to balance the clumsy but fully functional unicycle. Thrust the threatening mythical monsters with your sharpened lance as they sit on your way to glor...;https://shared.cloudflare.steamstatic.com/store_item_assets/steam/apps/1035850/header.jpg?t=1572262911;Jestercraft;AnvilBird Interactive;Windows;23 May, 2019;Action, Adventure, Casual, Indie, Racing;https://store.steampowered.com/app/1035850/Balancelot/;Unknown;;;;
Barbearian;Finland;Barbearian is a fast-paced hack'n'slash with massive battles in a colorful, hand-drawn world. Fight for your life, discover the secrets of the Arbitrators and find your way back home!;https://shared.cloudflare.steamstatic.com/store_item_assets/steam/apps/813450/header.jpg?t=1745466131;Kimmo Factor Oy;Kimmo Lahtinen;Windows;14 Aug, 2018;Action, Indie;https://store.steampowered.com/app/813450/Barbearian/;Unknown;;;https://www.nintendo.com/us/store/products/barbearian-switch/;
Barotrauma;Finland;Barotrauma is a 2D co-op submarine simulator – in space, with survival horror and RPG elements. Steer your submarine, complete missions, fight monsters, fix leaks, operate machinery...;https://shared.cloudflare.steamstatic.com/store_item_assets/steam/apps/602960/8f922ef588a72f55c22dbc6415ed698dd8158d8c/header_alt_assets_20.jpg?t=1745567004;Daedalic Entertainment;FakeFish, Undertow Games;Windows, macOS, SteamOS + Linux;13 Mar, 2023;Action, Indie, Simulation, Strategy;https://store.steampowered.com/app/602960/Barotrauma/;Unknown;;;;
Barry Has a Secret;Finland;Meal hiding simulator.;https://shared.cloudflare.steamstatic.com/store_item_assets/steam/apps/864230/header.jpg?t=1526802321;Sandbay Games;Sandbay Games;Windows;To be announced;Indie, Simulation, Early Access;https://store.steampowered.com/app/864230/Barry_Has_a_Secret/;Unknown;;;;
Base Raid;Finland;Base Raid is a 2D base build and defence strategy game. In the game your goal is to build the best base to crush the enemy before it crushes you. You have a specific amount of in-game...;https://shared.cloudflare.steamstatic.com/store_item_assets/steam/apps/511390/header.jpg?t=1616172216;Sageose;Sageose;Windows, macOS, SteamOS + Linux;17 Nov, 2016;Action, Casual, Indie, Strategy;https://store.steampowered.com/app/511390/Base_Raid/;Unknown;;;;
Baseball Riot;Finland;Start a baseball riot! Help Gabe Carpaccio take vengeance on the unholy alliance of his former team and a corrupt energy drink manufacturer Explodz Inc. in this fun physics based puzz...;https://shared.cloudflare.steamstatic.com/store_item_assets/steam/apps/567660/header.jpg?t=1521465657;10tons Ltd;10tons Ltd;Windows;9 Dec, 2015;Casual, Indie, Sports;https://store.steampowered.com/app/567660/Baseball_Riot/;Unknown;;https://www.xbox.com/en-us/games/store/Baseball-Riot/C0ZHSWVR0Q2B;;
Battle of Finland: Winter War;Finland;Battle of Finland: Winter War is a 2D side-scrolling action platformer. The Soviet Union began the conquest of Finland on November 30 1939, thus the Winter War was started. Can you he...;https://shared.cloudflare.steamstatic.com/store_item_assets/steam/apps/1899270/header.jpg?t=1665397696;Team-K;Team-K;Windows, macOS, SteamOS + Linux;14 Mar, 2022;Action, Adventure, Indie;https://store.steampowered.com/app/1899270/Battle_of_Finland_Winter_War/;Unknown;;;;
Battles of Norghan;Finland;Battles of Norghan is a unique gladiatorial management and strategy game where you not only must recruit, train, and equip fantasy gladiators, but also control them on a tactical grid...;https://shared.cloudflare.steamstatic.com/store_item_assets/steam/apps/531110/header.jpg?t=1517496312;Mitorah Games;Mitorah Games;Windows;26 Sep, 2016;Indie, RPG, Strategy;https://store.steampowered.com/app/531110/Battles_of_Norghan/;Unknown;;;;
Battlevoid: Harbinger;Finland;Battlevoid: Harbinger is a hard sci-fi space exploration game blending roguelike, turn-based, star map strategy, and real-time space battles. You are a young commander venturing out i...;https://shared.cloudflare.steamstatic.com/store_item_assets/steam/apps/396480/header.jpg?t=1667225465;Bugbyte Ltd.;Bugbyte Ltd.;Windows, macOS, SteamOS + Linux;24 Feb, 2016;Action, Indie, Simulation, Strategy;https://store.steampowered.com/app/396480/Battlevoid_Harbinger/;Unknown;;;;
Battlevoid: Sector Siege;Finland;Battlevoid: Sector Siege is an epic straight into action real-time space strategy game, in which the world has been built to deliver a lively battle field, and the action is never mor...;https://shared.cloudflare.steamstatic.com/store_item_assets/steam/apps/716630/header.jpg?t=1667223876;Bugbyte Ltd.;Bugbyte Ltd.;Windows, macOS, SteamOS + Linux;25 Oct, 2017;Action, Indie, Simulation, Strategy;https://store.steampowered.com/app/716630/Battlevoid_Sector_Siege/;Unknown;;;;
Beer and Skittls VR;Finland;Beer and Skittls is a strategic VR game that will challenge your skill level of throwing.;https://shared.cloudflare.steamstatic.com/store_item_assets/steam/apps/822700/header.jpg?t=1732956964;Soyhan Yazgan;Soyhan Yazgan;Windows;29 Mar, 2018;Casual, Indie, Simulation, Sports, Strategy;https://store.steampowered.com/app/822700/Beer_and_Skittls_VR/;Unknown;;;;
Bemis Wamilton Racing;Finland;Drive with Bemis Wamilton race in this race game with electronic racing cars against other competitors;https://shared.cloudflare.steamstatic.com/store_item_assets/steam/apps/2648890/header.jpg?t=1716614101;Valkeala Software;Valkeala Software, VS Revolution;Windows;1 Nov, 2023;Indie, Racing, Sports;https://store.steampowered.com/app/2648890/Bemis_Wamilton_Racing/;Unknown;;;;
Bionic Bay;Finland;A scientist uses a unique teleportation instrument to escape an ancient biomechanical world filled with imaginative technology, deadly traps, and hidden secrets.;https://shared.cloudflare.steamstatic.com/store_item_assets/steam/apps/1928690/header.jpg?t=1745313656;Kepler Interactive;Psychoflow Studio, Mureena Oy;Windows;16 Apr, 2025;Action, Adventure, Casual, Indie, Racing;https://store.steampowered.com/app/1928690/Bionic_Bay/;Unknown;;;;
Blacklist Brigade;Finland;Blacklist Brigade is a co-op focused top-down shooter game, where players as a part of a mercenary group fight against banana republic dictators and other evil scoundrels.;https://shared.cloudflare.steamstatic.com/store_item_assets/steam/apps/1061270/header.jpg?t=1727992238;Goat Forest Games;Goat Forest Games;Windows;28 May, 2019;Action, Indie, Early Access;https://store.steampowered.com/app/1061270/Blacklist_Brigade/;Unknown;;;;
Boing Odyssey;Finland;Build contraptions with various tools to end all roasted chickens rightly in this physics puzzle game, or create and share your own challenges!;https://shared.cloudflare.steamstatic.com/store_item_assets/steam/apps/2587960/header.jpg?t=1707827167;Tuonele;Tuonele;Windows, macOS, SteamOS + Linux;13 Feb, 2024;Casual;https://store.steampowered.com/app/2587960/Boing_Odyssey/;Unknown;;;;
Bomb Defense;Finland;A completely different take on the tower defense genre. Combining it with the Puzzle genre, making for a difficult game. Buy traps, bombs, turrets and walls and place them in optimal ...;https://shared.cloudflare.steamstatic.com/store_item_assets/steam/apps/656680/header.jpg?t=1502300782;Mitorah Games;Mitorah Games;Windows, macOS, SteamOS + Linux;5 Jul, 2017;Casual, Indie, Strategy;https://store.steampowered.com/app/656680/Bomb_Defense/;Unknown;;;;
Bone Dust;Finland;Enter Bone Dust, an adrenaline-fueled arena shooter with bullet hell dynamics. Engage in swift, arcade-inspired gameplay, and face off against terrifying adversaries using your magica...;https://shared.cloudflare.steamstatic.com/store_item_assets/steam/apps/2247640/header.jpg?t=1726054372;Toko Midori Games;Platonic Partnership;Windows;20 Apr, 2023;Action, Free To Play;https://store.steampowered.com/app/2247640/Bone_Dust/;Unknown;;;;
Boosted Survivors;Finland;Survive waves! Choose new abilities! Modify your hero in any way you like! Craft a powerful masterpiece, or a horrible concoction of awful ideas! Discover secrets! Sandbox your way to...;https://shared.cloudflare.steamstatic.com/store_item_assets/steam/apps/3161850/header.jpg?t=1724929505;Clarity Games;Clarity Games;Windows, SteamOS + Linux;29 Aug, 2024;Action, Indie, RPG;https://store.steampowered.com/app/3161850/Boosted_Survivors/;Unknown;;;;
Border of her Heart;Finland;Border of her Heart is a VN about Border control.;https://shared.cloudflare.steamstatic.com/store_item_assets/steam/apps/795680/header.jpg?t=1745756236;Tuomo's games;Tuomo Laine;Windows, macOS, SteamOS + Linux;14 Feb, 2018;Casual, Indie;https://store.steampowered.com/app/795680/Border_of_her_Heart/;Unknown;;;;
Boreal Blade;Finland;Boreal Blade is a team-based melee fighting game with a focus on player vs player combat, combining reactive and tactical gameplay with extraordinary freedom to variate your attacks a...;https://shared.cloudflare.steamstatic.com/store_item_assets/steam/apps/598780/header.jpg?t=1743696398;Frozenbyte;Frozenbyte;Windows;12 Nov, 2020;Action;https://store.steampowered.com/app/598780/Boreal_Blade/;Unknown;;;;
Bounce Rescue!;Finland;Bounce Rescue! is an arcade- styled puzzle platformer, telling a story about a group of heroes, saving their friends. Made by a small indiedev studio Bitecore Ltd.;https://shared.cloudflare.steamstatic.com/store_item_assets/steam/apps/746680/header.jpg?t=1526284593;Bitecore Ltd.;Bitecore Ltd.;Windows, macOS, SteamOS + Linux;1 Feb, 2018;Adventure, Indie;https://store.steampowered.com/app/746680/Bounce_Rescue/;Unknown;;;;
Bozalleth's Curse;Finland;Nightmares that wake you up in cold sweat. The world of dreams hides secrets and your sins. The game 'Bozalleth's Curse' tells you the story of Mary, who had an unfortunate accident e...;https://shared.cloudflare.steamstatic.com/store_item_assets/steam/apps/2264490/header.jpg?t=1718794596;AzatotGames;AzatotGames;Windows, macOS, SteamOS + Linux;4 Oct, 2023;Action, Adventure, Indie, Early Access;https://store.steampowered.com/app/2264490/Bozalleths_Curse/;Unknown;;;;
Break The Food Chain;Finland;Break The Food Chain is an arcade game about cute little animals shooting at each other in the face like there is no tomorrow.;https://shared.cloudflare.steamstatic.com/store_item_assets/steam/apps/635980/header.jpg?t=1500294465;Caffeine Overdose;TEHO Games;Windows;17 Jul, 2017;Action, Indie;https://store.steampowered.com/app/635980/Break_The_Food_Chain/;Unknown;;;;
Bucket Brawl: Ahlman Edition;Finland;A fast-paced arena fighter where animal toys seek to recycle each other in a world of plastic and raining buckets. Throw buckets on the heads of other players, push them off a ledge a...;https://shared.cloudflare.steamstatic.com/store_item_assets/steam/apps/2413660/header.jpg?t=1699364014;Ahlman Games;Bucket Brawl;Windows;17 Jun, 2023;Casual, Indie, Free To Play;https://store.steampowered.com/app/2413660/Bucket_Brawl_Ahlman_Edition/;Unknown;;;;
Bugger Off!;Finland;The fun and refreshing tower defense, tasked with controlling and commanding a squadron of specially trained frogs, your mission is to thwart the relentless bug invasion. Brace yourse...;https://shared.cloudflare.steamstatic.com/store_item_assets/steam/apps/2700080/header.jpg?t=1702753958;Jamk Games;Ribbit Inc.;Windows;14 Dec, 2023;Casual, Strategy;https://store.steampowered.com/app/2700080/Bugger_Off/;Unknown;;;;
Bunker - The Underground Game;Finland;This is Bunker: The Underground Game. You probably never heard of it but since you now have, you are one of the cool kids. Game takes place deep down in a forgotten Soviet bunker. You...;https://shared.cloudflare.steamstatic.com/store_item_assets/steam/apps/354180/header.jpg?t=1596551200;2tainment GmbH;Nightly Studios;Windows;21 May, 2015;Adventure, Indie;https://store.steampowered.com/app/354180/Bunker__The_Underground_Game/;Unknown;;;;
BusinessMan;Finland;In BusinessMan, you are an entrepreneur among others. You can for example start off by investing your initial 20k€ smartly or try to become a chairman in some company. Once you're a...;https://shared.cloudflare.steamstatic.com/store_item_assets/steam/apps/677820/header.jpg?t=1526905417;SugGames;SugGames;Windows;28 Jul, 2017;Indie, Simulation, Strategy;https://store.steampowered.com/app/677820/BusinessMan/;Unknown;;;;
CONTINUE;Finland;Cut and delete your way through a chaotic computer world filled with programs. Every program has a purpose, but what is yours?;https://shared.cloudflare.steamstatic.com/store_item_assets/steam/apps/996920/header.jpg?t=1745491459;Kajak Games, Kajaksi Game Collective;Pixel Pinecone;Windows;22 Feb, 2019;Action, Adventure, Indie;https://store.steampowered.com/app/996920/CONTINUE/;Unknown;;;;
Cave Digger VR;Finland;Cave Digger VR is a virtual reality mining game in an alternative western setting. Gear up with numerous unique tools and explore the town and the depths of the mountain. Discover sec...;https://shared.cloudflare.steamstatic.com/store_item_assets/steam/apps/844380/header.jpg?t=1729582107;VRKiwi;VRKiwi;Windows;10 May, 2018;Action, Adventure, Simulation;https://store.steampowered.com/app/844380/Cave_Digger_VR/;Unknown;;;;
