Name;Country;Description;Thumbnail;Publisher_Names;Developer_Names;Platform;Release_Date;Genre;Steam_Link;Epic_Link;PlayStation_Link;Xbox_Link;Switch_Link;GOG_Link
Moonatees;Finland;Moonatees is the most realistic VR space manatee simulator. You play as a freshly recruited, clumsy manatee in zero gravity playground. You face mundane tasks and an incoming asteroid...;https://shared.cloudflare.steamstatic.com/store_item_assets/steam/apps/607770/header.jpg?t=1501493836;Fungi In The Basement;Fungi In The Basement;Windows;29 Mar, 2017;Indie, Simulation;https://store.steampowered.com/app/607770/Moonatees/;Unknown;;;;
Morbid: The Lords of Ire;Finland;Risk insanity in the gruesome slash-em-up Morbid: The Lords of Ire, with brutal combat and souls-like elements. Defeat the five Lords of Ire as you fight for your life across tortured...;https://shared.cloudflare.steamstatic.com/store_item_assets/steam/apps/2171560/header.jpg?t=1716972671;Merge Games ;Still Running;Windows;17 May, 2024;Action, Adventure, Indie;https://store.steampowered.com/app/2171560/Morbid_The_Lords_of_Ire/;Unknown;;;;
Morbid: The Seven Acolytes;Finland;Morbid: The Seven Acolytes is a Horrorpunk Action RPG filled with Lovecraftian horrors and Cronenbergian gore, making it the most gruesome take on the isometric Souls-like genre yet!;https://shared.cloudflare.steamstatic.com/store_item_assets/steam/apps/1140890/header.jpg?t=1738068071;Silver Lining Interactive;Still Running;Windows;3 Dec, 2020;Action, Adventure, Indie, RPG;https://store.steampowered.com/app/1140890/Morbid_The_Seven_Acolytes/;Unknown;;;;
Mortal Glory;Finland;Mortal Glory is a fantasy-themed tactical roguelike game about recruiting a team of gladiators and pitting them against brutal competition in a blood-soaked tournament. Train your gla...;https://shared.cloudflare.steamstatic.com/store_item_assets/steam/apps/1097530/header.jpg?t=1745488131;Redbeak Games;Redbeak Games;Windows;29 Jan, 2020;Indie, RPG, Simulation, Strategy;https://store.steampowered.com/app/1097530/Mortal_Glory/;Unknown;;;;
My Summer Car;Finland;My Summer Car is the ultimate car owning, building, fixing, tuning, maintenance AND permadeath life survival simulator. You start the game with hundreds of loose parts and assemble bo...;https://shared.cloudflare.steamstatic.com/store_item_assets/steam/apps/516750/header.jpg?t=1736372299;Amistech Games;Amistech Games;Windows;8 Jan, 2025;Indie, Racing, Simulation;https://store.steampowered.com/app/516750/My_Summer_Car/;Unknown;;;;
Mythargia;Finland;You are a journalist in search of your breakthrough story. A promising lead takes you to the abandoned island of Mythargia where you have to discover its buried history connecting two...;https://shared.cloudflare.steamstatic.com/store_item_assets/steam/apps/2022470/header.jpg?t=1739371219;Bonus Stage Publishing;RunByCoffee;Windows, SteamOS + Linux;20 Feb, 2023;Adventure, Indie, RPG;https://store.steampowered.com/app/2022470/Mythargia/;Unknown;;;;
NO MORE HUMANS;Finland;NO MORE HUMANS is a top-down single player wave based shooter, where you play as one of the unique survivors slaying and surviving waves of nightmarish enemies. Choose and modify your...;https://shared.cloudflare.steamstatic.com/store_item_assets/steam/apps/3004710/header.jpg?t=1730061372;NO MORE HUMANS;NO MORE HUMANS;Windows;27 Oct, 2024;Action, Indie;https://store.steampowered.com/app/3004710/NO_MORE_HUMANS/;Unknown;;;;
Nash Racing;Finland;Nash Racing is indie racing game, with lot of tracks, cars and tuning systems. Drive fast and be the best driver!;https://shared.cloudflare.steamstatic.com/store_item_assets/steam/apps/581200/header.jpg?t=1713234628;HaDe Games;Tero Lunkka;Windows;2 Aug, 2017;Indie, Racing;https://store.steampowered.com/app/581200/Nash_Racing/;Unknown;;;;
Nash Racing 2: Muscle cars;Finland;Nash Racing 2 is minor indie racing game which contains 3 gamemodes: Race, Timetrial and Open World cruising. Lot of cars and over 10 tracks. One of steam cheapest race games;https://shared.cloudflare.steamstatic.com/store_item_assets/steam/apps/713580/header.jpg?t=1667054815;Tero Lunkka;Tero Lunkka, Valkeala Software;Windows;16 Oct, 2017;Casual, Indie, Racing;https://store.steampowered.com/app/713580/Nash_Racing_2_Muscle_cars/;Unknown;;;;
Navalia;Finland;Design, build and command your fleet of spaceships! Navalia allows you to freely design ships for your fleet, lead them in battle against formidable foes and gradually conquer the gal...;https://shared.cloudflare.steamstatic.com/store_item_assets/steam/apps/551630/header.jpg?t=1510532891;Digital Tribe;Luotsi Entertainment;Windows;2 Jun, 2017;Indie, Strategy;https://store.steampowered.com/app/551630/Navalia/;Unknown;;;;
Nemesis Perspective;Finland;Challenge your friend in a classic hero versus giant boss monster setting. Wielding VR equipment your objective is to prove your superiority by crushing those who disturb your sacred ...;https://shared.cloudflare.steamstatic.com/store_item_assets/steam/apps/537140/header.jpg?t=1745491468;Kajak Games, Kajaksi Game Collective;Evocat Games;Windows;21 Dec, 2016;Action, Indie;https://store.steampowered.com/app/537140/Nemesis_Perspective/;Unknown;;;;
Neon Chrome;Finland;A masterful combination of top-down shooter and endless replayability with procedural levels. Blast your way through walls & enemies with guns and cybernetic abilities. Install perks ...;https://shared.cloudflare.steamstatic.com/store_item_assets/steam/apps/428750/header.jpg?t=1714816134;10tons Ltd;10tons Ltd;Windows, macOS, SteamOS + Linux;28 Apr, 2016;Action, Adventure, Indie, RPG;https://store.steampowered.com/app/428750/Neon_Chrome/;Unknown;https://store.playstation.com/en-us/product/UP4403-PPSA02622_00-NEONCHROME000000/;;https://www.nintendo.com/us/store/products/neon-chrome-switch/;
News Reacts;Finland;Suddenly one morning you are accused of terrorism! In a slightly weird city you are always in the wrong place equipped only with your brain but with NO weaponry. You are hunted by aut...;https://shared.cloudflare.steamstatic.com/store_item_assets/steam/apps/1775300/header.jpg?t=1720854569;Net Get Games;Net Get Games;Windows;20 May, 2022;Action, Adventure, Casual, Indie, Racing;https://store.steampowered.com/app/1775300/News_Reacts/;Unknown;;;;
Nex Machina;Finland;Nex Machina is an intense arcade style twin-stick shooter from Housemarque. Taking hints from both Robotron and Smash TV, Nex Machina focuses on pure action, voxel destruction and com...;https://shared.cloudflare.steamstatic.com/store_item_assets/steam/apps/404540/header.jpg?t=1591699254;Housemarque;Housemarque;Windows;20 Jun, 2017;Action, Indie;https://store.steampowered.com/app/404540/Nex_Machina/;Unknown;;;;
Nine Parchments;Finland;Nine Parchments is a co-operative blast'em up game of magic mayhem from Frozenbyte, creators of the Trine series!;https://shared.cloudflare.steamstatic.com/store_item_assets/steam/apps/471550/header.jpg?t=1725007138;Frozenbyte;Frozenbyte;Windows;5 Dec, 2017;Action, RPG;https://store.steampowered.com/app/471550/Nine_Parchments/;Unknown;;https://www.xbox.com/en-us/games/store/Nine-Parchments/BZM82SL2TP6V;https://www.nintendo.com/us/store/products/nine-parchments-switch/;
NoReload Heroes;Finland;NoReload Heroes is a chaotic co-op party shooter for up to four people. Work as a team to beat the accidental evil you created, and be sure to pick up the best magitech guns on the wa...;https://shared.cloudflare.steamstatic.com/store_item_assets/steam/apps/806770/header.jpg?t=1524823399;Stupid Stupid Games;Stupid Stupid Games;Windows;27 Apr, 2018;Action, Casual, Indie;https://store.steampowered.com/app/806770/NoReload_Heroes/;Unknown;;;;
Noita;Finland;Noita is a magical action roguelite set in a world where every pixel is physically simulated. Fight, explore, melt, burn, freeze and evaporate your way through the procedurally genera...;https://shared.cloudflare.steamstatic.com/store_item_assets/steam/apps/881100/header.jpg?t=1675987871;Nolla Games;Nolla Games;Windows;15 Oct, 2020;Action, Adventure, Indie, RPG, Simulation;https://store.steampowered.com/app/881100/Noita/;Unknown;;;;
Noitapeli;Finland;First person horror game, you have a special watch in your hand which shows the distance to the noita. Find a bottle which noita needs and bring it back. Use gun, collect mushrooms an...;https://shared.cloudflare.steamstatic.com/store_item_assets/steam/apps/881180/header.jpg?t=1733927036;randomcreations;randomcreations;Windows;26 May, 2023;Action, Adventure, Indie;https://store.steampowered.com/app/881180/Noitapeli/;Unknown;;;;
Nonsense Soccer;Finland;⚽ Nonsense Soccer ⚽ is a platformer-soccer-hybrid for people who like chaotic local multiplayer games;https://shared.cloudflare.steamstatic.com/store_item_assets/steam/apps/1352130/header.jpg?t=1739207884;Parta Games Oy;Antti Kolehmainen;Windows, macOS, SteamOS + Linux;16 Oct, 2020;Casual, Indie, Sports, Early Access;https://store.steampowered.com/app/1352130/Nonsense_Soccer/;Unknown;;;;
Notrium;Finland;You have crash-landed on Notrium. Your food supplies are running low, and a pack of predatory aliens have your scent. You're out of bullets for your pistol, your only weapon a handful...;https://shared.cloudflare.steamstatic.com/store_item_assets/steam/apps/349100/header.jpg?t=1745996496;Ville Mönkkönen;Ville Mönkkönen, Michael Quigley;Windows;1 Sep, 2003;Action, Adventure, Indie, RPG;https://store.steampowered.com/app/349100/Notrium/;Unknown;;;;
Obenseuer;Finland;Obenseuer is an urban survival RPG game, where you become a property manager of a rundown unfinished tenement building, in an isolated quarantine district of Obenseuer. Maintain and u...;https://shared.cloudflare.steamstatic.com/store_item_assets/steam/apps/951240/header.jpg?t=1737023122;Loiste Interactive;Loiste Interactive;Windows;11 Dec, 2018;Indie, RPG, Early Access;https://store.steampowered.com/app/951240/Obenseuer/;Unknown;;;;
Oceanhorn: Monster of Uncharted Seas;Finland;Oceanhorn: Monster of Uncharted Seas combines captivating storytelling, breathtaking 3D visuals and exciting gameplay into one epic action-adventure experience. In the game you explor...;https://shared.cloudflare.steamstatic.com/store_item_assets/steam/apps/339200/header.jpg?t=1667398786;Cornfox & Brothers Ltd.;Cornfox & Brothers Ltd.;Windows, macOS;17 Mar, 2015;Action, Adventure, Indie, RPG;https://store.steampowered.com/app/339200/Oceanhorn_Monster_of_Uncharted_Seas/;Unknown;;;;
Odyssey: The Deep Space Expedition;Finland;Odyssey is a story-driven space adventure for solo and multiplayer. Search for a new home for humanity while protecting your exploration ship. Scientists onboard carry Earth's last ho...;https://shared.cloudflare.steamstatic.com/store_item_assets/steam/apps/738600/516ebcd20b7101a0884029920a4c951eef60b06a/header.jpg?t=1743681402;TouchDown Creations;TouchDown Creations;Windows;18 Jan, 2019;Action, Adventure, Indie, Simulation;https://store.steampowered.com/app/738600/Odyssey_The_Deep_Space_Expedition/;Unknown;;;;
Ogre Chambers DX;Finland;Roguelike bullet hell shooter, where you fend off waves of attacking monsters in a constantly transforming arena. You are rewarded with upgrades to your vulnerable spaceship if you su...;https://shared.cloudflare.steamstatic.com/store_item_assets/steam/apps/2280440/header.jpg?t=1734203781;ANTENNA GAMES;ANTENNA GAMES;Windows;3 Mar, 2023;Action, Indie, RPG, Free To Play;https://store.steampowered.com/app/2280440/Ogre_Chambers_DX/;Unknown;;;;
Ostrich Island;Finland;Don't be an ostrich, play Ostrich! Gain experience points and unlock new skills and achievements! Feel creative? Create whole new islands and share it with community!;https://shared.cloudflare.steamstatic.com/store_item_assets/steam/apps/337270/header.jpg?t=1667041925;MeDungeon Ltd.;MeDungeon Ltd.;Windows, macOS, SteamOS + Linux;8 Jan, 2015;Adventure, Casual, Indie, RPG;https://store.steampowered.com/app/337270/Ostrich_Island/;Unknown;;;;
Over 9000 Zombies!;Finland;Over 9000 Zombies! is top-down arcade action blown out of all reasonable proportions. An endless horde of zombies is coming your way, how long can you survive?;https://shared.cloudflare.steamstatic.com/store_item_assets/steam/apps/273500/header.jpg?t=1729071553;Loren Lemcke;Loren Lemcke;Windows;25 Feb, 2015;Action, Indie;https://store.steampowered.com/app/273500/Over_9000_Zombies/;Unknown;;;;
PAKO - Car Chase Simulator;Finland;Tough as nails arcade driving game where you try to survive as long as possible without crashing your car in a police chase situation.;https://shared.cloudflare.steamstatic.com/store_item_assets/steam/apps/559870/header.jpg?t=1731140304;Tree Men Games;Tree Men Games;Windows, macOS;10 Jan, 2017;Action, Indie, Racing;https://store.steampowered.com/app/559870/PAKO__Car_Chase_Simulator/;Unknown;;;;
PAKO 2;Finland;Getaway driving and gun shooting action in two alternative camera views;https://shared.cloudflare.steamstatic.com/store_item_assets/steam/apps/612370/header.jpg?t=1731657963;Tree Men Games;Tree Men Games;Windows, macOS, SteamOS + Linux;16 Nov, 2017;Action, Casual, Indie, Racing;https://store.steampowered.com/app/612370/PAKO_2/;Unknown;;;;
PAKO 4;Finland;"Action-packed crime ""simulator"" with lots of driving, running, gunning and doing crimes!";https://shared.cloudflare.steamstatic.com/store_item_assets/steam/apps/3425320/header.jpg?t=1745826080;Tree Men Games;Tree Men Games;Windows, macOS;10 Apr, 2025;Action, Indie, Racing, Early Access;https://store.steampowered.com/app/3425320/PAKO_4/;Unknown;;;;
Para Bellum - Hold the Line;Finland;Para Bellum - Hold the Line is a 3D real time small unit tactics game. Your task is to hold off enemy attacks wave after wave using a variety of different Units and Supports in your a...;https://shared.cloudflare.steamstatic.com/store_item_assets/steam/apps/1772920/header.jpg?t=1649329761;Laukaus Games;Laukaus Games;Windows, macOS, SteamOS + Linux;31 Dec, 2021;Strategy;https://store.steampowered.com/app/1772920/Para_Bellum__Hold_the_Line/;Unknown;;;;
Parcel;Finland;Parcel is an atmospheric block-pushing puzzle game where your goal is to solve interlocking laser puzzles by using the unique abilities of different characters. Switch between members...;https://shared.cloudflare.steamstatic.com/store_item_assets/steam/apps/316080/27c15b2f03cc3c2bd08ba9f23236375bdf3de203/header.jpg?t=1745304736;Polar Bunny Ltd;Polar Bunny Ltd;Windows, macOS, SteamOS + Linux;22 Apr, 2015;Adventure, Indie, Strategy;https://store.steampowered.com/app/316080/Parcel/;Unknown;;;;
Past Fate;Finland;Past Fate is an open world MMORPG set in medieval fantasy world where the players freedom is the key element. Choose what you will become and explore the vast world and its continents...;https://shared.cloudflare.steamstatic.com/store_item_assets/steam/apps/1028510/header.jpg?t=1743585674;Icy North Games;Icy North Games;Windows;To be announced;Action, Indie, Massively Multiplayer, RPG, Early Access;https://store.steampowered.com/app/1028510/Past_Fate/;Unknown;;;;
Pirates of Black Cove;Finland;Plunder your way to the top and claim the title of Pirate King. This humorous mix of adventure and strategy lets you unite pirate factions, manage strongholds, and dominate land and s...;https://shared.cloudflare.steamstatic.com/store_item_assets/steam/apps/49330/header.jpg?t=1734601440;Nitro Games;Nitro Games;Windows;2 Aug, 2011;Strategy;https://store.steampowered.com/app/49330/Pirates_of_Black_Cove/;Unknown;;;;
Pivot Pilot;Finland;Pivot Pilot is a challenging platformer with puzzle elements in which you take simultaneous control of a boy and a giant robot arm.;https://shared.cloudflare.steamstatic.com/store_item_assets/steam/apps/569360/header.jpg?t=1519754625;Niko Kivilahti;Niko Kivilahti;Windows;6 Jan, 2017;Action, Indie;https://store.steampowered.com/app/569360/Pivot_Pilot/;Unknown;;;;
Pixel Piracy;Finland;Embark on an epic 2D pirate simulator RPG adventure, where you navigate both land and sea. Upgrade your ship, recruit and level up your crew, and uncover hidden treasures as you becom...;https://shared.cloudflare.steamstatic.com/store_item_assets/steam/apps/264140/header.jpg?t=1703187003;Vitali Kirpu;Vitali Kirpu;Windows, macOS, SteamOS + Linux;23 Apr, 2015;Adventure, Indie, RPG, Simulation;https://store.steampowered.com/app/264140/Pixel_Piracy/;Unknown;;;;
Please The Gods;Finland;Journey to the land of the Gods in this atmospheric turn-based indie RPG. Vanquish deadly beasts of Finnish mythology, survive in the unforgiving wilderness and earn the favour of the...;https://shared.cloudflare.steamstatic.com/store_item_assets/steam/apps/1040080/header.jpg?t=1581875703;Spawn Point OSK;Surma Games;Windows;17 Jul, 2019;Adventure, RPG;https://store.steampowered.com/app/1040080/Please_The_Gods/;Unknown;;;;
Portal Mortal;Finland;Portal Mortal is a hardcore 2D puzzle platformer spiced with blood and guts! Explore unique environments, face challenging obstacles and get creative. Play alone or have fun online wi...;https://shared.cloudflare.steamstatic.com/store_item_assets/steam/apps/1486790/header.jpg?t=1745498382;Coil Games;Coil Games;Windows, SteamOS + Linux;1 Apr, 2022;Adventure, Indie;https://store.steampowered.com/app/1486790/Portal_Mortal/;Unknown;;;;
Potion Tycoon;Finland;Potion Tycoon is a management simulator with a witchy twist! Build and develop your very own magic shop. Manage resources, set up production lines, mix potions and sell them smartly t...;https://shared.cloudflare.steamstatic.com/store_item_assets/steam/apps/1485690/header.jpg?t=1732096723;Daedalic Entertainment;Snowhound Games;Windows;4 Oct, 2024;Simulation, Strategy;https://store.steampowered.com/app/1485690/Potion_Tycoon/;Unknown;https://store.playstation.com/en-us/concept/10013622;;;
Power Hover;Finland;Take control of the hoverboarding robots, explore the desolate world, defy gravity, dive into the oceans and ride with the sandworms on the dunes! Stylish graphics and groovy soundtra...;https://shared.cloudflare.steamstatic.com/store_item_assets/steam/apps/559960/header.jpg?t=1668158457;ODDROK;ODDROK;Windows, macOS;10 Jan, 2017;Action, Adventure, Indie, Racing;https://store.steampowered.com/app/559960/Power_Hover/;Unknown;;;;
Prehistoric Hunt;Finland;Dive into intense dinosaur hunting adventures with your friends. Complete hunting contracts for Preton Corporation. Gather rewards, improve your equipment and become a master hunter. ...;https://shared.cloudflare.steamstatic.com/store_item_assets/steam/apps/752900/header.jpg?t=1713127333;Antiproto Studios;Antiproto Studios;Windows;1 Dec, 2020;Action, Adventure, Indie, Simulation, Early Access;https://store.steampowered.com/app/752900/Prehistoric_Hunt/;Unknown;;;;
Premium Pool Arena;Finland;Premium Pool Arena is a modern arcade style pool game with single player, online and local multiplayer modes. If you love a relaxed game of 8 ball, this is the game for you!;https://shared.cloudflare.steamstatic.com/store_item_assets/steam/apps/616240/header.jpg?t=1711379845;Paradox Interactive;Iceflake Studios;Windows, macOS, SteamOS + Linux;14 Apr, 2017;Casual, Sports;https://store.steampowered.com/app/616240/Premium_Pool_Arena/;Unknown;;;;
PuckOFF;Finland;PuckOFF is a seriously unforgiving story-based hockey goon simulator only missing rules. You can do whatever it takes to win a game with different ways to do so, you can either outsco...;https://shared.cloudflare.steamstatic.com/store_item_assets/steam/apps/1765990/header.jpg?t=1740556619;Kuura Playhouse;Kuura Playhouse;Windows;13 May, 2022;Action, Indie, Sports;https://store.steampowered.com/app/1765990/PuckOFF/;Unknown;;;;
Puddle Knights;Finland;Protecting nobles from mud may look simple on the surface, but the intricate cape arranging puzzle mechanics ensure steadily increasing difficulty. Join the Knights on their quest to ...;https://shared.cloudflare.steamstatic.com/store_item_assets/steam/apps/1180540/header.jpg?t=1705743653;Lockpickle;Lockpickle;Windows, macOS;3 Mar, 2020;Casual, Indie, Strategy;https://store.steampowered.com/app/1180540/Puddle_Knights/;Unknown;;;;
Puzzle Station 15th Anniversary Retro Release;Finland;Puzzle Station offers two game modes. Arcade Mode is a fast paced and more casual and the Puzzle Mode offers hand crafted puzzles, which will require more planning ahead.;https://shared.cloudflare.steamstatic.com/store_item_assets/steam/apps/366990/header.jpg?t=1447373493;YeaBoing;Ninai Games, YeaBoing;Windows;14 Jul, 2000;Casual, Indie;https://store.steampowered.com/app/366990/Puzzle_Station_15th_Anniversary_Retro_Release/;Unknown;;;;
P·O·L·L·E·N;Finland;P·O·L·L·E·N is an atmospheric, suspenseful and highly interactive first person sci-fi exploration game set on Saturn’s moon Titan. Delve into the richly detailed Station M, and...;https://shared.cloudflare.steamstatic.com/store_item_assets/steam/apps/393750/header.jpg?t=1492076002;Mindfield Games;Mindfield Games;Windows;19 Apr, 2016;Adventure, Indie;https://store.steampowered.com/app/393750/POLLEN/;Unknown;;;;
Qbeh-1: The Atlas Cube;Finland;QBEH-1 is an atmospheric 1st-person puzzle platformer that takes players on a quest through a series of divergent worlds. Each world is filled with new puzzles that require special cu...;https://shared.cloudflare.steamstatic.com/store_item_assets/steam/apps/252550/header.jpg?t=1447358682;Digital Tribe;Liquid Flower;Windows, macOS;15 May, 2014;Adventure, Casual, Indie;https://store.steampowered.com/app/252550/Qbeh1_The_Atlas_Cube/;Unknown;;;;
Qiybz;Finland;Qiybz is a cube-filled auto-platformer with randomized platforms and experimental music, respecting skill, precision and a good balance between cautious and reckless behaviour.;https://shared.cloudflare.steamstatic.com/store_item_assets/steam/apps/2236960/header.jpg?t=1722652547;Jesse Sakari Hyttinen;Jesse Sakari Hyttinen;Windows;2 Feb, 2023;Casual, Indie, Simulation;https://store.steampowered.com/app/2236960/Qiybz/;Unknown;;;;
Quantum Break;Finland;From Remedy Entertainment, the masters of cinematic action games, comes Quantum Break, a time-amplified suspenseful blockbuster. The Quantum Break experience is part game, part live a...;https://shared.cloudflare.steamstatic.com/store_item_assets/steam/apps/474960/header.jpg?t=1682524073;Xbox Game Studios;Remedy Entertainment;Windows;29 Sep, 2016;Action;https://store.steampowered.com/app/474960/Quantum_Break/;Unknown;;;;
Quest for Conquest;Finland;Gather your troops and embark on a journey! The capital awaits you, but will you have what it takes to survive the journey, or will you fail like many others before you?;https://shared.cloudflare.steamstatic.com/store_item_assets/steam/apps/1147020/header.jpg?t=1745491470;Kajak Games, Kajaksi Game Collective;Pixel Pinecone;Windows;29 Oct, 2019;Adventure, Casual, Indie;https://store.steampowered.com/app/1147020/Quest_for_Conquest/;Unknown;;;;
RESCUE 2: Everyday Heroes;Finland;"HOW MANY LIVES WILL YOU SAVE?Experience your city through the eyes of a lifesaver and find out what it means to be a genuine ""Everyday Hero""! Keep track of several fire stations, a va...";https://shared.cloudflare.steamstatic.com/store_item_assets/steam/apps/339210/header.jpg?t=1654107362;astragon Sales & Services GmbH;Fragment Production Ltd.;Windows, macOS;3 Jun, 2015;Simulation, Strategy;https://store.steampowered.com/app/339210/RESCUE_2_Everyday_Heroes/;Unknown;;;;
RUNNING WITH RIFLES;Finland;RUNNING WITH RIFLES is a top-down tactical shooter with open world RPG elements. In RWR, you join the ranks of an army as a common soldier, just like the thousands around you.;https://shared.cloudflare.steamstatic.com/store_item_assets/steam/apps/270150/header.jpg?t=1669218056;Osumia Games;Osumia Games;Windows, macOS, SteamOS + Linux;2 Apr, 2015;Action, Indie;https://store.steampowered.com/app/270150/RUNNING_WITH_RIFLES/;Unknown;;;;
Race Arcade;Finland;The ultimate top down racing game with over 100 tracks, online and local multiplayer, extensive single player and a track editor to create and share your own tracks with the others.;https://shared.cloudflare.steamstatic.com/store_item_assets/steam/apps/355010/header.jpg?t=1711112551;Paradox Interactive;Iceflake Studios;Windows, macOS, SteamOS + Linux;5 Apr, 2017;Indie, Racing, Sports;https://store.steampowered.com/app/355010/Race_Arcade/;Unknown;;;;
Rainyday;Finland;It's going to rain for a while.;https://shared.cloudflare.steamstatic.com/store_item_assets/steam/apps/712980/header.jpg?t=1546781962;Kerkko Rasilainen;Kerkko Rasilainen;Windows;6 Oct, 2017;Adventure, Indie;https://store.steampowered.com/app/712980/Rainyday/;Unknown;;;;
Rauniot;Finland;Rauniot is an isometric post-apocalyptic point and click adventure game which takes place to Northern Finland.;https://shared.cloudflare.steamstatic.com/store_item_assets/steam/apps/1168490/header.jpg?t=1734689193;Act Normal Games;Act Normal Games;Windows;17 Apr, 2024;Adventure, Indie;https://store.steampowered.com/app/1168490/Rauniot/;Unknown;;;;
Redgar: The Space Viking;Finland;Unleash chaos as Redgar, a space Viking! Battle through castle-like starships and neon-lit fortresses with powerful weapons in this action-packed, story-driven top-down shooter.;https://shared.cloudflare.steamstatic.com/store_item_assets/steam/apps/1900890/header.jpg?t=1736242261;Bonus Stage Publishing;Kamara Creations;Windows;7 Nov, 2023;Action, Adventure;https://store.steampowered.com/app/1900890/Redgar_The_Space_Viking/;Unknown;;;https://www.nintendo.com/us/store/products/redgar-the-space-viking-switch/;
Ridge Racer™ Unbounded;Finland;The latest title in the RIDGE RACER franchise, RIDGE RACER Unbounded gears up to carve its own destructive path with a new breed of arcade racing.;https://shared.cloudflare.steamstatic.com/store_item_assets/steam/apps/202310/header.jpg?t=1676374201;BANDAI NAMCO Entertainment;BUGBEAR;Windows;29 Mar, 2012;Racing;https://store.steampowered.com/app/202310/Ridge_Racer_Unbounded/;Unknown;;;;
