Name;Country;Description;Thumbnail;Publisher_Names;Developer_Names;Platform;Release_Date;Genre;Steam_Link;Epic_Link;PlayStation_Link;Xbox_Link;Switch_Link;GOG_Link
Gloom;Finland;Afflicted by severe amnesia, you drift deep into the Common Dream. You scour for the lost pages of the Necronomicon, while clinging on to any little purpose you have left. Faced with ...;https://shared.cloudflare.steamstatic.com/store_item_assets/steam/apps/619280/header.jpg?t=1573752302;Hunchback Studio;Hunchback Studio;Windows, macOS, SteamOS + Linux;13 Apr, 2017;Action, Adventure, Indie;https://store.steampowered.com/app/619280/Gloom/;Unknown;;;;
Good Mourning;Finland;Run-based story game. Which mistakes would you repeat if you could?;https://shared.cloudflare.steamstatic.com/store_item_assets/steam/apps/1338790/header.jpg?t=1726054295;Platonic Partnership ;Platonic Partnership;Windows;29 Apr, 2021;Adventure, Casual, Indie;https://store.steampowered.com/app/1338790/Good_Mourning/;Unknown;;;;
Grab the Bottle;Finland;Grab the Bottle is a puzzle game in which you solve puzzles by stretching an infinitely stretchy arm through various levels, grabbing and dropping objects along the way.;https://shared.cloudflare.steamstatic.com/store_item_assets/steam/apps/546410/header.jpg?t=1667846048;Kamina Dimension;Kamina Dimension;Windows, macOS, SteamOS + Linux;22 May, 2017;Casual, Indie;https://store.steampowered.com/app/546410/Grab_the_Bottle/;Unknown;;;;
Great Houses of Calderia;Finland;Great Houses of Calderia is a Feudal Grand Strategy game focusing on family dynamics & stories. Use your family strengths to compete against rivals to rise in the ranks of Calderia - ...;https://shared.cloudflare.steamstatic.com/store_item_assets/steam/apps/1812910/header.jpg?t=1739538679;Firesquid;Resistance Games;Windows;2 May, 2024;Indie, RPG, Strategy;https://store.steampowered.com/app/1812910/Great_Houses_of_Calderia/;Unknown;;;;
Grimrush;Finland;Grimrush is a top down action game in which you must face off a gauntlet of seven brutal boss fights. Utilize three characters and a large selection of active and passive abilities. B...;https://shared.cloudflare.steamstatic.com/store_item_assets/steam/apps/704760/header.jpg?t=1674586936;Pohjoinen Pelinkehitys ry;Merge Heroes;Windows;30 Nov, 2017;Action, Indie;https://store.steampowered.com/app/704760/Grimrush/;Unknown;;;;
Gun Bombers;Finland;Grab your pickaxe and enter the mines! Search for treasures and fight against other miners in this fast, round-based multiplayer game (up to 10 players over LAN or internet). Comes wi...;https://shared.cloudflare.steamstatic.com/store_item_assets/steam/apps/416180/header.jpg?t=1695963526;Antti Vaihia;Antti Vaihia;Windows;21 Sep, 2016;Action, Indie, Strategy;https://store.steampowered.com/app/416180/Gun_Bombers/;Unknown;;;;
Gunnheim;Finland;Dish out carnage of hellish proportions in Gunnheim, a top-down co-op shooter where the equation is simple: Vikings + Guns = Mayhem!;https://shared.cloudflare.steamstatic.com/store_item_assets/steam/apps/371510/header.jpg?t=1568509561;SIEIDI Ltd;SIEIDI Ltd;Windows, macOS, SteamOS + Linux;10 Aug, 2015;Action, Indie;https://store.steampowered.com/app/371510/Gunnheim/;Unknown;;;;
Gust of Wind;Finland;A story-driven stealth game. Sneak, climb and fight your way through post-apocalyptic environments. Old-school stealth experience crafted in an immersive simulation spirit.;https://shared.cloudflare.steamstatic.com/store_item_assets/steam/apps/1715390/header.jpg?t=1734027167;Wrenchpunk Games;Wrenchpunk Games;Windows;30 Jul, 2023;Action, Adventure, Indie, Early Access;https://store.steampowered.com/app/1715390/Gust_of_Wind/;Unknown;;;;
Hardland;Finland;In the year 1018, an adventurer from Samarkand drifts to Hardland. Solve a mystery by delving into the different sides of this fantasy world. Hardland is a bustling kingdom filled wit...;https://shared.cloudflare.steamstatic.com/store_item_assets/steam/apps/321980/header.jpg?t=1639869266;Mountain Sheep;Mountain Sheep;Windows;17 Sep, 2019;Adventure, Indie;https://store.steampowered.com/app/321980/Hardland/;Unknown;;;;
Has-Been Heroes;Finland;Has-Been Heroes is a challenging, lane-based roguelike game of strategy and action, featuring a band of heroes on a quest to escort the King's twin princesses to school!;https://shared.cloudflare.steamstatic.com/store_item_assets/steam/apps/492290/header.jpg?t=1694422848;GameTrust Games;Frozenbyte;Windows;28 Mar, 2017;Action, Indie, RPG, Strategy;https://store.steampowered.com/app/492290/HasBeen_Heroes/;Unknown;https://store.playstation.com/en-us/product/UP2591-CUSA06643_00-HASBEENHEROES00A/;;https://www.nintendo.com/us/store/products/has-been-heroes-switch/;
Heal;Finland;Guide an old man through the dark and atmospheric world of Heal in this abstract 2D puzzle-adventure point-and-click game.;https://shared.cloudflare.steamstatic.com/store_item_assets/steam/apps/1056610/header.jpg?t=1732098955;Jesse Makkonen;Jesse Makkonen;Windows;10 Apr, 2020;Adventure, Indie;https://store.steampowered.com/app/1056610/Heal/;Unknown;;;;
Hero Siege;Finland;Hero Siege brings you the loot with a legion of playable character classes, procedually generated world, over 1000 unique items, endless replayability and a wide variety of dungeons a...;https://shared.cloudflare.steamstatic.com/store_item_assets/steam/apps/269210/header.jpg?t=1736850054;Panic Art Studios Ltd;Panic Art Studios Ltd;Windows, SteamOS + Linux;29 Jan, 2014;Action, Adventure, Indie, Massively Multiplayer, RPG;https://store.steampowered.com/app/269210/Hero_Siege/;Unknown;;;;
Hidden Boxes;Finland;In Hidden Boxes, players are divided into two different teams: seekers and props. Seekers try to find props before time runs out.;https://shared.cloudflare.steamstatic.com/store_item_assets/steam/apps/2604980/header.jpg?t=1721423637;Stackedbox;Stackedbox;Windows;19 Jul, 2024;Action, Casual, Indie;https://store.steampowered.com/app/2604980/Hidden_Boxes/;Unknown;;;;
Horde Hunters;Finland;Slay hordes of enemies on thrilling missions to save the humanity from a looming demon onslaught.;https://shared.cloudflare.steamstatic.com/store_item_assets/steam/apps/2178560/be9ea87b8cc9c6cd1f60d79073177a7ccc570abe/header.jpg?t=1744304506;Antti Vaihia;Antti Vaihia;Windows;10 Apr, 2025;Action;https://store.steampowered.com/app/2178560/Horde_Hunters/;Unknown;;;;
Hunted: Kalevala;Finland;Get your knife, get your spear. There is a monster on the loose. Shout Perkele, and kill the beast.;https://shared.cloudflare.steamstatic.com/store_item_assets/steam/apps/2203710/header.jpg?t=1733231412;Jamk Games;Hunted_Kalevala;Windows;9 Dec, 2022;Action, Adventure;https://store.steampowered.com/app/2203710/Hunted_Kalevala/;Unknown;;;;
Hypersensitive Bob;Finland;Hypersensitive Bob is roguelike sky-platform crawler where Bob fights his myriad forms of allergies. Some extreme situations may require Lobotomy or Surgery - even Laxative may prove ...;https://shared.cloudflare.steamstatic.com/store_item_assets/steam/apps/444270/header.jpg?t=1493884915;SIEIDI Ltd;SIEIDI Ltd;Windows, macOS, SteamOS + Linux;29 Mar, 2016;Action, Adventure, Casual, Indie;https://store.steampowered.com/app/444270/Hypersensitive_Bob/;Unknown;;;;
INFRA;Finland;INFRA puts you into the boots of a structural analyst on a routine mission. Quickly though, your task turns into a fight for survival, all caused by deep-rooted schemes of the past. Y...;https://shared.cloudflare.steamstatic.com/store_item_assets/steam/apps/251110/header.jpg?t=1693680015;Loiste Interactive;Loiste Interactive;Windows;15 Jan, 2016;Adventure, Indie;https://store.steampowered.com/app/251110/INFRA/;Unknown;;;;
Ice Lakes;Finland;Ice Lakes is a modern ice fishing simulator with different single and multiplayer game modes and sandbox approach to wintertime fishing. Use and customize wide selection of fishing ge...;https://shared.cloudflare.steamstatic.com/store_item_assets/steam/apps/393430/header.jpg?t=1711379282;Paradox Interactive;Iceflake Studios;Windows, macOS, SteamOS + Linux;19 Apr, 2016;Indie, Simulation, Sports;https://store.steampowered.com/app/393430/Ice_Lakes/;Unknown;;;;
Interplanetary: Enhanced Edition;Finland;In this turn-based strategic artillery game, players wage interplanetary wars by developing their home planets and firing massive barrages through the unpredictable gravity fields of ...;https://shared.cloudflare.steamstatic.com/store_item_assets/steam/apps/650220/header.jpg?t=1655731352;Team17 Digital Ltd;Team Jolly Roger;Windows, macOS, SteamOS + Linux;2 Aug, 2017;Indie, Simulation, Strategy;https://store.steampowered.com/app/650220/Interplanetary_Enhanced_Edition/;Unknown;;;;
Iron Danger;Finland;Iron Danger is a tactical combat puzzler with a unique time manipulation mechanic. A never before seen combination that blends the tactical depth of turn-based games with the exciting...;https://shared.cloudflare.steamstatic.com/store_item_assets/steam/apps/899310/header.jpg?t=1736357047;Daedalic Entertainment;Action Squad Studios;Windows;25 Mar, 2020;Action, Adventure, Indie, Strategy;https://store.steampowered.com/app/899310/Iron_Danger/;Unknown;;https://www.xbox.com/en-US/games/store/iron-danger/9P69B09J5QGW;;
JANITOR BLEEDS;Finland;Enter the abandoned arcade after your car has crashed, and the shelter you were looking for is trying to eat you alive in this dark mystery-horror adventure. Solve mysteries, keep JAN...;https://shared.cloudflare.steamstatic.com/store_item_assets/steam/apps/1552310/header.jpg?t=1739371058;Bonus Stage Publishing;Korpus;Windows;7 Apr, 2022;Action, Adventure, Indie;https://store.steampowered.com/app/1552310/JANITOR_BLEEDS/;Unknown;;https://www.xbox.com/en-us/games/store/janitor-bleeds/9p4r6h39c91j;;
JellyCod;Finland;Jellycod recaptures the core of classic shooters. Return to the simple days of playing first person shooters with your friends. Grab your bolt action rifle in 'rifles only' mode or co...;https://shared.cloudflare.steamstatic.com/store_item_assets/steam/apps/2418450/header.jpg?t=1714400011;Jellivaara;Jellivaara;Windows;To be announced;Action;https://store.steampowered.com/app/2418450/JellyCod/;Unknown;;;;
Johnny Graves—The Unchosen One;Finland;Johnny Graves is an urban fantasy shooter that demands accuracy and fast reflexes. Johnny has a key role in the civil war of Hell. He has to fight his way through the front lines to h...;https://shared.cloudflare.steamstatic.com/store_item_assets/steam/apps/476030/header.jpg?t=1491479204;Stupid Stupid Games;Stupid Stupid Games;Windows;6 Apr, 2017;Action, Indie, RPG;https://store.steampowered.com/app/476030/Johnny_GravesThe_Unchosen_One/;Unknown;;;;
KAUNA;Finland;KAUNA is a Finnish boomer shooter made with 90's retro style graphics.;https://shared.cloudflare.steamstatic.com/store_item_assets/steam/apps/3582660/a2e60300aaf0af354566739cb22fa28b5c60702f/header.jpg?t=1744388808;Antti Rönkkä;Antti Rönkkä;Windows, SteamOS + Linux;To be announced;Action;https://store.steampowered.com/app/3582660/KAUNA/;Unknown;;;;
Kalevania;Finland;Kalevania is a retro action platformer loosely based on Finnish mythology. Fight with bare hands, sword, axe, bow, and 12 runic weapons. With 50+ enemy types and collectibles, enjoy a...;https://shared.cloudflare.steamstatic.com/store_item_assets/steam/apps/2387950/header.jpg?t=1702389470;"Jukka Mattila - ""GamesByMichi""";Jukka Mattila;Windows, SteamOS + Linux;3 May, 2023;Action, Adventure, Indie;https://store.steampowered.com/app/2387950/Kalevania/;Unknown;;;;
King Oddball;Finland;End the world only using your tongue and boulders! Hurl away diamonds! See tiny humans fly around against their will! Crush them all!;https://shared.cloudflare.steamstatic.com/store_item_assets/steam/apps/525450/header.jpg?t=1601127728;10tons Ltd;10tons Ltd;Windows, macOS, SteamOS + Linux;9 Sep, 2016;Action, Indie;https://store.steampowered.com/app/525450/King_Oddball/;Unknown;;https://www.xbox.com/en-us/games/store/King-Oddball/BTK86T84DFSV;https://www.nintendo.com/us/store/products/king-oddball-switch/;
Knight King Assassin;Finland;Knight King Assassin is a minimal puzzle game inspired by rock-paper-scissors and chess. Your objective is to clear the board from all the symbols by moving them while taking into acc...;https://shared.cloudflare.steamstatic.com/store_item_assets/steam/apps/890590/header.jpg?t=1531503357;Niko Kivilahti;Niko Kivilahti;Windows;11 Jul, 2018;Casual, Indie;https://store.steampowered.com/app/890590/Knight_King_Assassin/;Unknown;;;;
Knights of Pen and Paper 2;Finland;Prepare to inhabit a world of chivalry, class warfare and off-beat pop references. Knights of Pen & Paper 2 is a turn-based, retro style, pixel-art adventure full of danger, intrigue,...;https://shared.cloudflare.steamstatic.com/store_item_assets/steam/apps/310060/header.jpg?t=1709831344;Paradox Interactive;Kyy Games;Windows, macOS, SteamOS + Linux;20 Oct, 2015;Adventure, Indie, RPG, Simulation, Strategy;https://store.steampowered.com/app/310060/Knights_of_Pen_and_Paper_2/;Unknown;;;;
Korpus: Buried over the Black Soil;Finland;Korpus: Buried over the Black Soil is a first-person horror game in which you have been sent to evaluate an abandoned house, set somewhere in Eastern Europe. Uncover the houses past a...;https://shared.cloudflare.steamstatic.com/store_item_assets/steam/apps/1236190/header.jpg?t=1615121893;Korpus;Korpus;Windows;14 Feb, 2020;Action, Adventure;https://store.steampowered.com/app/1236190/Korpus_Buried_over_the_Black_Soil/;Unknown;;;;
Kumoon : Ballistic Physics Puzzle;Finland;A unique puzzle game : a nonviolent trickshooting challenge with gamepad VR option.;https://shared.cloudflare.steamstatic.com/store_item_assets/steam/apps/386290/header.jpg?t=1486571725;Lucky You Studio;Lucky You Studio;Windows, macOS;10 Nov, 2015;Action, Casual, Indie, Simulation;https://store.steampowered.com/app/386290/Kumoon__Ballistic_Physics_Puzzle/;Unknown;;;;
Lake of Creatures;Finland;Difficult action FISHING ROGUELIKE, where you slaughter mutated creatures with weapons that shoot lasers and explosions!!! 💥 Catch fish to buy treasures that MODIFY YOUR BUILD and ...;https://shared.cloudflare.steamstatic.com/store_item_assets/steam/apps/1808320/header.jpg?t=1745584303;ANTENNA GAMES;ANTENNA GAMES;Windows;15 Nov, 2024;Action, RPG, Sports;https://store.steampowered.com/app/1808320/Lake_of_Creatures/;Unknown;;;;
Lakeview Cabin 2;Finland;The ultimate 2D horror is back! Dive deep into the diverse world of horror movies! Nothing can prepare you for the R-rated challenges you will face!;https://shared.cloudflare.steamstatic.com/store_item_assets/steam/apps/1291790/header.jpg?t=1698944822;Roope Tamminen;Roope Tamminen;Windows, macOS;19 Oct, 2023;Action, Indie, Strategy;https://store.steampowered.com/app/1291790/Lakeview_Cabin_2/;Unknown;;;;
Lakeview Cabin Collection;Finland;Delve into the diverse world of horror movies in this 2D action puzzler. Nothing can prepare you for the R-rated challenges you will face!;https://shared.cloudflare.steamstatic.com/store_item_assets/steam/apps/361990/header.jpg?t=1591427913;Roope Tamminen;Roope Tamminen;Windows, macOS;25 Mar, 2015;Indie;https://store.steampowered.com/app/361990/Lakeview_Cabin_Collection/;Unknown;;;;
Lakeview Valley;Finland;Murder rpg set in the small town of Lakeview Valley. Become the most popular home-owner or succumb to your dark desires. The choice is yours.;https://shared.cloudflare.steamstatic.com/store_item_assets/steam/apps/783840/header.jpg?t=1593170914;Roope Tamminen;Roope Tamminen;Windows, macOS;22 Oct, 2019;Adventure, Indie, RPG;https://store.steampowered.com/app/783840/Lakeview_Valley/;Unknown;;;;
Lalli;Finland;Lalli tells the tale of a Finnish folk hero and freedom fighter. In 1240, Finland is invaded by the neighboring Swedish Kingdom, aiming to convert the tribes to Christianity by force....;https://shared.cloudflare.steamstatic.com/store_item_assets/steam/apps/3035640/header.jpg?t=1718910438;AcroGames;AcroGames;Windows;20 Jun, 2024;Action, Adventure;https://store.steampowered.com/app/3035640/Lalli/;Unknown;;;;
Led It Rain;Finland;Motorcycles, guns, monsters and bikini-babes. Led It Rain is first person shooter motorcycle driving racing game. Faster you drive and shoot monsters more score you obtain. Each race ...;https://shared.cloudflare.steamstatic.com/store_item_assets/steam/apps/464610/header.jpg?t=1735733114;Ninma Ltd;Ataverti;Windows;12 Dec, 2018;Action, Indie, Racing;https://store.steampowered.com/app/464610/Led_It_Rain/;Unknown;;;;
Legend of Grimrock;Finland;Use the Dungeon Editor to build entirely new adventures and challenges for other players to solve.;https://shared.cloudflare.steamstatic.com/store_item_assets/steam/apps/207170/header.jpg?t=1447355394;Almost Human Games;Almost Human Games;Windows, macOS;11 Apr, 2012;Adventure, Indie, RPG;https://store.steampowered.com/app/207170/Legend_of_Grimrock/;Unknown;;;;
Legend of Grimrock 2;Finland;Legend of Grimrock 2 is a dungeon crawling role playing game with a modern execution but an oldschool heart. A group of four prisoners have shipwrecked on the secluded Isle of Nex. Th...;https://shared.cloudflare.steamstatic.com/store_item_assets/steam/apps/251730/header.jpg?t=1447358653;Almost Human Games;Almost Human Games;Windows, macOS;15 Oct, 2014;Adventure, Indie, RPG;https://store.steampowered.com/app/251730/Legend_of_Grimrock_2/;Unknown;;;;
Lempo;Finland;Find your way back home before Metsänpeitto, an otherworldly plane of existence, consumes you. Lempo is a psychological horror game inspired by Finnish mythology with an emphasis on ...;https://shared.cloudflare.steamstatic.com/store_item_assets/steam/apps/1891620/header.jpg?t=1744988604;PID Games, Gamersky Games;One Trick Entertainment;Windows;7 Sep, 2023;Adventure, Indie;https://store.steampowered.com/app/1891620/Lempo/;Unknown;;;;
Letifer;Finland;Take on the demonic threat as Letifer in an action-packed mix of twin-stick shooter, roguelite, and survivors-like gameplay. Gun through brutal Rituals, shape your build with powerful...;https://shared.cloudflare.steamstatic.com/store_item_assets/steam/apps/2294640/header.jpg?t=1744927175;Third Spirit Games;Third Spirit Games;Windows;17 Apr, 2025;Action, Adventure, Casual, Indie, Early Access;https://store.steampowered.com/app/2294640/Letifer/;Unknown;;;;
Levaluhta;Finland;You're a home care nurse who visits an elderly patient. On each run, your tasks, problems and threats are selected randomly. A Sinister horror game without jumpscares or gore.;https://shared.cloudflare.steamstatic.com/store_item_assets/steam/apps/1481760/header.jpg?t=1637321517;Platonic Partnership;Platonic Partnership;Windows;To be announced;Action, Adventure, Indie;https://store.steampowered.com/app/1481760/Levaluhta/;Unknown;;;;
Liekki;Finland;Liekki is a fast-paced puzzle platformer where you play as a little fire spirit and try to burn as much as possible – or as little as possible. Solve levels using different fire rel...;https://shared.cloudflare.steamstatic.com/store_item_assets/steam/apps/2454750/header.jpg?t=1740434209;Pultokas;Pultokas;Windows;To be announced;Adventure, Indie;https://store.steampowered.com/app/2454750/Liekki/;Unknown;;;;
Local News with Cliff Rockslide;Finland;You're the cameraperson of Butterfly Valley's #1 influencer: Cliff Rockslide. Frame every shot like you were a professional and follow the stories to make Cliff famous. Local News wit...;https://shared.cloudflare.steamstatic.com/store_item_assets/steam/apps/2464030/header.jpg?t=1739371149;Bonus Stage Publishing;Horsefly Games;Windows;7 Aug, 2023;Adventure, Casual, Simulation;https://store.steampowered.com/app/2464030/Local_News_with_Cliff_Rockslide/;Unknown;;;;
Lockdown: Stand Alone;Finland;You're alone in an abandoned post-apocalyptic city with a mission to nuke the entire area. Lose track of what’s real by immersing yourself to the unparalleled sense of scale and dep...;https://shared.cloudflare.steamstatic.com/store_item_assets/steam/apps/513270/header.jpg?t=1715716482;Viversion;Viversion;Windows;21 Dec, 2017;Action;https://store.steampowered.com/app/513270/Lockdown_Stand_Alone/;Unknown;;;;
Lost Home;Finland;Lost Home is a 2D adventure game with a platformer spirit. you'll play as an armadillo and a snake, who'll have to work together in order to find themselves a new home.;https://shared.cloudflare.steamstatic.com/store_item_assets/steam/apps/728020/header.jpg?t=1515663148;Lunar Collapse;Lunar Collapse;Windows;1 Dec, 2017;Adventure, Indie;https://store.steampowered.com/app/728020/Lost_Home/;Unknown;;;;
Lowglow;Finland;Lowglow - an audiovisual puzzle journey. Glowingly beautiful graphics combined with a dynamic audio environment make sure that Lowglow is an unforgettable, mind-bending experience for...;https://shared.cloudflare.steamstatic.com/store_item_assets/steam/apps/405950/header.jpg?t=1670413858;Rockodile;Rockodile;Windows, macOS;3 Dec, 2015;Adventure, Casual, Indie;https://store.steampowered.com/app/405950/Lowglow/;Unknown;;;;Unknown
Lucid;Finland;Discover a new way to match blocks in this otherworldly, Zen-like, relaxing puzzle experience. Lucid is the world's first Match-All puzzle game, in which you clear areas by combining ...;https://shared.cloudflare.steamstatic.com/store_item_assets/steam/apps/61100/header.jpg?t=1447354413;YeaBoing;YeaBoing;Windows;19 Jul, 2011;Indie, Casual;https://store.steampowered.com/app/61100/Lucid/;Unknown;;;;
Lucius Demake;Finland;Lucius game has been demade, and is now ready for mayhem. Enjoy all the gore now in fewer pixels and fewer colors. The original game has been fully demade to achieve the atmosphere of...;https://shared.cloudflare.steamstatic.com/store_item_assets/steam/apps/364230/header.jpg?t=1667024829;Shiver Games;Shiver Games;Windows, SteamOS + Linux;8 Aug, 2016;Action, Adventure, Casual, Indie;https://store.steampowered.com/app/364230/Lucius_Demake/;Unknown;;;;
Lucius II;Finland;Lucius is taken to the psychiatric ward of St. Benedict’s Hospital by unsuspecting caretakers. The Book of Revelation predicts the birth of a child that would end up ruling the worl...;https://shared.cloudflare.steamstatic.com/store_item_assets/steam/apps/296830/header.jpg?t=1667025112;Shiver Games;Shiver Games;Windows, SteamOS + Linux;13 Feb, 2015;Action, Adventure, Indie, Simulation;https://store.steampowered.com/app/296830/Lucius_II/;Unknown;;;;
Lucius III;Finland;Lucius is back. In a whole new narrative experience, he now returns to his old neighborhood of Winter Hill. The path will be a difficult one, with trials and tribulations waiting ahea...;https://shared.cloudflare.steamstatic.com/store_item_assets/steam/apps/513290/header.jpg?t=1667025723;Shiver Games;Shiver Games;Windows;13 Dec, 2018;Adventure, Indie;https://store.steampowered.com/app/513290/Lucius_III/;Unknown;;;;
Lumo;Finland;Witness the rebirth of a genre in Lumo – a classic isometric adventure with a modern twist for gamers young and old alike!;https://shared.cloudflare.steamstatic.com/store_item_assets/steam/apps/345480/header.jpg?t=1667047617;Triple Eh? Ltd;Triple Eh? Ltd;Windows, macOS, SteamOS + Linux;24 May, 2016;Adventure, Indie;https://store.steampowered.com/app/345480/Lumo/;Unknown;;;;
Lydia;Finland;Award winning emotional visual novel about a little girl in a world of adults. How can you find a monster you can’t see?;https://shared.cloudflare.steamstatic.com/store_item_assets/steam/apps/629000/header.jpg?t=1726686056;Platonic Partnership, Nakana.io;Platonic Partnership;Windows;2 Jun, 2017;Adventure;https://store.steampowered.com/app/629000/Lydia/;Unknown;;;;
Mauri Mursu's Hangover;Finland;Help Mauri Mursu on his adventure on the Walrus Islands and cure his hangover!;https://shared.cloudflare.steamstatic.com/store_item_assets/steam/apps/1522570/header.jpg?t=1667376129;Nervanti;Nervanti;Windows;2 Nov, 2022;Adventure, Indie;https://store.steampowered.com/app/1522570/Mauri_Mursus_Hangover/;Unknown;;;;
MewMew - PewPew;Finland;Dinosaurs have invaded MewMew’s home and now it's time for him to pick up his trusty old meteor gun and send them right back to extinction. Keep your combo as high as possible and g...;https://shared.cloudflare.steamstatic.com/store_item_assets/steam/apps/1981830/header.jpg?t=1653121852;Ahlman Games;Gäng Gäng Studios;Windows;21 May, 2022;Action, Free To Play;https://store.steampowered.com/app/1981830/MewMew__PewPew/;Unknown;;;;
MindSeize;Finland;MindSeize is a 2D Metroidvania game set in a Sci-Fi-universe. Transfer your mind to a robot and rescue your beloved one!;https://shared.cloudflare.steamstatic.com/store_item_assets/steam/apps/851280/header.jpg?t=1722176008;Kamina Dimension;Kamina Dimension;Windows;7 Feb, 2020;Action, Adventure, Indie;https://store.steampowered.com/app/851280/MindSeize/;Unknown;;;;
Moadra;Finland;Endure... Evolve... Or Die. Embrace the unknown and traverse a vast alien world riddled with bizarre creatures, deadly hazards, and grim mysteries. Seek redemption, and confront the t...;https://shared.cloudflare.steamstatic.com/store_item_assets/steam/apps/1713730/header.jpg?t=1746461447;Gloomsoft;Gloomsoft;Windows;To be announced;Action, Adventure, Indie;https://store.steampowered.com/app/1713730/Moadra/;Unknown;;;;
Monster Trucks Nitro ;Finland;Race, jump and nitroboost your way pass thrilling dynamic levels with your monster trucks. Earn medals and unlock new levels and vehicles. Lots of brilliant tracks Be fast but use als...;https://shared.cloudflare.steamstatic.com/store_item_assets/steam/apps/16620/header.jpg?t=1447351670;Redlynx Ltd;Redlynx Ltd;Windows, macOS;29 Jan, 2009;Indie, Racing, Sports;https://store.steampowered.com/app/16620/Monster_Trucks_Nitro/;Unknown;;;;
