Name;Country;Description;Thumbnail;Publisher_Names;Developer_Names;Platform;Release_Date;Genre;Steam_Link;Epic_Link;PlayStation_Link;Xbox_Link;Switch_Link;GOG_Link
Riptale;Finland;Riptale is a challenging 2D roguelike action game aiming to make sword combat be as bloody and impactful as possible. The player collects gems that allow them to execute different att...;https://shared.cloudflare.steamstatic.com/store_item_assets/steam/apps/616000/header.jpg?t=1496329105;Super God;Super God;Windows, macOS, SteamOS + Linux;27 Apr, 2017;Action, Adventure, Indie;https://store.steampowered.com/app/616000/Riptale/;Unknown;;;;
Road to Vostok;Finland;Road to Vostok is a hardcore single-player survival game set in a post-apocalyptic border zone between Finland and Russia. Survive, loot, plan and prepare your way across the Border Z...;https://shared.cloudflare.steamstatic.com/store_item_assets/steam/apps/1963610/header.jpg?t=1733006791;Road to Vostok;Road to Vostok;Windows;To be announced;Action, Early Access;https://store.steampowered.com/app/1963610/Road_to_Vostok/;Unknown;;;;
Roadside Assistance Simulator;Finland;Experience the everyday duties of a roadside assistance team in this realistic mix of simulation and management game. Direct your rescue team from your roadside assistance center. Unl...;https://shared.cloudflare.steamstatic.com/store_item_assets/steam/apps/302440/header.jpg?t=1654107409;rondomedia GmbH;Fragment Production Ltd;Windows;25 Sep, 2014;Simulation;https://store.steampowered.com/app/302440/Roadside_Assistance_Simulator/;Unknown;;;;
Rock 'n' Roll Will Never Die!;Finland;Hair metal's not dead, it just smells funny! Get your denim vest, bandana and makeup, and dive into a point-and-click adventure as a middle-aged teddy bear planning a comeback with hi...;https://shared.cloudflare.steamstatic.com/store_item_assets/steam/apps/1644080/header.jpg?t=1709882521;Instant Million;Valtteri Tavast;Windows;28 Apr, 2022;Adventure, Indie;https://store.steampowered.com/app/1644080/Rock_n_Roll_Will_Never_Die/;Unknown;;;;
Rogue Robots;Finland;A roguelite twin-stick shooter. Your mission is to defeat the cops gone mad in this action-packed game. Beware, their mission is to destroy humanity. The fate of the whole mankind is ...;https://shared.cloudflare.steamstatic.com/store_item_assets/steam/apps/1307730/header.jpg?t=1632379476;Bonus Stage Publishing;Rusto;Windows;12 Jun, 2020;Action, Indie;https://store.steampowered.com/app/1307730/Rogue_Robots/;Unknown;;;;
Rogue's Tale;Finland;Rogue's Tale is a single player turn-based dungeon crawling game.;https://shared.cloudflare.steamstatic.com/store_item_assets/steam/apps/265990/header.jpg?t=1681140330;Epixx.org;Epixx.org;Windows, macOS, SteamOS + Linux;28 Mar, 2014;Indie, RPG;https://store.steampowered.com/app/265990/Rogues_Tale/;Unknown;;;;
Rokka;Finland;"Rokka is an atmospheric Winter War simulator where you achieve a ""defensive victory"" by shooting incoming enemy soldiers and tanks. The game features adult humor.";https://shared.cloudflare.steamstatic.com/store_item_assets/steam/apps/1495830/header.jpg?t=1609197081;Jonne Ojennus;Jonne Ojennus;Windows;1 Jan, 2021;Action;https://store.steampowered.com/app/1495830/Rokka/;Unknown;;;;
Rose Seed Replica;Finland;A feel-good point-and-click lesbian love story about two women unexpectedly cast to the other end of the galaxy.;https://shared.cloudflare.steamstatic.com/store_item_assets/steam/apps/808980/header.jpg?t=1657514332;LezLiz;LezLiz;Windows, SteamOS + Linux;9 Sep, 2020;Adventure, Indie;https://store.steampowered.com/app/808980/Rose_Seed_Replica/;Unknown;;;;
Runemon;Finland;Runemon is a 1-3 player monster-taming game. Start an epic adventure with your friends, catch all the Runemon in the world, build a powerful squad and defeat your rivals in turn-based...;https://shared.cloudflare.steamstatic.com/store_item_assets/steam/apps/2763800/header.jpg?t=1712496638;Holotna;Holotna;Windows;To be announced;Adventure, Indie, RPG;https://store.steampowered.com/app/2763800/Runemon/;Unknown;;;;
Runo;Finland;A walking simulator about dear memories, overcoming obstacles, and finding your path. Experience a story inspired by finno-karelian folklore.;https://shared.cloudflare.steamstatic.com/store_item_assets/steam/apps/1642130/header.jpg?t=1644184909;Srsface Studios;runogame;Windows;5 Jul, 2021;Casual, Indie;https://store.steampowered.com/app/1642130/Runo/;Unknown;;;;
STATUS: INSANE;Finland;Escaping from a Mental Asylum Has Never Been This Much of.. Fun.;https://shared.cloudflare.steamstatic.com/store_item_assets/steam/apps/654430/header.jpg?t=1655225642;Frostbullet;Frostbullet;Windows;13 Nov, 2017;Action, Adventure, Indie, Strategy;https://store.steampowered.com/app/654430/STATUS_INSANE/;Unknown;;;;
Sabreurs - A Noble Duel;Finland;Sabreurs - A Noble Duel is a local 2-player fencing game about two noblemen settling their disagreement. Maybe someone insulted the other's mother, wronged their family or doubted the...;https://shared.cloudflare.steamstatic.com/store_item_assets/steam/apps/921840/header.jpg?t=1745491472;Kajak Games, Kajaksi Game Collective;Team Hamtrol;Windows;14 Sep, 2018;Indie, Sports;https://store.steampowered.com/app/921840/Sabreurs__A_Noble_Duel/;Unknown;;;;
Save Your Mother;Finland;Alice Andersson, a world-renowned scholar, faces a dilemma of grand proportions when her mother falls gravely ill. No traditional cures have been able to save her, not even the most u...;https://shared.cloudflare.steamstatic.com/store_item_assets/steam/apps/423740/header.jpg?t=1738872138;Tuomo's games;Tuomo Laine;Windows;3 Dec, 2015;Action, Adventure, Casual, Indie, RPG;https://store.steampowered.com/app/423740/Save_Your_Mother/;Unknown;;;;
Scatteria - Post-apocalyptic shooter;Finland;Scatteria is a 2D Platformer shooter with a big selection of different firearms and explosives. Many different post-apocalypse levels to choose to fight your battles against your enem...;https://shared.cloudflare.steamstatic.com/store_item_assets/steam/apps/926400/header.jpg?t=1669142009;Piston Media;Piston Media;Windows;8 Nov, 2019;Indie, Early Access;https://store.steampowered.com/app/926400/Scatteria__Postapocalyptic_shooter/;Unknown;;;;
Seeker: Soulrun;Finland;Run for your Soul! An epic 2D platformer adventure through mind-bending sceneries of the Abyss. Discover dark caverns, battle, or dodge your way through quests to get your exit-ticket...;https://shared.cloudflare.steamstatic.com/store_item_assets/steam/apps/1041910/header.jpg?t=1734280763;Jestercraft;Jestercraft;Windows;To be announced;Action, Adventure, Indie, Racing;https://store.steampowered.com/app/1041910/Seeker_Soulrun/;Unknown;;;;
Sektori;Finland;Sektori is an intense, fast paced twin-stick shooter infused with hard hitting techno music. A game where the high-adrenaline gameplay, visuals, and music come together to transport y...;https://shared.cloudflare.steamstatic.com/store_item_assets/steam/apps/2105620/header.jpg?t=1741587550;Kimmo Factor Oy;Kimmo Lahtinen;Windows;To be announced;Action;https://store.steampowered.com/app/2105620/Sektori/;Unknown;;;;
Shadow Bug;Finland;Leap, slash, splash! You are the overpowered ninja hero Shadow Bug! Save your home forest from the evil factory by slicing monsters to pieces.;https://shared.cloudflare.steamstatic.com/store_item_assets/steam/apps/656550/header.jpg?t=1667371712;Muro Studios;Muro Studios;Windows, macOS;21 Jul, 2017;Action, Adventure, Indie;https://store.steampowered.com/app/656550/Shadow_Bug/;Unknown;;;Unknown;Unknown
Shadowgrounds;Finland;Shadowgrounds breathes fresh air into the action genre with explosive combat sequences, an innovative weapon upgrade system, and an intriguing storyline. The adrenaline-pumping, top-d...;https://shared.cloudflare.steamstatic.com/store_item_assets/steam/apps/2500/header.jpg?t=1725011450;Frozenbyte;Frozenbyte;Windows, macOS;8 May, 2006;Action;https://store.steampowered.com/app/2500/Shadowgrounds/;Unknown;;;;
Shadowgrounds Survivor;Finland;Surviving is only half the game. The award-winning atmosphere and gameplay mechanics of the original Shadowgrounds make a triumphant return in this spin off/sequel armed with a slick ...;https://shared.cloudflare.steamstatic.com/store_item_assets/steam/apps/11200/header.jpg?t=1725011465;Frozenbyte;Frozenbyte;Windows, macOS;14 Nov, 2007;Action;https://store.steampowered.com/app/11200/Shadowgrounds_Survivor/;Unknown;;;;
Shadwen;Finland;Shadwen is a 3rd person stealth-action game where the only rule is to remain unseen. Stay hidden - or the ruthless guards will kill you on sight!;https://shared.cloudflare.steamstatic.com/store_item_assets/steam/apps/425210/header.jpg?t=1725011383;Frozenbyte;Frozenbyte;Windows, macOS, SteamOS + Linux;17 May, 2016;Action, Adventure;https://store.steampowered.com/app/425210/Shadwen/;Unknown;https://store.playstation.com/en-us/product/UP4029-CUSA04571_00-SHADWENSCEA00000/;;;
Shifter;Finland;Shifter is a third-person action game where you shift the direction of gravity, fight enemies, and run/fly/fall around a complex procedurally generated dream world. It has unique boss...;https://shared.cloudflare.steamstatic.com/store_item_assets/steam/apps/1683390/header.jpg?t=1743432091;Ilta Games;Ilta Games;Windows, SteamOS + Linux;To be announced;Action, Indie;https://store.steampowered.com/app/1683390/Shifter/;Unknown;;;;
Silence of the Sleep;Finland;You play as a man called Jacob Reeves. A man who has lost his reason to live. He throws himself into a blackness to end his misery, but instead of it being the end he wakes up without...;https://shared.cloudflare.steamstatic.com/store_item_assets/steam/apps/321870/header.jpg?t=1583133850;Jesse Makkonen;Jesse Makkonen;Windows;1 Oct, 2014;Adventure, Indie;https://store.steampowered.com/app/321870/Silence_of_the_Sleep/;Unknown;;;;
Single Malt Apocalypse;Finland;Save the sleepy mining town from a cosmic threat in this late 80s-style adventure with RPG elements. Retro to the core!;https://shared.cloudflare.steamstatic.com/store_item_assets/steam/apps/2444140/header.jpg?t=1720003338;wilpuriarts;wilpuriarts;Windows, macOS;3 Aug, 2023;Adventure, Indie, RPG;https://store.steampowered.com/app/2444140/Single_Malt_Apocalypse/;Unknown;;;;
Sixth Extinction;Finland;Sixth extinction is a dark, narrative-driven experience about extinction and discovering the true nature of yourself. Can you outwit the obstacles in your way, uncover the truth and b...;https://shared.cloudflare.steamstatic.com/store_item_assets/steam/apps/1531070/header.jpg?t=1688174388;Polte Games;Polte Games;Windows;17 Mar, 2021;Adventure, Casual, Indie;https://store.steampowered.com/app/1531070/Sixth_Extinction/;Unknown;;Unknown;;
Skábma™ - Snowfall;Finland;The rhythm of nature is in danger! You are Áilu, a young Sámi whose ordinary reindeer herding day turns into an adventure. Learn the old ways of the Noaidis, Sámi Healers. Harness ...;https://shared.cloudflare.steamstatic.com/store_item_assets/steam/apps/1665280/header.jpg?t=1744988309;PID Games, Sunsoft;Red Stage Entertainment;Windows;22 Apr, 2022;Action, Adventure, Indie;https://store.steampowered.com/app/1665280/Skbma__Snowfall/;Unknown;;;;
Sledders;Finland;Hit the backcountry in Sledders, the snowmobile simulator! Conquer deep powder with realistic physics and compete with friends in multiplayer. Are you skilled enough to reach the peak...;https://shared.cloudflare.steamstatic.com/store_item_assets/steam/apps/2486740/b525dc8fa823715d0c3f18a82953c8b8a858689a/header.jpg?t=1746021600;Bonus Stage Publishing;Hanki Games;Windows;20 Mar, 2025;Racing, Simulation, Sports;https://store.steampowered.com/app/2486740/Sledders/;Unknown;;;;
Sotidrokhima;Finland;Sotidrokhima is a story-driven top-down hack-and-slash game with first-person elements. Set in mid-13th century Finland, the eponymous folk hero must rise against oppressors from acro...;https://shared.cloudflare.steamstatic.com/store_item_assets/steam/apps/2201110/header.jpg?t=1669264268;AcroGames;AcroGames;Windows;23 Nov, 2022;Action, Adventure;https://store.steampowered.com/app/2201110/Sotidrokhima/;Unknown;;;;
Space Haven;Finland;Embark on a space voyage with your ragtag crew of civilians in search of a new home. Build spaceships tile by tile, create optimal gas conditions, manage the needs and moods of their ...;https://shared.cloudflare.steamstatic.com/store_item_assets/steam/apps/979110/header.jpg?t=1694086997;Bugbyte Ltd.;Bugbyte Ltd.;Windows, macOS, SteamOS + Linux;21 May, 2020;Indie, RPG, Simulation, Strategy, Early Access;https://store.steampowered.com/app/979110/Space_Haven/;Unknown;;;Unknown;
Sparkle 2;Finland;Challenge the darkness with your swift orb matching skills, mighty magical enchantments and earthshaking powerups. Match the orbs before they fall into the abyss and find your way thr...;https://shared.cloudflare.steamstatic.com/store_item_assets/steam/apps/370550/header.jpg?t=1572299074;10tons Ltd;10tons Ltd;Windows;1 Jun, 2015;Action, Adventure, Casual, Indie;https://store.steampowered.com/app/370550/Sparkle_2/;Unknown;;;https://www.nintendo.com/us/store/products/sparkle-2-switch/;
Sparkle Unleashed;Finland;Sparkle Unleashed is a wonderfully polished casual action puzzle game. Match like colored orbs before they fall into the abyss, unlock earthshaking powerups, and conquer more than a 1...;https://shared.cloudflare.steamstatic.com/store_item_assets/steam/apps/550450/header.jpg?t=1572299538;10tons Ltd;10tons Ltd;Windows;14 Apr, 2014;Action, Casual, Indie;https://store.steampowered.com/app/550450/Sparkle_Unleashed/;Unknown;;;https://www.nintendo.com/us/store/products/sparkle-unleashed-switch/;
Spells and Fellas;Finland;Spells and Fellas is an action-packed survival game with magic-based combat. Bring your enemies to their knees and receive more powerful spells and equipment as loot. Recruit allies t...;https://shared.cloudflare.steamstatic.com/store_item_assets/steam/apps/1372430/header.jpg?t=1712409656;Holotna;Holotna;Windows;7 Nov, 2022;Action, Indie, RPG, Strategy;https://store.steampowered.com/app/1372430/Spells_and_Fellas/;Unknown;;;;
Spellspire;Finland;Spellspire is a thrilling mashup of word game and action role playing game. Pick letters from a grid to spell words and shoot them from your wand as spells. The longer the word, the b...;https://shared.cloudflare.steamstatic.com/store_item_assets/steam/apps/626580/header.jpg?t=1630342241;10tons Ltd;10tons Ltd;Windows;23 May, 2017;RPG;https://store.steampowered.com/app/626580/Spellspire/;Unknown;https://store.playstation.com/en-us/product/UP4403-CUSA06517_00-SPELLSPIRE000000/;;Unknown;
Splittown;Finland;Splittown is a point-and-click adventure inspired by 90s classics such as Day of the Tentacle and Sam & Max Hit The Road. You are Leonard Nimby, a former top agent of the IM5, hot on ...;https://shared.cloudflare.steamstatic.com/store_item_assets/steam/apps/2117400/header.jpg?t=1739129922;All-Seeing Eye;Mats Kyyrö, Juha Keränen;Windows, macOS, SteamOS + Linux;15 Jan, 2025;Adventure, Casual, Indie, Early Access;https://store.steampowered.com/app/2117400/Splittown/;Unknown;;;;
Sproggiwood;Finland;Bring civilization to Sproggiwood, a story-driven, turn-based roguelike set in a humorous world inspired by Finnish mythology. Grow your civilization and plunder procedural dungeons w...;https://shared.cloudflare.steamstatic.com/store_item_assets/steam/apps/311720/header.jpg?t=1691167352;Freehold Games;Freehold Games;Windows, macOS, SteamOS + Linux;24 Oct, 2014;Indie, RPG, Strategy;https://store.steampowered.com/app/311720/Sproggiwood/;Unknown;;;;
Squishy the Suicidal Pig;Finland;From the creators of Hero Siege, Squishy the Suicidal Pig is a puzzle platformer with a counterintuitive goal where you play as Squishy, a pig wearing a yellow sweater who's trying to...;https://shared.cloudflare.steamstatic.com/store_item_assets/steam/apps/318430/header.jpg?t=1447363161;Panic Art Studios;Tomi Maarela, Elias Viglione;Windows, macOS;23 Oct, 2014;Adventure, Indie;https://store.steampowered.com/app/318430/Squishy_the_Suicidal_Pig/;Unknown;;;;
Star Saviors;Finland;Saviors brings the best bullet hell experience you can find on Steam. Play through 18 challenging stages in this ultimate test of tactics and reflexes.;https://shared.cloudflare.steamstatic.com/store_item_assets/steam/apps/314450/header.jpg?t=1572550455;Sharpened Edge Studios;Sharpened Edge Studios;Windows;6 May, 2016;Action, Indie, Strategy;https://store.steampowered.com/app/314450/Star_Saviors/;Unknown;;;;
Starbase;Finland;Starbase is a hybrid voxel/vertex-based space MMO with a fully destructible and infinitely expanding universe, with a focus on building and designing spaceships and stations, explorat...;https://shared.cloudflare.steamstatic.com/store_item_assets/steam/apps/454120/header.jpg?t=1730718967;Frozenbyte;Frozenbyte;Windows;29 Jul, 2021;Action, Massively Multiplayer, Simulation, Early Access;https://store.steampowered.com/app/454120/Starbase/;Unknown;;;;
Stardust Galaxy Warriors: Stellar Climax;Finland;Stardust Galaxy Warriors: Stellar Climax is a fast-paced couch co-op action shooter with SHMUP/Brawler gameplay and RPG elements. Choose your mechs, weapons & upgrades then soar throu...;https://shared.cloudflare.steamstatic.com/store_item_assets/steam/apps/389650/header.jpg?t=1690447610;Dreamloop Games;Dreamloop Games;Windows, macOS, SteamOS + Linux;10 Nov, 2015;Action, Adventure, Indie;https://store.steampowered.com/app/389650/Stardust_Galaxy_Warriors_Stellar_Climax/;Unknown;;https://www.xbox.com/en-us/games/store/Stardust-Galaxy-Warriors-Stellar-Climax/BXF6JL9FG2LL;;
Starwulf;Finland;Dive into Starwulf's unique blend of brick puzzles and space shooter action. Explore diverse planets and star systems, unlock special missions, and upgrade your ship. Can you save you...;https://shared.cloudflare.steamstatic.com/store_item_assets/steam/apps/2335110/header.jpg?t=1732730764;Arctic Apes;Arctic Apes;Windows;23 Jun, 2023;Action, Adventure, Casual, Indie;https://store.steampowered.com/app/2335110/Starwulf/;Unknown;;;;
Stilt Fella;Finland;Become the fella. Walk on the stilts.;https://shared.cloudflare.steamstatic.com/store_item_assets/steam/apps/1133590/header.jpg?t=1729860681;September Games;September Games;Windows;26 Feb, 2020;Indie, Simulation, Sports;https://store.steampowered.com/app/1133590/Stilt_Fella/;Unknown;;;;
Strangers of the Power;Finland;Strangers of The Power is a dungeon crawler RPG where the player can select between three different characters. Each character also has one unique follower.;https://shared.cloudflare.steamstatic.com/store_item_assets/steam/apps/683760/header.jpg?t=1633417241;Tuomo's games;Tuomo Laine;Windows, macOS;17 Aug, 2017;Casual, Indie, RPG;https://store.steampowered.com/app/683760/Strangers_of_the_Power/;Unknown;;;;
Streamer Mini Games Collection;Finland;This game allows the streamer's chat members to participate and interact with the game using chat commands. Mini games can be used as community games, during the streamer's breaks or ...;https://shared.cloudflare.steamstatic.com/store_item_assets/steam/apps/3345270/header.jpg?t=1738933656;IceCreamStick;IceCreamStick;Windows;2 Dec, 2024;Casual, Indie, Massively Multiplayer, Racing, Simulation;https://store.steampowered.com/app/3345270/Streamer_Mini_Games_Collection/;Unknown;;;;
Street Heat;Finland;Four-player arcade racing with a sensational synthwave soundtrack! Take to city streets in local or online mutiplayer and race across hazardous tracks. Boasting an unbelievably satisf...;https://shared.cloudflare.steamstatic.com/store_item_assets/steam/apps/744040/header.jpg?t=1741787013;PQube;Astalo Games;Windows;12 Dec, 2019;Indie, Racing;https://store.steampowered.com/app/744040/Street_Heat/;Unknown;;;;
Stuffo the Puzzle Bot;Finland;A laid-back but smart puzzle game. Stuffo is the last remaining puzzle bot stuck in a world filled with bite-sized brain-teasers. Help Stuffo to solve the mind-bending puzzles by usin...;https://shared.cloudflare.steamstatic.com/store_item_assets/steam/apps/1068460/header.jpg?t=1745471359;Hapatus Ltd;Hapatus Ltd;Windows;2 Mar, 2023;Adventure, Indie;https://store.steampowered.com/app/1068460/Stuffo_the_Puzzle_Bot/;Unknown;;;;
Stumble Guys;Finland;Ready for the chaos? Stumble Guys is a 32-player, fast-paced multiplayer party royale where players dash, jump, and fall across hilarious obstacle courses in a fun race to be the last...;https://shared.cloudflare.steamstatic.com/store_item_assets/steam/apps/1677740/header.jpg?t=1745583262;Scopely;Scopely;Windows;7 Oct, 2021;Action, Casual, Indie, Massively Multiplayer, Racing, Free To Play;https://store.steampowered.com/app/1677740/Stumble_Guys/;Unknown;https://store.playstation.com/en-us/product/UP7377-CUSA41724_00-STUMBLEGUYSPS4NA;https://www.xbox.com/en-US/games/store/stumble-guys/9n9l211hc9lq;https://www.nintendo.com/us/store/products/stumble-guys-switch/;
Super Blood Hockey;Finland;Create and manage your team in a violent, dystopic world of no-rules, fast-paced, arcade-style, ice hockey action. Adjust training regimens, control diets, administer black market pha...;https://shared.cloudflare.steamstatic.com/store_item_assets/steam/apps/532190/header.jpg?t=1729072014;Loren Lemcke;Loren Lemcke;Windows, macOS, SteamOS + Linux;17 Aug, 2017;Indie, Sports;https://store.steampowered.com/app/532190/Super_Blood_Hockey/;Unknown;https://store.playstation.com/en-us/product/UP2187-CUSA15811_00-SBHPS4SIEADIGI00/;;Unknown;
Super Dangerous Dungeons;Finland;Guide Timmy the treasure hunter through dangerous dungeons in search of the legendary treasure!;https://shared.cloudflare.steamstatic.com/store_item_assets/steam/apps/856540/header.jpg?t=1666983552;Adventure Islands;Adventure Islands;Windows, macOS;2 Jul, 2018;Action, Adventure, Indie;https://store.steampowered.com/app/856540/Super_Dangerous_Dungeons/;Unknown;;;;Unknown
Super X Chess;Finland;A chess game where you can combine your own pieces by capturing them. The combined piece moves as both pieces that got combined or with new rules when combining two pieces of same typ...;https://shared.cloudflare.steamstatic.com/store_item_assets/steam/apps/814990/header.jpg?t=1740434962;Mlyst;Mlyst;Windows, macOS, SteamOS + Linux;24 Oct, 2018;Indie, Strategy;https://store.steampowered.com/app/814990/Super_X_Chess/;Unknown;;;;
Supermoves: World of Parkour;Finland;Supermoves is the ultimate world of parkour where you run, jump and grind rails to glory! Brave the single player career mode, speedrun your way to the leaderboards or race against yo...;https://shared.cloudflare.steamstatic.com/store_item_assets/steam/apps/1959580/8d41e20cf88287ede1d1ae566da6ccc68e04a6b5/header.jpg?t=1746415147;Makea Games;Makea Games;Windows;28 Aug, 2024;Action, Casual, Indie, Racing, Sports;https://store.steampowered.com/app/1959580/Supermoves_World_of_Parkour/;Unknown;;;;
Survival Driver;Finland;Minor indie motorvehicle game, where only target is to pass different tracks, under limited time. Game contains 2 different bikes and 2 cars. So drive or die;https://shared.cloudflare.steamstatic.com/store_item_assets/steam/apps/586130/header.jpg?t=1713234544;HaDe Games;Tero Lunkka, Mikko Seppälä;Windows;15 Aug, 2017;Casual, Indie, Racing;https://store.steampowered.com/app/586130/Survival_Driver/;Unknown;;;;
Surviving the Aftermath;Finland;Survive and thrive in a post-apocalyptic future — resources are scarce, but opportunity calls! Build the ultimate disaster proof colony, protect your colonists, and restore civiliza...;https://shared.cloudflare.steamstatic.com/store_item_assets/steam/apps/684450/header.jpg?t=1726498077;Paradox Interactive;Iceflake Studios;Windows;16 Nov, 2021;Simulation, Strategy;https://store.steampowered.com/app/684450/Surviving_the_Aftermath/;Unknown;https://store.playstation.com/en-us/product/UP4139-CUSA15501_00-STA0000000000000;https://www.xbox.com/en-us/games/store/surviving-the-aftermath/9P40CJ0QJRHH;;
Taivas;Finland;Taivas is a mysterious action roguelite set in a world of myth, and a time of magic. The destiny of a Canidae Kingdom rests on the shoulders of a young fox alike boy. His name… Joak...;https://shared.cloudflare.steamstatic.com/store_item_assets/steam/apps/1388690/header.jpg?t=1712237689;JTS Development;F-Games;Windows;19 Nov, 2020;Adventure, Casual, Indie, Early Access;https://store.steampowered.com/app/1388690/Taivas/;Unknown;;;Unknown;
Taphouse VR;Finland;In Taphouse VR, you are the bartender! Run your own taphouse, give drunk dwarves their fill of delicious ale or drench the bunch by mixing delicious cocktails! Everything around the c...;https://shared.cloudflare.steamstatic.com/store_item_assets/steam/apps/591680/header.jpg?t=1726779053;Catland, Adjective Animal;Catland;Windows;27 Sep, 2018;Indie, Simulation;https://store.steampowered.com/app/591680/Taphouse_VR/;Unknown;;;;
Technocide;Finland;Technocide is a vertical scrolling shoot 'em up with a heavy emphasis on player weapons and abilities. You must not let enemies past you and reach your mothership! You will need quick...;https://shared.cloudflare.steamstatic.com/store_item_assets/steam/apps/2543560/header.jpg?t=1729957343;Dextrous Games;Dextrous Games;Windows;26 Feb, 2024;Action, Indie;https://store.steampowered.com/app/2543560/Technocide/;Unknown;;;;
Tennis in the Face;Finland;Shoot tennis balls at your adversaries and save the city from the evil Explodz Inc. This is no Wimbledon, this is Tennis in the Face! Get ready for some hilarious ragdoll-smashing bal...;https://shared.cloudflare.steamstatic.com/store_item_assets/steam/apps/394290/header.jpg?t=1521467002;10tons Ltd;10tons Ltd;Windows;18 Nov, 2015;Action, Casual, Indie, Sports;https://store.steampowered.com/app/394290/Tennis_in_the_Face/;Unknown;;https://www.xbox.com/en-us/games/store/Tennis-in-the-Face/C5JFNCNK58CT;https://www.nintendo.com/us/store/products/tennis-in-the-face-switch/;
