Name;Country;Description;Thumbnail;Publisher_Names;Developer_Names;Platform;Release_Date;Genre;Steam_Link;Epic_Link;Playstation_Link;Xbox_Link;Switch_Link;GOG_Link
Kriegsfront Tactics;Indonesia;Kriegsfront Tactics is a procedural turn-based mecha tactics RPG set in alternate 1970s during an era of conflict in Southeast Asia where you'll play as a commander of a mecha squad s...;https://shared.cloudflare.steamstatic.com/store_item_assets/steam/apps/1561740/header.jpg?t=1744275735;Toge Productions;Toge Productions;Windows;To be announced;Indie, Simulation, Strategy;https://store.steampowered.com/app/1561740/Kriegsfront_Tactics/;Unknown;Unknown;Unknown;Unknown;Unknown
Kriegsfront Battlescaper - Diorama Editor;Indonesia;Create mechs and battlefield dioramas using built-in photo mode, mecha builder, and level editor. Based on developer tools for our upcoming mecha turn-based tactics game, Kriegsfront ...;https://shared.cloudflare.steamstatic.com/store_item_assets/steam/apps/1703930/header.jpg?t=1725008749;Toge Productions;Toge Productions;Windows;To be announced;Casual, Indie, Simulation, Strategy, Free To Play;https://store.steampowered.com/app/1703930/Kriegsfront_Battlescaper__Diorama_Editor/;Unknown;Unknown;Unknown;Unknown;Unknown
How to Sing to Open Your Heart Remastered;Indonesia;"The cute fantasy visual novel, ""How to Sing to Open Your Heart"" returns as a remastered version. Princess Myana, who loves to sing, finally comes to Eroolia. A lot of people, like the...";https://shared.cloudflare.steamstatic.com/store_item_assets/steam/apps/1815820/header.jpg?t=1740474197;ROSEVERTE;ROSEVERTE;Windows, macOS, SteamOS + Linux;To be announced;Adventure, Casual, Indie;https://store.steampowered.com/app/1815820/How_to_Sing_to_Open_Your_Heart_Remastered/;Unknown;Unknown;Unknown;Unknown;Unknown
How to Fool a Liar King Remastered;Indonesia;"The cute fantasy visual novel, ""How to Fool a Liar King"" returns as a remastered version. Regina, a girl who loves cats, a bit forgetful but confident in her strength, suddenly appear...";https://shared.cloudflare.steamstatic.com/store_item_assets/steam/apps/1815800/header.jpg?t=1740470682;ROSEVERTE;ROSEVERTE;Windows, macOS, SteamOS + Linux;To be announced;Adventure, Indie;https://store.steampowered.com/app/1815800/How_to_Fool_a_Liar_King_Remastered/;Unknown;Unknown;Unknown;Unknown;Unknown
How to Take Off Your Mask Remastered;Indonesia;"The cute fantasy visual novel, ""How to Take Off Your Mask"" returns as a remastered version. One day, Lilia wakes up as a girl with cat ears and a tail! How could this happen, and how ...";https://shared.cloudflare.steamstatic.com/store_item_assets/steam/apps/1815750/header.jpg?t=1740469898;ROSEVERTE;ROSEVERTE;Windows, macOS, SteamOS + Linux;To be announced;Adventure, Casual, Indie;https://store.steampowered.com/app/1815750/How_to_Take_Off_Your_Mask_Remastered/;Unknown;Unknown;Unknown;Unknown;Unknown
Lastone: Behind the Choice;Indonesia;A point & click visual novel puzzle game where players fight against other characters in a game. Discover and progress stories of playable characters from varied backgrounds by winnin...;https://shared.cloudflare.steamstatic.com/store_item_assets/steam/apps/1844990/header.jpg?t=1723692513;Dragon Emperors;Dragon Emperors, Great Conspiracy Theory;Windows;To be announced;Casual, Indie;https://store.steampowered.com/app/1844990/Lastone_Behind_the_Choice/;Unknown;Unknown;Unknown;Unknown;Unknown
Attack on Toys;Indonesia;Relive Your Childhood Toys comes to life! Build your Army Toys, make battle scenario, watch the Toys battling each other, and customize your play with Attack on Toys Toy Box. Command ...;https://shared.cloudflare.steamstatic.com/store_item_assets/steam/apps/1269690/header.jpg?t=1744435648;N7T-GAMES;N7T-GAMES;Windows;To be announced;Action, Adventure, Casual, Indie, RPG, Simulation, Strategy, Early Access;https://store.steampowered.com/app/1269690/Attack_on_Toys/;Unknown;Unknown;Unknown;Unknown;Unknown
Puputan Legend VR;Indonesia;Puputan Legend VR Patih Kebo Iwa - is a custom multiplayer online battle arena game. Inspired by the history of the archipelago, this game has a puputan war theme with the icon Patih ...;https://shared.cloudflare.steamstatic.com/store_item_assets/steam/apps/1829000/header.jpg?t=1679442985;Digital Lontar Nusantara;Digital Lontar Nusantara;Windows;To be announced;Action, Indie, Strategy;https://store.steampowered.com/app/1829000/Puputan_Legend_VR/;Unknown;Unknown;Unknown;Unknown;Unknown
Gigapocalypse;Indonesia;Become a customizable giant monster with manifold skills in Gigapocalypse, inspired by classical Kaijū movies such as “Godzilla” and “King Kong” and the game classic “Rampage”.;https://shared.cloudflare.steamstatic.com/store_item_assets/steam/apps/1543240/header.jpg?t=1717675142;Headup;Goody Gameworks;Windows;To be announced;Action, Casual, Indie;https://store.steampowered.com/app/1543240/Gigapocalypse/;Unknown;Unknown;Unknown;Unknown;Unknown
Soul of Giga;Indonesia;Invoke and build your Giga team from various element and size, blast off the evil empire, and be the destined one. Explore the land of Giga in this pixel art turn-based battle adventu...;https://shared.cloudflare.steamstatic.com/store_item_assets/steam/apps/1052970/header.jpg?t=1614989879;KPL;Goody Pundit;Windows;To be announced;Action, Adventure, Casual, RPG, Strategy;https://store.steampowered.com/app/1052970/Soul_of_Giga/;Unknown;Unknown;Unknown;Unknown;Unknown
Transcendence Legacy - Voidswept;Indonesia;Uncover the truth behind a world plagued by monstrosities. Traverse through mysterious ruins to search for the answer with dependable allies at your side.;https://shared.cloudflare.steamstatic.com/store_item_assets/steam/apps/1814570/header.jpg?t=1657896013;YSY Softworks;Xurzerth;Windows;To be announced;Adventure, RPG;https://store.steampowered.com/app/1814570/Transcendence_Legacy__Voidswept/;Unknown;Unknown;Unknown;Unknown;Unknown
K-pop Idol Stories: Road to Debut;Indonesia;A love letter to the thrilling world of K-pop! In this life simulator, you're the manager responsible for scouting talent, organising schedules, creating budgets, planning social medi...;https://shared.cloudflare.steamstatic.com/store_item_assets/steam/apps/1662160/header.jpg?t=1741789261;PQube;Wisageni Studio;Windows;To be announced;Casual, Indie, RPG, Simulation;https://store.steampowered.com/app/1662160/Kpop_Idol_Stories_Road_to_Debut/;Unknown;Unknown;Unknown;Unknown;Unknown
Unveiled;Indonesia;Unveiled is a visual novel game with a unique twist of having a turn based strategy added in it. The story is taken from the super popular Isekai genre from Japan, about a boy who die...;https://shared.cloudflare.steamstatic.com/store_item_assets/steam/apps/1772070/header.jpg?t=1636831118;AnotherIndieGameDev;AnotherIndieGameDev;Windows, macOS, SteamOS + Linux;To be announced;Casual, Indie, Strategy;https://store.steampowered.com/app/1772070/Unveiled/;Unknown;Unknown;Unknown;Unknown;Unknown
Reach for an Angel;Indonesia;When youth shine brightly, do your best to fulfill your romantic wish: Reach for the feelings of your loved one. Choose one of the three female protagonist to be your beloved.;https://shared.cloudflare.steamstatic.com/store_item_assets/steam/apps/1807740/header.jpg?t=1725082782;YSY Softworks, Inova Forge;Platomenti, KPP Entertainment;Windows;To be announced;Adventure, Simulation;https://store.steampowered.com/app/1807740/Reach_for_an_Angel/;Unknown;Unknown;Unknown;Unknown;Unknown
Hello Goodboy;Indonesia;A lost soul and his dog set out on an otherworldly trek through the afterlife in this wholesome, non-linear adventure game. Pass into the world beyond, perform acts of kindness for ot...;https://shared.cloudflare.steamstatic.com/store_item_assets/steam/apps/1789090/header.jpg?t=1733361253;indie.io;Rolling Glory Jam;Windows;To be announced;Adventure, Casual, Indie;https://store.steampowered.com/app/1789090/Hello_Goodboy/;Unknown;Unknown;Unknown;Unknown;Unknown
Legends of Crystal;Indonesia;Legends of Crystal is a turn-based RPG that blends two cultures, namely Nusantara and Japan. It tells the story of a child chosen by a god who must save a crystal from evil. The cryst...;https://shared.cloudflare.steamstatic.com/store_item_assets/steam/apps/1765090/header.jpg?t=1727497790;GingerSun Games;GingerSun Games;Windows;To be announced;Action, Adventure, Indie, RPG;https://store.steampowered.com/app/1765090/Legends_of_Crystal/;Unknown;Unknown;Unknown;Unknown;Unknown
Tanasurga;Indonesia;Tanasurga is an Narrative driven RPG where you play as mecha mercenaries in alternate WW2 setting. Build your own mecha, recruit and lead a team of pilots with different characteristi...;https://shared.cloudflare.steamstatic.com/store_item_assets/steam/apps/1442090/header.jpg?t=1692432626;Rainman Studios, Niji Games;Rainman Studios, Niji Games;Windows;To be announced;Indie, RPG, Strategy;https://store.steampowered.com/app/1442090/Tanasurga/;Unknown;Unknown;Unknown;Unknown;Unknown
Fragmented Memories - Arc One;Indonesia;Immerse yourself in the Psychological horror adventure of James Charouz on his way to find his missing wife and uncover the dark secret of his hometown.;https://shared.cloudflare.steamstatic.com/store_item_assets/steam/apps/1750170/header.jpg?t=1668890819;YSY Softworks;Platomenti;Windows, macOS;To be announced;Adventure;https://store.steampowered.com/app/1750170/Fragmented_Memories__Arc_One/;Unknown;Unknown;Unknown;Unknown;Unknown
Here Comes The Hero;Indonesia;1 on 1 action roguelike game where you fight through a randomly generated path filled with villains and events until you defeat the final boss.;https://shared.cloudflare.steamstatic.com/store_item_assets/steam/apps/1752420/header.jpg?t=1727438590;GameChanger Studio;GameChanger Studio;Windows;To be announced;Action, Indie;https://store.steampowered.com/app/1752420/Here_Comes_The_Hero/;Unknown;Unknown;Unknown;Unknown;Unknown
Project UNSEEK;Indonesia;Project UNSEEK is a 2v6 class-based asymmetrical online multiplayer horror game inspired by 80s slasher horror movies, SCP urban legend, and Science Fiction, where you compete against...;https://shared.cloudflare.steamstatic.com/store_item_assets/steam/apps/1758470/header.jpg?t=1729519964;Arsanesia;Arsanesia;Windows, macOS;To be announced;Action, Casual;https://store.steampowered.com/app/1758470/Project_UNSEEK/;Unknown;Unknown;Unknown;Unknown;Unknown
Loading Story;Indonesia;A short story about loading, I guess. Play as Memu@ as she explores the cyberpunk(ish) little town and interacts with its inhabitants.;https://shared.cloudflare.steamstatic.com/store_item_assets/steam/apps/1721980/header.jpg?t=1631319149;Potatodog;Potatodog, Simpleton, Clay Game Studio;Windows;To be announced;Adventure, Casual, Indie;https://store.steampowered.com/app/1721980/Loading_Story/;Unknown;Unknown;Unknown;Unknown;Unknown
Buramato;Indonesia;Explore a vast fast-paced Action RPG inspired by traditional Bornean mythology. Slay monsters with stylish combos and discover the Old Lords’ cursed lands to unravel the secrets beh...;https://shared.cloudflare.steamstatic.com/store_item_assets/steam/apps/1726560/header.jpg?t=1739595863;OZYGAMES;OZYGAMES;Windows;To be announced;Action, Adventure, Indie, RPG;https://store.steampowered.com/app/1726560/Buramato/;Unknown;Unknown;Unknown;Unknown;Unknown
Another Path;Indonesia;A single-player puzzle exploration game sets in a desolated land in the mysterious world. Switch between a boy and a canine to explore this obscure island, and discover its mystical h...;https://shared.cloudflare.steamstatic.com/store_item_assets/steam/apps/1657620/header.jpg?t=1636902817;-;MyHand Studio;Windows;To be announced;Adventure, Indie;https://store.steampowered.com/app/1657620/Another_Path/;Unknown;Unknown;Unknown;Unknown;Unknown
TOXA : Mystical Cloning Powers;Indonesia;TOXΔ is the name for the spirit in the land of the gods. In their zeal to build and maintain their country. The land that is situated on a high cloud is approaching the sky. This lan...;https://shared.cloudflare.steamstatic.com/store_item_assets/steam/apps/1599830/header.jpg?t=1727371372;PMA Studio;PMA Studio;Windows;To be announced;Action, Adventure, Indie, RPG;https://store.steampowered.com/app/1599830/TOXA__Mystical_Cloning_Powers/;Unknown;Unknown;Unknown;Unknown;Unknown
StellaGale: The Trials Of Faith;Indonesia;StellaGale is a 2D hack and slash side-scroller set in the steampunk Roman Empire. Play as Stella the gladiator with her spirit-brother Gale to pave the way to be the strongest conten...;https://shared.cloudflare.steamstatic.com/store_item_assets/steam/apps/1538710/header.jpg?t=1737049441;Outpost Games Inc.;Extra life Entertaiment, Vifth Floor;Windows;To be announced;Action, Adventure, Early Access;https://store.steampowered.com/app/1538710/StellaGale_The_Trials_Of_Faith/;Unknown;Unknown;Unknown;Unknown;Unknown
Coffee Talk Episode 2: Hibiscus & Butterfly;Indonesia;Dust off your coffee machine and prepare your warmest smile to meet your customers again in the second episode of the much loved coffee brewing and heart-to-heart talking simulator, C...;https://shared.cloudflare.steamstatic.com/store_item_assets/steam/apps/1663220/header.jpg?t=1737345097;Toge Productions;Toge Productions;Windows, macOS;To be announced;Adventure, Casual, Indie, Simulation;https://store.steampowered.com/app/1663220/Coffee_Talk_Episode_2_Hibiscus__Butterfly/;Unknown;Unknown;Unknown;Unknown;Unknown
Grammarian Ltd;Indonesia;Welcome to 2099, where all communication must use correct grammar. Use your grammar and management skills to work your way in biggest grammar validation agency in Grammarian Ltd.;https://shared.cloudflare.steamstatic.com/store_item_assets/steam/apps/1578880/header.jpg?t=1740744788;Algorocks;Algorocks, Simpleton;Windows;To be announced;Adventure, Casual, Indie, Simulation;https://store.steampowered.com/app/1578880/Grammarian_Ltd/;Unknown;Unknown;Unknown;Unknown;Unknown
Perang Laut - Maritime Warfare;Indonesia;Perang Laut Maritime Warfare is a historical real time strategy set on early modern age(15th-18th century) in Indonesia archipelago. Lot of kingdoms rise as spices trading booming and...;https://shared.cloudflare.steamstatic.com/store_item_assets/steam/apps/1722410/header.jpg?t=1677436093;Sengkala Dev;Sengkala Dev;Windows;To be announced;Indie, Strategy;https://store.steampowered.com/app/1722410/Perang_Laut__Maritime_Warfare/;Unknown;Unknown;Unknown;Unknown;Unknown
Biwar Legend of Dragon Slayer;Indonesia;Biwar Legend of Dragon Slayer is an ancient legend that tells the story of a brave warrior who rose up to battle a fierce dragon and ultimately became the Dragon Slayer. It is a tale ...;https://shared.cloudflare.steamstatic.com/store_item_assets/steam/apps/1680800/header.jpg?t=1675324547;-;Devata Game Production;Windows;To be announced;Action, Adventure, Indie;https://store.steampowered.com/app/1680800/Biwar_Legend_of_Dragon_Slayer/;Unknown;Unknown;Unknown;Unknown;Unknown
Great Marble Adventure;Indonesia;Guide the marble in the journey through more than 50 thematic stages across three difficulties: Easy, Normal, and Hard, with various challenges in Great Marble Adventure, an unforgett...;https://shared.cloudflare.steamstatic.com/store_item_assets/steam/apps/1711520/header.jpg?t=1696329857;NaCl586, Extra life Entertaiment;NaCl586, Extra life Entertaiment;Windows;To be announced;Action, Casual, Indie, Racing, Strategy;https://store.steampowered.com/app/1711520/Great_Marble_Adventure/;Unknown;Unknown;Unknown;Unknown;Unknown
Hell Blasters;Indonesia;Hell Blasters is a bullet hell shoot 'em up where you can blast the bullet hell away!;https://shared.cloudflare.steamstatic.com/store_item_assets/steam/apps/1696200/header.jpg?t=1728027417;PlayShift Games;PlayShift Games;Windows;To be announced;Action, Indie;https://store.steampowered.com/app/1696200/Hell_Blasters/;Unknown;Unknown;Unknown;Unknown;Unknown
Tower of Guardian;Indonesia;"Tower of Guardian , is 2D Fantasy Platformer RPG, tells about adventure of a wizard princess from Kingdom called ""Aluria"" exploring The Tower of Darkness to find clue about mysterious...";https://shared.cloudflare.steamstatic.com/store_item_assets/steam/apps/1657100/header.jpg?t=1727628471;Mostdeep Games;Mostdeep Games;Windows;To be announced;Adventure, Indie, RPG, Early Access;https://store.steampowered.com/app/1657100/Tower_of_Guardian/;Unknown;Unknown;Unknown;Unknown;Unknown
ConnecTank;Indonesia;ConnecTank is an action game for one to four players where you step inside a big honking tank. Link conveyor belts together, craft ammo, and put out fires as you battle rival tanks to...;https://shared.cloudflare.steamstatic.com/store_item_assets/steam/apps/1597200/header.jpg?t=1633719952;Natsume Inc.;YummyYummyTummy, Tamatin Entertainment;Windows;To be announced;Action, Casual, Strategy;https://store.steampowered.com/app/1597200/ConnecTank/;Unknown;Unknown;Unknown;Unknown;Unknown
Grey Lucidity - Horror Visual Novel;Indonesia;Scary adventure horror with an element of visual novel game about escaping from the cursed town. Run to survive! But be wary, you wouldn't know what lies ahead.;https://shared.cloudflare.steamstatic.com/store_item_assets/steam/apps/1642460/header.jpg?t=1628273493;Miracle Gates Entertainment;Miracle Gates Entertainment;Windows;To be announced;Action, Casual;https://store.steampowered.com/app/1642460/Grey_Lucidity__Horror_Visual_Novel/;Unknown;Unknown;Unknown;Unknown;Unknown
Project to Escape;Indonesia;Project to escape is suitable for you to play with friends! This is a multiplayer game with up to 10 players support. In this game, your goal is to escape the area but someone will tr...;https://shared.cloudflare.steamstatic.com/store_item_assets/steam/apps/1612220/header.jpg?t=1636562551;HarlanBOT Studio;HarlanBOT Studio;Windows;To be announced;Action, Adventure, Casual, Indie, Massively Multiplayer, Strategy;https://store.steampowered.com/app/1612220/Project_to_Escape/;Unknown;Unknown;Unknown;Unknown;Unknown
Babol the Walking Box;Indonesia;Begin your adventure with your new friends! Babol the Walking Box Yes, it's game about Box that can walk, nope, just kidding hahaha UwU Explore the amazing world of box, from the wild...;https://shared.cloudflare.steamstatic.com/store_item_assets/steam/apps/1605930/header.jpg?t=1624642634;Gamecom Team;Gamecom Team;Windows;To be announced;Adventure, Indie;https://store.steampowered.com/app/1605930/Babol_the_Walking_Box/;Unknown;Unknown;Unknown;Unknown;Unknown
Afterlove EP;Indonesia;From the creator of Coffee Talk and What Comes After, comes a slice-of-life adventure set in modern Jakarta about love, loss and finding your own way forward. Step into the shoes of R...;https://shared.cloudflare.steamstatic.com/store_item_assets/steam/apps/1599780/header.jpg?t=1739615553;Fellow Traveller;Pikselnesia;Windows;To be announced;Adventure, Casual, Indie;https://store.steampowered.com/app/1599780/Afterlove_EP/;Unknown;Unknown;Unknown;Unknown;Unknown
Ann;Indonesia;Ann, an art student finds herself trapped in the school when she accidentally broke one of the school's rules. With the help of the school's security guard, help Ann navigate her way ...;https://shared.cloudflare.steamstatic.com/store_item_assets/steam/apps/1511270/header.jpg?t=1667040658;Rong Rong;Rong Rong;Windows;To be announced;Free To Play, Indie;https://store.steampowered.com/app/1511270/Ann/;Unknown;Unknown;Unknown;Unknown;Unknown
Valthirian Arc: Hero School Story 2;Indonesia;Not all heroes are born, many are forged by the finest Hero School – yours. Take command of the faculty, nurture a unique and ever-growing roster of students, and earn your place am...;https://shared.cloudflare.steamstatic.com/store_item_assets/steam/apps/1453640/header.jpg?t=1726725091;PQube;Agate;Windows;To be announced;RPG, Simulation, Strategy;https://store.steampowered.com/app/1453640/Valthirian_Arc_Hero_School_Story_2/;Unknown;Unknown;Unknown;Unknown;Unknown
LIRE;Indonesia;"Reveal the story behind the haunted mansion while looking for Sebastian. LIRE is a survival horror video game inspired by old horror RPG maker games ""IB"" and ""The Witch's House"".";https://shared.cloudflare.steamstatic.com/store_item_assets/steam/apps/1554160/header.jpg?t=1666984018;ZheroIsland;ZheroIsland;Windows;To be announced;Adventure, Indie;https://store.steampowered.com/app/1554160/LIRE/;Unknown;Unknown;Unknown;Unknown;Unknown
Startup Panic;Indonesia;Quit your job and build an exciting startup! Survive the tech bubble, compete with rival CEOs and expand your office from bedroom programmer up to the heights of global corporate sabo...;https://shared.cloudflare.steamstatic.com/store_item_assets/steam/apps/1045610/header.jpg?t=1727200932;tinyBuild;Algorocks;Windows;To be announced;Casual, Indie, Simulation, Strategy;https://store.steampowered.com/app/1045610/Startup_Panic/;Unknown;Unknown;Unknown;Unknown;Unknown
Troublemaker;Indonesia;Grab a backpack, boxing tape, and focus on what high school is all about: Beating the ever loving crap out of one another! Troublemaker blends favorite action-adventure-beat-'em-up el...;https://shared.cloudflare.steamstatic.com/store_item_assets/steam/apps/1498740/header.jpg?t=1744656859;indie.io;Gamecom Team;Windows;To be announced;Action, Adventure, Indie;https://store.steampowered.com/app/1498740/Troublemaker/;Unknown;Unknown;Unknown;Unknown;Unknown
Peaceful Soul;Indonesia;Peaceful Soul is a Social Life Simulation. In this game you can interact with villagers, building friendships, finding love, take part in interesting festivals.;https://shared.cloudflare.steamstatic.com/store_item_assets/steam/apps/1414610/header.jpg?t=1638263032;AWSUM! SINDIECATE by Inspirnasoft;Radish Developer;Windows;To be announced;Indie, RPG, Simulation, Early Access;https://store.steampowered.com/app/1414610/Peaceful_Soul/;Unknown;Unknown;Unknown;Unknown;Unknown
Dato of Srivijaya;Indonesia;Dato of Srivijaya is Historical RTS about rise of Srivijaya Empire in 7th century from unknown power in South Sumatra’s river to strong maritime power in Asia for almost 3.5 centuri...;https://shared.cloudflare.steamstatic.com/store_item_assets/steam/apps/1454410/header.jpg?t=1677051991;Sengkala Dev;Sengkala Dev;Windows;To be announced;Free To Play, Indie, Simulation, Strategy;https://store.steampowered.com/app/1454410/Dato_of_Srivijaya/;Unknown;Unknown;Unknown;Unknown;Unknown
Enthrean Radiance : The First Strike;Indonesia;Enthrean Radiance : The First Strike is a 2D action-RPG that invokes the feeling of classic Japanese games. Help Millia and Razh to save the world of Enthrean from chaos!;https://shared.cloudflare.steamstatic.com/store_item_assets/steam/apps/1455460/header.jpg?t=1626836991;Eggion;Enthrean Guardian, Eggion, stellarNull;Windows;To be announced;Action, Indie, RPG;https://store.steampowered.com/app/1455460/Enthrean_Radiance__The_First_Strike/;Unknown;Unknown;Unknown;Unknown;Unknown
Enthrean Radiance : Prologue;Indonesia;"This is the prologue chapter of ""Enthrean Radiance : The First Strike"", an upcoming 2D action-RPG that invokes the feeling of classic Japanese games. Help Millia and Razh to save the ...";https://shared.cloudflare.steamstatic.com/store_item_assets/steam/apps/1440810/header.jpg?t=1603948143;Eggion;Enthrean Guardian, Eggion, stellarNull;Windows;To be announced;Action, Adventure, Indie, RPG;https://store.steampowered.com/app/1440810/Enthrean_Radiance__Prologue/;Unknown;Unknown;Unknown;Unknown;Unknown
What Comes After;Indonesia;What Comes After is a side-scrolling adventure and a short heartwarming story about learning how to love yourself. Help Vivi in her journey on the train to the afterlife and back.;https://shared.cloudflare.steamstatic.com/store_item_assets/steam/apps/1421760/header.jpg?t=1726559591;Rolling Glory Jam;Pikselnesia, Rolling Glory Jam;Windows, macOS;To be announced;Adventure, Casual, Indie;https://store.steampowered.com/app/1421760/What_Comes_After/;Unknown;Unknown;Unknown;Unknown;Unknown
Escape from Naraka;Indonesia;Escape from Naraka is a hellish first-person action platformer. Journey to another realm to save your beloved from an evil demon named Rangda the Leyak Queen and platform your way thr...;https://shared.cloudflare.steamstatic.com/store_item_assets/steam/apps/1390670/header.jpg?t=1717687543;Headup;XeloGames;Windows;To be announced;Action, Adventure, Indie;https://store.steampowered.com/app/1390670/Escape_from_Naraka/;Unknown;Unknown;Unknown;Unknown;Unknown
Gravitators;Indonesia;Gravitators is a twin stick shooter game where you pilot ships and complete mission objectives to secure the future of humankind. Defend the Earth and travel through the galaxy to rep...;https://shared.cloudflare.steamstatic.com/store_item_assets/steam/apps/1321890/header.jpg?t=1735918644;Insular Games;Insular Games;Windows;To be announced;Action, Indie;https://store.steampowered.com/app/1321890/Gravitators/;Unknown;Unknown;Unknown;Unknown;Unknown
Potion Permit;Indonesia;Moonbury's residents need healing, and you're the best chemist around! With your trusty tools, a brewing cauldron, and a canine companion at your side, you'll need to diagnose symptom...;https://shared.cloudflare.steamstatic.com/store_item_assets/steam/apps/1337760/header.jpg?t=1741787991;PQube;MassHive Media;Windows, macOS;To be announced;Action, Adventure, Casual, RPG;https://store.steampowered.com/app/1337760/Potion_Permit/;Unknown;Unknown;Unknown;Unknown;Unknown
Knight vs Giant: The Broken Excalibur;Indonesia;Step into the greaves of King Arthur in this fantasy action roguelite and wield the Broken Excalibur in a quest to rescue the scattered citizens of Camelot, vanquish the calamitous Vo...;https://shared.cloudflare.steamstatic.com/store_item_assets/steam/apps/715680/header.jpg?t=1741788287;PQube;Gambir Studio;Windows, macOS;To be announced;Action, Adventure;https://store.steampowered.com/app/715680/Knight_vs_Giant_The_Broken_Excalibur/;Unknown;Unknown;Unknown;Unknown;Unknown
