Name;Country;Description;Thumbnail;Publisher_Names;Developer_Names;Platform;Release_Date;Genre;Steam_Link;Epic_Link;Playstation_Link;Xbox_Link;Switch_Link;GOG_Link
My Lovely Daughter;Indonesia;My Lovely Daughter is an alchemist simulator that explores the depth of a father’s grief and how far he will go to resurrect his daughter. Contains dark and disturbing subject matte...;https://shared.cloudflare.steamstatic.com/store_item_assets/steam/apps/580170/header.jpg?t=1726811396;Toge Productions, Neon Doctrine;GameChanger Studio;Windows, macOS, SteamOS + Linux;To be announced;Adventure, Indie, Simulation;https://store.steampowered.com/app/580170/My_Lovely_Daughter/;Unknown;Unknown;Unknown;Unknown;Unknown
Orbiz;Indonesia;Orbiz is a local coop multiplayer game with rogue-like elements. The primary objective of the game is to engage in three levels of combat with various zombies on each spherical world ...;https://shared.cloudflare.steamstatic.com/store_item_assets/steam/apps/572480/header.jpg?t=1568689939;Anoman Studio;Anoman Studio;Windows, macOS, SteamOS + Linux;To be announced;Action, Adventure, Casual, Indie;https://store.steampowered.com/app/572480/Orbiz/;Unknown;Unknown;Unknown;Unknown;Unknown
Multishop Tycoon Deluxe;Indonesia;A simplified business model of food selling shop network. Do your best to become the great businessman in the city. Enjoy the game!;https://shared.cloudflare.steamstatic.com/store_item_assets/steam/apps/568780/header.jpg?t=1731307743;Maulidan Games;Maulidan Games;Windows;To be announced;Indie, Simulation, Strategy;https://store.steampowered.com/app/568780/Multishop_Tycoon_Deluxe/;Unknown;Unknown;Unknown;Unknown;Unknown
EURGAVA™: Fight for Haaria;Indonesia;EURGAVA™ - Fight for Haaria, a reaction-based combat rpg where you struggle to rebuild your broken village, learn the fate of your home country, and restore its order. Get ready!;https://shared.cloudflare.steamstatic.com/store_item_assets/steam/apps/559350/header.jpg?t=1624915672;Ibrahim Indra Baskara;Ibrahim Indra Baskara;Windows;To be announced;Casual, Indie, RPG, Strategy;https://store.steampowered.com/app/559350/EURGAVA_Fight_for_Haaria/;Unknown;Unknown;Unknown;Unknown;Unknown
LEGRAND LEGACY: Tale of the Fatebounds;Indonesia;Join the Fatebounds as they travel the world of Legrand in a desperate attempt to stop the Mugna Feud, a war of unparalleled savagery, and uncover the sinister forces behind it!;https://shared.cloudflare.steamstatic.com/store_item_assets/steam/apps/556740/header.jpg?t=1667205501;SEMISOFT;SEMISOFT;Windows;To be announced;Action, Adventure, Indie, RPG;https://store.steampowered.com/app/556740/LEGRAND_LEGACY_Tale_of_the_Fatebounds/;Unknown;Unknown;Unknown;Unknown;Unknown
NSFW ~ Not a Simulator For Working;Indonesia;NSFW or Not a Simulator For Working is a casual simulator game where you try not to work anytime you can. Be careful of your snitching co-worker and strict boss. If you get caught, yo...;https://shared.cloudflare.steamstatic.com/store_item_assets/steam/apps/545030/header.jpg?t=1727438494;GameChanger Studio;GameChanger Studio;Windows, macOS, SteamOS + Linux;To be announced;Casual, Indie, Simulation;https://store.steampowered.com/app/545030/NSFW__Not_a_Simulator_For_Working/;Unknown;Unknown;Unknown;Unknown;Unknown
Si Kancil : The Adventurous Mouse Deer;Indonesia;Once upon a time, there is a little Mouse Deer, his name is Kancil. Kancil live in shady forest far away from the city. Actually that forest is a peace place for the animals before th...;https://shared.cloudflare.steamstatic.com/store_item_assets/steam/apps/530530/header.jpg?t=1478616187;Binarystudio 54;Binarystudio 54;Windows;To be announced;Adventure, Casual, Indie;https://store.steampowered.com/app/530530/Si_Kancil__The_Adventurous_Mouse_Deer/;Unknown;Unknown;Unknown;Unknown;Unknown
Zombo Buster Rising;Indonesia;Shoot zombies from terrace like a boss! Zombo Buster Rising Remastered brings you a nostalgic experience of classic 2D side shooting-defense in enhanced build right from your Steam li...;https://shared.cloudflare.steamstatic.com/store_item_assets/steam/apps/518730/header.jpg?t=1572942348;FIREBEAST;FIREBEAST;Windows, macOS, SteamOS + Linux;To be announced;Action, Indie;https://store.steampowered.com/app/518730/Zombo_Buster_Rising/;Unknown;Unknown;Unknown;Unknown;Unknown
Bad Pad;Indonesia;Bad Pad is a metal pumped metroidvania platfomer about a gamepad's buttons who came to life. Oozing with original music and storytelling songs, all in the spirit of metal. Precision p...;https://shared.cloudflare.steamstatic.com/store_item_assets/steam/apps/517210/header.jpg?t=1726253005;Headbang Games;Headbang Games, Oray Studios;Windows, SteamOS + Linux;To be announced;Action, Indie;https://store.steampowered.com/app/517210/Bad_Pad/;Unknown;Unknown;Unknown;Unknown;Unknown
Adventure Of Thieves;Indonesia;Platformer Lovers !!! Dare to accept the challenge? Player vs Player addicted? Train your skills in single player and join in PvP arena.;https://shared.cloudflare.steamstatic.com/store_item_assets/steam/apps/511610/header.jpg?t=1471935610;Binarystudio 54;Binarystudio 54;Windows, macOS;To be announced;Action, Casual, Indie, Early Access;https://store.steampowered.com/app/511610/Adventure_Of_Thieves/;Unknown;Unknown;Unknown;Unknown;Unknown
Just Deserts;Indonesia;Just Deserts is a sci-fi action dating sim where you play as a soldier who must protect a city from mysterious alien attack, while at the same time you will also be seeking to capture...;https://shared.cloudflare.steamstatic.com/store_item_assets/steam/apps/488660/header.jpg?t=1738224219;Sekai Project;Vifth Floor;Windows, macOS, SteamOS + Linux;To be announced;Casual, Indie, Simulation, Strategy;https://store.steampowered.com/app/488660/Just_Deserts/;Unknown;Unknown;Unknown;Unknown;Unknown
One Small Fire At A Time;Indonesia;"13-year-old Janis has ""Magic Deficiency Disorder,"" a madness where one can't use magic in a very magic-oriented world. For her protection, she lives in a madhouse: a place where those...";https://shared.cloudflare.steamstatic.com/store_item_assets/steam/apps/476410/header.jpg?t=1572869081;Culture Select;Kidalang;Windows, macOS, SteamOS + Linux;To be announced;Adventure, Casual, Indie;https://store.steampowered.com/app/476410/One_Small_Fire_At_A_Time/;Unknown;Unknown;Unknown;Unknown;Unknown
Calcu-Late;Indonesia;Calcu-Late is a story about a boy named James that needs to participate in a godly Olympics tournament as a representative for the goddess of mathematics, Seshat. The tournament will ...;https://shared.cloudflare.steamstatic.com/store_item_assets/steam/apps/449200/header.jpg?t=1458333433;Back To Basics Gaming;Blazing Fanfish;Windows;To be announced;Adventure, Indie, RPG;https://store.steampowered.com/app/449200/CalcuLate/;Unknown;Unknown;Unknown;Unknown;Unknown
The Admin;Indonesia;In the distant future, there are rumors of a mysterious cyborg running an abandoned hidden research facility on a planet far from the center of human civilizations.His mysterious orig...;https://shared.cloudflare.steamstatic.com/store_item_assets/steam/apps/420300/header.jpg?t=1574930530;Willpowaproject;Willpowaproject;Windows;To be announced;Action, Adventure, Indie;https://store.steampowered.com/app/420300/The_Admin/;Unknown;Unknown;Unknown;Unknown;Unknown
Nusakana;Indonesia;Nusakana is an open-world JRPG where you date fish girls while trying to solve the island mysteries. Play as a tourist having a full-year vacation on the island, on a mysterious invit...;https://shared.cloudflare.steamstatic.com/store_item_assets/steam/apps/401290/header.jpg?t=1667006702;Studio Namaapa;Studio Namaapa;Windows;To be announced;Adventure, Indie, RPG;https://store.steampowered.com/app/401290/Nusakana/;Unknown;Unknown;Unknown;Unknown;Unknown
Almightree: The Last Dreamer;Indonesia;The world is shattering and you are the only hope to restore the balance. A thrilling and challenging 3D puzzle platformer game, Almightree: The Last Dreamer has you racing through a ...;https://shared.cloudflare.steamstatic.com/store_item_assets/steam/apps/368050/header.jpg?t=1463970102;Digital Tribe;Chocoarts;Windows, macOS, SteamOS + Linux;To be announced;Action, Indie, Strategy;https://store.steampowered.com/app/368050/Almightree_The_Last_Dreamer/;Unknown;Unknown;Unknown;Unknown;Unknown
An Octave Higher;Indonesia;Fall into the magically complicated world of Overture as the three main characters embark on an adventure that will shake their lives and the world around them. Will they fan the flam...;https://shared.cloudflare.steamstatic.com/store_item_assets/steam/apps/352780/header.jpg?t=1572720419;PLAYISM;Kidalang;Windows, macOS, SteamOS + Linux;To be announced;Adventure, Indie;https://store.steampowered.com/app/352780/An_Octave_Higher/;Unknown;Unknown;Unknown;Unknown;Unknown
Battle Ranch: Pigs vs Plants;Indonesia;Fight off hordes of enemy pigs in this 200 level strategy, tower defense, and time management game.;https://shared.cloudflare.steamstatic.com/store_item_assets/steam/apps/340070/header.jpg?t=1574484045;Senpai Studios;Playboom;Windows, macOS, SteamOS + Linux;To be announced;Casual, Indie, Strategy;https://store.steampowered.com/app/340070/Battle_Ranch_Pigs_vs_Plants/;Unknown;Unknown;Unknown;Unknown;Unknown
Celestian Tales: Old North;Indonesia;Celestian Tales: Old North is a refreshing take on the classic turn-based Japanese style RPG. Scrapping away the cliché of a destined person or a boy/girl-saving-the-world, the story...;https://shared.cloudflare.steamstatic.com/store_item_assets/steam/apps/315860/header.jpg?t=1465923387;Digital Tribe;Ekuator Games;Windows, macOS, SteamOS + Linux;To be announced;Indie, RPG;https://store.steampowered.com/app/315860/Celestian_Tales_Old_North/;Unknown;Unknown;Unknown;Unknown;Unknown
Motte Island;Indonesia;This is a 2D top-down horror game. If you enjoy adventures, top-down game with a hint of horror in it, Motte Island is for you. It has numerous features including but not limited to v...;https://shared.cloudflare.steamstatic.com/store_item_assets/steam/apps/291290/header.jpg?t=1447361067;One Aperture;Gamebell Studio;Windows, macOS;To be announced;Adventure, Casual, Indie;https://store.steampowered.com/app/291290/Motte_Island/;Unknown;Unknown;Unknown;Unknown;Unknown
Infectonator: Survivors;Indonesia;"""Infectonator : Survivors"" is a Randomized Permadeath Survival Simulator that combines RTS, Tower Defense, Roguelike, and Management-Simulation gameplay. The goal is to lead a group o...";https://shared.cloudflare.steamstatic.com/store_item_assets/steam/apps/269310/header.jpg?t=1725347135;Toge Productions;Toge Productions;Windows, macOS;To be announced;Action, Adventure, Indie, RPG, Simulation, Strategy;https://store.steampowered.com/app/269310/Infectonator_Survivors/;Unknown;Unknown;Unknown;Unknown;Unknown
DreadOut: Keepers of The Dark;Indonesia;DreadOut: Keepers of the Dark is a new standalone horror game that takes place in the DreadOut universe. In this missing chapter, you will help Linda face the challenges of the DreadO...;https://shared.cloudflare.steamstatic.com/store_item_assets/steam/apps/418950/header.jpg?t=1733398712;Digital Happiness;Digital Happiness;Windows;To be announced;Adventure, Indie;https://store.steampowered.com/app/418950/DreadOut_Keepers_of_The_Dark/;Unknown;Unknown;Unknown;Unknown;Unknown
DreadOut;Indonesia;DreadOut is a third person supernatural horror game where you play as Linda, a high school student trapped in an old abandoned town. Equipped with her trusty smart-phone, she will bat...;https://shared.cloudflare.steamstatic.com/store_item_assets/steam/apps/269790/header.jpg?t=1661346820;Digital Happiness;Digital Happiness;Windows, SteamOS + Linux;To be announced;Adventure, Indie;https://store.steampowered.com/app/269790/DreadOut/;Unknown;Unknown;Unknown;Unknown;Unknown
