Name;Country;Description;Thumbnail;Publisher_Names;Developer_Names;Platform;Release_Date;Genre;Steam_Link;Epic_Link;Playstation_Link;Xbox_Link;Switch_Link;GOG_Link
Awakening of Celestial;Indonesia;Awakening of Celestial is a magical fantasy Visual Novel filled with exciting adventures, epic moments, complex characters, and many more! Developed by Celestial Project and the platf...;https://shared.cloudflare.steamstatic.com/store_item_assets/steam/apps/812590/header.jpg?t=1581525759;Celestial Project;Celestial Project;Windows, macOS, SteamOS + Linux;To be announced;Action, Adventure, Casual, Indie, RPG, Strategy;https://store.steampowered.com/app/812590/Awakening_of_Celestial/;Unknown;Unknown;Unknown;Unknown;Unknown
Ciel Fledge: A Daughter Raising Simulator;Indonesia;Daughter Raising Simulator with in-depth management gameplay, backed by an outstanding City Pop soundtrack. Take a young girl under your wing and raise her to adulthood. Set in a futu...;https://shared.cloudflare.steamstatic.com/store_item_assets/steam/apps/738270/header.jpg?t=1741787069;PQube;Studio Namaapa;Windows, SteamOS + Linux;To be announced;Indie, Simulation;https://store.steampowered.com/app/738270/Ciel_Fledge_A_Daughter_Raising_Simulator/;Unknown;Unknown;Unknown;Unknown;Unknown
Xagia Wars;Indonesia;Xagia Wars is an epic fantasy tale about Magic, Courage, and Friendship that revolves around Isaac Victor, a young man brimming with talent living his daily wizardry school life. But ...;https://shared.cloudflare.steamstatic.com/store_item_assets/steam/apps/727960/header.jpg?t=1510591573;Vifth Floor;NextHeaven;Windows, macOS, SteamOS + Linux;To be announced;Casual, Indie;https://store.steampowered.com/app/727960/Xagia_Wars/;Unknown;Unknown;Unknown;Unknown;Unknown
Celestian Tales: Realms Beyond;Indonesia;A beautiful hand-drawn turn-based RPG set in a world of questionable morals.;https://shared.cloudflare.steamstatic.com/store_item_assets/steam/apps/684700/header.jpg?t=1590177872;Digital Tribe ;Ekuator Games, Agate;Windows;To be announced;Indie, RPG;https://store.steampowered.com/app/684700/Celestian_Tales_Realms_Beyond/;Unknown;Unknown;Unknown;Unknown;Unknown
Fearless Tigor;Indonesia;It is a fastly paced 2d action platformer game with the mixed of Castlevania and other classic games, followed by interesting puzzles. The aim of this game is to help Tigor in facing ...;https://shared.cloudflare.steamstatic.com/store_item_assets/steam/apps/624930/header.jpg?t=1589164798;Bayam Software;Bayam Software;Windows, macOS;To be announced;Action, Adventure, Indie, Early Access;https://store.steampowered.com/app/624930/Fearless_Tigor/;Unknown;Unknown;Unknown;Unknown;Unknown
One Last Crane;Indonesia;One Last Crane is a visual novel centered on Yuuki Murakami, a boy who has a brain tumor. After a long year of treatment without any positive results, Yuuki asks for his final wish: t...;https://shared.cloudflare.steamstatic.com/store_item_assets/steam/apps/446530/header.jpg?t=1703118744;Sekai Project;Blissful Work's;Windows, macOS, SteamOS + Linux;To be announced;Adventure, Casual, Indie;https://store.steampowered.com/app/446530/One_Last_Crane/;Unknown;Unknown;Unknown;Unknown;Unknown
Hell's Pharma;Indonesia;Welcome Intern, to Hell's Pharma! A lot of sick demons are coming here to get cured. Read their prescription and make sure you gave them the right mixture of potion! Don't do illegal ...;https://shared.cloudflare.steamstatic.com/store_item_assets/steam/apps/1216150/header.jpg?t=1580132088;Rainman Studios;Rainman Studios;Windows;To be announced;Indie, Simulation;https://store.steampowered.com/app/1216150/Hells_Pharma/;Unknown;Unknown;Unknown;Unknown;Unknown
WISGR;Indonesia;A game that takes place on the planet WISGR. The Darkness emerged after years defeated by the light . A young man named boghe tries to save his planet that will be ruined.;https://shared.cloudflare.steamstatic.com/store_item_assets/steam/apps/878340/header.jpg?t=1530976671;GukLabs;GukLabs;Windows;To be announced;Action, Adventure, Indie, RPG;https://store.steampowered.com/app/878340/WISGR/;Unknown;Unknown;Unknown;Unknown;Unknown
DIVINATION;Indonesia;"""What if you're born into this world without your permission?"" DIVINATION is a very short visual novel where you act as a fortune teller in a futuristic world. Talk and listen to peop...";https://shared.cloudflare.steamstatic.com/store_item_assets/steam/apps/1180250/header.jpg?t=1725347159;Mojiken;Mojiken;Windows, macOS;To be announced;Casual, Indie;https://store.steampowered.com/app/1180250/DIVINATION/;Unknown;Unknown;Unknown;Unknown;Unknown
Legend of Everything;Indonesia;A mind-bending isekai other-world science adventure! On a quest to rescue the Princess from the Demon Lord, Brane encounters an eccentric young woman claiming to be from another world...;https://shared.cloudflare.steamstatic.com/store_item_assets/steam/apps/1165020/header.jpg?t=1573275145;Culture Select;Kidalang;Windows, macOS, SteamOS + Linux;To be announced;Adventure, Casual, Indie;https://store.steampowered.com/app/1165020/Legend_of_Everything/;Unknown;Unknown;Unknown;Unknown;Unknown
Sleep Paralysis : mystery of the mountain village;Indonesia;Sleep Paralysis is a game that tells about the incident where you were possessed by supernatural beings when you fell asleep and was followed by a ghost;https://shared.cloudflare.steamstatic.com/store_item_assets/steam/apps/1134470/header.jpg?t=1567523390;catgames.id;Ardiansa Reza;Windows;To be announced;Adventure, Indie, Simulation, Early Access;https://store.steampowered.com/app/1134470/Sleep_Paralysis__mystery_of_the_mountain_village/;Unknown;Unknown;Unknown;Unknown;Unknown
Run Roll Rumble;Indonesia;"Run, Roll, Rumble takes place in an ""ordinary"" neighborhood of the angry, rumbling is what they do. It is friendly yet dangerous. Play as one of the friendly neighborhood and brawl to...";https://shared.cloudflare.steamstatic.com/store_item_assets/steam/apps/1097160/header.jpg?t=1595749496;Benua Softworks;Matthew Marcellino;Windows;To be announced;Casual;https://store.steampowered.com/app/1097160/Run_Roll_Rumble/;Unknown;Unknown;Unknown;Unknown;Unknown
Ghost Parade;Indonesia;There’s something spooky in the woods... And it needs your help! Team up with 30 ghostly companions, each one lending a unique ability. Explore this spine-tingling scrolling action ...;https://shared.cloudflare.steamstatic.com/store_item_assets/steam/apps/1093360/header.jpg?t=1572505235;Aksys Games;Lentera Nusantara;Windows;To be announced;Action, Adventure, Indie;https://store.steampowered.com/app/1093360/Ghost_Parade/;Unknown;Unknown;Unknown;Unknown;Unknown
Reebyte : Visual Novel and Interactive App Maker;Indonesia;The most powerful tools to build a Visual Novel Game and Creative Interactive Projects. Easy to use with a drag n drop features. Multiplatform without any effort and very fast. You al...;https://shared.cloudflare.steamstatic.com/store_item_assets/steam/apps/1093310/header.jpg?t=1562998812;Reebyte;Reebyte;Windows, macOS;To be announced;Design & Illustration, Education, Software Training, Utilities, Web Publishing, Game Development;https://store.steampowered.com/app/1093310/Reebyte__Visual_Novel_and_Interactive_App_Maker/;Unknown;Unknown;Unknown;Unknown;Unknown
The Grandmaster;Indonesia;“Hit When Thou Can Hit, Don’t Hit When Thou Can’t Hit” is the name of the game here. Your job as the Grand Master is to send those pesky ninjas flying. This is a simple game, ...;https://shared.cloudflare.steamstatic.com/store_item_assets/steam/apps/1065350/header.jpg?t=1557841896;Beat-Fu Studio;Beat-Fu Studio;Windows;To be announced;Action, Casual, Free To Play, Indie;https://store.steampowered.com/app/1065350/The_Grandmaster/;Unknown;Unknown;Unknown;Unknown;Unknown
Metal Country;Indonesia;Not even alien invasion can stop this guitarist from playing on his concert. Play as Amadoni, a guitarist on a hover board fighting alien invasion with using his musics.;https://shared.cloudflare.steamstatic.com/store_item_assets/steam/apps/1055770/header.jpg?t=1574931267;Willpowaproject;Willpowaproject;Windows;To be announced;Action, Adventure, Indie;https://store.steampowered.com/app/1055770/Metal_Country/;Unknown;Unknown;Unknown;Unknown;Unknown
EURGAVA™: Tomb of Senza;Indonesia;Your days are numbered! End your sickness before you run out of time in this sidescroller beat-em-up RPG! Fight your way until you reach your goal in EURGAVA™ - Tomb of Senza!;https://shared.cloudflare.steamstatic.com/store_item_assets/steam/apps/1035490/header.jpg?t=1624915740;Ibrahim Indra Baskara;Ibrahim Indra Baskara;Windows;To be announced;Action, Adventure, Indie, RPG;https://store.steampowered.com/app/1035490/EURGAVA_Tomb_of_Senza/;Unknown;Unknown;Unknown;Unknown;Unknown
Nightmare (Incubo);Indonesia;INCUBO is a side scrolling platform game with a semi-horror theme. We present many ghost from around the world in our game as enemy and bosses. You played as a child in his nightmare ...;https://shared.cloudflare.steamstatic.com/store_item_assets/steam/apps/992330/header.jpg?t=1662638181;inngamezstudio;inngamezstudio;Windows;To be announced;Adventure, Indie;https://store.steampowered.com/app/992330/Nightmare_Incubo/;Unknown;Unknown;Unknown;Unknown;Unknown
Nusantara: Legend of The Winged Ones;Indonesia;An otome visual novel, combined with Indonesian culture, about a girl who falls into a world full of mystery and men!;https://shared.cloudflare.steamstatic.com/store_item_assets/steam/apps/986710/header.jpg?t=1572836974;SweetChiel;SweetChiel;Windows, macOS, SteamOS + Linux;To be announced;Adventure, Casual, Indie, Simulation;https://store.steampowered.com/app/986710/Nusantara_Legend_of_The_Winged_Ones/;Unknown;Unknown;Unknown;Unknown;Unknown
PsyBurst;Indonesia;Psyburst is an action side scroller, featuring 8 unique characters with many different skills. It's a hybird between sidescroller and fighting game. Play as hunters and slash your way...;https://shared.cloudflare.steamstatic.com/store_item_assets/steam/apps/926240/header.jpg?t=1542442958;Hakagame;Hakagame;Windows;To be announced;Action, Indie;https://store.steampowered.com/app/926240/PsyBurst/;Unknown;Unknown;Unknown;Unknown;Unknown
Aquaculture Land: Fish Farming Simulation;Indonesia;Aquaculture Land is a fish farming management game. You will act as a freshwater fish farm manager to nurture different varieties of fish, produce high-quality commodities, and fulfil...;https://shared.cloudflare.steamstatic.com/store_item_assets/steam/apps/858630/header.jpg?t=1731307749;Maulidan Games, Maple Whispering Limited;Maulidan Games;Windows;To be announced;Casual, Indie, Simulation, Strategy;https://store.steampowered.com/app/858630/Aquaculture_Land_Fish_Farming_Simulation/;Unknown;Unknown;Unknown;Unknown;Unknown
Pamali: Indonesian Folklore Horror;Indonesia;A narrative horror game set in the daily lives of Indonesian society. Interact with various mystical objects as you explore haunted places, unravel their lingering mysteries, and expe...;https://shared.cloudflare.steamstatic.com/store_item_assets/steam/apps/854570/header.jpg?t=1697010143;Storytale, Maple Whispering Limited;Storytale;Windows;To be announced;Adventure, Indie;https://store.steampowered.com/app/854570/Pamali_Indonesian_Folklore_Horror/;Unknown;Unknown;Unknown;Unknown;Unknown
What Are You Stupid;Indonesia;Prepare to get your knowledge tested by 15 wacky characters in a 1-on-1 quiz battle format, each with their own theme and unique personality. Brace yourself and do well - or get humil...;https://shared.cloudflare.steamstatic.com/store_item_assets/steam/apps/839570/header.jpg?t=1527318411;Beat-Fu Studio;Beat-Fu Studio;Windows, macOS;To be announced;Casual, Indie;https://store.steampowered.com/app/839570/What_Are_You_Stupid/;Unknown;Unknown;Unknown;Unknown;Unknown
Survival Planet;Indonesia;Stranded in alien planet, you need to find your crew while trying to survive and contact the earth;https://shared.cloudflare.steamstatic.com/store_item_assets/steam/apps/807870/header.jpg?t=1530346008;NexusLab;NexusLab;Windows;To be announced;Adventure, Indie, Early Access;https://store.steampowered.com/app/807870/Survival_Planet/;Unknown;Unknown;Unknown;Unknown;Unknown
My Safe House;Indonesia;After hearing loud thuds and getting texts from her sister, a young teen realizes that she might need to hide in her own house from dangers that might come.;https://shared.cloudflare.steamstatic.com/store_item_assets/steam/apps/805980/header.jpg?t=1524627610;StoryTale Studios;StoryTale Studios;Windows;To be announced;Action, Indie;https://store.steampowered.com/app/805980/My_Safe_House/;Unknown;Unknown;Unknown;Unknown;Unknown
My Sweet Waifu;Indonesia;My Sweet Waifu is a chatbot assistant virtual dating experience and visual novel. How the way you treat Her is will drive you to deep relationship and unexpected ending. Or Maybe your...;https://shared.cloudflare.steamstatic.com/store_item_assets/steam/apps/793760/header.jpg?t=1623400679; Labscle Entertainment;Labscle Entertainment;Windows;To be announced;Action, Casual, Indie, Simulation, Strategy, Early Access;https://store.steampowered.com/app/793760/My_Sweet_Waifu/;Unknown;Unknown;Unknown;Unknown;Unknown
Oracle of Forgotten Testament;Indonesia;Oracle of Forgotten Testament is an episodic turn-based RPG Touhou fangame where you play to explore Gensokyo and resolve incidents happening after Marisa found a peculiar book inside...;https://shared.cloudflare.steamstatic.com/store_item_assets/steam/apps/786510/header.jpg?t=1726559836;Great Conspiracy Theory;Dragon Emperors, Great Conspiracy Theory;Windows;To be announced;RPG;https://store.steampowered.com/app/786510/Oracle_of_Forgotten_Testament/;Unknown;Unknown;Unknown;Unknown;Unknown
Valthirian Arc: Hero School Story;Indonesia;Build a school for RPG heroes in a mix of simulation and role-play adventure. As Principal of a school for the warriors and mages of the future, you must build your Academy to train t...;https://shared.cloudflare.steamstatic.com/store_item_assets/steam/apps/785850/header.jpg?t=1741786623;PQube;Agate;Windows;To be announced;Action, Adventure, Indie, RPG, Simulation, Strategy;https://store.steampowered.com/app/785850/Valthirian_Arc_Hero_School_Story/;Unknown;Unknown;Unknown;Unknown;Unknown
Luminescence;Indonesia;"""Let's make a deal, if you can prove that urban legend is a lie, I won't bother you anymore."" Rena is annoying student. She always show up wherever Ady is. Until one day, they make a ...";https://shared.cloudflare.steamstatic.com/store_item_assets/steam/apps/785640/header.jpg?t=1536814465;Genetic Studio;Genetic Studio;Windows;To be announced;Casual;https://store.steampowered.com/app/785640/Luminescence/;Unknown;Unknown;Unknown;Unknown;Unknown
A Raven Monologue;Indonesia;A Raven Monologue is a short experimental silent story about a raven that does not know how to croak and his relationship with the people in the town.;https://shared.cloudflare.steamstatic.com/store_item_assets/steam/apps/744810/header.jpg?t=1723622366;Toge Productions;Mojiken;Windows, macOS;To be announced;Casual, Indie, Free To Play;https://store.steampowered.com/app/744810/A_Raven_Monologue/;Unknown;Unknown;Unknown;Unknown;Unknown
Banyu Lintar Angin - Little Storm -;Indonesia;Banyu Lintar Angin is a series of experimental illustrations about three siblings, living together independently in a rural Indonesian environment.;https://shared.cloudflare.steamstatic.com/store_item_assets/steam/apps/744800/header.jpg?t=1723622646;Toge Productions;Mojiken;Windows, macOS;To be announced;Casual, Indie, Free To Play;https://store.steampowered.com/app/744800/Banyu_Lintar_Angin__Little_Storm/;Unknown;Unknown;Unknown;Unknown;Unknown
VOID;Indonesia;VOID is a visual novel themed around espionage and revenge. You play as Arthur Woods, a man seeking revenge from the death of his loved one, forging himself into a deadly assassin. Al...;https://shared.cloudflare.steamstatic.com/store_item_assets/steam/apps/716330/header.jpg?t=1582669583;Sekai Project;Vifth Floor;Windows, macOS, SteamOS + Linux;To be announced;Casual, Indie;https://store.steampowered.com/app/716330/VOID/;Unknown;Unknown;Unknown;Unknown;Unknown
DreadEye VR;Indonesia;DreadEye is a virtual reality experience that allows you to become an Indonesian shaman. Immerse yourself in terrifying experiences set in haunted rural Indonesia, and discover the gr...;https://shared.cloudflare.steamstatic.com/store_item_assets/steam/apps/692930/header.jpg?t=1661347139;Digital Happiness;Digital Happiness;Windows;To be announced;Action, Adventure, Indie;https://store.steampowered.com/app/692930/DreadEye_VR/;Unknown;Unknown;Unknown;Unknown;Unknown
Oswald's Adventure;Indonesia;Follow Oswald in his short adventure to find his sister. Will he find her? Or is there a surprise waiting for him? There is only one way to find out! Good luck, adventurers.;https://shared.cloudflare.steamstatic.com/store_item_assets/steam/apps/688680/header.jpg?t=1537254725;MLG Games;Dede Bayi;Windows;To be announced;Adventure, Indie, RPG;https://store.steampowered.com/app/688680/Oswalds_Adventure/;Unknown;Unknown;Unknown;Unknown;Unknown
Azure Saga: Pathfinder;Indonesia;Dive into the world of Azure Saga: Pathfinder and band together to search for the legendary planet that will save humanity. Battle your enemies in JRPG-style turn-based combat, and ex...;https://shared.cloudflare.steamstatic.com/store_item_assets/steam/apps/672590/header.jpg?t=1667526311;MassHive Media;MassHive Media;Windows, macOS;To be announced;Adventure, Indie, RPG, Strategy;https://store.steampowered.com/app/672590/Azure_Saga_Pathfinder/;Unknown;Unknown;Unknown;Unknown;Unknown
Infectonator 3: Apocalypse;Indonesia;A campy, crazy pixelart zombie apocalypse arcade sim where you're the bad guy. Drop your virus and spread it across the globe while you unlock a whole horde of bizarre undead to do yo...;https://shared.cloudflare.steamstatic.com/store_item_assets/steam/apps/666570/header.jpg?t=1726581066;Armor Games Studios;Toge Productions;Windows, macOS;To be announced;Indie, Simulation, Strategy;https://store.steampowered.com/app/666570/Infectonator_3_Apocalypse/;Unknown;Unknown;Unknown;Unknown;Unknown
Lobster Empire;Indonesia;Lobster Empire is a game in which you build up your own lobster business, developing better fishing techniques and ways to create long-lasting and profitable lobster resources.;https://shared.cloudflare.steamstatic.com/store_item_assets/steam/apps/665960/header.jpg?t=1731307751;Maulidan Games;Maulidan Games;Windows;To be announced;Indie, Simulation;https://store.steampowered.com/app/665960/Lobster_Empire/;Unknown;Unknown;Unknown;Unknown;Unknown
Cognizant Protocol;Indonesia;Cognizant Protocol, a text based adventure game that brings player into the struggle of Aldis Farrell, an AI scientist who is unable to free himself from his emergency pod buried unde...;https://shared.cloudflare.steamstatic.com/store_item_assets/steam/apps/664440/header.jpg?t=1501255069;Nilem Studio;Nilem Studio;Windows;To be announced;Adventure, Indie, Simulation;https://store.steampowered.com/app/664440/Cognizant_Protocol/;Unknown;Unknown;Unknown;Unknown;Unknown
Rage in Peace;Indonesia;Rage in Peace is a story-driven action adventure with elements of surprise and memorization. Unravel the last day of Timmy's life, as he races against time to get back home and fulfil...;https://shared.cloudflare.steamstatic.com/store_item_assets/steam/apps/658690/header.jpg?t=1725267169;Toge Productions, Neon Doctrine;Rolling Glory Jam;Windows, macOS;To be announced;Action, Adventure, Indie;https://store.steampowered.com/app/658690/Rage_in_Peace/;Unknown;Unknown;Unknown;Unknown;Unknown
She and the Light Bearer;Indonesia;She and the Light Bearer is a point and click adventure game, a poem, a fairy tale. Take a journey inside a vibrantly colored forest, meet silly creatures, listen to serene folk music...;https://shared.cloudflare.steamstatic.com/store_item_assets/steam/apps/658590/header.jpg?t=1725270736;Toge Productions;Mojiken;Windows, macOS;To be announced;Adventure, Casual, Indie;https://store.steampowered.com/app/658590/She_and_the_Light_Bearer/;Unknown;Unknown;Unknown;Unknown;Unknown
Ultra Space Battle Brawl;Indonesia;Easy to learn yet hard to master, Ultra Space Battle Brawl is a fun competitive game fit for settling disputes, be it with your friends and family or rivals and arch nemesis.;https://shared.cloudflare.steamstatic.com/store_item_assets/steam/apps/658500/header.jpg?t=1725270283;Toge Productions;Mojiken;Windows, macOS;To be announced;Action, Indie, Sports;https://store.steampowered.com/app/658500/Ultra_Space_Battle_Brawl/;Unknown;Unknown;Unknown;Unknown;Unknown
Rising Hell;Indonesia;Rising Hell is a vertical platformer rogue-lite filled with adrenaline-pumping action and tons of heavy gothic metal shreds. Climb out from the ever-changing hell while you fight hord...;https://shared.cloudflare.steamstatic.com/store_item_assets/steam/apps/657000/header.jpg?t=1744190622;Toge Productions;Tahoe Games;Windows;To be announced;Action, Indie;https://store.steampowered.com/app/657000/Rising_Hell/;Unknown;Unknown;Unknown;Unknown;Unknown
MagiCat;Indonesia;MagiCat is a side-scrolling platformer inspired by the retro games from 16-bit era. The game features a cute magical cat adventuring 63 levels, each with their own unique boss battle ...;https://shared.cloudflare.steamstatic.com/store_item_assets/steam/apps/656970/header.jpg?t=1744190556;Toge Productions;Kucing Rembes;Windows, macOS;To be announced;Action, Adventure, Indie;https://store.steampowered.com/app/656970/MagiCat/;Unknown;Unknown;Unknown;Unknown;Unknown
Xenoslaive Overdrive;Indonesia;Xenoslaive Overdrive is a fractal bullet shoot-em-up. Specially made for players to feel the thrill from various challenging aspects. Shoot! Survive all enemy bullets! Defeat their bo...;https://shared.cloudflare.steamstatic.com/store_item_assets/steam/apps/654240/header.jpg?t=1512350094;EVXIO;EVXIO;Windows;To be announced;Action;https://store.steampowered.com/app/654240/Xenoslaive_Overdrive/;Unknown;Unknown;Unknown;Unknown;Unknown
Burst Fighter;Indonesia;Burst Fighter is a shoot'em up game with unique customizable ship feature fused with modern graphic and gorgeous art styles. Dodge, counter, and defeat various enemies / attack patter...;https://shared.cloudflare.steamstatic.com/store_item_assets/steam/apps/642600/header.jpg?t=1740434222;indie.io;Lion Core, Magesoft;Windows;To be announced;Action, Indie;https://store.steampowered.com/app/642600/Burst_Fighter/;Unknown;Unknown;Unknown;Unknown;Unknown
Calico & Co.;Indonesia;Help Calico in her quest to rescue her lost kittens and unravel the mysteries surrounding the culprit.;https://shared.cloudflare.steamstatic.com/store_item_assets/steam/apps/620580/header.jpg?t=1527672601;Green Moss Game;Green Moss Game;Windows;To be announced;Adventure, Casual, Indie;https://store.steampowered.com/app/620580/Calico__Co/;Unknown;Unknown;Unknown;Unknown;Unknown
GoBlock's Impossible Medley;Indonesia;GoBlock's Impossible Medley is the most impossible and frustrating yet addictive game that you ever play. The game combines three challenging gameplay in one impossible game. You will...;https://shared.cloudflare.steamstatic.com/store_item_assets/steam/apps/619220/header.jpg?t=1727438210;GameChanger Studio;GameChanger Studio;Windows, macOS, SteamOS + Linux;To be announced;Casual, Indie;https://store.steampowered.com/app/619220/GoBlocks_Impossible_Medley/;Unknown;Unknown;Unknown;Unknown;Unknown
Forged of Blood;Indonesia;A fantasy turn-based tactical RPG built on depth and mechanical complexity, featuring classless character building, strategic management, and small unit tactics on a world scale.;https://shared.cloudflare.steamstatic.com/store_item_assets/steam/apps/617640/header.jpg?t=1564642826;Critical Forge;Critical Forge;Windows;To be announced;Adventure, Indie, RPG, Strategy;https://store.steampowered.com/app/617640/Forged_of_Blood/;Unknown;Unknown;Unknown;Unknown;Unknown
Fallen Legion: Rise to Glory;Indonesia;Fallen Legion is an intense action RPG where every battle is a heart-pounding fight and each gut-wrenching choice impacts the realm.;https://shared.cloudflare.steamstatic.com/store_item_assets/steam/apps/612820/header.jpg?t=1743957072;YummyYummyTummy;YummyYummyTummy;Windows;To be announced;Action, RPG;https://store.steampowered.com/app/612820/Fallen_Legion_Rise_to_Glory/;Unknown;Unknown;Unknown;Unknown;Unknown
Legion Tale;Indonesia;Take part in the story set in Agia, a continent inflicted with conflicts between two races. Join Alan, a young man from Scarleta who lead a small legion of warriors, to take over the ...;https://shared.cloudflare.steamstatic.com/store_item_assets/steam/apps/604040/header.jpg?t=1731307745;Maulidan Games;Maulidan Games;Windows;To be announced;Indie, Strategy;https://store.steampowered.com/app/604040/Legion_Tale/;Unknown;Unknown;Unknown;Unknown;Unknown
Ascender;Indonesia;Ascender is a 2D explorative puzzle metroidvania. The game is set in the open world of GOA's districts, and the player will face many unique puzzles to solve. Warning!! This game will...;https://shared.cloudflare.steamstatic.com/store_item_assets/steam/apps/598230/header.jpg?t=1727437058;GameChanger Studio;GameChanger Studio;Windows, macOS, SteamOS + Linux;To be announced;Adventure, Indie;https://store.steampowered.com/app/598230/Ascender/;Unknown;Unknown;Unknown;Unknown;Unknown
