Name;Country;Description;Thumbnail;Publisher_Names;Developer_Names;Platform;Release_Date;Genre;Steam_Link;Epic_Link;PlayStation_Link;Xbox_Link;Switch_Link;GOG_Link
Mini Metro;Ireland;Mini Metro is a strategy simulation game about designing a subway map for a growing city. Draw lines between stations and start your trains running. As new stations open, redraw your ...;https://shared.cloudflare.steamstatic.com/store_item_assets/steam/apps/287980/header.jpg?t=1724386220;Dinosaur Polo Club;Dinosaur Polo Club;Windows, macOS, SteamOS + Linux;6 Nov, 2015;Indie, Simulation, Strategy;https://store.steampowered.com/app/287980/Mini_Metro/;Unknown;Unknown;Unknown;Unknown;Unknown
Moonatics;Ireland;MOONATICS is a hyperactive 2D fighter with a focus on KICKING ASS... featuring a colourful cast of freaks and misfits, rollback netcode, and stylish hand-drawn animations OOZING with ...;https://shared.cloudflare.steamstatic.com/store_item_assets/steam/apps/2003450/header.jpg?t=1730291415;Benpaste;Benpaste;Windows;To be announced;Action, Indie;https://store.steampowered.com/app/2003450/Moonatics/;Unknown;Unknown;Unknown;Unknown;Unknown
Necromage;Ireland;Be a necromancer who can learn to summon any creature from the world. Level up and equip your minions by crafting enchanted spells to use on them. All this takes place in an isometric...;https://shared.cloudflare.steamstatic.com/store_item_assets/steam/apps/2891720/header.jpg?t=1746495469;CrazyPepe Games;CrazyPepe Games;Windows;To be announced;Action, Indie, RPG;https://store.steampowered.com/app/2891720/Necromage/;Unknown;Unknown;Unknown;Unknown;Unknown
Neon Runner;Ireland;Neon Runner is a fast paced runner style game that requires speed and precision to complete all levels as quickly as possible and set a high score.;https://shared.cloudflare.steamstatic.com/store_item_assets/steam/apps/2471910/header.jpg?t=1746263979;iRL Games;iRL Games;Windows;To be announced;Action, Casual, Racing;https://store.steampowered.com/app/2471910/Neon_Runner/;Unknown;Unknown;Unknown;Unknown;Unknown
Oh No! UFO!;Ireland;Join Cosmo and P.E.A. as they write the first intergalactic planetary guidebook about the Earth. Explore the planet, meet interesting life forms, lend a tentacle when you find trouble...;https://shared.cloudflare.steamstatic.com/store_item_assets/steam/apps/3314190/180e804e57b13487b4c69f117909b37202fffca3/header.jpg?t=1744268073;Blunderjack;Blunderjack;Windows, macOS, SteamOS + Linux;To be announced;Adventure, Casual, Indie;https://store.steampowered.com/app/3314190/Oh_No_UFO/;Unknown;Unknown;Unknown;Unknown;Unknown
PILLORY;Ireland;A surreal indie RPG with a unique, mood-based combat system. The angels of Promontory have forgotten about this place - you are lost at the bottom of it.;https://shared.cloudflare.steamstatic.com/store_item_assets/steam/apps/2472530/header.jpg?t=1721731619;IODINE;IODINE;Windows;To be announced;RPG;https://store.steampowered.com/app/2472530/PILLORY/;Unknown;Unknown;Unknown;Unknown;Unknown
POCKET MYSTERY EP DX;Ireland;A surreal, murder-mystery puzzle game originally designed for the GameBoy.;https://shared.cloudflare.steamstatic.com/store_item_assets/steam/apps/3300480/header.jpg?t=1734445102;Kohococoa Design Works;Kohococoa Design Works;Windows;17 Dec, 2024;Adventure, Indie, Free To Play;https://store.steampowered.com/app/3300480/POCKET_MYSTERY_EP_DX/;Unknown;Unknown;Unknown;Unknown;Unknown
PUBG: BATTLEGROUNDS;Ireland;PUBG: BATTLEGROUNDS, the high-stakes winner-take-all shooter that started the Battle Royale craze, is free-to-play! Drop into diverse maps, loot unique weapons and supplies, and survi...;https://shared.cloudflare.steamstatic.com/store_item_assets/steam/apps/578080/841ea38bc58cabb70aef65365cf50bc2d79329d9/header.jpg?t=1745911212;KRAFTON, Inc.;PUBG Corporation;Windows;21 Dec, 2017;Action, Adventure, Massively Multiplayer, Free To Play;https://store.steampowered.com/app/578080/PUBG_BATTLEGROUNDS/;Unknown;Unknown;Unknown;Unknown;Unknown
Paleo Pines;Ireland;Welcome to Paleo Pines, a charming island known for its friendly dinosaurs, quirky townsfolk, and mysterious past. Befriend dinos and enlist their help to fix up your ranch and farm c...;https://shared.cloudflare.steamstatic.com/store_item_assets/steam/apps/1202200/header.jpg?t=1727904994;Maximum Entertainment;Italic Pig;Windows, SteamOS + Linux;26 Sep, 2023;Adventure, Casual, Indie, RPG, Simulation;https://store.steampowered.com/app/1202200/Paleo_Pines/;Unknown;Unknown;Unknown;Unknown;Unknown
Parcel Corps;Ireland;Ditch the 9-5 and embrace the high-octane life of a freelance bicycle messenger! Skid, grind, and wallride across eight huge levels, delivering parcels for a cast of eccentric busines...;https://shared.cloudflare.steamstatic.com/store_item_assets/steam/apps/2015960/header.jpg?t=1740150428;Secret Mode;Billy Goat Entertainment Ltd;Windows;3 Oct, 2024;Action, Adventure, Racing;https://store.steampowered.com/app/2015960/Parcel_Corps/;Unknown;Unknown;Unknown;Unknown;Unknown
PizzaBoy;Ireland;A fast paced metroidvania about delivering pizzas to monsters.;https://shared.cloudflare.steamstatic.com/store_item_assets/steam/apps/2238400/header.jpg?t=1740174089;Breadless;Breadless;Windows;To be announced;Adventure, Indie;https://store.steampowered.com/app/2238400/PizzaBoy/;Unknown;Unknown;Unknown;Unknown;Unknown
Poetry Pigeon;Ireland;Fly frantically between fast-approaching obstacles by typing classic poems! Put your skills of both typing and timing to the test in this new spin on an old favorite! Prefer to fly ca...;https://shared.cloudflare.steamstatic.com/store_item_assets/steam/apps/2942420/header.jpg?t=1726927130;T. T. Hew Games;T. T. Hew Games;Windows;1 Aug, 2024;Indie, Free To Play;https://store.steampowered.com/app/2942420/Poetry_Pigeon/;Unknown;Unknown;Unknown;Unknown;Unknown
Potter About;Ireland;This side scrolling platformer lets you explore a beautiful, cozy home as a well-worn flower pot. Navigate through the clustered rooms and wield peculiar, plant-inspired powers on thi...;https://shared.cloudflare.steamstatic.com/store_item_assets/steam/apps/2627200/header.jpg?t=1717236550;Stableboy Entertainment;Stableboy Entertainment;Windows;To be announced;Adventure, Casual, Indie;https://store.steampowered.com/app/2627200/Potter_About/;Unknown;Unknown;Unknown;Unknown;Unknown
Predestination;Ireland;Predestination is a turn-based sci-fi 4X game set in the distant past of our own galaxy. Ships from countless races are flung back in time by a powerful hostile race known as the Reve...;https://shared.cloudflare.steamstatic.com/store_item_assets/steam/apps/340210/header.jpg?t=1572545539;Brain and Nerd Ltd;Brain and Nerd Ltd;Windows;26 Feb, 2019;Indie, Strategy;https://store.steampowered.com/app/340210/Predestination/;Unknown;Unknown;Unknown;Unknown;Unknown
Prometheus Wept;Ireland;Prometheus Wept is a party and action point turn based RPG set in a near-future, post-digital Earth. The game offers hardcore squad-level combat, simultaneous battles between cyberspa...;https://shared.cloudflare.steamstatic.com/store_item_assets/steam/apps/1208110/header.jpg?t=1744888347;Timeslip Softworks;Timeslip Softworks;Windows;To be announced;Indie, RPG, Strategy, Early Access;https://store.steampowered.com/app/1208110/Prometheus_Wept/;Unknown;Unknown;Unknown;Unknown;Unknown
Ravel the Frays;Ireland;A sci fi mystery on a ship drifting through space. Solve dialogue puzzles to help the ship's computer AILISH sift through possible timelines to find which one of them can prevent an i...;https://shared.cloudflare.steamstatic.com/store_item_assets/steam/apps/3499260/header.jpg?t=1740996136;Margarita Games;Margarita Games;Windows;To be announced;Adventure, Casual, Indie;https://store.steampowered.com/app/3499260/Ravel_the_Frays/;Unknown;Unknown;Unknown;Unknown;Unknown
RelicWar;Ireland;Collect the requested dungeon Relic and escape unharmed. Battle tough dungeon monsters and enemy players along the way. They want to steal your valuable treasure. Run or fight your wa...;https://shared.cloudflare.steamstatic.com/store_item_assets/steam/apps/1646800/header.jpg?t=1745438947;Violent Candle Studios;Violent Candle Studios;Windows, macOS, SteamOS + Linux;To be announced;Casual, Indie, Massively Multiplayer, RPG;https://store.steampowered.com/app/1646800/RelicWar/;Unknown;Unknown;Unknown;Unknown;Unknown
Rise of Piracy;Ireland;The perfect blend of Action, Adventure and RTS. Begin your journey as the lowly captain of a small vessel. End as the commander of a threatening fleet. Rise to glory how you see fit. ...;https://shared.cloudflare.steamstatic.com/store_item_assets/steam/apps/1400660/header.jpg?t=1742764208;MicroProse Software;IrishJohnGames;Windows;To be announced;Action, Adventure, Indie, Simulation, Strategy, Early Access;https://store.steampowered.com/app/1400660/Rise_of_Piracy/;Unknown;Unknown;Unknown;Unknown;Unknown
Scrambled Eggs;Ireland;"""Why did the chicken cross the road? It didn't."" Try to stop the chicken hordes with vehicular combat. Compete for high scores against your friends.";https://shared.cloudflare.steamstatic.com/store_item_assets/steam/apps/2906540/header.jpg?t=1723148311;Jake Horner;Jake Horner, Anahat Mudgal, TheJackXBL;Windows, macOS;22 Jul, 2024;Action, Casual, Indie, Racing, Simulation, Strategy, Free To Play;https://store.steampowered.com/app/2906540/Scrambled_Eggs/;Unknown;Unknown;Unknown;Unknown;Unknown
Sergeant Squidley: Space Cop!;Ireland;There's been a murder in Moontropolis, and it's up to Sergeant Squidley to solve it! In this retro roleplaying/adventure hybrid, you’ll spend a week as Squidley trying to crack the ...;https://shared.cloudflare.steamstatic.com/store_item_assets/steam/apps/2238210/header.jpg?t=1691907990;Ninjaconor;Ninjaconor;Windows;4 Jul, 2023;Adventure, RPG;https://store.steampowered.com/app/2238210/Sergeant_Squidley_Space_Cop/;Unknown;Unknown;Unknown;Unknown;Unknown
Super Hexagon;Ireland;Super Hexagon is a minimal action game by Terry Cavanagh, with music by Chipzel.;https://shared.cloudflare.steamstatic.com/store_item_assets/steam/apps/221640/header.jpg?t=1653925774;Terry Cavanagh;Terry Cavanagh;Windows, macOS, SteamOS + Linux;27 Nov, 2012;Action, Indie;https://store.steampowered.com/app/221640/Super_Hexagon/;Unknown;Unknown;Unknown;Unknown;Unknown
Supermarket Shriek;Ireland;Join man and goat in this chaotic, award-winning couch-co-op adventure! Tackle outlandish obstacle courses, complete rewarding challenges and dodge deadly obstacles in a hectic race t...;https://shared.cloudflare.steamstatic.com/store_item_assets/steam/apps/1086460/header.jpg?t=1741787336;PQube;Billy Goat Entertainment;Windows;23 Oct, 2020;Adventure, Casual, Indie, Racing;https://store.steampowered.com/app/1086460/Supermarket_Shriek/;Unknown;Unknown;Unknown;Unknown;Unknown
Surviving the Abyss;Ireland;Earth, 1976. You have been tasked with managing a deep-sea science facility working to perfect cloning. Explore the darkness and keep your crew alive in this hardcore survival colony ...;https://shared.cloudflare.steamstatic.com/store_item_assets/steam/apps/1254320/header.jpg?t=1732710280;Paradox Arc;Rocket Flair Studios;Windows;5 Nov, 2024;Indie, Simulation, Strategy;https://store.steampowered.com/app/1254320/Surviving_the_Abyss/;Unknown;Unknown;Unknown;Unknown;Unknown
Swing Boy;Ireland;Swing Boy is a platformer that takes swinging to a new level. Use your grappling hook to navigate your way out of the sewers and back to the surface. What has changed since you were g...;https://shared.cloudflare.steamstatic.com/store_item_assets/steam/apps/2744520/header.jpg?t=1740306268;Yellowbyte Games;Robert O'Connor;Windows, macOS;To be announced;Action, Indie;https://store.steampowered.com/app/2744520/Swing_Boy/;Unknown;Unknown;Unknown;Unknown;Unknown
TAXINAUT;Ireland;TAXINAUT is a space-taxi sim / RPG set in a huge open-world galaxy.;https://shared.cloudflare.steamstatic.com/store_item_assets/steam/apps/2082260/header.jpg?t=1725460086;mosgrom;mosgrom;Windows;15 Sep, 2022;Adventure, Indie, RPG, Simulation, Early Access;https://store.steampowered.com/app/2082260/TAXINAUT/;Unknown;Unknown;Unknown;Unknown;Unknown
THE ENIGMA MACHINE;Ireland;ENIGMA TECHNOLOGIES invites you to delve into the mind of an AI. Seamlessly blending first-person exploration with point-and-click mechanics, THE ENIGMA MACHINE's completely unique pr...;https://shared.cloudflare.steamstatic.com/store_item_assets/steam/apps/977810/header.jpg?t=1617829502;ENIGMA STUDIO;ENIGMA STUDIO;Windows, macOS;16 Nov, 2018;Indie;https://store.steampowered.com/app/977810/THE_ENIGMA_MACHINE/;Unknown;Unknown;Unknown;Unknown;Unknown
Tax-Force;Ireland;Hunt down tax-evading billionaires and rebuild society in a hand-drawn, action-roguelite platformer inspired by 90's comicbooks.;https://shared.cloudflare.steamstatic.com/store_item_assets/steam/apps/2508290/header.jpg?t=1738059556;Outsider Games;Outsider Games;Windows;To be announced;Action, Indie;https://store.steampowered.com/app/2508290/TaxForce/;Unknown;Unknown;Unknown;Unknown;Unknown
Terry's Other Games;Ireland;Hi, I'm Terry Cavanagh! You might remember me from such videogames as Dicey Dungeons, Super Hexagon, and VVVVVV. Here are a few other things I've made over the years!;https://shared.cloudflare.steamstatic.com/store_item_assets/steam/apps/2824580/header.jpg?t=1745513534;Terry Cavanagh;Terry Cavanagh;Windows, macOS, SteamOS + Linux;13 Feb, 2025;Indie;https://store.steampowered.com/app/2824580/Terrys_Other_Games/;Unknown;Unknown;Unknown;Unknown;Unknown
The Caretaker;Ireland;The Caretaker is a Top Down, Dungeon-Crawler style survival game. Search your way through streets, buildings and sewers for anything you can use to keep you moving and keep you alive!;https://shared.cloudflare.steamstatic.com/store_item_assets/steam/apps/1399620/header.jpg?t=1625140703;Squid Monkey Studios;Squid Monkey Studios;Windows;30 Apr, 2021;Action, Adventure;https://store.steampowered.com/app/1399620/The_Caretaker/;Unknown;Unknown;Unknown;Unknown;Unknown
The Darkside Detective;Ireland;Grab your trench coat, tune your sixth sense and join the Darkside Division as they investigate the outright bizarre, the downright dangerous and the confusing cases of Twin Lakes. Fl...;https://shared.cloudflare.steamstatic.com/store_item_assets/steam/apps/368390/header.jpg?t=1735923220;Akupara Games;Spooky Doorway;Windows, macOS, SteamOS + Linux;27 Jul, 2017;Adventure, Casual, Indie;https://store.steampowered.com/app/368390/The_Darkside_Detective/;Unknown;Unknown;Unknown;Unknown;Unknown
The Darkside Detective: A Fumble in the Dark;Ireland;Delouse your room with sage and pack up your travel-sized ouija board, it’s time to re-enter Twin Lakes - America’s 34th most haunted city. Join Detective McQueen as he puzzles hi...;https://shared.cloudflare.steamstatic.com/store_item_assets/steam/apps/795420/header.jpg?t=1735923196;Akupara Games;Spooky Doorway;Windows, macOS, SteamOS + Linux;15 Apr, 2021;Adventure, Casual, Indie;https://store.steampowered.com/app/795420/The_Darkside_Detective_A_Fumble_in_the_Dark/;Unknown;Unknown;Unknown;Unknown;Unknown
The Final Farewell;Ireland;The Final Farewell is a cosy narrative adventure about finding peace in death, and learning to let go. As a lost ghost, befriend wayward mortals and piece together misty memories. Lay...;https://shared.cloudflare.steamstatic.com/store_item_assets/steam/apps/2803140/header.jpg?t=1723557451;Lovewish;Studio Witchstar;Windows;22 Apr, 2024;Adventure, Casual, Indie;https://store.steampowered.com/app/2803140/The_Final_Farewell/;Unknown;Unknown;Unknown;Unknown;Unknown
The Gauntlet;Ireland;The Gauntlet is a fast-paced movement driven game where you must survive a series of trials to claim the prize, your freedom. Bad Bat's brutal Game-Show has got a new contestant, lets...;https://shared.cloudflare.steamstatic.com/store_item_assets/steam/apps/2701020/header.jpg?t=1732220123;Scattergood Studios;Round Table Studios;Windows;4 Mar, 2024;Action, Indie;https://store.steampowered.com/app/2701020/The_Gauntlet/;Unknown;Unknown;Unknown;Unknown;Unknown
The Little Acre;Ireland;While searching for his father, Aidan travels to a strange new world. Lily - his heroic daughter - sets off after him. Fully voiced and with hand-drawn animations, The Little Acre is ...;https://shared.cloudflare.steamstatic.com/store_item_assets/steam/apps/423590/header.jpg?t=1637664791;Pewter Games Studios;Pewter Games Studios;Windows, macOS, SteamOS + Linux;13 Dec, 2016;Adventure, Indie;https://store.steampowered.com/app/423590/The_Little_Acre/;Unknown;Unknown;Unknown;Unknown;Unknown
The Necromancer's Tale;Ireland;A story-rich gothic RPG. Master the rituals of an ancient spellbook. Raise an undead army to march against your enemies. Commune with the realm of the dead & struggle with your descen...;https://shared.cloudflare.steamstatic.com/store_item_assets/steam/apps/1315320/217d3a95d7ea819a754a8ee8dae8d21ff9df041c/header.jpg?t=1745690030;Psychic Software;Psychic Software, Spiderwinkle Games;Windows, macOS;To be announced;Adventure, RPG, Strategy;https://store.steampowered.com/app/1315320/The_Necromancers_Tale/;Unknown;Unknown;Unknown;Unknown;Unknown
The Paddock;Ireland;Play as security guard tasked with keeping dinosaurs from getting into a facility. Throughout your shift, things will begin to go wrong and dinosaurs will start to end up where they s...;https://shared.cloudflare.steamstatic.com/store_item_assets/steam/apps/2972380/header.jpg?t=1744722742;Josh Devlin;Josh Devlin;Windows;To be announced;Casual, Indie, Simulation;https://store.steampowered.com/app/2972380/The_Paddock/;Unknown;Unknown;Unknown;Unknown;Unknown
The Pale Beyond;Ireland;You didn’t ask to lead this expedition, but here you are. Stuck in the ice, Captain missing, miles from civilisation. Someone has to take charge. Manage your meagre resources, balan...;https://shared.cloudflare.steamstatic.com/store_item_assets/steam/apps/1266030/header.jpg?t=1726131031;Fellow Traveller;Bellular Studios;Windows, macOS;24 Feb, 2023;Adventure, Indie, RPG, Simulation, Strategy;https://store.steampowered.com/app/1266030/The_Pale_Beyond/;Unknown;Unknown;Unknown;Unknown;Unknown
The Séance of Blake Manor;Ireland;The Séance of Blake Manor is a supernatural detective mystery, set in 1897 Ireland, where you investigate the disappearance of Evelyn Deane in a remote hotel full of secrets and othe...;https://shared.cloudflare.steamstatic.com/store_item_assets/steam/apps/1395520/09df209c551539dc76679ca24b079b5771c2c281/header.jpg?t=1746119321;Raw Fury;Spooky Doorway;Windows;To be announced;Adventure;https://store.steampowered.com/app/1395520/The_Sance_of_Blake_Manor/;Unknown;Unknown;Unknown;Unknown;Unknown
This Means Warp;Ireland;It’s co-op space survival fun, Jim, but not as we know it. This Means Warp is an intense spaceship management roguelite experience for 1-4 players. Explore a procedurally generated ...;https://shared.cloudflare.steamstatic.com/store_item_assets/steam/apps/1269300/header.jpg?t=1725373913;Jagex Ltd;Outlier;Windows;4 May, 2023;Action, Casual, Indie, Strategy;https://store.steampowered.com/app/1269300/This_Means_Warp/;Unknown;Unknown;Unknown;Unknown;Unknown
Tranquil Isle;Ireland;Tranquil Isle is a lo-fi strategic townbuilder. Create cozy little settlements on the sun-kissed shores of your very own island paradise.;https://shared.cloudflare.steamstatic.com/store_item_assets/steam/apps/2324180/f28ff3f74661daa0163f6dbcbb141731eeb3e9d9/header.jpg?t=1744983539;Future Friends Games;Tom Daly;Windows;18 Apr, 2025;Casual, Indie, Strategy;https://store.steampowered.com/app/2324180/Tranquil_Isle/;Unknown;Unknown;Unknown;Unknown;Unknown
Tree Kingdoms;Ireland;Winter approaches, Great Spirit. Rival Tree Kingdoms peck at your borders... Will you conquer, outlast, or outwit them in this bite-sized turn-based 4X struggle? Command your Treeling...;https://shared.cloudflare.steamstatic.com/store_item_assets/steam/apps/3477080/6f3a788d5bae4bf7d70d841e88a7297bbd651ef5/header.jpg?t=1745597945;Biscuit Factory Games;Biscuit Factory Games;Windows;To be announced;Strategy;https://store.steampowered.com/app/3477080/Tree_Kingdoms/;Unknown;Unknown;Unknown;Unknown;Unknown
Turret Baffler;Ireland;A stealth shooter which involves bamboozling turrets, cameras and other electronic hazards so an NPC can get past them. Pick your spot, take the shot, and don't let her get caught!;https://shared.cloudflare.steamstatic.com/store_item_assets/steam/apps/3462150/header.jpg?t=1744892667;Aceade Games;Aceade Games;Windows, SteamOS + Linux;26 May, 2025;Action, Indie;https://store.steampowered.com/app/3462150/Turret_Baffler/;Unknown;Unknown;Unknown;Unknown;Unknown
VVVVVV;Ireland;VVVVVV is a platform game all about exploring one simple mechanical idea - what if you reversed gravity instead of jumping?;https://shared.cloudflare.steamstatic.com/store_item_assets/steam/apps/70300/header.jpg?t=1704968437;Terry Cavanagh;Terry Cavanagh;Windows, macOS, SteamOS + Linux;7 Sep, 2010;Action, Indie;https://store.steampowered.com/app/70300/VVVVVV/;Unknown;Unknown;Unknown;Unknown;Unknown
Ventilate;Ireland;A bullet hell top-down/isometric steampunk game where you must fight rogue constructs to get home and flee the city.;https://shared.cloudflare.steamstatic.com/store_item_assets/steam/apps/3364220/cb933f04504889a33757388fb13f0fffc444b026/header.jpg?t=1746467444;Scattergood Studios;Inkfox Studios;Windows;9 May, 2025;Action, Indie;https://store.steampowered.com/app/3364220/Ventilate/;Unknown;Unknown;Unknown;Unknown;Unknown
Vigilantes;Ireland;Vigilantes is a combat focused, turn-based tactical RPG set in the crime riddled city of Reiker. The game offers hardcore squad-level combat in a gritty neo-noir setting, intel gather...;https://shared.cloudflare.steamstatic.com/store_item_assets/steam/apps/545600/header.jpg?t=1635504890;Timeslip Softworks;Timeslip Softworks;Windows, macOS, SteamOS + Linux;3 Oct, 2018;Indie, RPG, Strategy;https://store.steampowered.com/app/545600/Vigilantes/;Unknown;Unknown;Unknown;Unknown;Unknown
Wailing Heights;Ireland;A body-hopping, musical adventure game. Trapped in a horrific hamlet of modern monsters, ex-band manager Francis Finkelstein uses the possession wheel to sing his soul into hipster va...;https://shared.cloudflare.steamstatic.com/store_item_assets/steam/apps/443650/header.jpg?t=1725033239;Outsider Games;Outsider Games;Windows, macOS, SteamOS + Linux;27 Apr, 2016;Adventure, Indie;https://store.steampowered.com/app/443650/Wailing_Heights/;Unknown;Unknown;Unknown;Unknown;Unknown
Wee Boats;Ireland;A wholesome, multiplayer boating world to discover secrets and surprises in the ocean. Chat and honk to your heart's content! Wee Boats is an act of self care!;https://shared.cloudflare.steamstatic.com/store_item_assets/steam/apps/3578080/ef0826504e4d6f2d2bd8e94bdcff133adbd1d666/header.jpg?t=1745528190;Pool Party Games;James Poole, Laura Ryder, Brendan Hewson;Windows;To be announced;Adventure, Casual, Indie;https://store.steampowered.com/app/3578080/Wee_Boats/;Unknown;Unknown;Unknown;Unknown;Unknown
Whispers in the Shadows;Ireland;A Top-down Horror game, where light is your only weapon against the monsters lurking in the shadows. Keep your torch alive as you attempt to uncover the secrets hidden within the fore...;https://shared.cloudflare.steamstatic.com/store_item_assets/steam/apps/2891690/header.jpg?t=1729866511;Sugradh_Dev;Sugradh_Dev;Windows;22 Oct, 2024;Action, Adventure;https://store.steampowered.com/app/2891690/Whispers_in_the_Shadows/;Unknown;Unknown;Unknown;Unknown;Unknown
You've Changed;Ireland;"You've Changed is like scary ""spot the difference"". Observe changes in the environment and catch enemies before they attack in this retro-inspired, anomaly horror game! You've Changed...";https://shared.cloudflare.steamstatic.com/store_item_assets/steam/apps/3556110/0e5032e529ec0924646c9465b20a347aa36b7d25/header.jpg?t=1742043752;Burkus;Burkus;Windows;To be announced;Indie;https://store.steampowered.com/app/3556110/Youve_Changed/;Unknown;Unknown;Unknown;Unknown;Unknown
[ECHOSTASIS];Ireland;THE AWARD-WINNING CONCLUSION TO THE [ENIGMA] TRILOGY, [ECHOSTASIS] presents a world where our reality is not only curated by algorithms, but created by them.;https://shared.cloudflare.steamstatic.com/store_item_assets/steam/apps/1558000/header.jpg?t=1727975781;ENIGMA STUDIO;ENIGMA STUDIO;Windows;30 May, 2024;Action, Adventure;https://store.steampowered.com/app/1558000/ECHOSTASIS/;Unknown;Unknown;Unknown;Unknown;Unknown
com__et;Ireland;A queer romance/horror visual novel about being locked into a path, and having _______ words hidden from You. Find Your way to discover what's missing and reach Your ____ End.;https://shared.cloudflare.steamstatic.com/store_item_assets/steam/apps/2604450/header.jpg?t=1738242118;Margarita Games;Margarita Games, SuperBiasedGary;Windows, macOS, SteamOS + Linux;31 Oct, 2023;Adventure, Casual, Indie;https://store.steampowered.com/app/2604450/com__et/;Unknown;Unknown;Unknown;Unknown;Unknown
Éalú;Ireland;Éalú is an entirely hand-animated, stop-motion, point & click adventure game where you guide a wooden mouse through a maze, encountering puzzles, cheese and unknown dangers as you s...;https://shared.cloudflare.steamstatic.com/store_item_assets/steam/apps/3560370/aefed1790964333d4f0ab07e5d777316ca9b0bba/header.jpg?t=1745542775;Beyond the Bark;Beyond the Bark;Windows;To be announced;Adventure, Casual;https://store.steampowered.com/app/3560370/al/;Unknown;Unknown;Unknown;Unknown;Unknown
