Name;Country;Description;Thumbnail;Publisher_Names;Developer_Names;Platform;Release_Date;Genre;Steam_Link;Epic_Link;PlayStation_Link;Xbox_Link;Switch_Link;GOG_Link
A Dance of Fire and Ice;Malaysia;A Dance of Fire and Ice is a strict rhythm game. Keep your focus as you guide two orbiting planets along a winding path without breaking their perfect equilibrium.;https://shared.cloudflare.steamstatic.com/store_item_assets/steam/apps/977950/header.jpg?t=1734406213;7th Beat Games, indienova;7th Beat Games;Windows, macOS, SteamOS + Linux;24 Jan, 2019;Indie;https://store.steampowered.com/app/977950/A_Dance_of_Fire_and_Ice/;Unknown;Unknown;Unknown;Unknown;Unknown
Ageless;Malaysia;Ageless is a story driven puzzle platformer where you must alter the age of animals and plant life around you to progress. Play as Kiara, a young girl who braves through heartache and...;https://shared.cloudflare.steamstatic.com/store_item_assets/steam/apps/1210150/header.jpg?t=1731939952;Team17 Digital Ltd;One More Dream Studios;Windows;28 Jul, 2020;Adventure, Indie;https://store.steampowered.com/app/1210150/Ageless/;Unknown;Unknown;Unknown;Unknown;Unknown
Alpha Kimori™ 1;Malaysia;Alpha Kimori™ Great Doubt™ Episode One is the first of a trilogy of bright and colorful Japanese Anime inspired story-driven episodic 2D Role Playing Games, which feature an intri...;https://shared.cloudflare.steamstatic.com/store_item_assets/steam/apps/265870/header.jpg?t=1447359569;Sherman3D;Sherman3D;Windows;17 Mar, 2014;Adventure, Casual, Indie, RPG, Strategy;https://store.steampowered.com/app/265870/Alpha_Kimori_1/;Unknown;Unknown;Unknown;Unknown;Unknown
Amnesiac Adventurer;Malaysia;Our brave adventurer is almost at the end of his heroic journey, but realizes that his memories have been jumbled! Now filled with questions and doubts, he must recall what happened i...;https://shared.cloudflare.steamstatic.com/store_item_assets/steam/apps/1781060/header.jpg?t=1648396035;RoundTable Games Studio;RoundTable Games Studio;Windows;26 Mar, 2022;Casual;https://store.steampowered.com/app/1781060/Amnesiac_Adventurer/;Unknown;Unknown;Unknown;Unknown;Unknown
Astral Break;Malaysia;"Astral Break is a fusion of mech and roguelite action. Experience thrilling ""thrust"" controls that propel you through dynamic dungeons. Collect diverse modular armors to refine your c...";https://shared.cloudflare.steamstatic.com/store_item_assets/steam/apps/3145570/header.jpg?t=1737702968;Orb Square Studio;Orb Square Studio;Windows, SteamOS + Linux;To be announced;Action, Indie;https://store.steampowered.com/app/3145570/Astral_Break/;Unknown;Unknown;Unknown;Unknown;Unknown
Attack Of UNDO Zai;Malaysia;High definition furry anime characters in a non-stop action shooter with team.;https://shared.cloudflare.steamstatic.com/store_item_assets/steam/apps/1569720/header.jpg?t=1638279076;UNDO Academy;CTRLZ Game Studio, UNDO Academy;Windows;30 Nov, 2021;Action, Casual;https://store.steampowered.com/app/1569720/Attack_Of_UNDO_Zai/;Unknown;Unknown;Unknown;Unknown;Unknown
Bake 'n Switch;Malaysia;Bake ‘n Switch is a cute, yet tough couch co-op and PvP party game for 1-4 players. Embark on a 'Bun Solo' single-player adventure or team up with other Bakers to catch, throw, and...;https://shared.cloudflare.steamstatic.com/store_item_assets/steam/apps/1080410/header.jpg?t=1624352320;Streamline Media Group;Streamline Games;Windows;21 Aug, 2020;Action, Adventure, Casual, Indie, Strategy;https://store.steampowered.com/app/1080410/Bake_n_Switch/;Unknown;Unknown;Unknown;Unknown;Unknown
Banzai Escape;Malaysia;Banzai Universe Prologue. Starring Rokiahi as P.A.S.K.A.L special agent.;https://shared.cloudflare.steamstatic.com/store_item_assets/steam/apps/440340/header.jpg?t=1633506717;Xenoaisam Studio;XenoAisam;Windows;16 Mar, 2016;Action;https://store.steampowered.com/app/440340/Banzai_Escape/;Unknown;Unknown;Unknown;Unknown;Unknown
Banzai Escape 2;Malaysia;Banzai Universe continuation. Starring Rokiahi and Cpt. Benci as P.A.S.K.A.L special agents.;https://shared.cloudflare.steamstatic.com/store_item_assets/steam/apps/1230990/header.jpg?t=1666987097;Xenoaisam Studio;XenoAisam;Windows;17 Feb, 2020;Action, Adventure;https://store.steampowered.com/app/1230990/Banzai_Escape_2/;Unknown;Unknown;Unknown;Unknown;Unknown
Banzai Escape 2: Subterranean;Malaysia;Banzai Escape 2 Subterranean is a Singleplayer or Co-op Cute Anime Third-person Action Modern Warfare Shooter and a sequel based the events of Banzai Escape 2. You as a player, contro...;https://shared.cloudflare.steamstatic.com/store_item_assets/steam/apps/1758950/header.jpg?t=1745941406;Xenoaisam Studio;XenoAisam;Windows;29 Oct, 2021;Action, Early Access;https://store.steampowered.com/app/1758950/Banzai_Escape_2_Subterranean/;Unknown;Unknown;Unknown;Unknown;Unknown
Bashville;Malaysia;Bashville is a good old-fashioned shoot 'em up with loads of weapons and enemies to fight. Go through The Realm levels and defeat the various enemies found within. Use the level envir...;https://shared.cloudflare.steamstatic.com/store_item_assets/steam/apps/784890/header.jpg?t=1706599662;Winprovise;Winprovise;Windows, macOS;27 Feb, 2018;Action, Casual, Indie;https://store.steampowered.com/app/784890/Bashville/;Unknown;Unknown;Unknown;Unknown;Unknown
Boat Simulator Apprentice;Malaysia;Welcome to the simulator-arcade experience. Boat Simulator Apprentice is a small boat training game that caters to both simulator fans and arcade game lovers. Learn how to drive a mot...;https://shared.cloudflare.steamstatic.com/store_item_assets/steam/apps/1837570/header.jpg?t=1651068639;VSG LABS;VSG LABS;Windows;21 Feb, 2022;Action, Indie, Racing, Simulation, Early Access;https://store.steampowered.com/app/1837570/Boat_Simulator_Apprentice/;Unknown;Unknown;Unknown;Unknown;Unknown
CODE VEIN;Malaysia;In the face of certain death, we rise. Team up and embark on a journey to the ends of hell to unlock your past and escape your living nightmare in CODE VEIN.;https://shared.cloudflare.steamstatic.com/store_item_assets/steam/apps/678960/header.jpg?t=1701310785;Bandai Namco Entertainment;Bandai Namco Studios;Windows;26 Sep, 2019;Action, RPG;https://store.steampowered.com/app/678960/CODE_VEIN/;Unknown;Unknown;Unknown;Unknown;Unknown
Cerebral Escape Series: Vol 1;Malaysia;The Cerebral Escape Series is an anthology of first-person horror escape room games. It contains 3 different games namely Anachron, Pagan & Splinters. Utilize your deduction & observa...;https://shared.cloudflare.steamstatic.com/store_item_assets/steam/apps/2987870/header.jpg?t=1744621722;Cerebral Games;Cerebral Games;Windows;To be announced;Adventure, Casual, Indie;https://store.steampowered.com/app/2987870/Cerebral_Escape_Series_Vol_1/;Unknown;Unknown;Unknown;Unknown;Unknown
Chiyo;Malaysia;[Chiyo] is a first-person hardcore escape room horror game set in Japan's Edo era. As Idate Chiyo, a paranormal investigator possessing supernatural abilities, you are tasked with inv...;https://shared.cloudflare.steamstatic.com/store_item_assets/steam/apps/2220660/header.jpg?t=1705759546;SCRYsoft;Nimbus Games;Windows;18 Jan, 2024;Action, Adventure, Indie, Simulation;https://store.steampowered.com/app/2220660/Chiyo/;Unknown;Unknown;Unknown;Unknown;Unknown
Cramped Room of Death;Malaysia;A puzzle adventure in close quarters! Use your spear to defeat enemies and collect treasure, but plan your moves carefully—each room has tight turns, deadly traps and no margin for ...;https://shared.cloudflare.steamstatic.com/store_item_assets/steam/apps/1389200/header.jpg?t=1689794515;Nicalis, Inc.;Hafiz Mohd Rozlan;Windows;19 Jul, 2023;Casual, Indie;https://store.steampowered.com/app/1389200/Cramped_Room_of_Death/;Unknown;Unknown;Unknown;Unknown;Unknown
Cyberpunk Inquisitor;Malaysia;The world's first rogue-lite point-and-click adventure! As an Inquisitor in a dystopian cyberpunk world, enter a Megabuilding and solve the immersive, procedurally-generated murders w...;https://shared.cloudflare.steamstatic.com/store_item_assets/steam/apps/2957350/header.jpg?t=1714515575;Nerdook Productions;Nerdook Productions;Windows;To be announced;Adventure;https://store.steampowered.com/app/2957350/Cyberpunk_Inquisitor/;Unknown;Unknown;Unknown;Unknown;Unknown
DISDAIN;Malaysia;DISDAIN is a fast-paced, visceral retro-styled first person shooter, inspired by the legendary FPS games of yesteryear.;https://shared.cloudflare.steamstatic.com/store_item_assets/steam/apps/2113270/header.jpg?t=1672191592;Hellforge Studios;Nash Muhandes, Mischief Donut;Windows, macOS, SteamOS + Linux;To be announced;Action, Indie;https://store.steampowered.com/app/2113270/DISDAIN/;Unknown;Unknown;Unknown;Unknown;Unknown
DeLight: The Journey Home;Malaysia;DeLight tells the story of a blind girl, a stray dog, and their unexpected journey during wartime.;https://shared.cloudflare.steamstatic.com/store_item_assets/steam/apps/1278880/header.jpg?t=1664385717;DreamTree Studio Sdn. Bhd.;DreamTree Studio Sdn. Bhd.;Windows;19 Nov, 2020;Adventure, Casual, Indie;https://store.steampowered.com/app/1278880/DeLight_The_Journey_Home/;Unknown;Unknown;Unknown;Unknown;Unknown
Determinant;Malaysia;Realistic physics-based open-world survival game set in the future. Survival, crafting, exploration and base building are the main focus. Hunt for food and water and survive against e...;https://shared.cloudflare.steamstatic.com/store_item_assets/steam/apps/1445480/header.jpg?t=1728909335;Khor Chin Heong;Khor Chin Heong;Windows;To be announced;Action, Adventure, Indie, RPG, Simulation;https://store.steampowered.com/app/1445480/Determinant/;Unknown;Unknown;Unknown;Unknown;Unknown
Disassembly 3D;Malaysia;Disassembly and destruction physics sandbox simulator. Detailed models of objects and vehicles and their internal parts. Disassemble objects successfully to unlock weapons mode and de...;https://shared.cloudflare.steamstatic.com/store_item_assets/steam/apps/747910/header.jpg?t=1611135393;Khor Chin Heong;Khor Chin Heong;Windows;30 Nov, 2017;Indie, Simulation;https://store.steampowered.com/app/747910/Disassembly_3D/;Unknown;Unknown;Unknown;Unknown;Unknown
Disassembly VR;Malaysia;Disassembly and destruction physics sandbox simulator. Detailed models of objects and vehicles and their internal parts. Disassemble objects successfully to unlock new tools and weapo...;https://shared.cloudflare.steamstatic.com/store_item_assets/steam/apps/973700/header.jpg?t=1663922942;Khor Chin Heong;Khor Chin Heong;Windows;31 Jan, 2019;Action, Indie, Simulation;https://store.steampowered.com/app/973700/Disassembly_VR/;Unknown;Unknown;Unknown;Unknown;Unknown
Dive;Malaysia;Dive is a 2d pixel art platformer that takes place underwater. You cannot jump in this game, instead you use the ability to raise and lower pillars of water to gain vertical movement ...;https://shared.cloudflare.steamstatic.com/store_item_assets/steam/apps/798170/header.jpg?t=1520927463;Bala Vicknesh;Bala Vicknesh;Windows;7 Mar, 2018;Adventure;https://store.steampowered.com/app/798170/Dive/;Unknown;Unknown;Unknown;Unknown;Unknown
Doctor Who: The Lonely Assassins;Malaysia;Uncover the dark secrets of Wester Drumlins and confront a new evil in a thrilling found-phone mystery from the award-winning creators of Sara Is Missing and SIMULACRA.;https://shared.cloudflare.steamstatic.com/store_item_assets/steam/apps/1508270/header.jpg?t=1699884685;Maze Theory, Another Indie;Kaigan Games OÜ;Windows;18 Mar, 2021;Adventure, Casual, Indie;https://store.steampowered.com/app/1508270/Doctor_Who_The_Lonely_Assassins/;Unknown;Unknown;Unknown;Unknown;Unknown
Dying Flame;Malaysia;James is trapped in an unknown mansion. As he desperately searches for a way out, he finds that his wife, Mary is trapped there as well. Lurking in the darkness is a monster that’s ...;https://shared.cloudflare.steamstatic.com/store_item_assets/steam/apps/1507950/header.jpg?t=1648396891;RoundTable Games Studio;RoundTable Games Studio;Windows;22 Mar, 2021;Adventure, Indie;https://store.steampowered.com/app/1507950/Dying_Flame/;Unknown;Unknown;Unknown;Unknown;Unknown
ENDURA;Malaysia;Follow the journey of ex-convict, Jack Jr as he traverse the broken realm of Yagra to finish vital deliveries by utilizing grappling mechanics akin to Spiderman but with guns and swor...;https://shared.cloudflare.steamstatic.com/store_item_assets/steam/apps/1825760/header.jpg?t=1725266419;N/A;IFIO STUDIO;Windows;19 Aug, 2024;Action, Adventure, Indie, RPG, Early Access;https://store.steampowered.com/app/1825760/ENDURA/;Unknown;Unknown;Unknown;Unknown;Unknown
Ex Carrot Bur!!;Malaysia;;https://shared.cloudflare.steamstatic.com/store_item_assets/steam/apps/3159850/header.jpg?t=1745968551;RoundTable Games Studio;RoundTable Games Studio;Windows;6 May, 2025;Action, Adventure, Casual, Indie;https://store.steampowered.com/app/3159850/Ex_Carrot_Bur/;Unknown;Unknown;Unknown;Unknown;Unknown
Eximius: Seize the Frontline;Malaysia;EXIMIUS is a FPS/RTS hybrid that focuses on squad-based combat. The game features an intense 5v5 multiplayer experience with each team comprising of 4 Squad Officers and one Commander.;https://shared.cloudflare.steamstatic.com/store_item_assets/steam/apps/505740/header.jpg?t=1737626156;Ammobox Studios;Ammobox Studios;Windows;16 Mar, 2021;Action, Strategy;https://store.steampowered.com/app/505740/Eximius_Seize_the_Frontline/;Unknown;Unknown;Unknown;Unknown;Unknown
Falling Rain;Malaysia;Falling Rain is a third-person anime shooting RPG game with advance movement mechanic. Immerse yourself in a post apocalypse world and experiences the character struggle and follow th...;https://shared.cloudflare.steamstatic.com/store_item_assets/steam/apps/2895070/header.jpg?t=1741326462;Alkaline Game;Alkaline Game;Windows;To be announced;Action, Adventure, Indie, RPG;https://store.steampowered.com/app/2895070/Falling_Rain/;Unknown;Unknown;Unknown;Unknown;Unknown
Fires At Midnight;Malaysia;In a world where making love without being in love makes you spontaneously combust, the person you love most may be the one who burns you in Fires at Midnight – a cinematic and inte...;https://shared.cloudflare.steamstatic.com/store_item_assets/steam/apps/1282140/header.jpg?t=1643300138;Persona Theory Games;Persona Theory Games;Windows, macOS;9 Jul, 2020;Adventure, Casual, Indie;https://store.steampowered.com/app/1282140/Fires_At_Midnight/;Unknown;Unknown;Unknown;Unknown;Unknown
Foster: Ghost Child | 養小鬼;Malaysia;Foster: Ghost Child provides an atmospheric horror that incorporates East Asian elements rarely used in games. The game makes use of Chinese traditional elements to convey a distinct ...;https://shared.cloudflare.steamstatic.com/store_item_assets/steam/apps/2072890/header.jpg?t=1659755498;Lsgamedev;Lsgamedev;Windows;4 Aug, 2022;Indie;https://store.steampowered.com/app/2072890/Foster_Ghost_Child/;Unknown;Unknown;Unknown;Unknown;Unknown
GOD EATER 3;Malaysia;Set in a post-apocalyptic setting, it’s up to your special team of God Eaters to take down god-like monsters devastating the world. With an epic story, unique characters, and all ne...;https://shared.cloudflare.steamstatic.com/store_item_assets/steam/apps/899440/header.jpg?t=1701317278;BANDAI NAMCO Entertainment;BANDAI NAMCO Studios Inc.;Windows;7 Feb, 2019;Action;https://store.steampowered.com/app/899440/GOD_EATER_3/;Unknown;Unknown;Unknown;Unknown;Unknown
GigaBash;Malaysia;GigaBash is the ultimate Kaiju Fighting Game for 1-4 players, where you battle as film-inspired Kaijus and giant Heroes in fully destructible cityscapes.;https://shared.cloudflare.steamstatic.com/store_item_assets/steam/apps/1546400/header.jpg?t=1743348429;Passion Republic Games;Passion Republic Games;Windows;4 Aug, 2022;Action, Casual, Indie;https://store.steampowered.com/app/1546400/GigaBash/;Unknown;Unknown;Unknown;Unknown;Unknown
Go Gold Castle;Malaysia;An action-packed 4 person multiplayer party pixel game. It has a variety of funky little pixel characters for players to choose from, each with their own awesome abilities and skills.;https://shared.cloudflare.steamstatic.com/store_item_assets/steam/apps/1443700/header.jpg?t=1607315471;Lusolab Entertainment;Lusolab Entertainment;Windows;31 Oct, 2021;Action, Indie;https://store.steampowered.com/app/1443700/Go_Gold_Castle/;Unknown;Unknown;Unknown;Unknown;Unknown
Greyhat - A Digital Detective Adventure;Malaysia;How far would you go to save your daughter? As an infamous hacker-for-hire you have the skills to steal almost any secret. But when your daughter is taken, will you be able to use the...;https://shared.cloudflare.steamstatic.com/store_item_assets/steam/apps/1247940/header.jpg?t=1661959593;Limited Games;Limited Games;Windows;31 Aug, 2020;Adventure, Casual, Indie, Simulation;https://store.steampowered.com/app/1247940/Greyhat__A_Digital_Detective_Adventure/;Unknown;Unknown;Unknown;Unknown;Unknown
Hirogami;Malaysia;Explore a beautiful origami world as Hiro, a fan-wielding master of the art of ‘folding’. Embark on a mystical journey to save your fragile home from deadly digital invaders. Take...;https://shared.cloudflare.steamstatic.com/store_item_assets/steam/apps/3135840/header.jpg?t=1746442190;Kakehashi Games;Bandai Namco Studios Singapore Pte. Ltd., Bandai Namco Studios Malaysia Sdn. Bhd.;Windows;To be announced;Action, Adventure;https://store.steampowered.com/app/3135840/Hirogami/;Unknown;Unknown;Unknown;Unknown;Unknown
Hunter A Hunter;Malaysia;Hunter A Hunter is an Action Horror Arena game inspired by Pacman. Collect all lights scattered in arena while a hunter is searching for you.;https://shared.cloudflare.steamstatic.com/store_item_assets/steam/apps/1848650/header.jpg?t=1666133504;Ragent Sdn Bhd;Riz Ragent;Windows;5 Oct, 2022;Indie;https://store.steampowered.com/app/1848650/Hunter_A_Hunter/;Unknown;Unknown;Unknown;Unknown;Unknown
Kabaret;Malaysia;Welcome to the Kabaret - where monsters from Southeast Asian myths and folklores dwell. Perform tea ceremonies, play traditional games, and question your humanity.;https://shared.cloudflare.steamstatic.com/store_item_assets/steam/apps/1525580/header.jpg?t=1682395081;Persona Theory Games, Wings;Persona Theory Games;Windows;4 Apr, 2023;Adventure, Casual, Indie;https://store.steampowered.com/app/1525580/Kabaret/;Unknown;Unknown;Unknown;Unknown;Unknown
Katana Rama;Malaysia;A fast paced action game where you play as a hacker program, with the mission of breaking out of a digital security system. Lay waste to all that stands in your way.;https://shared.cloudflare.steamstatic.com/store_item_assets/steam/apps/1944630/header.jpg?t=1727864387;Ghost Machine Games;Ghost Machine Games;Windows;14 Sep, 2023;Action, Adventure, Indie;https://store.steampowered.com/app/1944630/Katana_Rama/;Unknown;Unknown;Unknown;Unknown;Unknown
Kill A Million Rats;Malaysia;A base-building, Roguelike Action/Turn-based Strategy (RATS) game, in a forest invaded by a million Rats. As the powerful Spirit of Vengeance, you must save the adorable Villagers! Ex...;https://shared.cloudflare.steamstatic.com/store_item_assets/steam/apps/2551440/header.jpg?t=1737976361;Surefire.Games;Nerdook Productions;Windows;15 Jan, 2025;Action, Adventure, Indie, Strategy;https://store.steampowered.com/app/2551440/Kill_A_Million_Rats/;Unknown;Unknown;Unknown;Unknown;Unknown
King's League II;Malaysia;Lead your team to victory! Recruit, train and manage fighters of different classes before entering tactical battles of wit and glory. In this sequel to an award-winning strategy simul...;https://shared.cloudflare.steamstatic.com/store_item_assets/steam/apps/996080/header.jpg?t=1596865810;Kurechii;Kurechii;Windows;7 Nov, 2019;Indie, RPG, Simulation, Strategy;https://store.steampowered.com/app/996080/Kings_League_II/;Unknown;Unknown;Unknown;Unknown;Unknown
Legends of Callasia;Malaysia;Choose your faction. Choose your heroes. Choose your troops. Conquer lands, create kingdoms, and destroy your enemies. All the lands of Callasia are yours to dominate in this original...;https://shared.cloudflare.steamstatic.com/store_item_assets/steam/apps/438920/header.jpg?t=1691120112;Boomzap Inc;Boomzap Inc;Windows;10 Jun, 2016;Strategy;https://store.steampowered.com/app/438920/Legends_of_Callasia/;Unknown;Unknown;Unknown;Unknown;Unknown
Lulu Way;Malaysia;Lulu the little astronaut is trapped in space. Help Lulu escape eternal limbo by jumping from one block to another, solving uniquely crafted puzzles is the only way!;https://shared.cloudflare.steamstatic.com/store_item_assets/steam/apps/1897990/header.jpg?t=1651236088;One Eyed Deer;One Eyed Deer;Windows;29 Apr, 2022;Action, Casual, Indie;https://store.steampowered.com/app/1897990/Lulu_Way/;Unknown;Unknown;Unknown;Unknown;Unknown
Malice;Malaysia;You fall through a sinkhole into a nightmarish Japanese mansion with a lingering, sinister presence and terrifying threats… and the only way out is deeper in. Malice is a two-player...;https://shared.cloudflare.steamstatic.com/store_item_assets/steam/apps/1799220/header.jpg?t=1701851076;SCRYsoft;Nimbus Games;Windows;2 Nov, 2022;Action, Adventure, Indie, Simulation;https://store.steampowered.com/app/1799220/Malice/;Unknown;Unknown;Unknown;Unknown;Unknown
Memoir;Malaysia;Explore the ruins of an ancient castle and solve puzzles to guide a little deer kin through the areas.;https://shared.cloudflare.steamstatic.com/store_item_assets/steam/apps/811040/header.jpg?t=1556205895;Ren Production Sdn Bhd;Lai Ze Ren, Oori;Windows, macOS;27 Apr, 2018;Adventure, Indie;https://store.steampowered.com/app/811040/Memoir/;Unknown;Unknown;Unknown;Unknown;Unknown
Memories of East Coast;Malaysia;An immersive visual novel experience that brings you on a journey through memory, nostalgia, and guilt.;https://shared.cloudflare.steamstatic.com/store_item_assets/steam/apps/1607430/header.jpg?t=1672473207;Roomah Gaming;Roomah Gaming;Windows;1 Jun, 2021;Casual, Indie;https://store.steampowered.com/app/1607430/Memories_of_East_Coast/;Unknown;Unknown;Unknown;Unknown;Unknown
Midwest 90: Rapid City;Malaysia;Midwest 90: Rapid City is a story focused, restaurant- tycoon, survival game. Overcome the struggles of running a restaurant during a Monster Apocalypse by serving monster meat dishes...;https://shared.cloudflare.steamstatic.com/store_item_assets/steam/apps/1818480/header.jpg?t=1743264813;Hidden Chest Studios;Hidden Chest Studios;Windows;To be announced;Indie, Simulation, Strategy;https://store.steampowered.com/app/1818480/Midwest_90_Rapid_City/;Unknown;Unknown;Unknown;Unknown;Unknown
Monster Hunters: Frost Giant;Malaysia;Follow the exciting adventures of this monster hunting family as they bring you on an epic journey. What started as a coming of age story quickly turned into a fight for survival when...;https://shared.cloudflare.steamstatic.com/store_item_assets/steam/apps/2193990/header.jpg?t=1667956602;Lamonade Games;Lamonade Games;Windows;8 Nov, 2022;Adventure, Indie, RPG, Strategy;https://store.steampowered.com/app/2193990/Monster_Hunters_Frost_Giant/;Unknown;Unknown;Unknown;Unknown;Unknown
Monster Slayers;Malaysia;Monster Slayers is a rogue-like deck-building RPG adventure. Create a hero and choose your path through the perilous Northern Valley as you battle to become a true Monster Slayer.;https://shared.cloudflare.steamstatic.com/store_item_assets/steam/apps/496620/header.jpg?t=1630517695;Digerati;Nerdook Productions;Windows, macOS;23 Mar, 2017;Action, Indie;https://store.steampowered.com/app/496620/Monster_Slayers/;Unknown;Unknown;Unknown;Unknown;Unknown
Mr Rabbit's Cambridge Point and Click Adventure;Malaysia;Discover an imagery Cambridge in this dynamic point and click adventure game. Find Mr Rabbit before The SS P320 leaves!;https://shared.cloudflare.steamstatic.com/store_item_assets/steam/apps/2332780/header.jpg?t=1694402066;SoyaDaizu;SoyaDaizu;Windows, macOS;30 Mar, 2023;Adventure, Casual, Indie;https://store.steampowered.com/app/2332780/Mr_Rabbits_Cambridge_Point_and_Click_Adventure/;Unknown;Unknown;Unknown;Unknown;Unknown
My Next Life as a Bird;Malaysia;"""My Next Life as a Bird"" is a speedrun platformer game. Players can customize various mechanics using ""Bird Coins,"" evade incoming magical projectiles, and aim to reach the finish lin...";https://shared.cloudflare.steamstatic.com/store_item_assets/steam/apps/2627150/header.jpg?t=1700047194;WaveBreak;WaveBreak;Windows;15 Nov, 2023;Casual, Indie;https://store.steampowered.com/app/2627150/My_Next_Life_as_a_Bird/;Unknown;Unknown;Unknown;Unknown;Unknown
NULLSPACE;Malaysia;Experience epic space battles in NULLSPACE, a story driven real-time strategy set in a retrofuturistic universe. Command massive fleets across the battlefield or jump in and take dire...;https://shared.cloudflare.steamstatic.com/store_item_assets/steam/apps/2363280/header.jpg?t=1742974622;Kaigan Games;Kaigan Games;Windows;To be announced;Strategy;https://store.steampowered.com/app/2363280/NULLSPACE/;Unknown;Unknown;Unknown;Unknown;Unknown
Nantara Adventures;Malaysia;Grow in virtue or infamy amongst others as you fight your way to become a renowned guild in a roguelike procedurally generated unique world of Nantara.;https://shared.cloudflare.steamstatic.com/store_item_assets/steam/apps/2456580/2507186024de31a0468381ccab42bfe01ed20221/header.jpg?t=1744690265;Moredoor Interactive;Moredoor Interactive;Windows, SteamOS + Linux;To be announced;Action, Adventure, Indie, RPG;https://store.steampowered.com/app/2456580/Nantara_Adventures/;Unknown;Unknown;Unknown;Unknown;Unknown
