Name;Country;Description;Thumbnail;Publisher_Names;Developer_Names;Platform;Release_Date;Genre;Steam_Link;Epic_Link;PlayStation_Link;Xbox_Link;Switch_Link;GOG_Link
Bloody Hell;Netherlands;A short but sweet game about an Angel on a Bloody Bullet-hell mission to kill Satan! Dash, Double Dash, Grapple & Blast your way through Hell to fulfill your Holy Mission. Will you be...;https://shared.cloudflare.steamstatic.com/store_item_assets/steam/apps/2056220/header.jpg?t=1721415490;Pun Intended;Pun Intended;Windows;27 Jan, 2023;Action, Adventure, Indie, Free To Play;https://store.steampowered.com/app/2056220/Bloody_Hell/;Unknown;Unknown;Unknown;Unknown;Unknown
Frog Detective 1: The Haunted Island;Netherlands;You're a detective, and a frog, and it's time to solve a mystery.;https://shared.cloudflare.steamstatic.com/store_item_assets/steam/apps/963000/header.jpg?t=1746201247;worm club, SUPERHOT PRESENTS;Grace Bruxner, Thomas Bowker;Windows, macOS;22 Nov, 2018;Adventure, Casual, Indie;https://store.steampowered.com/app/963000/Frog_Detective_1_The_Haunted_Island/;Unknown;Unknown;Unknown;Unknown;Unknown
Frog Detective 2: The Case of the Invisible Wizard;Netherlands;You're a detective, and a frog, and it's time to solve a mystery. Also there's a wizard.;https://shared.cloudflare.steamstatic.com/store_item_assets/steam/apps/1047220/header.jpg?t=1746201438;worm club, SUPERHOT PRESENTS;Grace Bruxner, Thomas Bowker;Windows, macOS;9 Dec, 2019;Adventure, Casual, Indie;https://store.steampowered.com/app/1047220/Frog_Detective_2_The_Case_of_the_Invisible_Wizard/;Unknown;Unknown;Unknown;Unknown;Unknown
Frog Detective 3: Corruption at Cowboy County;Netherlands;You're a detective, and a frog, and it's time to solve a mystery in the wild west.;https://shared.cloudflare.steamstatic.com/store_item_assets/steam/apps/1171320/header.jpg?t=1746201618;worm club, SUPERHOT PRESENTS;Grace Bruxner, Thomas Bowker;Windows, macOS;26 Oct, 2022;Adventure, Casual, Indie;https://store.steampowered.com/app/1171320/Frog_Detective_3_Corruption_at_Cowboy_County/;Unknown;Unknown;Unknown;Unknown;Unknown
Frog's Adventure;Netherlands;You're a frog who just got given a brain! 🐸 Point-and-click your way through a hand-drawn world and solve puzzles, collect items and talk to other hexed animals. . . Can you lift t...;https://shared.cloudflare.steamstatic.com/store_item_assets/steam/apps/2535670/header.jpg?t=1701637851;Sokpop Collective;Sokpop Collective;Windows, macOS;2 Aug, 2023;Adventure, Casual, Indie, RPG;https://store.steampowered.com/app/2535670/Frogs_Adventure/;Unknown;Unknown;Unknown;Unknown;Unknown
Herald: An Interactive Period Drama - Book I & II;Netherlands;Herald is a choice-driven adventure set on colonial tides. Board the HLV Herald and uncover its dark secrets in an intriguing tale about tyranny and servitude.;https://shared.cloudflare.steamstatic.com/store_item_assets/steam/apps/380810/e16c222195771323a8537d9c85397608b87e4379/header.jpg?t=1746173970;Wispfire;Wispfire;Windows, macOS, SteamOS + Linux;22 Feb, 2017;Adventure, Indie;https://store.steampowered.com/app/380810/Herald_An_Interactive_Period_Drama__Book_I__II/;Unknown;Unknown;Unknown;Unknown;Unknown
Isonzo;Netherlands;Ferocious Alpine warfare will test your tactical skills in this authentic WW1 FPS. Battle among the scenic peaks, rugged valleys and idyllic towns of northern Italy. The Great War on ...;https://shared.cloudflare.steamstatic.com/store_item_assets/steam/apps/1556790/bc8efee0bfa4745584a506cdf1ab8c0721b32dc8/header_alt_assets_10.jpg?t=1745844938;BlackMill Games;BlackMill Games;Windows, macOS, SteamOS + Linux;13 Sep, 2022;Action, Indie, Massively Multiplayer, Simulation, Strategy;https://store.steampowered.com/app/1556790/Isonzo/;Unknown;Unknown;Unknown;Unknown;Unknown
Lumini;Netherlands;A long-forgotten species, a hostile planet and a journey of discovery! Welcome to the world of Lumini – split and reform your swarm, evolve and discover new abilities to bring the L...;https://shared.cloudflare.steamstatic.com/store_item_assets/steam/apps/360840/header.jpg?t=1710786333;2Awesome Studio;Speelbaars;Windows, macOS, SteamOS + Linux;3 Sep, 2015;Adventure, Indie;https://store.steampowered.com/app/360840/Lumini/;Unknown;Unknown;Unknown;Unknown;Unknown
Milo and the Magpies;Netherlands;Milo and the Magpies is a point-and-click, hidden object game following the story of a little cat named Milo who is trying to find his way home after getting turned around by an unfor...;https://shared.cloudflare.steamstatic.com/store_item_assets/steam/apps/1407420/header.jpg?t=1703496388;Second Maze;Johan Scherft;Windows, macOS;7 Sep, 2021;Adventure, Indie;https://store.steampowered.com/app/1407420/Milo_and_the_Magpies/;Unknown;Unknown;Unknown;Unknown;Unknown
News Tower;Netherlands;Develop your newspaper and become New York’s new media mogul! In this tycoon, build and manage your newspaper from printer to toilet. Create your editorial line and lead your journa...;https://shared.cloudflare.steamstatic.com/store_item_assets/steam/apps/1649950/header.jpg?t=1744301267;Twin Sails Interactive;Sparrow Night;Windows, macOS;13 Feb, 2024;Simulation, Strategy, Early Access;https://store.steampowered.com/app/1649950/News_Tower/;Unknown;Unknown;Unknown;Unknown;Unknown
Prickle;Netherlands;Play father hedgehog on a quest to bring his prickly children back home, in this wholesome grid-based puzzle.;https://shared.cloudflare.steamstatic.com/store_item_assets/steam/apps/2759760/header.jpg?t=1738800487;Sunbird Studio;Sunbird Studio;Windows, macOS, SteamOS + Linux;22 Nov, 2024;Indie;https://store.steampowered.com/app/2759760/Prickle/;Unknown;Unknown;Unknown;Unknown;Unknown
RUMBLE;Netherlands;Become the greatest RUMBLE fighter the world has ever seen! By performing specific martial-arts inspired movements, you can control the earth around you. Gain mastery over this power,...;https://shared.cloudflare.steamstatic.com/store_item_assets/steam/apps/890550/header.jpg?t=1742840559;Buckethead Entertainment;Buckethead Entertainment;Windows;23 Sep, 2022;Action, Sports, Early Access;https://store.steampowered.com/app/890550/RUMBLE/;Unknown;Unknown;Unknown;Unknown;Unknown
Rusty Lake Hotel;Netherlands;Are you ready to serve the guests in the Rusty Lake Hotel? Solve all mysteries in this dark and eerie puzzle game. Rusty Lake Hotel is a point-and-click adventure by the creators of t...;https://shared.cloudflare.steamstatic.com/store_item_assets/steam/apps/435120/header.jpg?t=1746052885;Rusty Lake;Rusty Lake;Windows, macOS;29 Jan, 2016;Adventure, Indie;https://store.steampowered.com/app/435120/Rusty_Lake_Hotel/;Unknown;Unknown;Unknown;Unknown;Unknown
SCHiM;Netherlands;SCHiM is a game about jumping from shadow to shadow in a relaxing and lively environment. This 3D platformer takes elements of light, shadow & animation and adds them directly to the ...;https://shared.cloudflare.steamstatic.com/store_item_assets/steam/apps/1519710/header.jpg?t=1734949868;Extra Nice, PLAYISM;Ewoud van der Werf, Nils Slijkerman;Windows, macOS, SteamOS + Linux;18 Jul, 2024;Adventure, Casual, Indie;https://store.steampowered.com/app/1519710/SCHiM/;Unknown;Unknown;Unknown;Unknown;Unknown
Scott Pilgrim vs. The World™: The Game – Complete Edition;Netherlands;Rediscover the beloved 2D arcade-style beat 'em up inspired by the iconic comic and movie Scott Pilgrim vs. The World!;https://shared.cloudflare.steamstatic.com/store_item_assets/steam/apps/2215260/header.jpg?t=1673000566;Ubisoft;Engine Software, Ubisoft Montreal, Ubisoft Chengdu, Ubisoft Pune Production;Windows;5 Jan, 2023;Action, Adventure;https://store.steampowered.com/app/2215260/Scott_Pilgrim_vs_The_World_The_Game__Complete_Edition/;Unknown;Unknown;Unknown;Unknown;Unknown
SpeedRunners;Netherlands;Cut-throat multiplayer running game that pits 4 players against each other, locally and/or online. Run, jump, swing around, and use devious weapons and pick-ups to knock opponents off...;https://shared.cloudflare.steamstatic.com/store_item_assets/steam/apps/207140/77a8927116d04679ac9e09c88a5360914ccbccc8/header_alt_assets_0.jpg?t=1744311256;tinyBuild;DoubleDutch Games;Windows, macOS, SteamOS + Linux;19 Apr, 2016;Action, Casual, Indie, Racing, Sports;https://store.steampowered.com/app/207140/SpeedRunners/;Unknown;Unknown;Unknown;Unknown;Unknown
Stacklands;Netherlands;Stacklands is a village builder where you stack cards to collect food, build structures, and fight creatures. 🃏 For example, dragging a Villager card on top of a Berry Bush card wi...;https://shared.cloudflare.steamstatic.com/store_item_assets/steam/apps/1948280/header.jpg?t=1729241259;Sokpop Collective;Sokpop Collective;Windows, macOS;8 Apr, 2022;Casual, Indie, Simulation;https://store.steampowered.com/app/1948280/Stacklands/;Unknown;Unknown;Unknown;Unknown;Unknown
Swords and Soldiers 2 Shawarmageddon;Netherlands;Take command of mighty Vikings, sly Persians or brutish Demons! Destroy your opponent’s base while defending your own in this action-packed side-scrolling RTS!;https://shared.cloudflare.steamstatic.com/store_item_assets/steam/apps/703880/header.jpg?t=1715018131;Atari;Ronimo Games;Windows;6 Nov, 2018;Action, Indie, Strategy;https://store.steampowered.com/app/703880/Swords_and_Soldiers_2_Shawarmageddon/;Unknown;Unknown;Unknown;Unknown;Unknown
The Past Within;Netherlands;The Past Within is the new co-op experience from Rusty Lake! Play together with someone you deem trustworthy: one in The Past, the other in The Future. Observe and communicate what yo...;https://shared.cloudflare.steamstatic.com/store_item_assets/steam/apps/1515210/header.jpg?t=1740070156;Rusty Lake;Rusty Lake;Windows, macOS;2 Nov, 2022;Adventure, Indie;https://store.steampowered.com/app/1515210/The_Past_Within/;Unknown;Unknown;Unknown;Unknown;Unknown
Tiny Terry's Turbo Trip;Netherlands;Terry wants to launch himself into space using his new car. Doing something this cool and reckless will surely make him the talk of the town. Run, drive and glide through this small j...;https://shared.cloudflare.steamstatic.com/store_item_assets/steam/apps/2238040/header.jpg?t=1734089791;Super Rare Originals;snekflat;Windows;30 May, 2024;Adventure, Casual, Indie, RPG;https://store.steampowered.com/app/2238040/Tiny_Terrys_Turbo_Trip/;Unknown;Unknown;Unknown;Unknown;Unknown
Tricky Towers;Netherlands;With your brilliant robe and magic powers, it’s time to build some Tricky Towers! Stack your bricks in this land of fable, whose marvelous tower will be the most stable? Battle your...;https://shared.cloudflare.steamstatic.com/store_item_assets/steam/apps/437920/header.jpg?t=1730451129;WeirdBeard;WeirdBeard;Windows, macOS, SteamOS + Linux;2 Aug, 2016;Casual, Indie;https://store.steampowered.com/app/437920/Tricky_Towers/;Unknown;Unknown;Unknown;Unknown;Unknown
Underground Blossom;Netherlands;Underground Blossom is a new adventure game by Rusty Lake. Fulfil various tasks at every station to find the metro that will take you through each important event from Laura Vanderboo...;https://shared.cloudflare.steamstatic.com/store_item_assets/steam/apps/2291850/header.jpg?t=1713632188;Rusty Lake;Rusty Lake;Windows, macOS;27 Sep, 2023;Adventure, Indie;https://store.steampowered.com/app/2291850/Underground_Blossom/;Unknown;Unknown;Unknown;Unknown;Unknown
We Were Here;Netherlands;Lost in a frozen wasteland and split up from your partner inside an abandoned castle, the only possession you have left is a walkie-talkie with a familiar voice on the other end. Can ...;https://shared.cloudflare.steamstatic.com/store_item_assets/steam/apps/582500/header.jpg?t=1744796388;Total Mayhem Games;Total Mayhem Games;Windows, macOS;3 Feb, 2017;Action, Adventure, Indie, Free To Play;https://store.steampowered.com/app/582500/We_Were_Here/;Unknown;Unknown;Unknown;Unknown;Unknown
We Were Here Expeditions: The FriendShip;Netherlands;Partner up with your friend online and test your friendship by solving puzzles together in an abandoned amusement park. Work together to overcome brain-teasing challenges in this stan...;https://shared.cloudflare.steamstatic.com/store_item_assets/steam/apps/2296990/header.jpg?t=1730303893;Total Mayhem Games;Total Mayhem Games;Windows;14 Sep, 2023;Adventure, Casual, Indie;https://store.steampowered.com/app/2296990/We_Were_Here_Expeditions_The_FriendShip/;Unknown;Unknown;Unknown;Unknown;Unknown
Zeepkist;Netherlands;Welcome to Zeepkist! You race soapboxes down hills!;https://shared.cloudflare.steamstatic.com/store_item_assets/steam/apps/1440670/header.jpg?t=1732068251;Steelpan Interactive;Steelpan Interactive;Windows;28 Jan, 2021;Action, Indie, Racing, Sports, Early Access;https://store.steampowered.com/app/1440670/Zeepkist/;Unknown;Unknown;Unknown;Unknown;Unknown
