Name;Country;Description;Thumbnail;Publisher_Names;Developer_Names;Platform;Release_Date;Genre;Steam_Link;Epic_Link;PlayStation_Link;Xbox_Link;Switch_Link;GOG_Link
64.0;Peru;64.0 is a minimal fast-paced arcade game, where you shoot the squares that have the same color as the background.;https://shared.cloudflare.steamstatic.com/store_item_assets/steam/apps/578850/header.jpg?t=1691435831;rebel rabbit;rebel rabbit;Windows, macOS;16 Mar, 2017;Action, Indie;https://store.steampowered.com/app/578850/640/;Unknown;Unknown;Unknown;Unknown;Unknown
A Dance of Fire and Ice;Peru;A Dance of Fire and Ice is a strict rhythm game. Keep your focus as you guide two orbiting planets along a winding path without breaking their perfect equilibrium.;https://shared.cloudflare.steamstatic.com/store_item_assets/steam/apps/977950/header.jpg?t=1734406213;7th Beat Games, indienova;7th Beat Games;Windows, macOS, SteamOS + Linux;24 Jan, 2019;Indie;https://store.steampowered.com/app/977950/A_Dance_of_Fire_and_Ice/;Unknown;Unknown;Unknown;Unknown;Unknown
Arrog;Peru;Arrog is an enigmatic puzzle adventure game featuring hand-drawn art and set in a bizarre black-and-white world with color accents.;https://shared.cloudflare.steamstatic.com/store_item_assets/steam/apps/1185700/header.jpg?t=1729491414;indienova;LEAP Game Studios, Hermanos Magia;Windows;28 Jul, 2020;Adventure, Indie;https://store.steampowered.com/app/1185700/Arrog/;Unknown;Unknown;Unknown;Unknown;Unknown
Avatar: The Last Airbender - Quest for Balance;Peru;Team Avatar is back! Relive the epic adventure of the original Avatar: The Last Airbender series, as you play as Aang and his 8 friends to explore the most unique locations from the ...;https://shared.cloudflare.steamstatic.com/store_item_assets/steam/apps/1620030/header.jpg?t=1746025140;GameMill Entertainment;Bamtang Games;Windows;22 Sep, 2023;Action;https://store.steampowered.com/app/1620030/Avatar_The_Last_Airbender__Quest_for_Balance/;Unknown;Unknown;Unknown;Unknown;Unknown
Capelord: Bounty Hunters;Peru;Capelord:Bounty Hunter is a multiplayer lateral action shooter for up to 4 players, play campaign missions alone or as a team, compete against other players for loot by defeating the ...;https://shared.cloudflare.steamstatic.com/store_item_assets/steam/apps/1880870/header.jpg?t=1655849308;Wirasoft;Wirasoft;Windows;To be announced;Action, Indie, Massively Multiplayer;https://store.steampowered.com/app/1880870/Capelord_Bounty_Hunters/;Unknown;Unknown;Unknown;Unknown;Unknown
Coins Invaders;Peru;Save Bitcoin from this currency madness by destroying altcoins while the Fed keeps us in this currency issuance currency madness;https://shared.cloudflare.steamstatic.com/store_item_assets/steam/apps/1710840/header.jpg?t=1672433153;Netdreams - Regob EIRL;Adrian Blume, Rafael Gonzalez-Otoya B.;Windows;15 Feb, 2022;Action, Adventure, Casual, Indie;https://store.steampowered.com/app/1710840/Coins_Invaders/;Unknown;Unknown;Unknown;Unknown;Unknown
Dicefolk;Peru;Wield magical dice and build a team of powerful Chimeras to stop a mysterious evil in this tactical roguelite adventure. As a Chimera Summoner, recruit and create your perfect team of...;https://shared.cloudflare.steamstatic.com/store_item_assets/steam/apps/1996430/header.jpg?t=1728984525;Good Shepherd Entertainment;LEAP Game Studios, Tiny Ghoul;Windows;27 Feb, 2024;Casual, Indie, Strategy;https://store.steampowered.com/app/1996430/Dicefolk/;Unknown;Unknown;Unknown;Unknown;Unknown
Dan the Inmortal;Peru;Dan wants to reach the top to drink the fountain of mortality, will he be able to reach his goal?;https://shared.cloudflare.steamstatic.com/store_item_assets/steam/apps/2062830/header.jpg?t=1666988125;Max Valentino Calderon reyes;Max Valentino Calderon Reyes;Windows;3 Aug, 2022;Casual, Indie;https://store.steampowered.com/app/2062830/Dan_the_Inmortal/;Unknown;Unknown;Unknown;Unknown;Unknown
DarkStory Online;Peru;Bring the past back to life and live a new story in DarkStory, It's an authentic MMORPG 2D inspired by classic old-school RPGs. With hundreds of gameplay hours, immerse yourself with ...;https://shared.cloudflare.steamstatic.com/store_item_assets/steam/apps/1020780/header.jpg?t=1644289694;BraveWolf;BraveWolf;Windows;22 May, 2020;Action, Adventure, Free To Play, Indie, Massively Multiplayer, RPG;https://store.steampowered.com/app/1020780/DarkStory_Online/;Unknown;Unknown;Unknown;Unknown;Unknown
DreamWorks All-Star Kart Racing;Peru;An all-star cast of iconic DreamWorks characters brings the fun and hilarity to high-speed kart racing action like never before! Race on 20 different DreamWorks-themed tracks with you...;https://shared.cloudflare.steamstatic.com/store_item_assets/steam/apps/2224740/header.jpg?t=1746025480;GameMill Entertainment;Bamtang Games;Windows;3 Nov, 2023;Racing;https://store.steampowered.com/app/2224740/DreamWorks_AllStar_Kart_Racing/;Unknown;Unknown;Unknown;Unknown;Unknown
Duel on Board;Peru;Duel on Board is a 1 vs 1 local multiplayer competitive / party game where pirates fight for the precious beer while sailing the dangerous high seas. Just like old school games, you c...;https://shared.cloudflare.steamstatic.com/store_item_assets/steam/apps/612040/header.jpg?t=1618454185;indienova;rebel rabbit;Windows, macOS;4 Mar, 2021;Action, Casual, Indie;https://store.steampowered.com/app/612040/Duel_on_Board/;Unknown;Unknown;Unknown;Unknown;Unknown
El Hincha - El Videojuego;Peru;El hincha is a video game that presents Luchito in his quest to go to the world through many places;https://shared.cloudflare.steamstatic.com/store_item_assets/steam/apps/865370/header.jpg?t=1562640863;XBIT S.A.C;LABASE Entertainment;Windows;19 Jun, 2018;Action, Adventure, Casual, Free To Play, Indie, Sports, Early Access;https://store.steampowered.com/app/865370/El_Hincha__El_Videojuego/;Unknown;Unknown;Unknown;Unknown;Unknown
Gobernators (Parodia política peruana);Peru;Un absurdo plataformas de disparos 2.5D inspirado en lo absurdo de las elecciones presidenciales peruanas.;https://shared.cloudflare.steamstatic.com/store_item_assets/steam/apps/525370/header.jpg?t=1475970164;Elcaelum;Elcaelum, CGA Studio;Windows;4 Jun, 2016;Action, Free To Play, Indie;https://store.steampowered.com/app/525370/Gobernators_Parodia_politica_peruana/;Unknown;Unknown;Unknown;Unknown;Unknown
Imp of the Sun;Peru;Restore the Sun’s light and end the Eternal Eclipse in this 2D fast-paced action-platformer game inspired by Peruvian cultures. Explore hand-crafted environments, battle and improve...;https://shared.cloudflare.steamstatic.com/store_item_assets/steam/apps/1535780/header.jpg?t=1715614778;Fireshine Games;Sunwolf Entertainment;Windows;24 Mar, 2022;Action, Adventure, Indie;https://store.steampowered.com/app/1535780/Imp_of_the_Sun/;Unknown;Unknown;Unknown;Unknown;Unknown
Mago;Peru;Mago is a retro 2D platformer that puts us in the boots of a sorcerer, who was unfortunate enough to eat evil overlords' food. Now he has to rescue his beloved princess from the dinne...;https://shared.cloudflare.steamstatic.com/store_item_assets/steam/apps/1098280/header.jpg?t=1704919332;Dream Potion Games;Dream Potion Games;Windows;21 Jun, 2022;Adventure, Indie;https://store.steampowered.com/app/1098280/Mago/;Unknown;Unknown;Unknown;Unknown;Unknown
Mago: The Villain's Burger;Peru;Mago: The Villain's Burger is a retro 2D platformer that puts us in the boots of a sorcerer, who was unfortunate enough to eat evil overlord's food. Now he has to rescue his beloved p...;https://shared.cloudflare.steamstatic.com/store_item_assets/steam/apps/1809650/header.jpg?t=1656350445;HypeTrain Digital;Dream Potion Games;Windows;7 Feb, 2022;Action, Adventure, Indie;https://store.steampowered.com/app/1809650/Mago_The_Villains_Burger/;Unknown;Unknown;Unknown;Unknown;Unknown
Nickelodeon Kart Racers 2: Grand Prix;Peru;Nickelodeon Kart Racers is back and we’re kicking it into overdrive! In Nickelodeon Kart Racers 2: Grand Prix, you can select from 30 playable racers and 70 team members to assemble...;https://shared.cloudflare.steamstatic.com/store_item_assets/steam/apps/1383960/header.jpg?t=1746026506;GameMill Entertainment;Bamtang Games;Windows;1 Dec, 2020;Action, Casual, Racing;https://store.steampowered.com/app/1383960/Nickelodeon_Kart_Racers_2_Grand_Prix/;Unknown;Unknown;Unknown;Unknown;Unknown
Nickelodeon Kart Racers 3: Slime Speedway;Peru;Nickelodeon Kart Racers 3: Slime Speedway features a cast of over 40 iconic characters, drift, slide and boost your way to the finish line on tracks inspired by legendary Nickelodeon ...;https://shared.cloudflare.steamstatic.com/store_item_assets/steam/apps/1620040/header.jpg?t=1746026529;GameMill Entertainment;Bamtang Games;Windows;14 Oct, 2022;Racing;https://store.steampowered.com/app/1620040/Nickelodeon_Kart_Racers_3_Slime_Speedway/;Unknown;Unknown;Unknown;Unknown;Unknown
Night Reverie;Peru;Night Reverie is a Puzzle/Adventure game in which a child must solve the mystery behind the distortion of his house. Explore puzzle-filled environments and discover strange creatures ...;https://shared.cloudflare.steamstatic.com/store_item_assets/steam/apps/1254670/header.jpg?t=1726251512;Somber Pixel, indienova;Somber Pixel;Windows;8 Oct, 2021;Adventure, Casual, Indie;https://store.steampowered.com/app/1254670/Night_Reverie/;Unknown;Unknown;Unknown;Unknown;Unknown
Rhythm Doctor;Peru;Save patients with your rhythm mastery! Rhythm Doctor is a rhythm game where you heal patients by defibrillating in time to their heartbeats. Learn each patient's unique heartbeat and...;https://shared.cloudflare.steamstatic.com/store_item_assets/steam/apps/774181/header.jpg?t=1741877372;7th Beat Games, indienova;7th Beat Games;Windows, macOS, SteamOS + Linux;26 Feb, 2021;Indie, Early Access;https://store.steampowered.com/app/774181/Rhythm_Doctor/;Unknown;Unknown;Unknown;Unknown;Unknown
SU the Son of Gaia;Peru;Explore the land of Panacea and its secrets in this vibrant and colorful pixelart Action RPG and help SU in his adventure to recover the balance of the contaminated ecosystems.;https://shared.cloudflare.steamstatic.com/store_item_assets/steam/apps/1986910/header.jpg?t=1676082997;Zeoarts Inc;Zeoarts Inc, rebel rabbit;Windows;To be announced;Action, Adventure, Indie, RPG;https://store.steampowered.com/app/1986910/SU_the_Son_of_Gaia/;Unknown;Unknown;Unknown;Unknown;Unknown
Suns of Wiraqocha;Peru;Help the God Wiraqocha to recover all the stolen suns that have been hidden in different dimensions, which you can access through the Great Gate of the Sun, to return light to the Mil...;https://shared.cloudflare.steamstatic.com/store_item_assets/steam/apps/2132370/header.jpg?t=1708377228;Netdreams - Regob EIRL;Alejandro Medina, Rafael Gonzalez-Otoya B., Adrian Blume;Windows;27 Oct, 2023;Adventure, Casual, Indie;https://store.steampowered.com/app/2132370/Suns_of_Wiraqocha/;Unknown;Unknown;Unknown;Unknown;Unknown
Tunche;Peru;Tunche is a charming hand-drawn action game with roguelike elements. Team up with your friends or play solo. Choose from 5 unique characters and restore peace in the Amazon rainforest!;https://shared.cloudflare.steamstatic.com/store_item_assets/steam/apps/887450/header.jpg?t=1721399704;HypeTrain Digital;LEAP Game Studios;Windows;2 Nov, 2021;Action, Adventure, Casual, Indie, RPG;https://store.steampowered.com/app/887450/Tunche/;Unknown;Unknown;Unknown;Unknown;Unknown
Tunche: Arena;Peru;Try the challenging Arena mode, a free standalone version of an upcoming hand-drawn beat’em up adventure Tunche, a glorious return of classic 2D beat'em up gameplay mixed with rogue...;https://shared.cloudflare.steamstatic.com/store_item_assets/steam/apps/906200/header.jpg?t=1615639226;HypeTrain Digital;LEAP Game Studios;Windows;18 Jan, 2019;Action, Free To Play, Indie;https://store.steampowered.com/app/906200/Tunche_Arena/;Unknown;Unknown;Unknown;Unknown;Unknown
Viral Execution;Peru;If you like challenges, complete the ten levels available in its five difficulty modes to overcome the objective proposed by Viral Execution. Manage your ammunition well and get all t...;https://shared.cloudflare.steamstatic.com/store_item_assets/steam/apps/1333950/header.jpg?t=1721761919;WBStudios Games;INTI Game Productions;Windows;22 Jul, 2020;Action, Adventure, Indie;https://store.steampowered.com/app/1333950/Viral_Execution/;Unknown;Unknown;Unknown;Unknown;Unknown
Wira & Taksa: Against the Master of Gravity;Peru;Wira & Taksa is a videogame that mixes the platforms and breaks heads, adding to them the special component of mixing the gravities of the universe to generate in the users a fantasti...;https://shared.cloudflare.steamstatic.com/store_item_assets/steam/apps/710620/header.jpg?t=1598504572;3S Design;3S Design;Windows;26 Aug, 2020;Action, Adventure, Casual, Indie, Early Access;https://store.steampowered.com/app/710620/Wira__Taksa_Against_the_Master_of_Gravity/;Unknown;Unknown;Unknown;Unknown;Unknown
Yakuza Cats;Peru;Yakuza Cats is a graphic adventure set in a 100% feline Tokyo. This original world mixes Ukiyo-e art with Gen Z aesthetics. It is a coming of age story that puts the player through di...;https://shared.cloudflare.steamstatic.com/store_item_assets/steam/apps/1471950/header.jpg?t=1611077686;Bivium Games ;Bivium Games;Windows;To be announced;Adventure;https://store.steampowered.com/app/1471950/Yakuza_Cats/;Unknown;Unknown;Unknown;Unknown;Unknown
Yupi;Peru;Run, jump and collect coins .. Yupi has come to save us!;https://shared.cloudflare.steamstatic.com/store_item_assets/steam/apps/1619890/header.jpg?t=1644254654;Netdreams - Regob EIRL;Isaac Ortega, Rafael Gonzalez-Otoya B.;Windows;31 May, 2021;Adventure, Casual, Indie;https://store.steampowered.com/app/1619890/Yupi/;Unknown;Unknown;Unknown;Unknown;Unknown
Wild Wild Space;Peru;Welcome to the New Wild West! Join a space gang, become the galaxy's most dangerous outlaw, explore planets filled with enemy space gangs and shoot your way through them in this bulle...;https://shared.cloudflare.steamstatic.com/store_item_assets/steam/apps/2341430/header.jpg?t=1699543884;rebel rabbit;rebel rabbit;Windows, macOS, SteamOS + Linux;To be announced;Action, Adventure, Indie;https://store.steampowered.com/app/2341430/Wild_Wild_Space/;Unknown;Unknown;Unknown;Unknown;Unknown
Looney Tunes: Wacky World of Sports;Peru;Get ready for Basketball, Soccer, Golf and Tennis combined into one Looney Tunes sport game! Gain power-ups to incite chaos against your friends and family as you control your favorit...;https://shared.cloudflare.steamstatic.com/store_item_assets/steam/apps/2330430/header.jpg?t=1746026108;GameMill Entertainment;Bamtang Games;Windows;27 Sep, 2024;Sports;https://store.steampowered.com/app/2330430/Looney_Tunes_Wacky_World_of_Sports/;Unknown;Unknown;Unknown;Unknown;Unknown
Civilización Caral Perú, la más antigua de América;Peru;"VR experience of the ""Ceremonial Hall of the Pututus"" in Peñico, one of the 25 urban centers of the Caral Civilization, the oldest in America. Discovered by Dr. Ruth Shady's team, it...";https://shared.cloudflare.steamstatic.com/store_item_assets/steam/apps/3004270/header.jpg?t=1727983997;Zona Arqueologica Caral;Zona Arqueologica Caral;Windows;3 Oct, 2024;Casual, Indie, Free To Play, Education;https://store.steampowered.com/app/3004270/Civilizacion_Caral_Peru_la_mas_antigua_de_America/;Unknown;Unknown;Unknown;Unknown;Unknown
Ancings: The First Tournament;Peru;Ancings is a dynamic turn-based strategic fighting video game. As you win battles, you gain levels, new powers and new evolutions. Each enemy is unique, so they all have different att...;https://shared.cloudflare.steamstatic.com/store_item_assets/steam/apps/2775100/header.jpg?t=1732568229;Willians Ccahuana Nieto;Willians Ccahuana Nieto;Windows;25 Nov, 2024;Action, Indie, Strategy;https://store.steampowered.com/app/2775100/Ancings_The_First_Tournament/;Unknown;Unknown;Unknown;Unknown;Unknown
