Name;;Country;;Description;;Thumbnail;;Publisher_Names;;Developer_Names;;Platform;;Steam_Link;;Release_Date;;Genre;;Epic_Link;;Playstation_Link;;Xbox_Link;;Switch_Link
Semblance;;South Africa;;Semblance is an innovative platformer with deformable terrain, set in a beautiful minimalist world. It’s a game that asks, what if you could deform and reshape the world itself? Sembl...;;https://shared.cloudflare.steamstatic.com/store_item_assets/steam/apps/700160/header.jpg?t=1680797529;;Good Shepherd Entertainment;;Nyamakop;;Windows, macOS;;https://store.steampowered.com/app/700160/Semblance/;;24 Jul, 2018;;Action, Adventure, Casual, Indie;;Unknown;;Unknown;;Unknown;;Unknown
Broforce;;South Africa;;Broforce is an action-packed side-scrolling run ‘n’ gun ode to freedom, putting you in control of an under-funded, overpowered paramilitary organization dealing exclusively in exces...;;https://shared.cloudflare.steamstatic.com/store_item_assets/steam/apps/274190/header.jpg?t=1728690033;;Devolver Digital;;Free Lives;;Windows, macOS, SteamOS + Linux;;https://store.steampowered.com/app/274190/Broforce/;;15 Oct, 2015;;Action, Adventure, Casual, Indie;;Unknown;;Unknown;;Unknown;;Unknown
Boet Fighter;;South Africa;;BOET FIGHTER is a mega-schweet faaghting video game where Hard Eddy and his taaghtest charnas must moer all of Fourways in the face, as they faaght to reclaim his stolen binnet! It's go...;;https://shared.cloudflare.steamstatic.com/store_item_assets/steam/apps/1108350/header.jpg?t=1570546706;;Califourways;;Califourways;;Windows;;https://store.steampowered.com/app/1108350/Boet_Fighter/;;8 Oct, 2019;;Action, Indie;;Unknown;;Unknown;;Unknown;;Unknown
STASIS;;South Africa;;STASIS The isometric, point-and-click, sci-fi horror adventure game! In the distant future aboard a seemingly abandoned spacecraft, John Maracheck awakes from stasis. He must push himse...;;https://shared.cloudflare.steamstatic.com/store_item_assets/steam/apps/380150/header.jpg?t=1721030415;;THE BROTHERHOOD;;THE BROTHERHOOD;;Windows, macOS;;https://store.steampowered.com/app/380150/STASIS/;;31 Aug, 2015;;Adventure, Indie;;Unknown;;Unknown;;Unknown;;Unknown
GORN;;South Africa;;GORN is a ludicrously violent VR gladiator simulator, made by Free Lives, the developers of Broforce and Genital Jousting.;;https://shared.cloudflare.steamstatic.com/store_item_assets/steam/apps/578620/header.jpg?t=1728690184;;Devolver Digital;;Free Lives;;Windows;;https://store.steampowered.com/app/578620/GORN/;;18 Jul, 2019;;Action, Indie;;Unknown;;Unknown;;Unknown;;Unknown
