Name;;Country;;Description;;Thumbnail;;Publisher_Names;;Developer_Names;;Platform;;Steam_Link;;Release_Date;;Genre
Wizard's Way Out;;Sweden;;A small puzzle game about getting out of big trouble! Trapped in a prison, a Wizard uses telekinesis to push and pull their way out and escape together with newfound friends!;;https://shared.akamai.steamstatic.com/store_item_assets/steam/apps/2341410/header.jpg?t=1725008129;;Kikimora Games;;Kikimora Games;;Windows, SteamOS + Linux;;https://store.steampowered.com/app/2341410/Wizards_Way_Out/;;24 Apr, 2023;;Adventure, Casual, Indie
Rain of Reflections: Set Free;;Sweden;;Rain of Reflections is an atmospheric, dystopian adventure game with exploration and deep character interactions. Its turn-based strategic confrontations are uniquely centered around a motivation mechanic.;;https://shared.akamai.steamstatic.com/store_item_assets/steam/apps/695050/header.jpg?t=1572876316;;Lionbite Games;;Lionbite Games;;Windows;;https://store.steampowered.com/app/695050/Rain_of_Reflections_Set_Free/;;4 Oct, 2019;;Adventure, Indie, Strategy
Magicka 2;;Sweden;;The world’s most irreverent co-op action adventure returns! In the next chapter of Magicka, players ascend from the ruins of Aldrheim to experience a Midgård almost wiped free of Wizards after the Wizard Wars, with the few that do remain having either gone mad or extremely hostile toward all others;;https://shared.akamai.steamstatic.com/store_item_assets/steam/apps/238370/header.jpg?t=1709831158;;Paradox Interactive;;Pieces Interactive;;Windows, macOS, SteamOS + Linux;;https://store.steampowered.com/app/238370/Magicka_2/;;26 May, 2015;;Action, Adventure
Magicka;;Sweden;;Magicka is a satirical action-adventure game set in a rich fantasy world based on Norse mythology. The player assumes the role of a wizard from a sacred order tasked with stopping an evil sorcerer who has thrown the world into turmoil, his foul creations besieging the forces of good.;;https://shared.akamai.steamstatic.com/store_item_assets/steam/apps/42910/header.jpg?t=1615973729;;Paradox Interactive;;Arrowhead Game Studios;;Windows;;https://store.steampowered.com/app/42910/Magicka/;;25 Jan, 2011;;Action, RPG
Gauntlet™ Slayer Edition;;Sweden;;The classic Gauntlet 4-player co-op action gameplay returns in a completely new experience! Battle the endless hordes of foes as you and your friends fight for treasure and glory via both local and online co-op multiplayer. Invade the Darkness!;;https://shared.akamai.steamstatic.com/store_item_assets/steam/apps/258970/header.jpg?t=1568335399;;WB Games;;Arrowhead Game Studios;;Windows;;https://store.steampowered.com/app/258970/Gauntlet_Slayer_Edition/;;23 Sep, 2014;;Action, Adventure, RPG
Passpartout 2: The Lost Artist;;Sweden;;Embark on your struggling artist adventure. Draw and sell art to cheeky critics to reclaim your lost art career. Explore the endearing art-starved town of Phénix and show them you're a true artist!;;https://shared.akamai.steamstatic.com/store_item_assets/steam/apps/1571100/header.jpg?t=1717763400;;Flamebait Games;;Flamebait Games;;Windows, macOS;;https://store.steampowered.com/app/1571100/Passpartout_2_The_Lost_Artist/;;4 Apr, 2023;;Casual, Indie, Simulation
Passpartout: The Starving Artist;;Sweden;;Even you can become a great artist! Wrestle subjectivity as you attempt to sell your art to rude customers in order to progress in this confusing art scene. The only thing threatening you is your expensive wine and baguette addiction! Will your art end up in the Louvre or on your parents' fridge?;;https://shared.akamai.steamstatic.com/store_item_assets/steam/apps/582550/header.jpg?t=1717763868;;Flamebait Games, Gamera Games;;Flamebait Games;;Windows, macOS, SteamOS + Linux;;https://store.steampowered.com/app/582550/Passpartout_The_Starving_Artist/;;6 Jun, 2017;;Casual, Indie, Simulation
Forge and Fight!;;Sweden;;Craft, Defeat, Repeat! As a blacksmith gladiator, you must experiment with over-the-top weapon builds and engage in frenzied fighting, either in the online arena or the open-ended sandbox mode.;;https://shared.akamai.steamstatic.com/store_item_assets/steam/apps/1066810/header.jpg?t=1667903462;;Flamebait Games;;Flamebait Games;;Windows;;https://store.steampowered.com/app/1066810/Forge_and_Fight/;;17 Sep, 2020;;Action, Casual, Indie, Simulation
Verlet Swing;;Sweden;;Verlet Swing brings you energetic swinging in a world that would be best described as a fever dream. Swing fast, don't crash and reach the goal as fast as possible!;;https://shared.akamai.steamstatic.com/store_item_assets/steam/apps/811870/header.jpg?t=1722433762;;Flamebait Games;;Flamebait Games;;Windows, macOS;;https://store.steampowered.com/app/811870/Verlet_Swing/;;18 Sep, 2018;;Action, Indie
Just Read The Instructions;;Sweden;;Fight off thousands of enemies with a variety of powerful weapons in this surreal co-op shooter. Enter a simulation controlled by a corrupted AI to disrupt and destroy it. Explore procedural worlds, eliminate enemies, break logic, and watch it all collapse.;;https://shared.akamai.steamstatic.com/store_item_assets/steam/apps/1461370/header.jpg?t=1713359134;;Knackelibang Productions;;Knackelibang Productions;;Windows;;https://store.steampowered.com/app/1461370/Just_Read_The_Instructions/;;16 Apr, 2024;;Action, Indie, Early Access
Bombergrounds: Reborn;;Sweden;;BOMBERGROUNDS: Immerse in a free-to-play massive multiplayer action-packed arena inspired by classic bomber games. Dash, bomb, bat, and explode your way to victory. Your realm of relentless arcade action is just a click away—dive in and rule the grounds!;;https://shared.akamai.steamstatic.com/store_item_assets/steam/apps/1104450/header.jpg?t=1699276808;;Gigantic Duck Games;;Gigantic Duck Games;;Windows, macOS;;https://store.steampowered.com/app/1104450/Bombergrounds_Reborn/;;6 Oct, 2022;;Action, Adventure, Indie, Massively Multiplayer, Strategy, Free To Play
Taur;;Sweden;;Taur is an action-strategy sci-fi game. Control the Prime Cannon and unlock all of its powerful weapons and abilities. Build turrets, droids, aircraft and more as you fight to protect the homeworld of the Tauron droids against a relentless invasion. Will your Taur stand against the Imperion warmachine?;;https://shared.akamai.steamstatic.com/store_item_assets/steam/apps/1227780/header.jpg?t=1669210248;;Echo Entertainment;;Echo Entertainment;;Windows;;https://store.steampowered.com/app/1227780/Taur/;;20 Feb, 2020;;Action, Indie, Strategy
Lake Ridden;;Sweden;;Lake Ridden is a story-driven, first-person puzzle game! A cozy supernatural adventure where you unravel a mysterious past, trying to find your sister. Luckily, you are not alone...;;https://shared.akamai.steamstatic.com/store_item_assets/steam/apps/696530/header.jpg?t=1588514919;;Midnight Hub;;Midnight Hub;;Windows;;https://store.steampowered.com/app/696530/Lake_Ridden/;;10 May, 2018;;Adventure, Indie
Starmancer;;Sweden;;From a small 2-man team comes a unique space station management sim. Take on the role of an A.I commanding a lost space ark. Try not to let your crew run amok and wreck the place.;;https://shared.akamai.steamstatic.com/store_item_assets/steam/apps/1062000/header.jpg?t=1710365828;;Chucklefish;;Ominux Games;;Windows, macOS, SteamOS + Linux;;https://store.steampowered.com/app/1062000/Starmancer/;;5 Aug, 2021;;Indie, Simulation, Strategy, Early Access
OVERPASS™;;Sweden;;Take control of big-name buggies and quads to negotiate scree slopes, steep inclines and various obstacles on extreme off-road and technically challenging tracks. Find the best route, and manage your acceleration, differentials and drivetrain to dominate in local or online competitions.;;https://shared.akamai.steamstatic.com/store_item_assets/steam/apps/970840/header.jpg?t=1725351793;;Nacon;;Zordix Racing;;Windows;;https://store.steampowered.com/app/970840/OVERPASS/;;16 Mar, 2021;;Racing, Simulation, Sports
Unravel Two;;Sweden;;When you cut ties to the past, new bonds form. Build relationships with other Yarnys in local co-op or as a single player, fostering friendship and support as you journey together.;;https://shared.akamai.steamstatic.com/store_item_assets/steam/apps/1225570/header.jpg?t=1721053654;;Electronic Arts;;Coldwood Interactive;;Windows;;https://store.steampowered.com/app/1225570/Unravel_Two/;;9 Jun, 2018;;Action, Adventure
Unravel;;Sweden;;Unravel is a physics-based puzzle platformer. Yarny, a character made from a single thread of yarn, must embark on a larger than life adventure.;;https://shared.akamai.steamstatic.com/store_item_assets/steam/apps/1225560/header.jpg?t=1598618701;;Electronic Arts;;Coldwood Interactive;;Windows;;https://store.steampowered.com/app/1225560/Unravel/;;9 Feb, 2016;;Action, Adventure
FreakOut: Extreme Freeride;;Sweden;;The steepest slopes, thrilling stunts and dangerous action provide a most excellent skiing experience. At an altitude of 2000 metres, far away from civilization, in a battle between you and nature.;;https://shared.akamai.steamstatic.com/store_item_assets/steam/apps/304540/header.jpg?t=1562843208;;THQ Nordic;;Coldwood Interactive;;Windows;;https://store.steampowered.com/app/304540/FreakOut_Extreme_Freeride/;;28 Aug, 2007;;Action, Sports
Hotel Architect;;Sweden;;Step into the chaotic 24/7 lifestyle of a hotel owner as you design and build grand hotels across the globe. Juggle the increasingly elaborate demands of disorderly guests, logistical nightmares and unexpected obstacles in Hotel Architect, the ultimate hotel construction and tycoon management game.;;https://shared.akamai.steamstatic.com/store_item_assets/steam/apps/1602000/header.jpg?t=1725379108;;Wired Productions;;Pathos Interactive;;Windows;;https://store.steampowered.com/app/1602000/Hotel_Architect/;;Coming soon;;Indie, Simulation, Strategy
BANNERMEN;;Sweden;;A singleplayer fast-paced classic RTS game in which you take on the role of a fallen lord on his journey back to become one of the mightiest in the medieval realm of Valtoria.;;https://shared.akamai.steamstatic.com/store_item_assets/steam/apps/699740/header.jpg?t=1683875131;;Pathos Interactive;;Pathos Interactive;;Windows;;https://store.steampowered.com/app/699740/BANNERMEN/;;21 Feb, 2019;;Action, Adventure, Indie, Massively Multiplayer, Strategy
The Ascent;;Sweden;;The Ascent is a solo and co-op Action-shooter RPG set in a cyberpunk world. The mega corporation that owns you and everyone, The Ascent Group, has just collapsed. Can you survive without it?;;https://shared.akamai.steamstatic.com/store_item_assets/steam/apps/979690/header.jpg?t=1725028041;;Curve Games;;Neon Giant;;Windows;;https://store.steampowered.com/app/979690/The_Ascent/;;29 Jul, 2021;;Action, Adventure, Indie, RPG
The Foretold: Westmark Legacy;;Sweden;;Fight to investigate another day in this gothic horror adventure card game. Equip items and relics. Acquire cards and use them wisely to survive what lurks in the darkest corners of town. Take a short and mind-bending dive into the unknown with a cosy horror atmosphere.;;https://shared.akamai.steamstatic.com/store_item_assets/steam/apps/1746400/header.jpg?t=1714489998;;Crytivo;;Nodbrim Interactive;;Windows;;https://store.steampowered.com/app/1746400/The_Foretold_Westmark_Legacy/;;30 Apr, 2024;;Adventure, Indie, RPG, Strategy
Westmark Manor;;Sweden;;What lurks in the darkest corners of the mansion? Westmark Manor is a journey into the occult, a mind-bending survival horror game, with a heavy focus on solving puzzles and exploration, inspired by the formidable H.P. Lovecraft.;;https://shared.akamai.steamstatic.com/store_item_assets/steam/apps/1158970/header.jpg?t=1681375616;;Toadman Interactive;;Nodbrim Interactive;;Windows;;https://store.steampowered.com/app/1158970/Westmark_Manor/;;18 Jun, 2020;;Adventure
Acaratus;;Sweden;;Acaratus is a turnbased tactical RPG set in a medieval steampunk world where you build and fight with your mechanized battle suits to help Adina free the people enslaved by the emperor Helios, their oppressor.;;https://shared.akamai.steamstatic.com/store_item_assets/steam/apps/376410/header.jpg?t=1560320671;;Nodbrim Interactive;;Nodbrim Interactive;;Windows;;https://store.steampowered.com/app/376410/Acaratus/;;25 Feb, 2016;;Adventure, Indie, RPG, Strategy
Immortal: Unchained;;Sweden;;Unleashed and unforgiving. Can you rise to the challenge? Immortal: Unchained is the latest addition to the genre of ultra-hardcore action RPGs. Take the role of a living weapon, unleashed to stop the source of a cataclysmic event threatening to end all worlds.;;https://shared.akamai.steamstatic.com/store_item_assets/steam/apps/369440/header.jpg?t=1612196773;;Game Odyssey Limited;;Toadman Interactive;;Windows;;https://store.steampowered.com/app/369440/Immortal_Unchained/;;7 Sep, 2018;;Action, Adventure, RPG
Warhammer 40,000: Darktide;;Sweden;;Take back the city of Tertium from hordes of bloodthirsty foes in this intense and brutal action shooter. Warhammer 40,000: Darktide is the new co-op focused experience from the award-winning team behind the Vermintide series. As Tertium falls, Rejects Will Rise.;;https://shared.akamai.steamstatic.com/store_item_assets/steam/apps/1361210/header.jpg?t=1725043951;;Fatshark;;Fatshark;;Windows;;https://store.steampowered.com/app/1361210/Warhammer_40000_Darktide/;;30 Nov, 2022;;Action, Adventure, Indie
Warhammer: Vermintide 2;;Sweden;;The critically acclaimed Vermintide 2 is a visually stunning and groundbreaking melee action game pushing the boundaries of the first person co-op genre. Join the fight now!;;https://shared.akamai.steamstatic.com/store_item_assets/steam/apps/552500/header.jpg?t=1725364346;;Fatshark;;Fatshark;;Windows;;https://store.steampowered.com/app/552500/Warhammer_Vermintide_2/;;8 Mar, 2018;;Action, Indie, RPG
Bloodsports.TV;;Sweden;;Co-Op Hero Defense set in a deadly post-apocalyptic Sweden. Team up with your friends and protect the Missile Silo against horrific beasts and outlaws.;;https://shared.akamai.steamstatic.com/store_item_assets/steam/apps/336420/header.jpg?t=1703014772;;Fatshark;;Toadman Interactive, Fatshark;;Windows;;https://store.steampowered.com/app/336420/BloodsportsTV/;;30 Mar, 2015;;Action, Adventure, Casual, Indie, Sports, Strategy
Krater;;Sweden;;The game brings you far into the future of a post-apocalyptic Sweden.;;https://shared.akamai.steamstatic.com/store_item_assets/steam/apps/42170/header.jpg?t=1591085012;;Fatshark;;Fatshark;;Windows, macOS;;https://store.steampowered.com/app/42170/Krater/;;12 Jun, 2012;;Action, Adventure, Indie, RPG, Strategy
Hamilton's Great Adventure;;Sweden;;All new DLC, Retro Fever, Now Available!;;https://shared.akamai.steamstatic.com/store_item_assets/steam/apps/42140/header.jpg?t=1591085088;;Fatshark;;Fatshark;;Windows;;https://store.steampowered.com/app/42140/Hamiltons_Great_Adventure/;;31 May, 2011;;Adventure, Casual, Indie
GONNER2;;Sweden;;In this sequel to GoNNER: Journey your way through deep dark chaotic places with unimaginable sparks of colour as you go on a mission to help Death rid a mysterious presence from her lair. Battle crazy bosses, lose your head (a lot), in this messy, cute, fast-paced procedurally-generated platformer.;;https://shared.akamai.steamstatic.com/store_item_assets/steam/apps/1117670/header.jpg?t=1695303754;;Raw Fury;;Art in Heart;;Windows, macOS, SteamOS + Linux;;https://store.steampowered.com/app/1117670/GONNER2/;;21 Oct, 2020;;Action, Indie
GoNNER;;Sweden;;GoNNER is a tough as hell procedurally-generated 2D platformer with roguelike elements, following the largely misunderstood and altruistic Ikk on a journey to cheer up his only friend in this world - a giant landbound whale named Sally - by searching for just the right trinket in the deep and dark places nearby.;;https://shared.akamai.steamstatic.com/store_item_assets/steam/apps/437570/header.jpg?t=1725358270;;Raw Fury;;Art in Heart;;Windows, macOS, SteamOS + Linux;;https://store.steampowered.com/app/437570/GoNNER/;;12 Oct, 2016;;Indie
SULFUR;;Sweden;;SULFUR is a modern old-school action-adventure: Outsmart enemies, find treasure, improve weapons, harness powers. Delve deeper, find answers, make it end.;;https://shared.akamai.steamstatic.com/store_item_assets/steam/apps/2124120/header.jpg?t=1725898649;;Perfect Random;;Perfect Random;;Windows;;https://store.steampowered.com/app/2124120/SULFUR/;;October 2024;;Action, Adventure, Indie, RPG, Simulation, Early Access
Lost in Random™;;Sweden;;Play the odds in Lost in Random™, a gothic-fairy-tale-inspired action-adventure where every citizen’s fate is determined by a roll of the dice.;;https://shared.akamai.steamstatic.com/store_item_assets/steam/apps/1462570/header.jpg?t=1662047426;;Electronic Arts;;Zoink, Thunderful;;Windows;;https://store.steampowered.com/app/1462570/Lost_in_Random/;;10 Sep, 2021;;Action, Adventure, Indie
Fe;;Sweden;;Run, climb and glide your way through a dark Nordic forest and explore its living, breathing ecosystem filled with secrets and mystical creatures. Become Fe and discover a world that you will never want to leave.;;https://shared.akamai.steamstatic.com/store_item_assets/steam/apps/1225580/header.jpg?t=1721053648;;Electronic Arts;;Zoink;;Windows;;https://store.steampowered.com/app/1225580/Fe/;;16 Feb, 2018;;Action, Adventure
Flipping Death;;Sweden;;Possess the living, aid the dead and flip between the worlds of Flipping Death - a puzzling adventure platformer where you find yourself filling in for Death. Maybe your new powers will help you solve the mystery of your own demise?;;https://shared.akamai.steamstatic.com/store_item_assets/steam/apps/626660/header.jpg?t=1587728311;;Zoink Games;;Zoink Games;;Windows;;https://store.steampowered.com/app/626660/Flipping_Death/;;6 Aug, 2018;;Adventure, Indie
Zombie Vikings: Stab-a-thon;;Sweden;;Battle your friends in this free to play game based in the Zombie Vikings universe! With weapons like Blunt Fish Trauma and The Pülverizer for Patient People you'll hack and slash for your life in this brawler game for up to 4 players.;;https://shared.akamai.steamstatic.com/store_item_assets/steam/apps/566910/header.jpg?t=1572440833;;Zoink Games;;Zoink Games;;Windows;;https://store.steampowered.com/app/566910/Zombie_Vikings_Stabathon/;;22 Dec, 2016;;Action, Free To Play, Indie
Zombie Vikings;;Sweden;;From the creators of indie smash hit Stick It to The Man! comes a new one to four-player co-op stab-you-in-the-gut-a-thon. Embark on a dead funny adventure with the Zombie Vikings. A putrid posse sent on a mission through the most epic of worlds to retrieve Odin’s lost eye.;;https://shared.akamai.steamstatic.com/store_item_assets/steam/apps/337480/header.jpg?t=1707165692;;Zoink Games;;Zoink Games;;Windows;;https://store.steampowered.com/app/337480/Zombie_Vikings/;;7 Dec, 2015;;Action, Adventure
Stick it to The Man!;;Sweden;;Hard hat tester, Ray, has a bizarre accident and wakes up with a giant pink spaghetti arm sticking out of his brain! With his awesome new powers he can read minds and change the world with stickers but he’s on the run for a crime he didn’t commit. Can you help Ray out of this sticky situation?;;https://shared.akamai.steamstatic.com/store_item_assets/steam/apps/251830/header.jpg?t=1592572419;;Ripstone;;Zoink Games;;Windows, macOS;;https://store.steampowered.com/app/251830/Stick_it_to_The_Man/;;13 Dec, 2013;;Action, Adventure, Indie
Immortal Realms: Vampire Wars;;Sweden;;Immortal Realms: Vampire Wars is an engaging strategy game set in a dark vampire world in turmoil, that combines empire management and turn-based combat with unique card-game elements.;;https://shared.akamai.steamstatic.com/store_item_assets/steam/apps/1024480/header.jpg?t=1724069652;;Kalypso Media;;Palindrome Interactive;;Windows;;https://store.steampowered.com/app/1024480/Immortal_Realms_Vampire_Wars/;;28 Aug, 2020;;Action, RPG, Strategy
Bionic Commando;;Sweden;;"The first true sequel to the classic 1988 Nintendo Entertainment System original, Bionic Commando sees the return of the bionically-enhanced Nathan ""R.A.D."" Spencer. Time has not been kind to Spencer: Five years after his heroic defeat of the Imperials, he has been betrayed by the government he swore to serve, imprisoned for...";;https://shared.akamai.steamstatic.com/store_item_assets/steam/apps/21670/header.jpg?t=1709710946;;Capcom;;Capcom;;Windows;;https://store.steampowered.com/app/21670/Bionic_Commando/;;28 Jul, 2009;;Action, Adventure
Ground Control II: Operation Exodus;;Sweden;;It’s 2741 and the universe is at war. The Terran Empire is laying siege to the NSA, a treaty of colonies that upholds freedom and democracy. After losing the battle in space, the NSA is forced to retreat to its last stronghold. Can you snatch victory from impending doom?;;https://shared.akamai.steamstatic.com/store_item_assets/steam/apps/254840/header.jpg?t=1579791420;;Rebellion;;Massive Entertainment;;Windows;;https://store.steampowered.com/app/254840/Ground_Control_II_Operation_Exodus/;;18 Jun, 2004;;Strategy
Ground Control Anthology;;Sweden;;The year is 2419. War has devastated Earth, and mega-corporations take to the stars to fight over colonised planets. Your employer, the Crayven Corporation, chose you to command an army of ground and air forces. You thought it would be just another brush-fire war. You were wrong.;;https://shared.akamai.steamstatic.com/store_item_assets/steam/apps/254820/header.jpg?t=1579791410;;Rebellion;;Massive Entertainment;;Windows;;https://store.steampowered.com/app/254820/Ground_Control_Anthology/;;31 May, 2000;;Strategy
Songs of Conquest;;Sweden;;Raise mighty armies, wield ancient magic and forge an empire. This turn-based strategy adventure game fuses strategic decision making, tactical combat and kingdom management.;;https://shared.akamai.steamstatic.com/store_item_assets/steam/apps/867210/header.jpg?t=1725187919;;Coffee Stain Publishing;;Lavapotion;;Windows, macOS;;https://store.steampowered.com/app/867210/Songs_of_Conquest/;;20 May, 2024;;Adventure, RPG, Strategy
It Takes Two;;Sweden;;Embark on the craziest journey of your life in It Takes Two. Invite a friend to join for free with Friend’s Pass and work together across a huge variety of gleefully disruptive gameplay challenges. Winner of GAME OF THE YEAR at the Game Awards 2021.;;https://shared.akamai.steamstatic.com/store_item_assets/steam/apps/1426210/header.jpg?t=1725585631;;Electronic Arts;;Hazelight Studios;;Windows;;https://store.steampowered.com/app/1426210/It_Takes_Two/;;25 Mar, 2021;;Action, Adventure
A Way Out;;Sweden;;A Way Out is an exclusively co-op adventure where you play the role of one of two prisoners making their daring escape from prison.;;https://shared.akamai.steamstatic.com/store_item_assets/steam/apps/1222700/header.jpg?t=1718278523;;Electronic Arts;;Hazelight Studios;;Windows;;https://store.steampowered.com/app/1222700/A_Way_Out/;;23 Mar, 2018;;Action, Adventure, Indie
Brothers - A Tale of Two Sons;;Sweden;;Guide two brothers on an epic fairy tale journey from visionary Swedish film director, Josef Fares and top-tier developer Starbreeze Studios. Control both brothers at once as you experience co-op play in single player mode, like never before.;;https://shared.akamai.steamstatic.com/store_item_assets/steam/apps/225080/header.jpg?t=1725036160;;505 Games;;Starbreeze Studios AB;;Windows;;https://store.steampowered.com/app/225080/Brothers__A_Tale_of_Two_Sons/;;3 Sep, 2013;;Action, Adventure, Indie
Knights of the Temple: Infernal Crusade;;Sweden;;You are Paul de Raque, a Knight Templar on a journey to the Holy Land with the goal to reunite with his Order in Jerusalem. But you are more than just a common crusader - you are on a holy mission. The future of the world and all mankind rests on your shoulders…;;https://shared.akamai.steamstatic.com/store_item_assets/steam/apps/1194610/header.jpg?t=1577269907;;bitComposer Interactive GmbH;;Starbreeze Studios;;Windows;;https://store.steampowered.com/app/1194610/Knights_of_the_Temple_Infernal_Crusade/;;8 Apr, 2004;;Action, Adventure
Enclave;;Sweden;;Experience incredibly atmospheric and intense medieval combat action! Go ahead and enter a new world, the award-winning world of ENCLAVE!The people of Light and Darkness are divided by a bottomless rift that split the earth many millennia ago.;;https://shared.akamai.steamstatic.com/store_item_assets/steam/apps/253980/header.jpg?t=1625585338;;Topware Interactive;;Starbreeze;;Windows, macOS, SteamOS + Linux;;https://store.steampowered.com/app/253980/Enclave/;;10 Mar, 2003;;Action, RPG
Hotline Miami 2: Wrong Number;;Sweden;;Hotline Miami 2: Wrong Number is the brutal conclusion to the Hotline Miami saga, set against a backdrop of escalating violence and retribution over spilled blood in the original game.;;https://shared.akamai.steamstatic.com/store_item_assets/steam/apps/274170/header.jpg?t=1710762910;;Devolver Digital;;Dennaton Games;;Windows, macOS, SteamOS + Linux;;https://store.steampowered.com/app/274170/Hotline_Miami_2_Wrong_Number/;;10 Mar, 2015;;Action, Indie
Call of the Wild: The Angler™;;Sweden;;The Angler is an open world fishing game that can be played solo or with friends. Discover and catch a wide variety of unique fish species, from common to rare, on your journey to become a master angler.;;https://shared.akamai.steamstatic.com/store_item_assets/steam/apps/1408610/header.jpg?t=1724762648;;Expansive Worlds;;Expansive Worlds;;Windows;;https://store.steampowered.com/app/1408610/Call_of_the_Wild_The_Angler/;;31 Aug, 2022;;Adventure, Casual, Simulation, Sports
