Name;;Country;;Description;;Thumbnail;;Publisher_Names;;Developer_Names;;Platform;;Steam_Link;;Release_Date;;Genre;;Epic_Link;;Playstation_Link;;Xbox_Link;;Switch_Link
Phantom Stars;;Thailand;;A Visual Novel of an investigaing-dating idols: “When a new police officer has to go undercover as an 'idol group leader' to solve a case.”;;https://shared.akamai.steamstatic.com/store_item_assets/steam/apps/2613130/header.jpg?t=1715166430;;Triple Trio Studio;;Mini Gemini, Triple Trio Studio;;Windows;;https://store.steampowered.com/app/2613130/Phantom_Stars/;;To be announced;;Casual, Indie, RPG;;Unknown;;Unknown;;Unknown;;Unknown
Z speed Arcade;;Thailand;;Z speed Arcade, The retro endless driving game inspired by early 90s racing game but combination with modern graphic which give higher resolution. Avoid the traffic, escape the cop, col...;;https://shared.akamai.steamstatic.com/store_item_assets/steam/apps/2725170/header.jpg?t=1720246653;;T&T game;;T&T game;;Windows;;https://store.steampowered.com/app/2725170/Z_speed_Arcade/;;25 Jun, 2024;;Casual, Indie, Racing;;Unknown;;Unknown;;Unknown;;Unknown
Our Mountain;;Thailand;;Charles, a man living a peaceful life in the countryside, is faced with a serious problem that requires him to return to the city on the other side of the valley. With time running out,...;;https://shared.akamai.steamstatic.com/store_item_assets/steam/apps/1668990/header.jpg?t=1686648469;;Good Monkey;;Rachata Suksereekul;;Windows;;https://store.steampowered.com/app/1668990/Our_Mountain/;;27 Sep, 2022;;Adventure, Indie;;Unknown;;Unknown;;Unknown;;Unknown
Aquatia;;Thailand;;Dive into Aquatia, a third-person anime-action RPG game, where you'll become the master of water magic. Experience the graceful aqua ballet, using water magic to defeat monsters with fi...;;https://shared.akamai.steamstatic.com/store_item_assets/steam/apps/2488900/header.jpg?t=1725123565;;Rocketlion Studio;;Rocketlion Studio;;Windows;;https://store.steampowered.com/app/2488900/Aquatia/;;To be announced;;Action, Adventure, Indie, RPG;;Unknown;;Unknown;;Unknown;;Unknown
Asuji: The Legend of You;;Thailand;;"You play as ""You"", a sperm who wants to become Human! Collect all the sperm cells, dodge the crazy sperms and maybe become long enough to inject yourself into the egg!";;https://shared.akamai.steamstatic.com/store_item_assets/steam/apps/2337910/header.jpg?t=1705065554;;Somnolent Team;;Somnolent Team, Sproot Production;;Windows, macOS;;https://store.steampowered.com/app/2337910/Asuji_The_Legend_of_You/;;13 Apr, 2023;;Action, Adventure, Casual, Indie, Racing, Simulation;;Unknown;;Unknown;;Unknown;;Unknown
Eternal Acid Rain;;Thailand;;This dystopian world, plagued by relentless acid rain, burdens players with the vital mission. To succeed, we must complete our assigned tasks while evading the ever-watchful AI.;;https://shared.akamai.steamstatic.com/store_item_assets/steam/apps/2698800/header.jpg?t=1702571425;;NoAh+;;NoAh+;;Windows;;https://store.steampowered.com/app/2698800/Eternal_Acid_Rain/;;To be announced;;Casual, Indie;;Unknown;;Unknown;;Unknown;;Unknown
Northwind;;Thailand;;Northwind is a monster-hunting rogue-lite deckbuilder. Hunt monsters, gather resources, and explore card crafting in Northwind Town. Discover new monsters and unlock town upgrades as yo...;;https://shared.akamai.steamstatic.com/store_item_assets/steam/apps/1476400/header.jpg?t=1728822952;;Barking Kitten Interactive;;Barking Kitten Interactive;;Windows;;https://store.steampowered.com/app/1476400/Northwind/;;To be announced;;Indie, Strategy, Early Access;;Unknown;;Unknown;;Unknown;;Unknown
OutlawZ : Headhunter;;Thailand;;Just remember, if you mess up big time, you could lose everything, even your life. So, for safety's sake, always make sure to keep your valuables in the safe zone.;;https://shared.akamai.steamstatic.com/store_item_assets/steam/apps/2696190/header.jpg?t=1727695398;;Gaming Insight;;Gaming Insight;;Windows;;https://store.steampowered.com/app/2696190/OutlawZ__Headhunter/;;22 Jul, 2024;;Action, Massively Multiplayer, Early Access;;Unknown;;Unknown;;Unknown;;Unknown
Bō: Path of the Teal Lotus;;Thailand;;Flow gracefully through a colorful, hand-drawn 2.5D action platformer inspired by Japanese folklore. Engage in acrobatic aerial combat, unlock powerful mystical abilities, and explore a...;;https://shared.akamai.steamstatic.com/store_item_assets/steam/apps/1614440/header.jpg?t=1723879561;;Humble Games;;Squid Shock Studios, Christopher Stair, Trevor Youngquist;;Windows;;https://store.steampowered.com/app/1614440/Bo_Path_of_the_Teal_Lotus/;;17 Jul, 2024;;Action, Adventure, Indie;;Unknown;;Unknown;;Unknown;;Unknown
ZombiGON;;Thailand;;Pick up any weapons you have. Then deal with the zombies that are intent on eating you. We provide you with lots of weapons and ammunition. Eh! But we're not sure. If this is enough for...;;https://shared.akamai.steamstatic.com/store_item_assets/steam/apps/2754750/header.jpg?t=1726916484;;WIK Games Studio;;WIK Games Studio;;Windows;;https://store.steampowered.com/app/2754750/ZombiGON/;;14 Aug, 2024;;Action, Indie, Early Access;;Unknown;;Unknown;;Unknown;;Unknown
Wholesome: Heartdrawn;;Thailand;;Wholesome: Heartdrawn is a Turn-Based RPG and adventure game about Lyra, who creates her world to imagine her memories to escape from some things. Explore real and imagined worlds, and ...;;https://shared.akamai.steamstatic.com/store_item_assets/steam/apps/2415680/header.jpg?t=1722177148;;Prejordria Interactives;;Daybloom Project;;Windows;;https://store.steampowered.com/app/2415680/Wholesome_Heartdrawn/;;To be announced;;Adventure, Indie, RPG;;Unknown;;Unknown;;Unknown;;Unknown
Falling Day;;Thailand;;Falling Day is an emotional, story-driven adventure game about coming of age and resolving supernatural mysteries. Two students become involved in several mysteries, murders, suicides, ...;;https://shared.akamai.steamstatic.com/store_item_assets/steam/apps/2607550/header.jpg?t=1696917771;;WBB STUDIO;;WBB STUDIO;;Windows;;https://store.steampowered.com/app/2607550/Falling_Day/;;To be announced;;Adventure, Indie;;Unknown;;Unknown;;Unknown;;Unknown
Temporarily;;Thailand;;Temporality is a first-person game where the player takes on the role of Jack who wakes up in a room without knowing how the protagonist got here and must travel through the past. of hi...;;https://shared.akamai.steamstatic.com/store_item_assets/steam/apps/2688620/header.jpg?t=1704253316;;CypherZero Studio;;CypherZero Studio;;Windows;;https://store.steampowered.com/app/2688620/Temporarily/;;2 Jan, 2024;;Indie;;Unknown;;Unknown;;Unknown;;Unknown
Gaia's Blessing;;Thailand;;Gaia's Blessing is a casual deck building farming simulator with hundred of cards for you to discover and use. Plan, Plant, and Profit as you build up your personal card collection. Hel...;;https://shared.akamai.steamstatic.com/store_item_assets/steam/apps/2707100/header.jpg?t=1702940244;;Midnight Breakfast;;Midnight Breakfast;;Windows;;https://store.steampowered.com/app/2707100/Gaias_Blessing/;;18 Dec, 2023;;Casual, Indie;;Unknown;;Unknown;;Unknown;;Unknown
Tearfallen;;Thailand;;Rise against the Origins of Primorden! Gather your party and forge your own path in this fast-paced online action roguelike adventure. Feel your power grow through each Expedition as yo...;;https://shared.akamai.steamstatic.com/store_item_assets/steam/apps/2719140/header.jpg?t=1726715390;;Chillchat;;Chillchat;;Windows;;https://store.steampowered.com/app/2719140/Tearfallen/;;To be announced;;Action, RPG;;Unknown;;Unknown;;Unknown;;Unknown
The Great;;Thailand;;How do you feel If you have to live as someone living in a city full of dangerous criminals. But you still have to live, eat, work, sleep and socialize. It sounds normal. but it's not n...;;https://shared.akamai.steamstatic.com/store_item_assets/steam/apps/2069680/header.jpg?t=1690545160;;WIK Games Studio;;WIK Games Studio;;Windows;;https://store.steampowered.com/app/2069680/The_Great/;;30 Jul, 2022;;RPG, Early Access;;Unknown;;Unknown;;Unknown;;Unknown
Ark Odyssey;;Thailand;;Ark Odyssey is a top-down arcade shooter that lets you command an army of starships to fight against the force of void! Gather your fleet into formations, and build your team of evolvin...;;https://shared.akamai.steamstatic.com/store_item_assets/steam/apps/2701870/header.jpg?t=1728818219;;BinaryStella;;BinaryStella;;Windows;;https://store.steampowered.com/app/2701870/Ark_Odyssey/;;To be announced;;Action, Casual, Indie, Strategy, Early Access;;Unknown;;Unknown;;Unknown;;Unknown
Zoul Dungeon;;Thailand;;is a strategic dungeon defense game where you take on the role of a dungeon master. Summon monsters, upgrade your lair, and set traps to fend off waves of greedy adventurers. Protect yo...;;https://shared.akamai.steamstatic.com/store_item_assets/steam/apps/3188750/header.jpg?t=1727705531;;nongshy;;nongshy;;Windows;;https://store.steampowered.com/app/3188750/Zoul_Dungeon/;;11 Sep, 2024;;Indie, Simulation;;Unknown;;Unknown;;Unknown;;Unknown
Zlime: Return Of Demon Lord;;Thailand;;Enter the world of Zlime, an action Roguelike game where you'll embark on a thrilling adventure in a demonic realm. Experience an unique transformation system, devour your foes, enhance...;;https://shared.akamai.steamstatic.com/store_item_assets/steam/apps/2583330/header.jpg?t=1726318536;;DUO AB Indie Developer;;DUO AB Indie Developer;;Windows;;https://store.steampowered.com/app/2583330/Zlime_Return_Of_Demon_Lord/;;27 Apr, 2024;;Action, Casual, Indie, Early Access;;Unknown;;Unknown;;Unknown;;Unknown
Playground Mayhem;;Thailand;;Defend your base solo or with friends against endless waves of foes using your weapons and turrets. Are you up for the challenge?;;https://shared.akamai.steamstatic.com/store_item_assets/steam/apps/2972530/header.jpg?t=1726499305;;WindShift Studio;;WindShift Studio;;Windows;;https://store.steampowered.com/app/2972530/Playground_Mayhem/;;24 Jun, 2024;;Action, Indie, Strategy, Early Access;;Unknown;;Unknown;;Unknown;;Unknown
Sticks Together: The Wishing Well;;Thailand;;A math-powered adventure awaits! Join the friends on a quest for The Wishing Well. Conquer foes in 2D turn-based combats where your calculation skills are the key to victory. Sharpen yo...;;https://shared.akamai.steamstatic.com/store_item_assets/steam/apps/3024170/header.jpg?t=1717524406;;NakaDev;;NakaDev;;Windows;;https://store.steampowered.com/app/3024170/Sticks_Together_The_Wishing_Well/;;To be announced;;Indie, RPG, Strategy;;Unknown;;Unknown;;Unknown;;Unknown
At Your Service;;Thailand;;At Your Service is a wacky co-op party game for up to four players. Visit futuristic and fantasy themed homes, and get them clean and tidy before their owner’s get angry! Just don’t...;;https://shared.akamai.steamstatic.com/store_item_assets/steam/apps/1731130/header.jpg?t=1658910578;;FairPlay Studios Co. Ltd;;FairPlay Studios Co. Ltd;;Windows;;https://store.steampowered.com/app/1731130/At_Your_Service/;;To be announced;;Action, Casual, Indie, Simulation;;Unknown;;Unknown;;Unknown;;Unknown
Neko Odyssey;;Thailand;;Neko Odyssey: A Game for Cat Lovers You Can't Miss! Here’s a slightly unusual Casual Adventure game where the main gameplay centers around taking pictures of cats. The pixel art graph...;;https://shared.akamai.steamstatic.com/store_item_assets/steam/apps/2476350/header.jpg?t=1725005404;;Flyhigh Works;;SECRET CHARACTER;;Windows;;https://store.steampowered.com/app/2476350/Neko_Odyssey/;;To be announced;;Adventure, Casual, Indie;;Unknown;;Unknown;;Unknown;;Unknown
Holiday Party: Mascot Brawl;;Thailand;;A silly multiplayer party game, Holiday Party: Mascot Brawl brings festive cheer with battles and mini-games matched with absurd weapons. Compete against friends and roast them with a f...;;https://shared.akamai.steamstatic.com/store_item_assets/steam/apps/2282650/header.jpg?t=1728869210;;Namson Digital;;Namson Digital;;Windows;;https://store.steampowered.com/app/2282650/Holiday_Party_Mascot_Brawl/;;To be announced;;Action, Casual;;Unknown;;Unknown;;Unknown;;Unknown
Kyrie and Terra;;Thailand;;Explore Grand Terra's fantasy world through a Japanese RPG. Recruit Celestia, customize them, and gather skill cards and equipment to build your unique party. Save the world in this epi...;;https://shared.akamai.steamstatic.com/store_item_assets/steam/apps/3157800/header.jpg?t=1725339917;;ROTJANA KAANKEM Co., Ltd.;;ROTJANA KAANKEM Co., Ltd.;;Windows;;https://store.steampowered.com/app/3157800/Kyrie_and_Terra/;;To be announced;;Adventure, Casual, Indie, RPG, Strategy, Free To Play, Early Access;;Unknown;;Unknown;;Unknown;;Unknown
The Land Beneath Us;;Thailand;;The Land Beneath Us: A turn-based rogue-lite dungeon crawler rooted in Welsh mythology. Unleash skill combos and wield stylish weaponry in Annwn's Underworld. Conquer the Seven Lords, s...;;https://shared.akamai.steamstatic.com/store_item_assets/steam/apps/2131010/header.jpg?t=1718370739;;Dear Villagers, Gamera Games;;FairPlay Studios Co. Ltd;;Windows;;https://store.steampowered.com/app/2131010/The_Land_Beneath_Us/;;13 May, 2024;;Indie, Strategy;;Unknown;;Unknown;;Unknown;;Unknown
Spirit Mancer;;Thailand;;Slash, Shoot and Break demons. Capture their spirits and summon them out into your battle in the beautiful yet dangerous world of Inferno. Fight against hordes of demons and stop the ev...;;https://shared.akamai.steamstatic.com/store_item_assets/steam/apps/2172580/header.jpg?t=1728962534;;Dear Villagers, OKJOY;;Sunny Syrup Studio;;Windows;;https://store.steampowered.com/app/2172580/Spirit_Mancer/;;7 Nov, 2024;;Action, Adventure, Casual, Indie;;Unknown;;Unknown;;Unknown;;Unknown
Guardian Tactics: Deck of the Chosen;;Thailand;;Command a squad of guardians in a thrilling deckbuilding, roguelike card battle to save the world from an Android army invasion. Fight, fall, learn, rise again!;;https://shared.akamai.steamstatic.com/store_item_assets/steam/apps/2862500/header.jpg?t=1717656953;;Urnique Studio;;Urnique Studio;;Windows;;https://store.steampowered.com/app/2862500/Guardian_Tactics_Deck_of_the_Chosen/;;To be announced;;Indie, Strategy;;Unknown;;Unknown;;Unknown;;Unknown
LEEN;;Thailand;;LEEN is a Turn-based Multiplayer game where you have to calculate your move to fight with your friend until only one player stands victorious.;;https://shared.akamai.steamstatic.com/store_item_assets/steam/apps/2018140/header.jpg?t=1655449284;;Techcast;;Techcast;;Windows, macOS, SteamOS + Linux;;https://store.steampowered.com/app/2018140/LEEN/;;17 Jun, 2022;;Casual, Indie, Strategy;;Unknown;;Unknown;;Unknown;;Unknown
Yakiniku simulator;;Thailand;;Simple and easy game! Just chill out and simulate eating yakiniku!;;https://shared.akamai.steamstatic.com/store_item_assets/steam/apps/2001570/header.jpg?t=1725006198;;SECRET CHARACTER, Flyhigh Works;;SECRET CHARACTER, Napas Torteeka, REBUILD GAMES;;Windows;;https://store.steampowered.com/app/2001570/Yakiniku_simulator/;;3 Jun, 2022;;Casual, Indie, Simulation;;Unknown;;Unknown;;Unknown;;Unknown
DEMON DARK I;;Thailand;;DEMON DARK I Game is fighting style is a fast two-handed sword fight. Players will control a character who can use both hand-to-hand combat, punching, kicking, punching, archery fightin...;;https://shared.akamai.steamstatic.com/store_item_assets/steam/apps/2294020/header.jpg?t=1675936899;;HirunStudioSoft;;HirunStudioSoft;;Windows;;https://store.steampowered.com/app/2294020/DEMON_DARK_I/;;9 Feb, 2023;;Action;;Unknown;;Unknown;;Unknown;;Unknown
Aether: Wizard Life;;Thailand;;Aether Wizard Life is a magical and adventurous wizard Farm Sim game packed with exciting Action Adventures.;;https://shared.akamai.steamstatic.com/store_item_assets/steam/apps/2195450/header.jpg?t=1673346662;;Vonder Games;;Vonder Games;;Windows;;https://store.steampowered.com/app/2195450/Aether_Wizard_Life/;;To be announced;;Action, Adventure, Indie, RPG, Simulation;;Unknown;;Unknown;;Unknown;;Unknown
Uptown Outbreak;;Thailand;;Use your driving and battling skills to defeat the virus and restore the game to its former glory.;;https://shared.akamai.steamstatic.com/store_item_assets/steam/apps/2486620/header.jpg?t=1690545616;;PRINTmov;;PRINTmov;;Windows;;https://store.steampowered.com/app/2486620/Uptown_Outbreak/;;28 Jul, 2023;;Action, Racing;;Unknown;;Unknown;;Unknown;;Unknown
7 Sins : Lost in Labyrinth;;Thailand;;“7 Sins : Lost in Labyrinth” A Survival Horror Game, based on the Cutie Characters and World of 7 Sexy Sins Series. You have but one goal: survive and escape the hellish mazes! Run ...;;https://shared.akamai.steamstatic.com/store_item_assets/steam/apps/2221820/header.jpg?t=1680868723;;Zai Studio;;Zai Studio;;Windows;;https://store.steampowered.com/app/2221820/7_Sins__Lost_in_Labyrinth/;;10 Feb, 2023;;Indie, Early Access;;Unknown;;Unknown;;Unknown;;Unknown
PHYAKH;;Thailand;;Story-driven, action adventure combining exploration with fast-paced combat games. Phyakh, a creature who was saved from death in bio-robotic suit. He comeback to help his wife from und...;;https://shared.akamai.steamstatic.com/store_item_assets/steam/apps/2149270/header.jpg?t=1668442775;;SmilefrogGames;;SmilefrogGames;;Windows;;https://store.steampowered.com/app/2149270/PHYAKH/;;17 Oct, 2022;;Action, Adventure;;Unknown;;Unknown;;Unknown;;Unknown
Myth;;Thailand;;Myth is a puzzle horror multiplayer game that guarantees an intense and headache-inducing experience with friends. Why the headache, you ask? Well, let's just say the puzzles are so min...;;https://shared.akamai.steamstatic.com/store_item_assets/steam/apps/2430410/header.jpg?t=1685690714;;Techcast;;Techcast;;Windows;;https://store.steampowered.com/app/2430410/Myth/;;2 Jun, 2023;;Action, Adventure;;Unknown;;Unknown;;Unknown;;Unknown
Social Warfare;;Thailand;;Be a troll-for-hire on social media! You will serve in the Social Warfare battalion and promote loyalty to the Great Kingdom of Eternia, while disrupting society in the enemy nation.;;https://shared.cloudflare.steamstatic.com/store_item_assets/steam/apps/3205170/header.jpg?t=1729469535;;Sanuk Games;;Sanuk Games;;Windows;;https://store.steampowered.com/app/3205170/Social_Warfare/;;To be announced;;Adventure, Casual, Indie;;Unknown;;Unknown;;Unknown;;Unknown
METAMATHEMA;;Thailand;;Engage proxy wars as an elite merc on METAMATHEMA (MEMA), the secret military service platform providing millions of stealth missions. Arm yourself fully to infiltrate the enemy FOB. Co...;;https://shared.cloudflare.steamstatic.com/store_item_assets/steam/apps/2852630/header.jpg?t=1730605893;;Teppo;;Teppo;;Windows;;https://store.steampowered.com/app/2852630/METAMATHEMA/;;4 Nov, 2024;;Action, Early Access;;Unknown;;Unknown;;Unknown;;Unknown
Conquest Tactics : Realm of Sin;;Thailand;;Conquest Tactics: Realm of Sin is a dark fantasy roguelite with hex-based, turn-based tactical combat. Command your forces, make impactful choices, and navigate a realm consumed by sin—...;;https://shared.cloudflare.steamstatic.com/store_item_assets/steam/apps/3308960/header.jpg?t=1732000834;;Singular Sunshine Studios;;Singular Sunshine Studios;;Windows;;https://store.steampowered.com/app/3308960/Conquest_Tactics__Realm_of_Sin/;;To be announced;;Indie, Strategy;;Unknown;;Unknown;;Unknown;;Unknown
Hacky;;Thailand;;Become an elite hacker in cyberpunk typing simulator. Infiltrate networks, steal data by typing simple commands. Navigate through pixel art cyberspace, unlocking new abilities as you go...;;https://shared.cloudflare.steamstatic.com/store_item_assets/steam/apps/3292980/header.jpg?t=1730476679;;Napas Torteeka;;Napas Torteeka;;Windows;;https://store.steampowered.com/app/3292980/Hacky/;;1 Nov, 2024;;Indie, Simulation;;Unknown;;Unknown;;Unknown;;Unknown
