Name;;Country;;Description;;Thumbnail;;Publisher_Names;;Developer_Names;;Platform;;Steam_Link;;Release_Date;;Genre;;Epic_Link;;Playstation_Link;;Xbox_Link;;Switch_Link
GeminiFlame : Alpha Dragon;;Thailand;;You are the one!! Who came to this RPG world during a time of conflict among the local people. You have 4 character to take care and fight with the dragon and more?. What is happen? And...;;https://shared.akamai.steamstatic.com/store_item_assets/steam/apps/2609430/header.jpg?t=1706373769;;MAINSOLAR Entertainment;;Jaruwit Kraijan, MAINSOLAR entertainment;;Windows;;https://store.steampowered.com/app/2609430/GeminiFlame__Alpha_Dragon/;;17 Oct, 2023;;Adventure, RPG, Simulation, Strategy;;Unknown;;Unknown;;Unknown;;Unknown
Toxic place;;Thailand;;Toxic Place, an exciting story in the form of a soul like game, combined with a sandbox for you to experience adventure. In a world full of pollution and monsters that have been affecte...;;https://shared.akamai.steamstatic.com/store_item_assets/steam/apps/2916950/header.jpg?t=1715941290;;PrimoSalmon;;PrimoSalmon;;Windows;;https://store.steampowered.com/app/2916950/Toxic_place/;;16 May, 2024;;Action, Adventure, RPG, Simulation, Early Access;;Unknown;;Unknown;;Unknown;;Unknown
Adventure In Wachirawit World;;Thailand;;The most mind-blowing RPG Maker game from Thailand. With unique storytelling, gameplay, and presentation. Created by an expert of the RPG Maker Thailand community. In this game, you wil...;;https://shared.akamai.steamstatic.com/store_item_assets/steam/apps/2480910/header.jpg?t=1721030921;;Wachirawit Ruangsap;;Wachirawit Ruangsap;;Windows;;https://store.steampowered.com/app/2480910/Adventure_In_Wachirawit_World/;;To be announced;;Adventure, Indie, Free To Play;;Unknown;;Unknown;;Unknown;;Unknown
Unwashed;;Thailand;;Explore the nightmarish, simulated world of Unwashed, a horror game that you must stay clean! Play as AA and uncover the truth behind Lumina, a government secret project, while racing a...;;https://shared.akamai.steamstatic.com/store_item_assets/steam/apps/2343470/header.jpg?t=1693063299;;Good Monkey;;Good Monkey;;Windows;;https://store.steampowered.com/app/2343470/Unwashed/;;To be announced;;Action, Adventure, Indie, Simulation;;Unknown;;Unknown;;Unknown;;Unknown
NARATHA;;Thailand;;NARATHA is a story-driven RPG with deck-building gameplay. Adventure through the world as Naratha, the beast slayer. Hunting down black beasts who plagued the land, and your journey wil...;;https://shared.akamai.steamstatic.com/store_item_assets/steam/apps/2442510/header.jpg?t=1705046040;;Parapluie Studio;;Parapluie Studio;;Windows;;https://store.steampowered.com/app/2442510/NARATHA/;;To be announced;;Adventure, Indie, RPG, Strategy;;Unknown;;Unknown;;Unknown;;Unknown
Seed of Heroes;;Thailand;;Journey through the realms with your heroes party. Defeat hordes of enemies in a bullet heaven and reach Valhalla where you belong.;;https://shared.akamai.steamstatic.com/store_item_assets/steam/apps/2942700/header.jpg?t=1726686309;;Sekai Project;;Vermillion Digital;;Windows;;https://store.steampowered.com/app/2942700/Seed_of_Heroes/;;17 Sep, 2024;;Action, Casual, Indie;;Unknown;;Unknown;;Unknown;;Unknown
Magnir Saga Part 1;;Thailand;;Magnir Saga is an action adventure game. Which our hero was reincarnated as a magic sword man. He will journey across the planet of Magnir to revenge for his father and save the planet.;;https://shared.akamai.steamstatic.com/store_item_assets/steam/apps/2427540/header.jpg?t=1710034106;;PordeeHouse;;PordeeHouse;;Windows;;https://store.steampowered.com/app/2427540/Magnir_Saga_Part_1/;;7 Sep, 2023;;Action, Adventure, RPG;;Unknown;;Unknown;;Unknown;;Unknown
Eonheart;;Thailand;;Explore Eonheart, an enigmatic machine complex in this classic-style 2D Puzzle Platformer where you can create platforms by yourself and manipulate them to traverse the complex, brave d...;;https://shared.akamai.steamstatic.com/store_item_assets/steam/apps/3115410/header.jpg?t=1721787027;;AeraDev;;AeraDev;;Windows;;https://store.steampowered.com/app/3115410/Eonheart/;;To be announced;;Adventure, Indie;;Unknown;;Unknown;;Unknown;;Unknown
Gluua;;Thailand;;first-person 1-4 multiplayer horror game. The game will allow players to take on the role of a spirit liberator who will be able to freely choose missions based on the difficulty and re...;;https://shared.akamai.steamstatic.com/store_item_assets/steam/apps/1664810/header.jpg?t=1709175995;;Knarl Studio;;Knarl Studio;;Windows;;https://store.steampowered.com/app/1664810/Gluua/;;28 Feb, 2024;;Indie, Simulation;;Unknown;;Unknown;;Unknown;;Unknown
Water Festa;;Thailand;;Water Festa is a top-down shooter inspired by Thailand's Songkran water festival. You play as a mermaid girl, balancing wetness to remain human, dodge water to avoid becoming too wet, b...;;https://shared.akamai.steamstatic.com/store_item_assets/steam/apps/2872580/header.jpg?t=1712591220;;XNKLV;;sTeloXz;;Windows;;https://store.steampowered.com/app/2872580/Water_Festa/;;8 Apr, 2024;;Action;;Unknown;;Unknown;;Unknown;;Unknown
Alterhavoc;;Thailand;;Alterhavoc is a Rogue-like Bullet hell game where players have to survive and fight monsters with an Inventory system where the resources can be arranged in a limited area to receive ad...;;https://shared.akamai.steamstatic.com/store_item_assets/steam/apps/2734770/header.jpg?t=1704281880;;IntroWork;;IntroWork;;Windows;;https://store.steampowered.com/app/2734770/Alterhavoc/;;3 Jan, 2024;;Action, Indie, Early Access;;Unknown;;Unknown;;Unknown;;Unknown
Tragedy Theater;;Thailand;;Tragedy Theater is RPGmaker Horror game. You'll get the thrill of being chased by those mascots. Don't get caught. Help your friend, result puzzles and choose the choice that won't make...;;https://shared.akamai.steamstatic.com/store_item_assets/steam/apps/2520920/header.jpg?t=1692775110;;TrickBunny;;TrickBunny, TrickBunny;;Windows;;https://store.steampowered.com/app/2520920/Tragedy_Theater/;;8 Aug, 2023;;Indie;;Unknown;;Unknown;;Unknown;;Unknown
Sole Saga;;Thailand;;Fast-paced action rogue-Like survival with a touch of Soul-like, Challenging yet rewarding gameplay!, Battle with horde of monsters, Build your favorite hero with powerful skills and we...;;https://shared.akamai.steamstatic.com/store_item_assets/steam/apps/2027970/header.jpg?t=1727963120;;Dev It With Cat, Electronic Sheep Games;;Dev It With Cat;;Windows, SteamOS + Linux;;https://store.steampowered.com/app/2027970/Sole_Saga/;;28 Apr, 2023;;Action, Indie, Early Access;;Unknown;;Unknown;;Unknown;;Unknown
Spire Horizon;;Thailand;;Discover a thrilling world of adventure in Spire Horizon, an RPG open world game, where you embody a skeleton protagonist, explore a visually stunning world, engage in battles against f...;;https://shared.akamai.steamstatic.com/store_item_assets/steam/apps/2321880/header.jpg?t=1707962039;;Mendoka;;Mendoka;;Windows;;https://store.steampowered.com/app/2321880/Spire_Horizon/;;14 Feb, 2024;;Action, Adventure, Indie, RPG;;Unknown;;Unknown;;Unknown;;Unknown
Tale of REN ~ [Searching for HEART droplets] ~;;Thailand;;Me...Mizu Ren Nanami… As a REN people, it's time to go on a mission to conquer the hearts of people in other realms. Then, the Rostania is the town where I was chosen to come here. to...;;https://shared.akamai.steamstatic.com/store_item_assets/steam/apps/2286070/header.jpg?t=1723760597;;Erost Game79 Studio;;Erost Game79 Studio;;Windows;;https://store.steampowered.com/app/2286070/Tale_of_REN__Searching_for_HEART_droplets/;;Q4 2024;;Action, Adventure, Casual, Indie, RPG, Simulation, Strategy;;Unknown;;Unknown;;Unknown;;Unknown
SlasherRPG;;Thailand;;Slasher RPG is Game Fantasy Faming , Action and Survival We combined many feature. such as hunting , farming , hack and slash , building , raise animals;;https://shared.akamai.steamstatic.com/store_item_assets/steam/apps/2196230/header.jpg?t=1681395021;;Genesis Gaming Network;;Genesis Gaming Network;;Windows;;https://store.steampowered.com/app/2196230/SlasherRPG/;;6 Jan, 2023;;Action, Adventure, Indie, RPG, Simulation, Strategy;;Unknown;;Unknown;;Unknown;;Unknown
XBattleCarsPVP;;Thailand;;Gear up for battle in XBattleCar PVP! Choose your vehicle and join your teammates in a real-time battle against other players. Strategize with your team and use your unique vehicle abil...;;https://shared.akamai.steamstatic.com/store_item_assets/steam/apps/2311310/header.jpg?t=1705321146;;xkatruz;;xkatruz;;Windows;;https://store.steampowered.com/app/2311310/XBattleCarsPVP/;;20 Oct, 2023;;Casual, Racing, Strategy, Free To Play;;Unknown;;Unknown;;Unknown;;Unknown
LightSup!;;Thailand;;LightSup! is a couch-action co-op game for 1-4 players with rogue-lite elements where you play as adventurers encounter ferocious monsters crawling from the Eclipse Dungeons. Prepare yo...;;https://shared.akamai.steamstatic.com/store_item_assets/steam/apps/2266750/header.jpg?t=1728744946;;BugBlio Studio;;BugBlio Studio;;Windows;;https://store.steampowered.com/app/2266750/LightSup/;;Q2 2025;;Action, Adventure, Indie, Early Access;;Unknown;;Unknown;;Unknown;;Unknown
Vest A Life;;Thailand;;The world is finally in an unreturnable condition. war, chemicals, nuclear, global warming, and widespread plastic pollution causing problems that are too late to fix, and now all human...;;https://shared.akamai.steamstatic.com/store_item_assets/steam/apps/2985370/header.jpg?t=1717742690;;Igasha Co.,Ltd;;Igasha Co.,Ltd;;Windows;;https://store.steampowered.com/app/2985370/Vest_A_Life/;;6 Jun, 2024;;Action, RPG, Free To Play;;Unknown;;Unknown;;Unknown;;Unknown
Dala and the Cursed Forest;;Thailand;;A Roguelike Deckbuilder with fun card fusion and transformations. Combine different cards to create powerful combos and generate power cells that can be used to unlock special abilities...;;https://shared.akamai.steamstatic.com/store_item_assets/steam/apps/2748770/header.jpg?t=1725634628;;Zai Studio;;Zai Studio;;Windows;;https://store.steampowered.com/app/2748770/Dala_and_the_Cursed_Forest/;;To be announced;;Indie, Strategy;;Unknown;;Unknown;;Unknown;;Unknown
THE COPE;;Thailand;;The Cope is a 2D, point and click game that presents the fear of the unknown. Your night shift client service job as a janitor will start with you getting entangled in a series of stran...;;https://shared.akamai.steamstatic.com/store_item_assets/steam/apps/2979860/header.jpg?t=1721465743;;DoubleZero Studio;;DoubleZero Studio;;Windows;;https://store.steampowered.com/app/2979860/THE_COPE/;;To be announced;;Adventure;;Unknown;;Unknown;;Unknown;;Unknown
Around Us : Zombie Shooter;;Thailand;;Around Us is a multiplayer cooperative zombie shooting game. There are various kinds of zombies and bosses. A lot of weapons and upgrades are waiting for you to unlock via waves. Try to...;;https://shared.akamai.steamstatic.com/store_item_assets/steam/apps/2437950/header.jpg?t=1728748347;;SCF;;Burapa Phatichon;;Windows;;https://store.steampowered.com/app/2437950/Around_Us__Zombie_Shooter/;;19 Jul, 2023;;Action, Indie, Early Access;;Unknown;;Unknown;;Unknown;;Unknown
Encoded War;;Thailand;;Here is the 5-year contract to get your son back. You must become the morse messenger during World War II. Each day comes with new tasks to overcome and challenge your morse coding skil...;;https://shared.akamai.steamstatic.com/store_item_assets/steam/apps/2220070/header.jpg?t=1702382525;;Somnolent Team;;Somnolent Team;;Windows, macOS;;https://store.steampowered.com/app/2220070/Encoded_War/;;20 Jan, 2023;;Casual, Indie, Simulation;;Unknown;;Unknown;;Unknown;;Unknown
Cursorblade;;Thailand;;Cursorblade is a bullet hell game where you play as the cursor, fighting your way through waves of enemies. Combine weapons and items to become more powerful with your own unique builds...;;https://shared.akamai.steamstatic.com/store_item_assets/steam/apps/2449040/header.jpg?t=1700495397;;RealPeach;;RealPeach;;Windows;;https://store.steampowered.com/app/2449040/Cursorblade/;;6 Nov, 2023;;Action, Casual, Indie;;Unknown;;Unknown;;Unknown;;Unknown
OA Family;;Thailand;;OA Family, a game with learning and relaxation. The main system of the game is to bring the popular English vocabulary game Hangman to do in a player-friendly format with a helper.;;https://shared.akamai.steamstatic.com/store_item_assets/steam/apps/2570040/header.jpg?t=1695181191;;Wayutit Chamsart;;Wayutit Chamsart;;Windows;;https://store.steampowered.com/app/2570040/OA_Family/;;19 Sep, 2023;;Adventure, Casual;;Unknown;;Unknown;;Unknown;;Unknown
Building Relationships;;Thailand;;Experience life as a house in this silly adventure game! Play as a building as you roll, jump, and wave-dash across a cozy island. Meet eligible structures, romance them, and experience...;;https://shared.akamai.steamstatic.com/store_item_assets/steam/apps/2666920/header.jpg?t=1728928070;;Tan Ant Games;;Tan Ant Games, Tanat Boozayaangool;;Windows;;https://store.steampowered.com/app/2666920/Building_Relationships/;;Q1 2025;;Adventure, Casual, Indie;;Unknown;;Unknown;;Unknown;;Unknown
FARSIDERS;;Thailand;;'Farsiders' is a top-down (isometric view) 3D action Hack-and-Slash RPG game set in a stylized futuristic cyberpunk world. Embark on a journey as 'Cassie' to the past with references to...;;https://shared.akamai.steamstatic.com/store_item_assets/steam/apps/2281310/header.jpg?t=1689761117;;Gambit Ghost Studio;;Gambit Ghost Studio;;Windows;;https://store.steampowered.com/app/2281310/FARSIDERS/;;19 Jul, 2023;;Action, Adventure;;Unknown;;Unknown;;Unknown;;Unknown
GemCrusty;;Thailand;;Dig, Discover, Date! Gemcrusty is a casual mining game, where precious gemstones are actually gems in human form.;;https://shared.akamai.steamstatic.com/store_item_assets/steam/apps/2287990/header.jpg?t=1685107054;;RedSensationGames;;RedSensationGames;;Windows;;https://store.steampowered.com/app/2287990/GemCrusty/;;20 Apr, 2023;;Adventure, Casual, Free To Play, Indie;;Unknown;;Unknown;;Unknown;;Unknown
Legend of Parry King;;Thailand;;Legend of Parry King is an action-packed boss-rush game inspired by the combat of Sekiro. Explore the beautiful eastern lands and face off against corrupted demons, defeating them throu...;;https://shared.akamai.steamstatic.com/store_item_assets/steam/apps/3116540/header.jpg?t=1723981789;;TwinSpiritsGames;;TwinSpiritsGames;;Windows;;https://store.steampowered.com/app/3116540/Legend_of_Parry_King/;;To be announced;;Action;;Unknown;;Unknown;;Unknown;;Unknown
Red Ruins: Asymmetric VR vs. PC;;Thailand;;Red Ruins is an asymmetric VR game created by students, where one player becomes a Demon Lord in VR, facing off against Heroes on PC. With powerful weapons and strategic gameplay, playe...;;https://shared.akamai.steamstatic.com/store_item_assets/steam/apps/2972870/header.jpg?t=1721074509;;FallingMouse;;FallingMouse;;Windows;;https://store.steampowered.com/app/2972870/Red_Ruins_Asymmetric_VR_vs_PC/;;4 Jun, 2024;;Action, Indie, RPG, Free To Play;;Unknown;;Unknown;;Unknown;;Unknown
Abyssal Blood;;Thailand;;Abyssal Blood is an Action Rogue-like/Survivors-like where you can dual-wield many types of different weapons at the same time. Play as Lucy, the daughter of Lucifer, who must eliminate...;;https://shared.akamai.steamstatic.com/store_item_assets/steam/apps/2901660/header.jpg?t=1712251591;;Xilosopher;;Xilosopher;;Windows;;https://store.steampowered.com/app/2901660/Abyssal_Blood/;;To be announced;;Action;;Unknown;;Unknown;;Unknown;;Unknown
Magic Caster;;Thailand;;Enter a thrilling wizard world where drawing gestures gives you power! Defeat monsters cast powerful spells, and dodge intense attacks. Experience the excitement of Magic Caster—unlea...;;https://shared.akamai.steamstatic.com/store_item_assets/steam/apps/2773160/header.jpg?t=1726715915;;LavaLittleBird;;Teerawat Samansook;;Windows;;https://store.steampowered.com/app/2773160/Magic_Caster/;;20 Jun, 2024;;Action, Adventure, Casual, Indie;;Unknown;;Unknown;;Unknown;;Unknown
Algor PEW PEW;;Thailand;;One day, invaders from the other world attacked and kidnapped all ARPs. Your mission is to travel through parallel worlds, enjoy the rhythms, rescue the ARPs and survive until end. Let ...;;https://shared.akamai.steamstatic.com/store_item_assets/steam/apps/2599700/header.jpg?t=1727616658;;Realic Production;;Realic Production;;Windows;;https://store.steampowered.com/app/2599700/Algor_PEW_PEW/;;25 Sep, 2024;;Action, Casual, Indie;;Unknown;;Unknown;;Unknown;;Unknown
Unknown Soul With Me;;Thailand;;This is a game where you play as a young girl abandoned in a dungeon. who was saved by a mysterious spirit The spirit introduced himself as having lived in this place. But can't go anyw...;;https://shared.akamai.steamstatic.com/store_item_assets/steam/apps/2734790/header.jpg?t=1703864781;;NotYet;;NotYet;;Windows;;https://store.steampowered.com/app/2734790/Unknown_Soul_With_Me/;;29 Dec, 2023;;Adventure, Indie;;Unknown;;Unknown;;Unknown;;Unknown
Bangkok Story: A Stray Dog;;Thailand;;A top-down 2D story-driven adventure game inspired by real-life events. Traverse and experience the life of a formerly homeless man through an interview of how he regained his sense of ...;;https://shared.akamai.steamstatic.com/store_item_assets/steam/apps/2121450/header.jpg?t=1728205794;;Shameful Guys Development;;Shameful Guys Development;;Windows, macOS;;https://store.steampowered.com/app/2121450/Bangkok_Story_A_Stray_Dog/;;To be announced;;Adventure, RPG;;Unknown;;Unknown;;Unknown;;Unknown
Walpurgis Raid;;Thailand;;Prepare yourself for Roguelite bullet-hell battles! Dive into a magic world to sets out on the royal battle. Upgrade your witch and transform into an unstoppable force, obliterating ene...;;https://shared.akamai.steamstatic.com/store_item_assets/steam/apps/2444900/header.jpg?t=1702701413;;Bliss BonZ;;Bliss BonZ;;Windows;;https://store.steampowered.com/app/2444900/Walpurgis_Raid/;;15 Dec, 2023;;Action, Casual, Indie;;Unknown;;Unknown;;Unknown;;Unknown
Third Wild;;Thailand;;Third Wild it is a game that combines survival with fantasy. Survive, fight, build your buildings, and go on an adventure in a medieval open world with monsters and strange areas for yo...;;https://shared.akamai.steamstatic.com/store_item_assets/steam/apps/2074040/header.jpg?t=1664371767;;landing man studio;;landing man studio;;Windows;;https://store.steampowered.com/app/2074040/Third_Wild/;;3 Aug, 2022;;Action, Adventure, Indie, Massively Multiplayer, RPG;;Unknown;;Unknown;;Unknown;;Unknown
Winter Night;;Thailand;;"Game genre: Horror adventure, (point and click adventure horror game). Game""Winter Night"" presents a story inspired by beliefs in Thailand.Players will experience the atmosphere of an a...";;https://shared.akamai.steamstatic.com/store_item_assets/steam/apps/2828320/header.jpg?t=1715510239;;GenaticStudio;;GenaticStudio;;Windows, macOS;;https://store.steampowered.com/app/2828320/Winter_Night/;;28 Feb, 2024;;Adventure, Indie;;Unknown;;Unknown;;Unknown;;Unknown
The Quarantine;;Thailand;;Experience a blend of survival horror and strategic management. Fortify your base, manage resources, and scavenge for supplies in a world overrun by monstrous creatures and corrupted by...;;https://shared.akamai.steamstatic.com/store_item_assets/steam/apps/3025540/header.jpg?t=1721059883;;BgiantStudio;;BgiantStudio;;Windows;;https://store.steampowered.com/app/3025540/The_Quarantine/;;To be announced;;Simulation;;Unknown;;Unknown;;Unknown;;Unknown
Delivery Man;;Thailand;;A small town food delivery man receives an order to deliver food to a strange house. When he arrived, he discovered that the house contained a terrifying secret that one who knew it wou...;;https://shared.akamai.steamstatic.com/store_item_assets/steam/apps/2181440/header.jpg?t=1715585306;;Negative Return;;Negative Return;;Windows;;https://store.steampowered.com/app/2181440/Delivery_Man/;;24 Nov, 2022;;Action, Adventure, Indie;;Unknown;;Unknown;;Unknown;;Unknown
Burning Sword: Death Sun;;Thailand;;Burning Sword: Death Sun is a Wuxia hack n' slash game. Play as the great fighter, Zhāng Yì Xiàn, who seeks revenge for the death of his family at the hands of China's powerful Gāo ...;;https://shared.akamai.steamstatic.com/store_item_assets/steam/apps/2561460/header.jpg?t=1728959791;;Nomadic Games;;Nomadic Games;;Windows;;https://store.steampowered.com/app/2561460/Burning_Sword_Death_Sun/;;Q1 2025;;Action;;Unknown;;Unknown;;Unknown;;Unknown
Home Sweet Home : Online;;Thailand;;Experience the balanced PvP Battles in a 4vs1 style. Win through collecting souls in a 4vs4 style battle where the person that holds the Warden Soul will turn into a Warden to hunt down...;;https://shared.akamai.steamstatic.com/store_item_assets/steam/apps/2334220/header.jpg?t=1698923397;;Shift Now;;YGGDRAZIL GROUP PUBLIC COMPANY LIMITED;;Windows;;https://store.steampowered.com/app/2334220/Home_Sweet_Home__Online/;;21 Jun, 2023;;Action, Indie, Strategy, Free To Play;;Unknown;;Unknown;;Unknown;;Unknown
PSYCHO DEAD;;Thailand;;A third-person survival horror game that you play as a girl with psychic power who tries to escape from a secret lab and is pursued by deadly stalkers.;;https://shared.akamai.steamstatic.com/store_item_assets/steam/apps/3018390/header.jpg?t=1728616699;;MOON CATALYST CO., LTD.;;MOON CATALYST CO., LTD.;;Windows;;https://store.steampowered.com/app/3018390/PSYCHO_DEAD/;;To be announced;;Action, Adventure, Indie;;Unknown;;Unknown;;Unknown;;Unknown
Goi: Spooky Run;;Thailand;;Goi: Spooky Run is 3-10 players “Catch me if you can” online party survival game. Put your friendship to the test! Prank your friends, survive the ghost hunt, and be the last one st...;;https://shared.akamai.steamstatic.com/store_item_assets/steam/apps/2009310/header.jpg?t=1711693446;;MYGG;;YGGDRAZIL GROUP PUBLIC COMPANY LIMITED;;Windows;;https://store.steampowered.com/app/2009310/Goi_Spooky_Run/;;13 Mar, 2023;;Action, Casual, Indie;;Unknown;;Unknown;;Unknown;;Unknown
Frog Story : The Power Tongue;;Thailand;;Join a thrilling journey with a tiny frog and its mighty tongue, collecting fireflies and sealing the shadows of the Dark Toad King. Navigate through a charming puzzle-platformer world ...;;https://shared.akamai.steamstatic.com/store_item_assets/steam/apps/2208130/header.jpg?t=1710848241;;ADox-Lab;;ADox-Lab;;Windows;;https://store.steampowered.com/app/2208130/Frog_Story__The_Power_Tongue/;;4 Feb, 2024;;Action, Indie;;Unknown;;Unknown;;Unknown;;Unknown
XILOST;;Thailand;;The doom of humanity arrives as chemists and scientists experiment with the genetic codings and structurings of all living things, ending up with unwanted infiltrators smuggling into th...;;https://shared.akamai.steamstatic.com/store_item_assets/steam/apps/943270/header.jpg?t=1728801149;;Xilost Team;;Xilost Team;;Windows;;https://store.steampowered.com/app/943270/XILOST/;;To be announced;;Action, Indie, Early Access;;Unknown;;Unknown;;Unknown;;Unknown
Golf by the way;;Thailand;;A fast-paced real-time mini-golf party game with no stroke count! Play as an actual golfer in real-time and go SMACK your friends’ golf ball or even your friends themselves.;;https://shared.akamai.steamstatic.com/store_item_assets/steam/apps/2550840/header.jpg?t=1707578800;;Pie Seven Gun;;Pie Seven Gun;;Windows;;https://store.steampowered.com/app/2550840/Golf_by_the_way/;;To be announced;;Casual;;Unknown;;Unknown;;Unknown;;Unknown
A Technician's Nightmare;;Thailand;;This is a multiplayer survival game in a haunted house. For 1-4 players The player must successfully complete the mission, during which there will be strange events occurring in the hou...;;https://shared.akamai.steamstatic.com/store_item_assets/steam/apps/2472390/header.jpg?t=1704115859;;Luzh.;;Luzh.;;Windows;;https://store.steampowered.com/app/2472390/A_Technicians_Nightmare/;;1 Jan, 2024;;Indie, Simulation;;Unknown;;Unknown;;Unknown;;Unknown
Safehouse;;Thailand;;In Safehouse, play as a member of a criminal crew holed up in a Safehouse with a traitor among you working with the enemy to bring you down. Can you uncover their identity and eliminate...;;https://shared.akamai.steamstatic.com/store_item_assets/steam/apps/2271300/header.jpg?t=1674677999;;Gecco Studio Games;;Gecco Studio Games;;Windows, macOS;;https://store.steampowered.com/app/2271300/Safehouse/;;22 Jan, 2023;;Action, Indie, Early Access;;Unknown;;Unknown;;Unknown;;Unknown
Wild Alone;;Thailand;;As you find yourself stranded on an island overrun by vicious dinosaurs and cretures, you must fight to survive and make your escape. Explore the island's dangerous landscapes, capture ...;;https://shared.akamai.steamstatic.com/store_item_assets/steam/apps/2494500/header.jpg?t=1714284898;;Wild Alone 21;;Wild Alone 21;;Windows;;https://store.steampowered.com/app/2494500/Wild_Alone/;;27 Apr, 2024;;Action, Adventure, Indie, Massively Multiplayer, RPG, Simulation, Early Access;;Unknown;;Unknown;;Unknown;;Unknown
FREELIFE;;Thailand;;Add FREELIFE to your wishlist now! Co-create a universe teeming with potential in this open world voxel sandbox.Craft a character that reflects your style, race around the city in high-...;;https://shared.akamai.steamstatic.com/store_item_assets/steam/apps/2730860/header.jpg?t=1728028367;;202studio;;202studio;;Windows;;https://store.steampowered.com/app/2730860/FREELIFE/;;To be announced;;Action, Adventure, Indie, Massively Multiplayer, RPG, Simulation, Early Access;;Unknown;;Unknown;;Unknown;;Unknown
Exsys;;Thailand;;Exsys is an action-packed adventure that blends classic 90s beat-'em-up gameplay with modern Action RPG elements. Explore a stunning 3D world of scrap and danger.;;https://shared.akamai.steamstatic.com/store_item_assets/steam/apps/1116350/header.jpg?t=1727524149;;Peakware Studio;;Charkrid Pornpitackchaikul;;Windows;;https://store.steampowered.com/app/1116350/Exsys/;;21 Feb, 2020;;Action, Indie, RPG, Early Access;;Unknown;;Unknown;;Unknown;;Unknown
